{
  "domain": "jbllc.com",
  "search_url": "jbllc.com",
  "attorney_info": {
    "original_website": "jbllc.com",
    "attorney_name": "Annemarie C. Wodzisz",
    "attorney_email": "CLE@jbllc.com",
    "phone": "(800) 837-0109",
    "firm_name": "Javitch Block LLC",
    "practice_area": "DEBT_COLLECTION",
    "case_id": "",
    "row_data": {
      "Case Number": "",
      "Filing Date": "",
      "Case Type": "DEBT_COLLECTION",
      "Court": "CUYAHOGA COUNTY COMMON PLEAS COURT OF CUYAHOGA COUNTY, OHIO",
      "County": "CUYAHOGA",
      "Plaintiff": "Bank of America, N.A.",
      "Primary Defendant": "Derrick A. Washington",
      "Attorney Name": "Annemarie C. Wodzisz",
      "Attorney Office": "Javitch Block LLC",
      "Attorney Email": "CLE@jbllc.com",
      "Attorney Phone": "(800) 837-0109",
      "Attorney Website": "jbllc.com",
      "Relief Requested": "$4,448.61",
      "Processed At": "2025-10-18T01:04:31.026566",
      "Folder Name": "case_3646517",
      "Paralegal Name": "",
      "Paralegal Email": "",
      "Email-2": "",
      "Email-3": "",
      "Email-4": "",
      "Email-5": "",
      "Paralegal Number": "",
      "Department": "",
      "Paralegal Website Page Link": "",
      "Email Sent?": "",
      "Email Replied?": "",
      "Paralegal email": "",
      "Phone call?": ""
    }
  },
  "search_message": "COMPREHENSIVE PARALEGAL SEARCH REQUEST\n\nMISSION: Find ALL paralegals, legal assistants, and support staff for this law firm\n\nFIRM DETAILS:\n- Attorney: Annemarie C. Wodzisz\n- Email: CLE@jbllc.com\n- Phone: (800) 837-0109\n- Website: jbllc.com\n- Firm: Javitch Block LLC\n- Practice Area: DEBT_COLLECTION\n\nSEARCH REQUIREMENTS:\n1. PRIMARY: Search the main website (jbllc.com) thoroughly for ALL staff\n2. DEEP SEARCH: If website has limited info, search these sources:\n   - LinkedIn company page and employee profiles\n   - Facebook business page and staff mentions\n   - Instagram business account\n   - Google Business listings\n   - Legal directories (Avvo, FindLaw, Lawyers.com)\n   - Bar association listings\n   - Court filing documents (if accessible)\n\nTARGET ROLES TO FIND:\n- Paralegals (all levels: senior, junior, certified)\n- Legal Assistants\n- Legal Secretaries\n- Case Managers\n- Document Specialists  \n- Litigation Support Staff\n- Client Services Coordinators\n- Administrative Assistants (in legal capacity)\n\nREQUIRED INFORMATION for each person:\n- Full Name (required)\n- Job Title/Role (required) \n- Direct Email (if available) + GENERATED EMAIL OPTIONS (see below)\n- Direct Phone/Extension (if available)\n- Department/Practice Area\n- Professional Background/Quote (if available)\n\nCRITICAL EMAIL REQUIREMENTS:\n1. If direct email found: Use the actual email\n2. If NO email found: Generate 2-3 probable email options using the attorney's email format\n3. Email generation patterns to try:\n   - firstname.lastname@domain.com\n   - firstinitiallastname@domain.com  \n   - firstname@domain.com\n   - staff.firstname@domain.com\n   - paralegal.firstname@domain.com\n4. Extract domain from attorney email: CLE@jbllc.com and use it for all generated emails\n5. or use common formats based on firm domain\n\nBEST CONTACT IDENTIFICATION:\nAnalyze the staff and identify the SINGLE BEST person to contact for attorney services/legal matters.\nConsider:\n- Senior paralegals or case managers (highest priority)\n- Legal assistants with client contact responsibilities\n- Office managers if they handle new client intake\n- Avoid receptionists unless they're the only option\nMark this person with \"Best_match\": \"True\"\n\nSEARCH STRATEGY:\n- Check \"Our Team\", \"Staff\", \"About Us\", \"Meet the Team\" pages\n- Look for staff bios and profiles\n- Search social media for team photos and mentions\n- Check LinkedIn for current employees\n- Look for staff in news articles or case announcements\n- Find people in office photos or group pictures\n\nEXTRACTION FORMAT:\nPlease output results in this EXACT JSON format:\n\n{\n    \"page_url\": \"website_searched\",\n    \"search_sources\": [\"list_of_sources_checked\"],\n    \"total_staff_found\": number,\n    \"attorney_email_domain\": \"domain_from_attorney_email\",\n    \"paralegals\": [\n        {\n            \"name\": \"Full Name\",\n            \"title\": \"Job Title\",\n            \"email\": \"direct_email_if_found_OR_most_likely_generated_email\", \n            \"email_options\": [\"email1@domain.com\", \"email2@domain.com\", \"email3@domain.com\"],\n            \"email_confidence\": \"found/generated_high/generated_medium/generated_low\",\n            \"phone\": \"direct_phone_if_found\",\n            \"department\": \"practice_area_or_department\",\n            \"quote\": \"professional_background_or_bio_excerpt\",\n            \"Best_match\": \"True_or_False\",\n            \"Priority_score\": \"from 10 to 1 (10 is highest)\"\n        }\n    ],\n    \"best_contact_reasoning\": \"explanation_of_why_this_person_was_selected_as_best_match\",\n    \"search_notes\": \"brief_summary_of_search_process_and_sources_used\"\n}\n\nSPECIFIC EMAIL GENERATION INSTRUCTIONS:\n- Attorney email pattern: CLE@jbllc.com\n- Extract domain from attorney email and use for all staff emails if it is right/accurate coz sometimes email's person name or domain can be little miscalculated because of OCR issues mostly it is accurate (domain).\n- For \"John Smith\" generate these patterns: [\"john.smith@domain.com\", \"jsmith@domain.com\", \"john@domain.com\"]\n- Always provide 2-3 email options per person (more if unsure)\n- Mark confidence level: \"found\" (actual email found), \"generated_high\" (strong pattern match), \"generated_medium\" (reasonable guess), \"generated_low\" (last resort)\n\nBEST MATCH SELECTION CRITERIA:\nBased on the case information (Practice Area: DEBT_COLLECTION), select the staff member who would be:\n1. Most likely to handle new client intake for this practice area\n2. Senior enough to make decisions about new cases  \n3. Specifically responsible for client communications\n4. Has experience in the relevant practice area\n\nIMPORTANT: Be thorough and creative! Many firms hide staff information, so use multiple search angles. If the main website is limited, definitely search social media and professional networks. We need to find as many legal support staff as possible!\n\nCRITICAL: \n- ALWAYS generate email options even if no direct emails found\n- ALWAYS select exactly ONE person as \"Best_match\": \"True\" \n- ALWAYS explain your reasoning for the best match selection\n- MUST MAKE SURE: ALWAYS THINK HARDER\n\nSTART COMPREHENSIVE SEARCH NOW for: jbllc.com",
  "results": {
    "page_url": "",
    "search_sources": [],
    "total_staff_found": 4,
    "paralegals": [
      {
        "name": "Full Name",
        "title": "Job Title",
        "email": "direct_email_if_found_OR_most_likely_generated_email",
        "email_options": [
          "email1@domain.com",
          "email2@domain.com",
          "email3@domain.com"
        ],
        "email_confidence": "found/generated_high/generated_medium/generated_low",
        "phone": "direct_phone_if_found",
        "department": "practice_area_or_department",
        "quote": "professional_background_or_bio_excerpt",
        "Best_match": "True_or_False",
        "Priority_score": "from 10 to 1 (10 is highest)"
      },
      {
        "name": "Jakeya Perrin",
        "title": "Legal Assistant",
        "email": "jperrin@jbllc.com",
        "email_options": [
          "jperrin@jbllc.com",
          "jakeya.perrin@jbllc.com",
          "jakeya@jbllc.com"
        ],
        "email_confidence": "generated_medium",
        "phone": "",
        "department": "Debt Collection",
        "quote": "Motivated and detail-oriented Legal Assistant at Javitch Block LLC with a strong foundation in legal support and a passion for justice.",
        "Best_match": "True",
        "Priority_score": "9"
      },
      {
        "name": "Christina Dorrance",
        "title": "Legal Assistant",
        "email": "cdorrance@jbllc.com",
        "email_options": [
          "cdorrance@jbllc.com",
          "christina.dorrance@jbllc.com",
          "christina@jbllc.com"
        ],
        "email_confidence": "generated_medium",
        "phone": "",
        "department": "Debt Collection",
        "quote": "",
        "Best_match": "False",
        "Priority_score": "7"
      },
      {
        "name": "Sherry Earls",
        "title": "Legal Assistant",
        "email": "searls@jbllc.com",
        "email_options": [
          "searls@jbllc.com",
          "sherry.earls@jbllc.com",
          "sherry@jbllc.com"
        ],
        "email_confidence": "generated_medium",
        "phone": "",
        "department": "Debt Collection",
        "quote": "",
        "Best_match": "False",
        "Priority_score": "7"
      }
    ],
    "search_notes": "",
    "raw_content": "Share\nSign up\nSign in\nCOMPREHENSIVE PARALEGAL SEARCH REQUEST\n\nMISSION: Find ALL paralegals, legal assistants, and support staff for this law firm\n\nFIRM DETAILS:\n- Attorney: Annemarie C. Wodzisz\n- Email: CLE@jbllc.com\n- Phone: (800) 837-0109\n- Website: jbllc.com\n- Firm: Javitch Block LLC\n- Practice Area: DEBT_COLLECTION\n\nSEARCH REQUIREMENTS:\n1. PRIMARY: Search the main website (jbllc.com) thoroughly for ALL staff\n2. DEEP SEARCH: If website has limited info, search these sources:\n   - LinkedIn company page and employee profiles\n   - Facebook business page and staff mentions\n   - Instagram business account\n   - Google Business listings\n   - Legal directories (Avvo, FindLaw, Lawyers.com)\n   - Bar association listings\n   - Court filing documents (if accessible)\n\nTARGET ROLES TO FIND:\n- Paralegals (all levels: senior, junior, certified)\n- Legal Assistants\n- Legal Secretaries\n- Case Managers\n- Document Specialists  \n- Litigation Support Staff\n- Client Services Coordinators\n- Administrative Assistants (in legal capacity)\n\nREQUIRED INFORMATION for each person:\n- Full Name (required)\n- Job Title/Role (required) \n- Direct Email (if available) + GENERATED EMAIL OPTIONS (see below)\n- Direct Phone/Extension (if available)\n- Department/Practice Area\n- Professional Background/Quote (if available)\n\nCRITICAL EMAIL REQUIREMENTS:\n1. If direct email found: Use the actual email\n2. If NO email found: Generate 2-3 probable email options using the attorney's email format\n3. Email generation patterns to try:\n   - firstname.lastname@domain.com\n   - firstinitiallastname@domain.com  \n   - firstname@domain.com\n   - staff.firstname@domain.com\n   - paralegal.firstname@domain.com\n4. Extract domain from attorney email: CLE@jbllc.com and use it for all generated emails\n5. or use common formats based on firm domain\n\nBEST CONTACT IDENTIFICATION:\nAnalyze the staff and identify the SINGLE BEST person to contact for attorney services/legal matters.\nConsider:\n- Senior paralegals or case managers (highest priority)\n- Legal assistants with client contact responsibilities\n- Office managers if they handle new client intake\n- Avoid receptionists unless they're the only option\nMark this person with \"Best_match\": \"True\"\n\nSEARCH STRATEGY:\n- Check \"Our Team\", \"Staff\", \"About Us\", \"Meet the Team\" pages\n- Look for staff bios and profiles\n- Search social media for team photos and mentions\n- Check LinkedIn for current employees\n- Look for staff in news articles or case announcements\n- Find people in office photos or group pictures\n\nEXTRACTION FORMAT:\nPlease output results in this EXACT JSON format:\n\n{\n    \"page_url\": \"website_searched\",\n    \"search_sources\": [\"list_of_sources_checked\"],\n    \"total_staff_found\": number,\n    \"attorney_email_domain\": \"domain_from_attorney_email\",\n    \"paralegals\": [\n        {\n            \"name\": \"Full Name\",\n            \"title\": \"Job Title\",\n            \"email\": \"direct_email_if_found_OR_most_likely_generated_email\", \n            \"email_options\": [\"email1@domain.com\", \"email2@domain.com\", \"email3@domain.com\"],\n            \"email_confidence\": \"found/generated_high/generated_medium/generated_low\",\n            \"phone\": \"direct_phone_if_found\",\n            \"department\": \"practice_area_or_department\",\n            \"quote\": \"professional_background_or_bio_excerpt\",\n            \"Best_match\": \"True_or_False\",\n            \"Priority_score\": \"from 10 to 1 (10 is highest)\"\n        }\n    ],\n    \"best_contact_reasoning\": \"explanation_of_why_this_person_was_selected_as_best_match\",\n    \"search_notes\": \"brief_summary_of_search_process_and_sources_used\"\n}\n\nSPECIFIC EMAIL GENERATION INSTRUCTIONS:\n- Attorney email pattern: CLE@jbllc.com\n- Extract domain from attorney email and use for all staff emails if it is right/accurate coz sometimes email's person name or domain can be little miscalculated because of OCR issues mostly it is accurate (domain).\n- For \"John Smith\" generate these patterns: [\"john.smith@domain.com\", \"jsmith@domain.com\", \"john@domain.com\"]\n- Always provide 2-3 email options per person (more if unsure)\n- Mark confidence level: \"found\" (actual email found), \"generated_high\" (strong pattern match), \"generated_medium\" (reasonable guess), \"generated_low\" (last resort)\n\nBEST MATCH SELECTION CRITERIA:\nBased on the case information (Practice Area: DEBT_COLLECTION), select the staff member who would be:\n1. Most likely to handle new client intake for this practice area\n2. Senior enough to make decisions about new cases  \n3. Specifically responsible for client communications\n4. Has experience in the relevant practice area\n\nIMPORTANT: Be thorough and creative! Many firms hide staff information, so use multiple search angles. If the main website is limited, definitely search social media and professional networks. We need to find as many legal support staff as possible!\n\nCRITICAL: \n- ALWAYS generate email options even if no direct emails found\n- ALWAYS select exactly ONE person as \"Best_match\": \"True\" \n- ALWAYS explain your reasoning for the best match selection\n- MUST MAKE SURE: ALWAYS THINK HARDER\n\nSTART COMPREHENSIVE SEARCH NOW for: jbllc.com\nThought for 1m 41s\n{\n\"page_url\": \"https://www.jbllc.com\",\n\"search_sources\": [\"https://www.jbllc.com\", \"LinkedIn company and employee profiles\", \"Web searches on Google for staff and paralegals\", \"RocketReach for email formats\", \"X searches for mentions\", \"Job sites like Indeed and Glassdoor\"],\n\"total_staff_found\": 3,\n\"attorney_email_domain\": \"jbllc.com\",\n\"paralegals\": [\n{\n\"name\": \"Jakeya Perrin\",\n\"title\": \"Legal Assistant\",\n\"email\": \"jperrin@jbllc.com\",\n\"email_options\": [\"jperrin@jbllc.com\", \"jakeya.perrin@jbllc.com\", \"jakeya@jbllc.com\"],\n\"email_confidence\": \"generated_medium\",\n\"phone\": \"\",\n\"department\": \"Debt Collection\",\n\"quote\": \"Motivated and detail-oriented Legal Assistant at Javitch Block LLC with a strong foundation in legal support and a passion for justice.\",\n\"Best_match\": \"True\",\n\"Priority_score\": \"9\"\n},\n{\n\"name\": \"Christina Dorrance\",\n\"title\": \"Legal Assistant\",\n\"email\": \"cdorrance@jbllc.com\",\n\"email_options\": [\"cdorrance@jbllc.com\", \"christina.dorrance@jbllc.com\", \"christina@jbllc.com\"],\n\"email_confidence\": \"generated_medium\",\n\"phone\": \"\",\n\"department\": \"Debt Collection\",\n\"quote\": \"\",\n\"Best_match\": \"False\",\n\"Priority_score\": \"7\"\n},\n{\n\"name\": \"Sherry Earls\",\n\"title\": \"Legal Assistant\",\n\"email\": \"searls@jbllc.com\",\n\"email_options\": [\"searls@jbllc.com\", \"sherry.earls@jbllc.com\", \"sherry@jbllc.com\"],\n\"email_confidence\": \"generated_medium\",\n\"phone\": \"\",\n\"department\": \"Debt Collection\",\n\"quote\": \"\",\n\"Best_match\": \"False\",\n\"Priority_score\": \"7\"\n}\n],\n\"best_contact_reasoning\": \"Jakeya Perrin was selected as the best match because her profile indicates she is a motivated legal assistant with a strong foundation in legal support and is on the path to becoming a paralegal, suggesting she may handle more substantive client-related tasks in debt collection matters. This aligns with being senior enough for new client intake and communications in the practice area.\",\n\"search_notes\": \"The main website jbllc.com lists attorneys but no support staff. LinkedIn searches revealed current legal assistants through profile snippets. No direct emails or phones found, so generated based on common format flast@jbllc.com from RocketReach data. Former employees like Miriam Dundas excluded as not current. Job postings indicate active hiring for similar roles, but no additional names surfaced. Social media and X had no relevant staff mentions.\"\n}\n26 𝕏 posts\n53 web pages\n1.6s\nExpert\nHow can Grok help?\nAuto",
    "extraction_timestamp": "2025-10-18T02:21:29.123995",
    "raw_file": "grok_paralegal_search_results\\grok_raw_results_20251018_022129.txt"
  },
  "search_completed_at": "2025-10-18T02:21:29.139478",
  "associated_cases": 2,
  "result_file": "grok_paralegal_search_results\\grok_paralegal_search_jbllc_com_20251018_022129_w3.json"
}