{
  "domain": "levylawfirms.com",
  "search_url": "levylawfirms.com",
  "attorney_info": {
    "original_website": "levylawfirms.com",
    "attorney_name": "Erin Enderle",
    "attorney_email": "legal@levylawfirms.com",
    "phone": "(614) 898-5200",
    "firm_name": "Levy & Associates, LLC",
    "practice_area": "DEBT_COLLECTION",
    "case_id": "",
    "row_data": {
      "Case Number": "",
      "Filing Date": "",
      "Case Type": "DEBT_COLLECTION",
      "Court": "CUYAHOGA COUNTY COMMON PLEAS COURT",
      "County": "CUYAHOGA",
      "Plaintiff": "First National Bank of Omaha",
      "Primary Defendant": "Charles W Kintner",
      "Attorney Name": "Erin Enderle",
      "Attorney Office": "Levy & Associates, LLC",
      "Attorney Email": "legal@levylawfirms.com",
      "Attorney Phone": "(614) 898-5200",
      "Attorney Website": "levylawfirms.com",
      "Relief Requested": "$32,569.09",
      "Processed At": "2025-10-18T01:04:31.217397",
      "Folder Name": "case_3646740",
      "Paralegal Name": "",
      "Paralegal Email": "",
      "Email-2": "",
      "Email-3": "",
      "Email-4": "",
      "Email-5": "",
      "Paralegal Number": "",
      "Department": "",
      "Paralegal Website Page Link": "",
      "Email Sent?": "",
      "Email Replied?": "",
      "Paralegal email": "",
      "Phone call?": ""
    }
  },
  "search_message": "COMPREHENSIVE PARALEGAL SEARCH REQUEST\n\nMISSION: Find ALL paralegals, legal assistants, and support staff for this law firm\n\nFIRM DETAILS:\n- Attorney: Erin Enderle\n- Email: legal@levylawfirms.com\n- Phone: (614) 898-5200\n- Website: levylawfirms.com\n- Firm: Levy & Associates, LLC\n- Practice Area: DEBT_COLLECTION\n\nSEARCH REQUIREMENTS:\n1. PRIMARY: Search the main website (levylawfirms.com) thoroughly for ALL staff\n2. DEEP SEARCH: If website has limited info, search these sources:\n   - LinkedIn company page and employee profiles\n   - Facebook business page and staff mentions\n   - Instagram business account\n   - Google Business listings\n   - Legal directories (Avvo, FindLaw, Lawyers.com)\n   - Bar association listings\n   - Court filing documents (if accessible)\n\nTARGET ROLES TO FIND:\n- Paralegals (all levels: senior, junior, certified)\n- Legal Assistants\n- Legal Secretaries\n- Case Managers\n- Document Specialists  \n- Litigation Support Staff\n- Client Services Coordinators\n- Administrative Assistants (in legal capacity)\n\nREQUIRED INFORMATION for each person:\n- Full Name (required)\n- Job Title/Role (required) \n- Direct Email (if available) + GENERATED EMAIL OPTIONS (see below)\n- Direct Phone/Extension (if available)\n- Department/Practice Area\n- Professional Background/Quote (if available)\n\nCRITICAL EMAIL REQUIREMENTS:\n1. If direct email found: Use the actual email\n2. If NO email found: Generate 2-3 probable email options using the attorney's email format\n3. Email generation patterns to try:\n   - firstname.lastname@domain.com\n   - firstinitiallastname@domain.com  \n   - firstname@domain.com\n   - staff.firstname@domain.com\n   - paralegal.firstname@domain.com\n4. Extract domain from attorney email: legal@levylawfirms.com and use it for all generated emails\n5. or use common formats based on firm domain\n\nBEST CONTACT IDENTIFICATION:\nAnalyze the staff and identify the SINGLE BEST person to contact for attorney services/legal matters.\nConsider:\n- Senior paralegals or case managers (highest priority)\n- Legal assistants with client contact responsibilities\n- Office managers if they handle new client intake\n- Avoid receptionists unless they're the only option\nMark this person with \"Best_match\": \"True\"\n\nSEARCH STRATEGY:\n- Check \"Our Team\", \"Staff\", \"About Us\", \"Meet the Team\" pages\n- Look for staff bios and profiles\n- Search social media for team photos and mentions\n- Check LinkedIn for current employees\n- Look for staff in news articles or case announcements\n- Find people in office photos or group pictures\n\nEXTRACTION FORMAT:\nPlease output results in this EXACT JSON format:\n\n{\n    \"page_url\": \"website_searched\",\n    \"search_sources\": [\"list_of_sources_checked\"],\n    \"total_staff_found\": number,\n    \"attorney_email_domain\": \"domain_from_attorney_email\",\n    \"paralegals\": [\n        {\n            \"name\": \"Full Name\",\n            \"title\": \"Job Title\",\n            \"email\": \"direct_email_if_found_OR_most_likely_generated_email\", \n            \"email_options\": [\"email1@domain.com\", \"email2@domain.com\", \"email3@domain.com\"],\n            \"email_confidence\": \"found/generated_high/generated_medium/generated_low\",\n            \"phone\": \"direct_phone_if_found\",\n            \"department\": \"practice_area_or_department\",\n            \"quote\": \"professional_background_or_bio_excerpt\",\n            \"Best_match\": \"True_or_False\",\n            \"Priority_score\": \"from 10 to 1 (10 is highest)\"\n        }\n    ],\n    \"best_contact_reasoning\": \"explanation_of_why_this_person_was_selected_as_best_match\",\n    \"search_notes\": \"brief_summary_of_search_process_and_sources_used\"\n}\n\nSPECIFIC EMAIL GENERATION INSTRUCTIONS:\n- Attorney email pattern: legal@levylawfirms.com\n- Extract domain from attorney email and use for all staff emails if it is right/accurate coz sometimes email's person name or domain can be little miscalculated because of OCR issues mostly it is accurate (domain).\n- For \"John Smith\" generate these patterns: [\"john.smith@domain.com\", \"jsmith@domain.com\", \"john@domain.com\"]\n- Always provide 2-3 email options per person (more if unsure)\n- Mark confidence level: \"found\" (actual email found), \"generated_high\" (strong pattern match), \"generated_medium\" (reasonable guess), \"generated_low\" (last resort)\n\nBEST MATCH SELECTION CRITERIA:\nBased on the case information (Practice Area: DEBT_COLLECTION), select the staff member who would be:\n1. Most likely to handle new client intake for this practice area\n2. Senior enough to make decisions about new cases  \n3. Specifically responsible for client communications\n4. Has experience in the relevant practice area\n\nIMPORTANT: Be thorough and creative! Many firms hide staff information, so use multiple search angles. If the main website is limited, definitely search social media and professional networks. We need to find as many legal support staff as possible!\n\nCRITICAL: \n- ALWAYS generate email options even if no direct emails found\n- ALWAYS select exactly ONE person as \"Best_match\": \"True\" \n- ALWAYS explain your reasoning for the best match selection\n- MUST MAKE SURE: ALWAYS THINK HARDER\n\nSTART COMPREHENSIVE SEARCH NOW for: levylawfirms.com",
  "results": {
    "page_url": "",
    "search_sources": [],
    "total_staff_found": 9,
    "paralegals": [
      {
        "name": "Full Name",
        "title": "Job Title",
        "email": "direct_email_if_found_OR_most_likely_generated_email",
        "email_options": [
          "email1@domain.com",
          "email2@domain.com",
          "email3@domain.com"
        ],
        "email_confidence": "found/generated_high/generated_medium/generated_low",
        "phone": "direct_phone_if_found",
        "department": "practice_area_or_department",
        "quote": "professional_background_or_bio_excerpt",
        "Best_match": "True_or_False",
        "Priority_score": "from 10 to 1 (10 is highest)"
      },
      {
        "name": "Dawn Sisson",
        "title": "Director of Client and Legal Operations",
        "email": "dsisson@levylawfirms.com",
        "email_options": [
          "dawn.sisson@levylawfirms.com",
          "dsisson@levylawfirms.com",
          "dawn@levylawfirms.com"
        ],
        "email_confidence": "generated_medium",
        "phone": "",
        "department": "Debt Collection",
        "quote": "Experienced in client and legal operations with a Bachelor of Arts in Legal Assistant/Paralegal from Bradford Business School.",
        "Best_match": "True",
        "Priority_score": "10"
      },
      {
        "name": "Louise Trapp",
        "title": "Legal Assistant",
        "email": "ltrapp@levylawfirms.com",
        "email_options": [
          "louise.trapp@levylawfirms.com",
          "ltrapp@levylawfirms.com",
          "louise@levylawfirms.com"
        ],
        "email_confidence": "generated_medium",
        "phone": "",
        "department": "Debt Collection",
        "quote": "",
        "Best_match": "False",
        "Priority_score": "6"
      },
      {
        "name": "Cari Tangey",
        "title": "Paralegal",
        "email": "ctangey@levylawfirms.com",
        "email_options": [
          "cari.tangey@levylawfirms.com",
          "ctangey@levylawfirms.com",
          "cari@levylawfirms.com"
        ],
        "email_confidence": "generated_medium",
        "phone": "",
        "department": "Debt Collection",
        "quote": "",
        "Best_match": "False",
        "Priority_score": "8"
      },
      {
        "name": "Danielle Rand",
        "title": "Legal Assistant",
        "email": "drand@levylawfirms.com",
        "email_options": [
          "danielle.rand@levylawfirms.com",
          "drand@levylawfirms.com",
          "danielle@levylawfirms.com"
        ],
        "email_confidence": "generated_medium",
        "phone": "",
        "department": "Debt Collection",
        "quote": "",
        "Best_match": "False",
        "Priority_score": "6"
      },
      {
        "name": "Randi Nichols",
        "title": "Lien Specialist/Legal Assistant",
        "email": "rnichols@levylawfirms.com",
        "email_options": [
          "randi.nichols@levylawfirms.com",
          "rnichols@levylawfirms.com",
          "randi@levylawfirms.com"
        ],
        "email_confidence": "generated_medium",
        "phone": "",
        "department": "Debt Collection",
        "quote": "",
        "Best_match": "False",
        "Priority_score": "6"
      },
      {
        "name": "Traci Atkins",
        "title": "Legal Administrative Assistant",
        "email": "tatkins@levylawfirms.com",
        "email_options": [
          "traci.atkins@levylawfirms.com",
          "tatkins@levylawfirms.com",
          "traci@levylawfirms.com"
        ],
        "email_confidence": "generated_medium",
        "phone": "",
        "department": "Debt Collection",
        "quote": "Provides legal services and support in pursuit of debt collection.",
        "Best_match": "False",
        "Priority_score": "6"
      },
      {
        "name": "Maurice Walker",
        "title": "Paralegal",
        "email": "mwalker@levylawfirms.com",
        "email_options": [
          "maurice.walker@levylawfirms.com",
          "mwalker@levylawfirms.com",
          "maurice@levylawfirms.com"
        ],
        "email_confidence": "generated_medium",
        "phone": "",
        "department": "Debt Collection",
        "quote": "",
        "Best_match": "False",
        "Priority_score": "8"
      },
      {
        "name": "Vanhvilay Do",
        "title": "Paralegal",
        "email": "vdo@levylawfirms.com",
        "email_options": [
          "vanhvilay.do@levylawfirms.com",
          "vdo@levylawfirms.com",
          "vanhvilay@levylawfirms.com"
        ],
        "email_confidence": "generated_medium",
        "phone": "",
        "department": "Debt Collection",
        "quote": "",
        "Best_match": "False",
        "Priority_score": "8"
      }
    ],
    "search_notes": "",
    "raw_content": "Share\nSign up\nSign in\nCOMPREHENSIVE PARALEGAL SEARCH REQUEST\n\nMISSION: Find ALL paralegals, legal assistants, and support staff for this law firm\n\nFIRM DETAILS:\n- Attorney: Erin Enderle\n- Email: legal@levylawfirms.com\n- Phone: (614) 898-5200\n- Website: levylawfirms.com\n- Firm: Levy & Associates, LLC\n- Practice Area: DEBT_COLLECTION\n\nSEARCH REQUIREMENTS:\n1. PRIMARY: Search the main website (levylawfirms.com) thoroughly for ALL staff\n2. DEEP SEARCH: If website has limited info, search these sources:\n   - LinkedIn company page and employee profiles\n   - Facebook business page and staff mentions\n   - Instagram business account\n   - Google Business listings\n   - Legal directories (Avvo, FindLaw, Lawyers.com)\n   - Bar association listings\n   - Court filing documents (if accessible)\n\nTARGET ROLES TO FIND:\n- Paralegals (all levels: senior, junior, certified)\n- Legal Assistants\n- Legal Secretaries\n- Case Managers\n- Document Specialists  \n- Litigation Support Staff\n- Client Services Coordinators\n- Administrative Assistants (in legal capacity)\n\nREQUIRED INFORMATION for each person:\n- Full Name (required)\n- Job Title/Role (required) \n- Direct Email (if available) + GENERATED EMAIL OPTIONS (see below)\n- Direct Phone/Extension (if available)\n- Department/Practice Area\n- Professional Background/Quote (if available)\n\nCRITICAL EMAIL REQUIREMENTS:\n1. If direct email found: Use the actual email\n2. If NO email found: Generate 2-3 probable email options using the attorney's email format\n3. Email generation patterns to try:\n   - firstname.lastname@domain.com\n   - firstinitiallastname@domain.com  \n   - firstname@domain.com\n   - staff.firstname@domain.com\n   - paralegal.firstname@domain.com\n4. Extract domain from attorney email: legal@levylawfirms.com and use it for all generated emails\n5. or use common formats based on firm domain\n\nBEST CONTACT IDENTIFICATION:\nAnalyze the staff and identify the SINGLE BEST person to contact for attorney services/legal matters.\nConsider:\n- Senior paralegals or case managers (highest priority)\n- Legal assistants with client contact responsibilities\n- Office managers if they handle new client intake\n- Avoid receptionists unless they're the only option\nMark this person with \"Best_match\": \"True\"\n\nSEARCH STRATEGY:\n- Check \"Our Team\", \"Staff\", \"About Us\", \"Meet the Team\" pages\n- Look for staff bios and profiles\n- Search social media for team photos and mentions\n- Check LinkedIn for current employees\n- Look for staff in news articles or case announcements\n- Find people in office photos or group pictures\n\nEXTRACTION FORMAT:\nPlease output results in this EXACT JSON format:\n\n{\n    \"page_url\": \"website_searched\",\n    \"search_sources\": [\"list_of_sources_checked\"],\n    \"total_staff_found\": number,\n    \"attorney_email_domain\": \"domain_from_attorney_email\",\n    \"paralegals\": [\n        {\n            \"name\": \"Full Name\",\n            \"title\": \"Job Title\",\n            \"email\": \"direct_email_if_found_OR_most_likely_generated_email\", \n            \"email_options\": [\"email1@domain.com\", \"email2@domain.com\", \"email3@domain.com\"],\n            \"email_confidence\": \"found/generated_high/generated_medium/generated_low\",\n            \"phone\": \"direct_phone_if_found\",\n            \"department\": \"practice_area_or_department\",\n            \"quote\": \"professional_background_or_bio_excerpt\",\n            \"Best_match\": \"True_or_False\",\n            \"Priority_score\": \"from 10 to 1 (10 is highest)\"\n        }\n    ],\n    \"best_contact_reasoning\": \"explanation_of_why_this_person_was_selected_as_best_match\",\n    \"search_notes\": \"brief_summary_of_search_process_and_sources_used\"\n}\n\nSPECIFIC EMAIL GENERATION INSTRUCTIONS:\n- Attorney email pattern: legal@levylawfirms.com\n- Extract domain from attorney email and use for all staff emails if it is right/accurate coz sometimes email's person name or domain can be little miscalculated because of OCR issues mostly it is accurate (domain).\n- For \"John Smith\" generate these patterns: [\"john.smith@domain.com\", \"jsmith@domain.com\", \"john@domain.com\"]\n- Always provide 2-3 email options per person (more if unsure)\n- Mark confidence level: \"found\" (actual email found), \"generated_high\" (strong pattern match), \"generated_medium\" (reasonable guess), \"generated_low\" (last resort)\n\nBEST MATCH SELECTION CRITERIA:\nBased on the case information (Practice Area: DEBT_COLLECTION), select the staff member who would be:\n1. Most likely to handle new client intake for this practice area\n2. Senior enough to make decisions about new cases  \n3. Specifically responsible for client communications\n4. Has experience in the relevant practice area\n\nIMPORTANT: Be thorough and creative! Many firms hide staff information, so use multiple search angles. If the main website is limited, definitely search social media and professional networks. We need to find as many legal support staff as possible!\n\nCRITICAL: \n- ALWAYS generate email options even if no direct emails found\n- ALWAYS select exactly ONE person as \"Best_match\": \"True\" \n- ALWAYS explain your reasoning for the best match selection\n- MUST MAKE SURE: ALWAYS THINK HARDER\n\nSTART COMPREHENSIVE SEARCH NOW for: levylawfirms.com\nThought for 2m 21s\n{\n\"page_url\": \"https://levylawfirms.com\",\n\"search_sources\": [\"https://levylawfirms.com\", \"https://levylawllc.com\", \"LinkedIn\", \"BBB.org\", \"Avvo.com\", \"FindLaw.com\", \"Lawyers.com\", \"SuperLawyers.com\", \"Creditorsbar.org\"],\n\"total_staff_found\": 8,\n\"attorney_email_domain\": \"levylawfirms.com\",\n\"paralegals\": [\n{\n\"name\": \"Dawn Sisson\",\n\"title\": \"Director of Client and Legal Operations\",\n\"email\": \"dsisson@levylawfirms.com\",\n\"email_options\": [\"dawn.sisson@levylawfirms.com\", \"dsisson@levylawfirms.com\", \"dawn@levylawfirms.com\"],\n\"email_confidence\": \"generated_medium\",\n\"phone\": \"\",\n\"department\": \"Debt Collection\",\n\"quote\": \"Experienced in client and legal operations with a Bachelor of Arts in Legal Assistant/Paralegal from Bradford Business School.\",\n\"Best_match\": \"True\",\n\"Priority_score\": \"10\"\n},\n{\n\"name\": \"Louise Trapp\",\n\"title\": \"Legal Assistant\",\n\"email\": \"ltrapp@levylawfirms.com\",\n\"email_options\": [\"louise.trapp@levylawfirms.com\", \"ltrapp@levylawfirms.com\", \"louise@levylawfirms.com\"],\n\"email_confidence\": \"generated_medium\",\n\"phone\": \"\",\n\"department\": \"Debt Collection\",\n\"quote\": \"\",\n\"Best_match\": \"False\",\n\"Priority_score\": \"6\"\n},\n{\n\"name\": \"Cari Tangey\",\n\"title\": \"Paralegal\",\n\"email\": \"ctangey@levylawfirms.com\",\n\"email_options\": [\"cari.tangey@levylawfirms.com\", \"ctangey@levylawfirms.com\", \"cari@levylawfirms.com\"],\n\"email_confidence\": \"generated_medium\",\n\"phone\": \"\",\n\"department\": \"Debt Collection\",\n\"quote\": \"\",\n\"Best_match\": \"False\",\n\"Priority_score\": \"8\"\n},\n{\n\"name\": \"Danielle Rand\",\n\"title\": \"Legal Assistant\",\n\"email\": \"drand@levylawfirms.com\",\n\"email_options\": [\"danielle.rand@levylawfirms.com\", \"drand@levylawfirms.com\", \"danielle@levylawfirms.com\"],\n\"email_confidence\": \"generated_medium\",\n\"phone\": \"\",\n\"department\": \"Debt Collection\",\n\"quote\": \"\",\n\"Best_match\": \"False\",\n\"Priority_score\": \"6\"\n},\n{\n\"name\": \"Randi Nichols\",\n\"title\": \"Lien Specialist/Legal Assistant\",\n\"email\": \"rnichols@levylawfirms.com\",\n\"email_options\": [\"randi.nichols@levylawfirms.com\", \"rnichols@levylawfirms.com\", \"randi@levylawfirms.com\"],\n\"email_confidence\": \"generated_medium\",\n\"phone\": \"\",\n\"department\": \"Debt Collection\",\n\"quote\": \"\",\n\"Best_match\": \"False\",\n\"Priority_score\": \"6\"\n},\n{\n\"name\": \"Traci Atkins\",\n\"title\": \"Legal Administrative Assistant\",\n\"email\": \"tatkins@levylawfirms.com\",\n\"email_options\": [\"traci.atkins@levylawfirms.com\", \"tatkins@levylawfirms.com\", \"traci@levylawfirms.com\"],\n\"email_confidence\": \"generated_medium\",\n\"phone\": \"\",\n\"department\": \"Debt Collection\",\n\"quote\": \"Provides legal services and support in pursuit of debt collection.\",\n\"Best_match\": \"False\",\n\"Priority_score\": \"6\"\n},\n{\n\"name\": \"Maurice Walker\",\n\"title\": \"Paralegal\",\n\"email\": \"mwalker@levylawfirms.com\",\n\"email_options\": [\"maurice.walker@levylawfirms.com\", \"mwalker@levylawfirms.com\", \"maurice@levylawfirms.com\"],\n\"email_confidence\": \"generated_medium\",\n\"phone\": \"\",\n\"department\": \"Debt Collection\",\n\"quote\": \"\",\n\"Best_match\": \"False\",\n\"Priority_score\": \"8\"\n},\n{\n\"name\": \"Vanhvilay Do\",\n\"title\": \"Paralegal\",\n\"email\": \"vdo@levylawfirms.com\",\n\"email_options\": [\"vanhvilay.do@levylawfirms.com\", \"vdo@levylawfirms.com\", \"vanhvilay@levylawfirms.com\"],\n\"email_confidence\": \"generated_medium\",\n\"phone\": \"\",\n\"department\": \"Debt Collection\",\n\"quote\": \"\",\n\"Best_match\": \"False\",\n\"Priority_score\": \"8\"\n}\n],\n\"best_contact_reasoning\": \"Dawn Sisson was selected as the best match because as Director of Client and Legal Operations, she holds a senior position likely responsible for client intake, legal operations, and decision-making in new cases, especially in the debt collection practice area. Her paralegal background further supports her suitability for handling client communications and new matters.\",\n\"search_notes\": \"The main website had limited staff information, primarily consumer-facing. Deep search on LinkedIn yielded multiple support staff profiles. Checked legal directories like Avvo, FindLaw, and Lawyers.com, which mostly listed attorneys. BBB provided some executive names but no support staff. No social media business pages with staff mentions found. Focused on current employees based on profiles.\"\n}\n89 web pages\n2 / 2\n1.3s\nExpert\nDetails on Yale Levy\nContacting other debt firms\nAdd phone numbers\nHow can Grok help?\nAuto",
    "extraction_timestamp": "2025-10-18T02:27:24.118636",
    "raw_file": "grok_paralegal_search_results\\grok_raw_results_20251018_022724.txt"
  },
  "search_completed_at": "2025-10-18T02:27:24.143365",
  "associated_cases": 2,
  "result_file": "grok_paralegal_search_results\\grok_paralegal_search_levylawfirms_com_20251018_022724_w0.json"
}