{
  "domain": "ohiolawyer4you.com",
  "search_url": "ohiolawyer4you.com",
  "attorney_info": {
    "original_website": "ohiolawyer4you.com",
    "attorney_name": "Patrick P. Merrick",
    "attorney_email": "pmerrick@ohiolawyer4you.com",
    "phone": "(216) 339-1800",
    "firm_name": "Patrick Merrick, Attorney At Law",
    "practice_area": "OTHER",
    "case_id": "20-134475",
    "row_data": {
      "Case Number": "20-134475",
      "Filing Date": "2025-10-17",
      "Case Type": "OTHER",
      "Court": "COURT OF COMMON PLEAS CUYAHOGA COUNTY, OHIO",
      "County": "CUYAHOGA",
      "Plaintiff": "LUIS MIRANDA",
      "Primary Defendant": "SUNSET MEMORIAL PARK ASSOC",
      "Attorney Name": "Patrick P. Merrick",
      "Attorney Office": "Patrick Merrick, Attorney At Law",
      "Attorney Email": "pmerrick@ohiolawyer4you.com",
      "Attorney Phone": "(216) 339-1800",
      "Attorney Website": "ohiolawyer4you.com",
      "Relief Requested": "",
      "Processed At": "2025-10-18T01:04:32.879321",
      "Folder Name": "case_3648059",
      "Paralegal Name": "",
      "Paralegal Email": "",
      "Email-2": "",
      "Email-3": "",
      "Email-4": "",
      "Email-5": "",
      "Paralegal Number": "",
      "Department": "",
      "Paralegal Website Page Link": "",
      "Email Sent?": "",
      "Email Replied?": "",
      "Paralegal email": "",
      "Phone call?": ""
    }
  },
  "search_message": "COMPREHENSIVE PARALEGAL SEARCH REQUEST\n\nMISSION: Find ALL paralegals, legal assistants, and support staff for this law firm\n\nFIRM DETAILS:\n- Attorney: Patrick P. Merrick\n- Email: pmerrick@ohiolawyer4you.com\n- Phone: (216) 339-1800\n- Website: ohiolawyer4you.com\n- Firm: Patrick Merrick, Attorney At Law\n- Practice Area: OTHER\n\nSEARCH REQUIREMENTS:\n1. PRIMARY: Search the main website (ohiolawyer4you.com) thoroughly for ALL staff\n2. DEEP SEARCH: If website has limited info, search these sources:\n   - LinkedIn company page and employee profiles\n   - Facebook business page and staff mentions\n   - Instagram business account\n   - Google Business listings\n   - Legal directories (Avvo, FindLaw, Lawyers.com)\n   - Bar association listings\n   - Court filing documents (if accessible)\n\nTARGET ROLES TO FIND:\n- Paralegals (all levels: senior, junior, certified)\n- Legal Assistants\n- Legal Secretaries\n- Case Managers\n- Document Specialists  \n- Litigation Support Staff\n- Client Services Coordinators\n- Administrative Assistants (in legal capacity)\n\nREQUIRED INFORMATION for each person:\n- Full Name (required)\n- Job Title/Role (required) \n- Direct Email (if available) + GENERATED EMAIL OPTIONS (see below)\n- Direct Phone/Extension (if available)\n- Department/Practice Area\n- Professional Background/Quote (if available)\n\nCRITICAL EMAIL REQUIREMENTS:\n1. If direct email found: Use the actual email\n2. If NO email found: Generate 2-3 probable email options using the attorney's email format\n3. Email generation patterns to try:\n   - firstname.lastname@domain.com\n   - firstinitiallastname@domain.com  \n   - firstname@domain.com\n   - staff.firstname@domain.com\n   - paralegal.firstname@domain.com\n4. Extract domain from attorney email: pmerrick@ohiolawyer4you.com and use it for all generated emails\n5. or use common formats based on firm domain\n\nBEST CONTACT IDENTIFICATION:\nAnalyze the staff and identify the SINGLE BEST person to contact for attorney services/legal matters.\nConsider:\n- Senior paralegals or case managers (highest priority)\n- Legal assistants with client contact responsibilities\n- Office managers if they handle new client intake\n- Avoid receptionists unless they're the only option\nMark this person with \"Best_match\": \"True\"\n\nSEARCH STRATEGY:\n- Check \"Our Team\", \"Staff\", \"About Us\", \"Meet the Team\" pages\n- Look for staff bios and profiles\n- Search social media for team photos and mentions\n- Check LinkedIn for current employees\n- Look for staff in news articles or case announcements\n- Find people in office photos or group pictures\n\nEXTRACTION FORMAT:\nPlease output results in this EXACT JSON format:\n\n{\n    \"page_url\": \"website_searched\",\n    \"search_sources\": [\"list_of_sources_checked\"],\n    \"total_staff_found\": number,\n    \"attorney_email_domain\": \"domain_from_attorney_email\",\n    \"paralegals\": [\n        {\n            \"name\": \"Full Name\",\n            \"title\": \"Job Title\",\n            \"email\": \"direct_email_if_found_OR_most_likely_generated_email\", \n            \"email_options\": [\"email1@domain.com\", \"email2@domain.com\", \"email3@domain.com\"],\n            \"email_confidence\": \"found/generated_high/generated_medium/generated_low\",\n            \"phone\": \"direct_phone_if_found\",\n            \"department\": \"practice_area_or_department\",\n            \"quote\": \"professional_background_or_bio_excerpt\",\n            \"Best_match\": \"True_or_False\",\n            \"Priority_score\": \"from 10 to 1 (10 is highest)\"\n        }\n    ],\n    \"best_contact_reasoning\": \"explanation_of_why_this_person_was_selected_as_best_match\",\n    \"search_notes\": \"brief_summary_of_search_process_and_sources_used\"\n}\n\nSPECIFIC EMAIL GENERATION INSTRUCTIONS:\n- Attorney email pattern: pmerrick@ohiolawyer4you.com\n- Extract domain from attorney email and use for all staff emails if it is right/accurate coz sometimes email's person name or domain can be little miscalculated because of OCR issues mostly it is accurate (domain).\n- For \"John Smith\" generate these patterns: [\"john.smith@domain.com\", \"jsmith@domain.com\", \"john@domain.com\"]\n- Always provide 2-3 email options per person (more if unsure)\n- Mark confidence level: \"found\" (actual email found), \"generated_high\" (strong pattern match), \"generated_medium\" (reasonable guess), \"generated_low\" (last resort)\n\nBEST MATCH SELECTION CRITERIA:\nBased on the case information (Practice Area: OTHER), select the staff member who would be:\n1. Most likely to handle new client intake for this practice area\n2. Senior enough to make decisions about new cases  \n3. Specifically responsible for client communications\n4. Has experience in the relevant practice area\n\nIMPORTANT: Be thorough and creative! Many firms hide staff information, so use multiple search angles. If the main website is limited, definitely search social media and professional networks. We need to find as many legal support staff as possible!\n\nCRITICAL: \n- ALWAYS generate email options even if no direct emails found\n- ALWAYS select exactly ONE person as \"Best_match\": \"True\" \n- ALWAYS explain your reasoning for the best match selection\n- MUST MAKE SURE: ALWAYS THINK HARDER\n\nSTART COMPREHENSIVE SEARCH NOW for: ohiolawyer4you.com",
  "results": {
    "page_url": "",
    "search_sources": [],
    "total_staff_found": 4,
    "paralegals": [
      {
        "name": "Full Name",
        "title": "Job Title",
        "email": "direct_email_if_found_OR_most_likely_generated_email",
        "email_options": [
          "email1@domain.com",
          "email2@domain.com",
          "email3@domain.com"
        ],
        "email_confidence": "found/generated_high/generated_medium/generated_low",
        "phone": "direct_phone_if_found",
        "department": "practice_area_or_department",
        "quote": "professional_background_or_bio_excerpt",
        "Best_match": "True_or_False",
        "Priority_score": "from 10 to 1 (10 is highest)"
      },
      {
        "name": "Renee Giannoulis",
        "title": "Case Manager",
        "email": "rgiannoulis@ohiolawyer4you.com",
        "email_options": [
          "renee.giannoulis@ohiolawyer4you.com",
          "rgiannoulis@ohiolawyer4you.com",
          "renee@ohiolawyer4you.com"
        ],
        "email_confidence": "generated_medium",
        "phone": "",
        "department": "Social Security Disability",
        "quote": "case manager for his social security disability claimants",
        "Best_match": "True",
        "Priority_score": "10"
      },
      {
        "name": "Kathy Canon",
        "title": "Legal Assistant",
        "email": "kcanon@ohiolawyer4you.com",
        "email_options": [
          "kathy.canon@ohiolawyer4you.com",
          "kcanon@ohiolawyer4you.com",
          "kathy@ohiolawyer4you.com"
        ],
        "email_confidence": "generated_high",
        "phone": "",
        "department": "OTHER",
        "quote": "",
        "Best_match": "False",
        "Priority_score": "8"
      },
      {
        "name": "Karen Davis",
        "title": "Legal Assistant",
        "email": "kdavis@ohiolawyer4you.com",
        "email_options": [
          "karen.davis@ohiolawyer4you.com",
          "kdavis@ohiolawyer4you.com",
          "karen@ohiolawyer4you.com"
        ],
        "email_confidence": "generated_medium",
        "phone": "",
        "department": "OTHER",
        "quote": "",
        "Best_match": "False",
        "Priority_score": "7"
      }
    ],
    "search_notes": "",
    "raw_content": "Share\nSign up\nSign in\nCOMPREHENSIVE PARALEGAL SEARCH REQUEST\n\nMISSION: Find ALL paralegals, legal assistants, and support staff for this law firm\n\nFIRM DETAILS:\n- Attorney: Patrick P. Merrick\n- Email: pmerrick@ohiolawyer4you.com\n- Phone: (216) 339-1800\n- Website: ohiolawyer4you.com\n- Firm: Patrick Merrick, Attorney At Law\n- Practice Area: OTHER\n\nSEARCH REQUIREMENTS:\n1. PRIMARY: Search the main website (ohiolawyer4you.com) thoroughly for ALL staff\n2. DEEP SEARCH: If website has limited info, search these sources:\n   - LinkedIn company page and employee profiles\n   - Facebook business page and staff mentions\n   - Instagram business account\n   - Google Business listings\n   - Legal directories (Avvo, FindLaw, Lawyers.com)\n   - Bar association listings\n   - Court filing documents (if accessible)\n\nTARGET ROLES TO FIND:\n- Paralegals (all levels: senior, junior, certified)\n- Legal Assistants\n- Legal Secretaries\n- Case Managers\n- Document Specialists  \n- Litigation Support Staff\n- Client Services Coordinators\n- Administrative Assistants (in legal capacity)\n\nREQUIRED INFORMATION for each person:\n- Full Name (required)\n- Job Title/Role (required) \n- Direct Email (if available) + GENERATED EMAIL OPTIONS (see below)\n- Direct Phone/Extension (if available)\n- Department/Practice Area\n- Professional Background/Quote (if available)\n\nCRITICAL EMAIL REQUIREMENTS:\n1. If direct email found: Use the actual email\n2. If NO email found: Generate 2-3 probable email options using the attorney's email format\n3. Email generation patterns to try:\n   - firstname.lastname@domain.com\n   - firstinitiallastname@domain.com  \n   - firstname@domain.com\n   - staff.firstname@domain.com\n   - paralegal.firstname@domain.com\n4. Extract domain from attorney email: pmerrick@ohiolawyer4you.com and use it for all generated emails\n5. or use common formats based on firm domain\n\nBEST CONTACT IDENTIFICATION:\nAnalyze the staff and identify the SINGLE BEST person to contact for attorney services/legal matters.\nConsider:\n- Senior paralegals or case managers (highest priority)\n- Legal assistants with client contact responsibilities\n- Office managers if they handle new client intake\n- Avoid receptionists unless they're the only option\nMark this person with \"Best_match\": \"True\"\n\nSEARCH STRATEGY:\n- Check \"Our Team\", \"Staff\", \"About Us\", \"Meet the Team\" pages\n- Look for staff bios and profiles\n- Search social media for team photos and mentions\n- Check LinkedIn for current employees\n- Look for staff in news articles or case announcements\n- Find people in office photos or group pictures\n\nEXTRACTION FORMAT:\nPlease output results in this EXACT JSON format:\n\n{\n    \"page_url\": \"website_searched\",\n    \"search_sources\": [\"list_of_sources_checked\"],\n    \"total_staff_found\": number,\n    \"attorney_email_domain\": \"domain_from_attorney_email\",\n    \"paralegals\": [\n        {\n            \"name\": \"Full Name\",\n            \"title\": \"Job Title\",\n            \"email\": \"direct_email_if_found_OR_most_likely_generated_email\", \n            \"email_options\": [\"email1@domain.com\", \"email2@domain.com\", \"email3@domain.com\"],\n            \"email_confidence\": \"found/generated_high/generated_medium/generated_low\",\n            \"phone\": \"direct_phone_if_found\",\n            \"department\": \"practice_area_or_department\",\n            \"quote\": \"professional_background_or_bio_excerpt\",\n            \"Best_match\": \"True_or_False\",\n            \"Priority_score\": \"from 10 to 1 (10 is highest)\"\n        }\n    ],\n    \"best_contact_reasoning\": \"explanation_of_why_this_person_was_selected_as_best_match\",\n    \"search_notes\": \"brief_summary_of_search_process_and_sources_used\"\n}\n\nSPECIFIC EMAIL GENERATION INSTRUCTIONS:\n- Attorney email pattern: pmerrick@ohiolawyer4you.com\n- Extract domain from attorney email and use for all staff emails if it is right/accurate coz sometimes email's person name or domain can be little miscalculated because of OCR issues mostly it is accurate (domain).\n- For \"John Smith\" generate these patterns: [\"john.smith@domain.com\", \"jsmith@domain.com\", \"john@domain.com\"]\n- Always provide 2-3 email options per person (more if unsure)\n- Mark confidence level: \"found\" (actual email found), \"generated_high\" (strong pattern match), \"generated_medium\" (reasonable guess), \"generated_low\" (last resort)\n\nBEST MATCH SELECTION CRITERIA:\nBased on the case information (Practice Area: OTHER), select the staff member who would be:\n1. Most likely to handle new client intake for this practice area\n2. Senior enough to make decisions about new cases  \n3. Specifically responsible for client communications\n4. Has experience in the relevant practice area\n\nIMPORTANT: Be thorough and creative! Many firms hide staff information, so use multiple search angles. If the main website is limited, definitely search social media and professional networks. We need to find as many legal support staff as possible!\n\nCRITICAL: \n- ALWAYS generate email options even if no direct emails found\n- ALWAYS select exactly ONE person as \"Best_match\": \"True\" \n- ALWAYS explain your reasoning for the best match selection\n- MUST MAKE SURE: ALWAYS THINK HARDER\n\nSTART COMPREHENSIVE SEARCH NOW for: ohiolawyer4you.com\nThought for 9m 2s\n{\n\"page_url\": \"ohiolawyer4you.com\",\n\"search_sources\": [\"ohiolawyer4you.com\", \"LinkedIn\", \"ZoomInfo\", \"Yelp\", \"web searches\"],\n\"total_staff_found\": 3,\n\"attorney_email_domain\": \"ohiolawyer4you.com\",\n\"paralegals\": [\n{\n\"name\": \"Renee Giannoulis\",\n\"title\": \"Case Manager\",\n\"email\": \"rgiannoulis@ohiolawyer4you.com\",\n\"email_options\": [\"renee.giannoulis@ohiolawyer4you.com\", \"rgiannoulis@ohiolawyer4you.com\", \"renee@ohiolawyer4you.com\"],\n\"email_confidence\": \"generated_medium\",\n\"phone\": \"\",\n\"department\": \"Social Security Disability\",\n\"quote\": \"case manager for his social security disability claimants\",\n\"Best_match\": \"True\",\n\"Priority_score\": \"10\"\n},\n{\n\"name\": \"Kathy Canon\",\n\"title\": \"Legal Assistant\",\n\"email\": \"kcanon@ohiolawyer4you.com\",\n\"email_options\": [\"kathy.canon@ohiolawyer4you.com\", \"kcanon@ohiolawyer4you.com\", \"kathy@ohiolawyer4you.com\"],\n\"email_confidence\": \"generated_high\",\n\"phone\": \"\",\n\"department\": \"OTHER\",\n\"quote\": \"\",\n\"Best_match\": \"False\",\n\"Priority_score\": \"8\"\n},\n{\n\"name\": \"Karen Davis\",\n\"title\": \"Legal Assistant\",\n\"email\": \"kdavis@ohiolawyer4you.com\",\n\"email_options\": [\"karen.davis@ohiolawyer4you.com\", \"kdavis@ohiolawyer4you.com\", \"karen@ohiolawyer4you.com\"],\n\"email_confidence\": \"generated_medium\",\n\"phone\": \"\",\n\"department\": \"OTHER\",\n\"quote\": \"\",\n\"Best_match\": \"False\",\n\"Priority_score\": \"7\"\n}\n],\n\"best_contact_reasoning\": \"Renee Giannoulis was selected as the best match because her role as a case manager indicates senior-level support with likely responsibilities for client communications and case handling, aligning with the criteria for handling new client intake and decisions about new cases.\",\n\"search_notes\": \"The firm's website provided no staff information, with several subpages returning 404 errors. LinkedIn search identified Renee Giannoulis as having worked most recently as case manager. ZoomInfo revealed Kathy Canon and Karen Davis as colleagues/employees at the firm. Multiple web searches and social media checks yielded no additional staff details; job postings suggest ongoing hiring for paralegal roles but no current names beyond these.\"\n}\n73 web pages\nExpert\nHow can Grok help?\nAuto",
    "extraction_timestamp": "2025-10-18T03:13:41.295454",
    "raw_file": "grok_paralegal_search_results\\grok_raw_results_20251018_031341.txt"
  },
  "search_completed_at": "2025-10-18T03:13:41.307144",
  "associated_cases": 1,
  "result_file": "grok_paralegal_search_results\\grok_paralegal_search_ohiolawyer4you_com_20251018_031341_w2.json"
}