{
  "domain": "tt-law.com",
  "search_url": "tt-law.com",
  "attorney_info": {
    "original_website": "tt-law.com",
    "attorney_name": "Ernest V. Thomas, III",
    "attorney_email": "rick@tt-law.com",
    "phone": "513/961-5311",
    "firm_name": "Thomas & Thomas Attorneys at Law",
    "practice_area": "DEBT_COLLECTION",
    "case_id": "",
    "row_data": {
      "Case Number": "",
      "Filing Date": "",
      "Case Type": "DEBT_COLLECTION",
      "Court": "CUYAHOGA COUNTY COMMON PLEAS, CUYAHOGA COUNTY, OHIO",
      "County": "CUYAHOGA",
      "Plaintiff": "Tribune Broadcasting Company II, LLC",
      "Primary Defendant": "Unitrex, Ltd.",
      "Attorney Name": "Ernest V. Thomas, III",
      "Attorney Office": "Thomas & Thomas Attorneys at Law",
      "Attorney Email": "rick@tt-law.com",
      "Attorney Phone": "513/961-5311",
      "Attorney Website": "tt-law.com",
      "Relief Requested": "$20,000.00",
      "Processed At": "2025-10-18T01:04:32.455087",
      "Folder Name": "case_3647569",
      "Paralegal Name": "",
      "Paralegal Email": "",
      "Email-2": "",
      "Email-3": "",
      "Email-4": "",
      "Email-5": "",
      "Paralegal Number": "",
      "Department": "",
      "Paralegal Website Page Link": "",
      "Email Sent?": "",
      "Email Replied?": "",
      "Paralegal email": "",
      "Phone call?": ""
    }
  },
  "search_message": "COMPREHENSIVE PARALEGAL SEARCH REQUEST\n\nMISSION: Find ALL paralegals, legal assistants, and support staff for this law firm\n\nFIRM DETAILS:\n- Attorney: Ernest V. Thomas, III\n- Email: rick@tt-law.com\n- Phone: 513/961-5311\n- Website: tt-law.com\n- Firm: Thomas & Thomas Attorneys at Law\n- Practice Area: DEBT_COLLECTION\n\nSEARCH REQUIREMENTS:\n1. PRIMARY: Search the main website (tt-law.com) thoroughly for ALL staff\n2. DEEP SEARCH: If website has limited info, search these sources:\n   - LinkedIn company page and employee profiles\n   - Facebook business page and staff mentions\n   - Instagram business account\n   - Google Business listings\n   - Legal directories (Avvo, FindLaw, Lawyers.com)\n   - Bar association listings\n   - Court filing documents (if accessible)\n\nTARGET ROLES TO FIND:\n- Paralegals (all levels: senior, junior, certified)\n- Legal Assistants\n- Legal Secretaries\n- Case Managers\n- Document Specialists  \n- Litigation Support Staff\n- Client Services Coordinators\n- Administrative Assistants (in legal capacity)\n\nREQUIRED INFORMATION for each person:\n- Full Name (required)\n- Job Title/Role (required) \n- Direct Email (if available) + GENERATED EMAIL OPTIONS (see below)\n- Direct Phone/Extension (if available)\n- Department/Practice Area\n- Professional Background/Quote (if available)\n\nCRITICAL EMAIL REQUIREMENTS:\n1. If direct email found: Use the actual email\n2. If NO email found: Generate 2-3 probable email options using the attorney's email format\n3. Email generation patterns to try:\n   - firstname.lastname@domain.com\n   - firstinitiallastname@domain.com  \n   - firstname@domain.com\n   - staff.firstname@domain.com\n   - paralegal.firstname@domain.com\n4. Extract domain from attorney email: rick@tt-law.com and use it for all generated emails\n5. or use common formats based on firm domain\n\nBEST CONTACT IDENTIFICATION:\nAnalyze the staff and identify the SINGLE BEST person to contact for attorney services/legal matters.\nConsider:\n- Senior paralegals or case managers (highest priority)\n- Legal assistants with client contact responsibilities\n- Office managers if they handle new client intake\n- Avoid receptionists unless they're the only option\nMark this person with \"Best_match\": \"True\"\n\nSEARCH STRATEGY:\n- Check \"Our Team\", \"Staff\", \"About Us\", \"Meet the Team\" pages\n- Look for staff bios and profiles\n- Search social media for team photos and mentions\n- Check LinkedIn for current employees\n- Look for staff in news articles or case announcements\n- Find people in office photos or group pictures\n\nEXTRACTION FORMAT:\nPlease output results in this EXACT JSON format:\n\n{\n    \"page_url\": \"website_searched\",\n    \"search_sources\": [\"list_of_sources_checked\"],\n    \"total_staff_found\": number,\n    \"attorney_email_domain\": \"domain_from_attorney_email\",\n    \"paralegals\": [\n        {\n            \"name\": \"Full Name\",\n            \"title\": \"Job Title\",\n            \"email\": \"direct_email_if_found_OR_most_likely_generated_email\", \n            \"email_options\": [\"email1@domain.com\", \"email2@domain.com\", \"email3@domain.com\"],\n            \"email_confidence\": \"found/generated_high/generated_medium/generated_low\",\n            \"phone\": \"direct_phone_if_found\",\n            \"department\": \"practice_area_or_department\",\n            \"quote\": \"professional_background_or_bio_excerpt\",\n            \"Best_match\": \"True_or_False\",\n            \"Priority_score\": \"from 10 to 1 (10 is highest)\"\n        }\n    ],\n    \"best_contact_reasoning\": \"explanation_of_why_this_person_was_selected_as_best_match\",\n    \"search_notes\": \"brief_summary_of_search_process_and_sources_used\"\n}\n\nSPECIFIC EMAIL GENERATION INSTRUCTIONS:\n- Attorney email pattern: rick@tt-law.com\n- Extract domain from attorney email and use for all staff emails if it is right/accurate coz sometimes email's person name or domain can be little miscalculated because of OCR issues mostly it is accurate (domain).\n- For \"John Smith\" generate these patterns: [\"john.smith@domain.com\", \"jsmith@domain.com\", \"john@domain.com\"]\n- Always provide 2-3 email options per person (more if unsure)\n- Mark confidence level: \"found\" (actual email found), \"generated_high\" (strong pattern match), \"generated_medium\" (reasonable guess), \"generated_low\" (last resort)\n\nBEST MATCH SELECTION CRITERIA:\nBased on the case information (Practice Area: DEBT_COLLECTION), select the staff member who would be:\n1. Most likely to handle new client intake for this practice area\n2. Senior enough to make decisions about new cases  \n3. Specifically responsible for client communications\n4. Has experience in the relevant practice area\n\nIMPORTANT: Be thorough and creative! Many firms hide staff information, so use multiple search angles. If the main website is limited, definitely search social media and professional networks. We need to find as many legal support staff as possible!\n\nCRITICAL: \n- ALWAYS generate email options even if no direct emails found\n- ALWAYS select exactly ONE person as \"Best_match\": \"True\" \n- ALWAYS explain your reasoning for the best match selection\n- MUST MAKE SURE: ALWAYS THINK HARDER\n\nSTART COMPREHENSIVE SEARCH NOW for: tt-law.com",
  "results": {
    "page_url": "",
    "search_sources": [],
    "total_staff_found": 4,
    "paralegals": [
      {
        "name": "Full Name",
        "title": "Job Title",
        "email": "direct_email_if_found_OR_most_likely_generated_email",
        "email_options": [
          "email1@domain.com",
          "email2@domain.com",
          "email3@domain.com"
        ],
        "email_confidence": "found/generated_high/generated_medium/generated_low",
        "phone": "direct_phone_if_found",
        "department": "practice_area_or_department",
        "quote": "professional_background_or_bio_excerpt",
        "Best_match": "True_or_False",
        "Priority_score": "from 10 to 1 (10 is highest)"
      },
      {
        "name": "Andrew McAfee",
        "title": "Commercial Litigation Paralegal",
        "email": "amcafee@tt-law.com",
        "email_options": [
          "andrew.mcafee@tt-law.com",
          "amcafee@tt-law.com",
          "andrew@tt-law.com"
        ],
        "email_confidence": "generated_medium",
        "phone": "",
        "department": "Debt Collection / Creditors' Rights",
        "quote": "Started as assisting paralegals and advanced to Commercial Paralegal; firm focuses on debt collection, creditorâ€™s rights, and a small amount of bankruptcy. Pursued paralegal studies as a stepping stone to law school.",
        "Best_match": "True",
        "Priority_score": "10"
      },
      {
        "name": "Sarah Schmidt",
        "title": "Litigation Paralegal",
        "email": "sschmidt@tt-law.com",
        "email_options": [
          "sarah.schmidt@tt-law.com",
          "sschmidt@tt-law.com",
          "sarah@tt-law.com"
        ],
        "email_confidence": "generated_medium",
        "phone": "",
        "department": "Litigation",
        "quote": "Worked as Litigation Paralegal from September 2010 to June 2012.",
        "Best_match": "False",
        "Priority_score": "9"
      },
      {
        "name": "Joticia Hyde",
        "title": "Paralegal",
        "email": "jhyde@tt-law.com",
        "email_options": [
          "joticia.hyde@tt-law.com",
          "jhyde@tt-law.com",
          "joticia@tt-law.com"
        ],
        "email_confidence": "generated_medium",
        "phone": "",
        "department": "General Legal",
        "quote": "Worked as Paralegal from August 2007 to May 2008 in Cincinnati, Ohio Area.",
        "Best_match": "False",
        "Priority_score": "8"
      }
    ],
    "search_notes": "",
    "raw_content": "Share\nSign up\nSign in\nCOMPREHENSIVE PARALEGAL SEARCH REQUEST\n\nMISSION: Find ALL paralegals, legal assistants, and support staff for this law firm\n\nFIRM DETAILS:\n- Attorney: Ernest V. Thomas, III\n- Email: rick@tt-law.com\n- Phone: 513/961-5311\n- Website: tt-law.com\n- Firm: Thomas & Thomas Attorneys at Law\n- Practice Area: DEBT_COLLECTION\n\nSEARCH REQUIREMENTS:\n1. PRIMARY: Search the main website (tt-law.com) thoroughly for ALL staff\n2. DEEP SEARCH: If website has limited info, search these sources:\n   - LinkedIn company page and employee profiles\n   - Facebook business page and staff mentions\n   - Instagram business account\n   - Google Business listings\n   - Legal directories (Avvo, FindLaw, Lawyers.com)\n   - Bar association listings\n   - Court filing documents (if accessible)\n\nTARGET ROLES TO FIND:\n- Paralegals (all levels: senior, junior, certified)\n- Legal Assistants\n- Legal Secretaries\n- Case Managers\n- Document Specialists  \n- Litigation Support Staff\n- Client Services Coordinators\n- Administrative Assistants (in legal capacity)\n\nREQUIRED INFORMATION for each person:\n- Full Name (required)\n- Job Title/Role (required) \n- Direct Email (if available) + GENERATED EMAIL OPTIONS (see below)\n- Direct Phone/Extension (if available)\n- Department/Practice Area\n- Professional Background/Quote (if available)\n\nCRITICAL EMAIL REQUIREMENTS:\n1. If direct email found: Use the actual email\n2. If NO email found: Generate 2-3 probable email options using the attorney's email format\n3. Email generation patterns to try:\n   - firstname.lastname@domain.com\n   - firstinitiallastname@domain.com  \n   - firstname@domain.com\n   - staff.firstname@domain.com\n   - paralegal.firstname@domain.com\n4. Extract domain from attorney email: rick@tt-law.com and use it for all generated emails\n5. or use common formats based on firm domain\n\nBEST CONTACT IDENTIFICATION:\nAnalyze the staff and identify the SINGLE BEST person to contact for attorney services/legal matters.\nConsider:\n- Senior paralegals or case managers (highest priority)\n- Legal assistants with client contact responsibilities\n- Office managers if they handle new client intake\n- Avoid receptionists unless they're the only option\nMark this person with \"Best_match\": \"True\"\n\nSEARCH STRATEGY:\n- Check \"Our Team\", \"Staff\", \"About Us\", \"Meet the Team\" pages\n- Look for staff bios and profiles\n- Search social media for team photos and mentions\n- Check LinkedIn for current employees\n- Look for staff in news articles or case announcements\n- Find people in office photos or group pictures\n\nEXTRACTION FORMAT:\nPlease output results in this EXACT JSON format:\n\n{\n    \"page_url\": \"website_searched\",\n    \"search_sources\": [\"list_of_sources_checked\"],\n    \"total_staff_found\": number,\n    \"attorney_email_domain\": \"domain_from_attorney_email\",\n    \"paralegals\": [\n        {\n            \"name\": \"Full Name\",\n            \"title\": \"Job Title\",\n            \"email\": \"direct_email_if_found_OR_most_likely_generated_email\", \n            \"email_options\": [\"email1@domain.com\", \"email2@domain.com\", \"email3@domain.com\"],\n            \"email_confidence\": \"found/generated_high/generated_medium/generated_low\",\n            \"phone\": \"direct_phone_if_found\",\n            \"department\": \"practice_area_or_department\",\n            \"quote\": \"professional_background_or_bio_excerpt\",\n            \"Best_match\": \"True_or_False\",\n            \"Priority_score\": \"from 10 to 1 (10 is highest)\"\n        }\n    ],\n    \"best_contact_reasoning\": \"explanation_of_why_this_person_was_selected_as_best_match\",\n    \"search_notes\": \"brief_summary_of_search_process_and_sources_used\"\n}\n\nSPECIFIC EMAIL GENERATION INSTRUCTIONS:\n- Attorney email pattern: rick@tt-law.com\n- Extract domain from attorney email and use for all staff emails if it is right/accurate coz sometimes email's person name or domain can be little miscalculated because of OCR issues mostly it is accurate (domain).\n- For \"John Smith\" generate these patterns: [\"john.smith@domain.com\", \"jsmith@domain.com\", \"john@domain.com\"]\n- Always provide 2-3 email options per person (more if unsure)\n- Mark confidence level: \"found\" (actual email found), \"generated_high\" (strong pattern match), \"generated_medium\" (reasonable guess), \"generated_low\" (last resort)\n\nBEST MATCH SELECTION CRITERIA:\nBased on the case information (Practice Area: DEBT_COLLECTION), select the staff member who would be:\n1. Most likely to handle new client intake for this practice area\n2. Senior enough to make decisions about new cases  \n3. Specifically responsible for client communications\n4. Has experience in the relevant practice area\n\nIMPORTANT: Be thorough and creative! Many firms hide staff information, so use multiple search angles. If the main website is limited, definitely search social media and professional networks. We need to find as many legal support staff as possible!\n\nCRITICAL: \n- ALWAYS generate email options even if no direct emails found\n- ALWAYS select exactly ONE person as \"Best_match\": \"True\" \n- ALWAYS explain your reasoning for the best match selection\n- MUST MAKE SURE: ALWAYS THINK HARDER\n\nSTART COMPREHENSIVE SEARCH NOW for: tt-law.com\nThought for 2m 47s\n{\n\"page_url\": \"tt-law.com\",\n\"search_sources\": [\"tt-law.com\", \"linkedin.com\", \"ucclermont.edu\", \"zoominfo.com\", \"rocketreach.co\", \"clla.org\", \"lawcrossing.com\"],\n\"total_staff_found\": 3,\n\"attorney_email_domain\": \"tt-law.com\",\n\"paralegals\": [\n{\n\"name\": \"Andrew McAfee\",\n\"title\": \"Commercial Litigation Paralegal\",\n\"email\": \"amcafee@tt-law.com\",\n\"email_options\": [\"andrew.mcafee@tt-law.com\", \"amcafee@tt-law.com\", \"andrew@tt-law.com\"],\n\"email_confidence\": \"generated_medium\",\n\"phone\": \"\",\n\"department\": \"Debt Collection / Creditors' Rights\",\n\"quote\": \"Started as assisting paralegals and advanced to Commercial Paralegal; firm focuses on debt collection, creditorâ€™s rights, and a small amount of bankruptcy. Pursued paralegal studies as a stepping stone to law school.\",\n\"Best_match\": \"True\",\n\"Priority_score\": \"10\"\n},\n{\n\"name\": \"Sarah Schmidt\",\n\"title\": \"Litigation Paralegal\",\n\"email\": \"sschmidt@tt-law.com\",\n\"email_options\": [\"sarah.schmidt@tt-law.com\", \"sschmidt@tt-law.com\", \"sarah@tt-law.com\"],\n\"email_confidence\": \"generated_medium\",\n\"phone\": \"\",\n\"department\": \"Litigation\",\n\"quote\": \"Worked as Litigation Paralegal from September 2010 to June 2012.\",\n\"Best_match\": \"False\",\n\"Priority_score\": \"9\"\n},\n{\n\"name\": \"Joticia Hyde\",\n\"title\": \"Paralegal\",\n\"email\": \"jhyde@tt-law.com\",\n\"email_options\": [\"joticia.hyde@tt-law.com\", \"jhyde@tt-law.com\", \"joticia@tt-law.com\"],\n\"email_confidence\": \"generated_medium\",\n\"phone\": \"\",\n\"department\": \"General Legal\",\n\"quote\": \"Worked as Paralegal from August 2007 to May 2008 in Cincinnati, Ohio Area.\",\n\"Best_match\": \"False\",\n\"Priority_score\": \"8\"\n}\n],\n\"best_contact_reasoning\": \"Although all identified staff members are former employees based on available public information, Andrew McAfee stands out as the best match due to his most recent tenure (2012-2015), role as a Commercial Litigation Paralegal directly aligned with the firm's debt collection practice area, and demonstrated progression in responsibilities which suggests seniority and client-handling capabilities.\",\n\"search_notes\": \"The main website tt-law.com provides no specific staff details beyond general mentions of paralegals and collectors. Deep searches on LinkedIn, university success stories, and directories like ZoomInfo revealed only former paralegals; no current support staff were identified in any sources. Attempts to browse LinkedIn profiles and ZoomInfo returned no data, possibly due to access restrictions. Social media and legal directories yielded no additional staff information.\"\n}\n56 web pages\n2.5s\nExpert\nSearch RocketReach for current staff\nExplore Apollo.io for firm contacts\nAdd current staff verification steps\nHow can Grok help?\nAuto",
    "extraction_timestamp": "2025-10-18T02:56:17.206522",
    "raw_file": "grok_paralegal_search_results\\grok_raw_results_20251018_025617.txt"
  },
  "search_completed_at": "2025-10-18T02:56:17.216460",
  "associated_cases": 1,
  "result_file": "grok_paralegal_search_results\\grok_paralegal_search_tt-law_com_20251018_025617_w1.json"
}