{
  "domain": "sandhu-law.com",
  "search_url": "sandhu-law.com",
  "attorney_info": {
    "original_website": "sandhu-law.com",
    "attorney_name": "David T. Brady",
    "attorney_email": "sgodenswager@sandhu-law.com",
    "phone": "216-373-1001",
    "firm_name": "Sandhu Law Group, LLC",
    "practice_area": "FORECLOSURE",
    "case_id": "23-01031",
    "row_data": {
      "Case Number": "23-01031",
      "Filing Date": "2025-10-16",
      "Case Type": "FORECLOSURE",
      "Court": "IN THE COURT OF COMMON PLEAS, CUYAHOGA COUNTY, OHIO, CIVIL DIVISION",
      "County": "CUYAHOGA",
      "Plaintiff": "FIFTH THIRD BANK, N.A.",
      "Primary Defendant": "SHEILA R. EXNER",
      "Attorney Name": "David T. Brady",
      "Attorney Office": "Sandhu Law Group, LLC",
      "Attorney Email": "sgodenswager@sandhu-law.com",
      "Attorney Phone": "216-373-1001",
      "Attorney Website": "sandhu-law.com",
      "Relief Requested": "$102,816.06",
      "Processed At": "2025-10-18T01:04:32.620328",
      "Folder Name": "case_3647754",
      "Paralegal Name": "",
      "Paralegal Email": "",
      "Email-2": "",
      "Email-3": "",
      "Email-4": "",
      "Email-5": "",
      "Paralegal Number": "",
      "Department": "",
      "Paralegal Website Page Link": "",
      "Email Sent?": "",
      "Email Replied?": "",
      "Paralegal email": "",
      "Phone call?": ""
    }
  },
  "search_message": "COMPREHENSIVE PARALEGAL SEARCH REQUEST\n\nMISSION: Find ALL paralegals, legal assistants, and support staff for this law firm\n\nFIRM DETAILS:\n- Attorney: David T. Brady\n- Email: sgodenswager@sandhu-law.com\n- Phone: 216-373-1001\n- Website: sandhu-law.com\n- Firm: Sandhu Law Group, LLC\n- Practice Area: FORECLOSURE\n\nSEARCH REQUIREMENTS:\n1. PRIMARY: Search the main website (sandhu-law.com) thoroughly for ALL staff\n2. DEEP SEARCH: If website has limited info, search these sources:\n   - LinkedIn company page and employee profiles\n   - Facebook business page and staff mentions\n   - Instagram business account\n   - Google Business listings\n   - Legal directories (Avvo, FindLaw, Lawyers.com)\n   - Bar association listings\n   - Court filing documents (if accessible)\n\nTARGET ROLES TO FIND:\n- Paralegals (all levels: senior, junior, certified)\n- Legal Assistants\n- Legal Secretaries\n- Case Managers\n- Document Specialists  \n- Litigation Support Staff\n- Client Services Coordinators\n- Administrative Assistants (in legal capacity)\n\nREQUIRED INFORMATION for each person:\n- Full Name (required)\n- Job Title/Role (required) \n- Direct Email (if available) + GENERATED EMAIL OPTIONS (see below)\n- Direct Phone/Extension (if available)\n- Department/Practice Area\n- Professional Background/Quote (if available)\n\nCRITICAL EMAIL REQUIREMENTS:\n1. If direct email found: Use the actual email\n2. If NO email found: Generate 2-3 probable email options using the attorney's email format\n3. Email generation patterns to try:\n   - firstname.lastname@domain.com\n   - firstinitiallastname@domain.com  \n   - firstname@domain.com\n   - staff.firstname@domain.com\n   - paralegal.firstname@domain.com\n4. Extract domain from attorney email: sgodenswager@sandhu-law.com and use it for all generated emails\n5. or use common formats based on firm domain\n\nBEST CONTACT IDENTIFICATION:\nAnalyze the staff and identify the SINGLE BEST person to contact for attorney services/legal matters.\nConsider:\n- Senior paralegals or case managers (highest priority)\n- Legal assistants with client contact responsibilities\n- Office managers if they handle new client intake\n- Avoid receptionists unless they're the only option\nMark this person with \"Best_match\": \"True\"\n\nSEARCH STRATEGY:\n- Check \"Our Team\", \"Staff\", \"About Us\", \"Meet the Team\" pages\n- Look for staff bios and profiles\n- Search social media for team photos and mentions\n- Check LinkedIn for current employees\n- Look for staff in news articles or case announcements\n- Find people in office photos or group pictures\n\nEXTRACTION FORMAT:\nPlease output results in this EXACT JSON format:\n\n{\n    \"page_url\": \"website_searched\",\n    \"search_sources\": [\"list_of_sources_checked\"],\n    \"total_staff_found\": number,\n    \"attorney_email_domain\": \"domain_from_attorney_email\",\n    \"paralegals\": [\n        {\n            \"name\": \"Full Name\",\n            \"title\": \"Job Title\",\n            \"email\": \"direct_email_if_found_OR_most_likely_generated_email\", \n            \"email_options\": [\"email1@domain.com\", \"email2@domain.com\", \"email3@domain.com\"],\n            \"email_confidence\": \"found/generated_high/generated_medium/generated_low\",\n            \"phone\": \"direct_phone_if_found\",\n            \"department\": \"practice_area_or_department\",\n            \"quote\": \"professional_background_or_bio_excerpt\",\n            \"Best_match\": \"True_or_False\",\n            \"Priority_score\": \"from 10 to 1 (10 is highest)\"\n        }\n    ],\n    \"best_contact_reasoning\": \"explanation_of_why_this_person_was_selected_as_best_match\",\n    \"search_notes\": \"brief_summary_of_search_process_and_sources_used\"\n}\n\nSPECIFIC EMAIL GENERATION INSTRUCTIONS:\n- Attorney email pattern: sgodenswager@sandhu-law.com\n- Extract domain from attorney email and use for all staff emails if it is right/accurate coz sometimes email's person name or domain can be little miscalculated because of OCR issues mostly it is accurate (domain).\n- For \"John Smith\" generate these patterns: [\"john.smith@domain.com\", \"jsmith@domain.com\", \"john@domain.com\"]\n- Always provide 2-3 email options per person (more if unsure)\n- Mark confidence level: \"found\" (actual email found), \"generated_high\" (strong pattern match), \"generated_medium\" (reasonable guess), \"generated_low\" (last resort)\n\nBEST MATCH SELECTION CRITERIA:\nBased on the case information (Practice Area: FORECLOSURE), select the staff member who would be:\n1. Most likely to handle new client intake for this practice area\n2. Senior enough to make decisions about new cases  \n3. Specifically responsible for client communications\n4. Has experience in the relevant practice area\n\nIMPORTANT: Be thorough and creative! Many firms hide staff information, so use multiple search angles. If the main website is limited, definitely search social media and professional networks. We need to find as many legal support staff as possible!\n\nCRITICAL: \n- ALWAYS generate email options even if no direct emails found\n- ALWAYS select exactly ONE person as \"Best_match\": \"True\" \n- ALWAYS explain your reasoning for the best match selection\n- MUST MAKE SURE: ALWAYS THINK HARDER\n\nSTART COMPREHENSIVE SEARCH NOW for: sandhu-law.com",
  "results": {
    "page_url": "",
    "search_sources": [],
    "total_staff_found": 6,
    "paralegals": [
      {
        "name": "Full Name",
        "title": "Job Title",
        "email": "direct_email_if_found_OR_most_likely_generated_email",
        "email_options": [
          "email1@domain.com",
          "email2@domain.com",
          "email3@domain.com"
        ],
        "email_confidence": "found/generated_high/generated_medium/generated_low",
        "phone": "direct_phone_if_found",
        "department": "practice_area_or_department",
        "quote": "professional_background_or_bio_excerpt",
        "Best_match": "True_or_False",
        "Priority_score": "from 10 to 1 (10 is highest)"
      },
      {
        "name": "Shannon Kilbane",
        "title": "Paralegal",
        "email": "skilbane@sandhu-law.com",
        "email_options": [
          "skilbane@sandhu-law.com",
          "shannon.kilbane@sandhu-law.com",
          "shannon@sandhu-law.com"
        ],
        "email_confidence": "generated_high",
        "phone": "",
        "department": "Foreclosure / Creditors Rights",
        "quote": "Experienced paralegal with prior roles as Paralegal at Crawford Law LLC and Legal Assistant II.",
        "Best_match": "True",
        "Priority_score": "10"
      },
      {
        "name": "James Bodrock",
        "title": "Legal Assistant",
        "email": "jbodrock@sandhu-law.com",
        "email_options": [
          "jbodrock@sandhu-law.com",
          "james.bodrock@sandhu-law.com",
          "james@sandhu-law.com"
        ],
        "email_confidence": "generated_high",
        "phone": "",
        "department": "Foreclosure / Creditors Rights",
        "quote": "",
        "Best_match": "False",
        "Priority_score": "7"
      },
      {
        "name": "Julian Sellars",
        "title": "Legal Assistant",
        "email": "jsellars@sandhu-law.com",
        "email_options": [
          "jsellars@sandhu-law.com",
          "julian.sellars@sandhu-law.com",
          "julian@sandhu-law.com"
        ],
        "email_confidence": "generated_high",
        "phone": "",
        "department": "Foreclosure / Creditors Rights",
        "quote": "",
        "Best_match": "False",
        "Priority_score": "6"
      },
      {
        "name": "Jessie Wright",
        "title": "Legal Assistant",
        "email": "jwright@sandhu-law.com",
        "email_options": [
          "jwright@sandhu-law.com",
          "jessie.wright@sandhu-law.com",
          "jessie@sandhu-law.com"
        ],
        "email_confidence": "generated_high",
        "phone": "",
        "department": "Foreclosure / Creditors Rights",
        "quote": "Recent graduate with a B.A. in Psychology and a minor in Criminal Justice.",
        "Best_match": "False",
        "Priority_score": "5"
      },
      {
        "name": "Jennifer Silva",
        "title": "Administrative Assistant",
        "email": "jsilva@sandhu-law.com",
        "email_options": [
          "jsilva@sandhu-law.com",
          "jennifer.silva@sandhu-law.com",
          "jennifer@sandhu-law.com"
        ],
        "email_confidence": "found",
        "phone": "",
        "department": "Client Services / Administrative",
        "quote": "",
        "Best_match": "False",
        "Priority_score": "9"
      }
    ],
    "search_notes": "",
    "raw_content": "Share\nSign up\nSign in\nCOMPREHENSIVE PARALEGAL SEARCH REQUEST\n\nMISSION: Find ALL paralegals, legal assistants, and support staff for this law firm\n\nFIRM DETAILS:\n- Attorney: David T. Brady\n- Email: sgodenswager@sandhu-law.com\n- Phone: 216-373-1001\n- Website: sandhu-law.com\n- Firm: Sandhu Law Group, LLC\n- Practice Area: FORECLOSURE\n\nSEARCH REQUIREMENTS:\n1. PRIMARY: Search the main website (sandhu-law.com) thoroughly for ALL staff\n2. DEEP SEARCH: If website has limited info, search these sources:\n   - LinkedIn company page and employee profiles\n   - Facebook business page and staff mentions\n   - Instagram business account\n   - Google Business listings\n   - Legal directories (Avvo, FindLaw, Lawyers.com)\n   - Bar association listings\n   - Court filing documents (if accessible)\n\nTARGET ROLES TO FIND:\n- Paralegals (all levels: senior, junior, certified)\n- Legal Assistants\n- Legal Secretaries\n- Case Managers\n- Document Specialists  \n- Litigation Support Staff\n- Client Services Coordinators\n- Administrative Assistants (in legal capacity)\n\nREQUIRED INFORMATION for each person:\n- Full Name (required)\n- Job Title/Role (required) \n- Direct Email (if available) + GENERATED EMAIL OPTIONS (see below)\n- Direct Phone/Extension (if available)\n- Department/Practice Area\n- Professional Background/Quote (if available)\n\nCRITICAL EMAIL REQUIREMENTS:\n1. If direct email found: Use the actual email\n2. If NO email found: Generate 2-3 probable email options using the attorney's email format\n3. Email generation patterns to try:\n   - firstname.lastname@domain.com\n   - firstinitiallastname@domain.com  \n   - firstname@domain.com\n   - staff.firstname@domain.com\n   - paralegal.firstname@domain.com\n4. Extract domain from attorney email: sgodenswager@sandhu-law.com and use it for all generated emails\n5. or use common formats based on firm domain\n\nBEST CONTACT IDENTIFICATION:\nAnalyze the staff and identify the SINGLE BEST person to contact for attorney services/legal matters.\nConsider:\n- Senior paralegals or case managers (highest priority)\n- Legal assistants with client contact responsibilities\n- Office managers if they handle new client intake\n- Avoid receptionists unless they're the only option\nMark this person with \"Best_match\": \"True\"\n\nSEARCH STRATEGY:\n- Check \"Our Team\", \"Staff\", \"About Us\", \"Meet the Team\" pages\n- Look for staff bios and profiles\n- Search social media for team photos and mentions\n- Check LinkedIn for current employees\n- Look for staff in news articles or case announcements\n- Find people in office photos or group pictures\n\nEXTRACTION FORMAT:\nPlease output results in this EXACT JSON format:\n\n{\n    \"page_url\": \"website_searched\",\n    \"search_sources\": [\"list_of_sources_checked\"],\n    \"total_staff_found\": number,\n    \"attorney_email_domain\": \"domain_from_attorney_email\",\n    \"paralegals\": [\n        {\n            \"name\": \"Full Name\",\n            \"title\": \"Job Title\",\n            \"email\": \"direct_email_if_found_OR_most_likely_generated_email\", \n            \"email_options\": [\"email1@domain.com\", \"email2@domain.com\", \"email3@domain.com\"],\n            \"email_confidence\": \"found/generated_high/generated_medium/generated_low\",\n            \"phone\": \"direct_phone_if_found\",\n            \"department\": \"practice_area_or_department\",\n            \"quote\": \"professional_background_or_bio_excerpt\",\n            \"Best_match\": \"True_or_False\",\n            \"Priority_score\": \"from 10 to 1 (10 is highest)\"\n        }\n    ],\n    \"best_contact_reasoning\": \"explanation_of_why_this_person_was_selected_as_best_match\",\n    \"search_notes\": \"brief_summary_of_search_process_and_sources_used\"\n}\n\nSPECIFIC EMAIL GENERATION INSTRUCTIONS:\n- Attorney email pattern: sgodenswager@sandhu-law.com\n- Extract domain from attorney email and use for all staff emails if it is right/accurate coz sometimes email's person name or domain can be little miscalculated because of OCR issues mostly it is accurate (domain).\n- For \"John Smith\" generate these patterns: [\"john.smith@domain.com\", \"jsmith@domain.com\", \"john@domain.com\"]\n- Always provide 2-3 email options per person (more if unsure)\n- Mark confidence level: \"found\" (actual email found), \"generated_high\" (strong pattern match), \"generated_medium\" (reasonable guess), \"generated_low\" (last resort)\n\nBEST MATCH SELECTION CRITERIA:\nBased on the case information (Practice Area: FORECLOSURE), select the staff member who would be:\n1. Most likely to handle new client intake for this practice area\n2. Senior enough to make decisions about new cases  \n3. Specifically responsible for client communications\n4. Has experience in the relevant practice area\n\nIMPORTANT: Be thorough and creative! Many firms hide staff information, so use multiple search angles. If the main website is limited, definitely search social media and professional networks. We need to find as many legal support staff as possible!\n\nCRITICAL: \n- ALWAYS generate email options even if no direct emails found\n- ALWAYS select exactly ONE person as \"Best_match\": \"True\" \n- ALWAYS explain your reasoning for the best match selection\n- MUST MAKE SURE: ALWAYS THINK HARDER\n\nSTART COMPREHENSIVE SEARCH NOW for: sandhu-law.com\nThought for 2m 23s\n{\n\"page_url\": \"https://sandhu-law.com\",\n\"search_sources\": [\"https://sandhu-law.com\", \"LinkedIn\", \"Avvo.com\", \"FindLaw.com\", \"Lawyers.com\", \"Ohio State Bar Association\", \"Court filings via web search\", \"Facebook search\", \"Instagram search\", \"X (Twitter)\"],\n\"total_staff_found\": 5,\n\"attorney_email_domain\": \"sandhu-law.com\",\n\"paralegals\": [\n{\n\"name\": \"Shannon Kilbane\",\n\"title\": \"Paralegal\",\n\"email\": \"skilbane@sandhu-law.com\",\n\"email_options\": [\"skilbane@sandhu-law.com\", \"shannon.kilbane@sandhu-law.com\", \"shannon@sandhu-law.com\"],\n\"email_confidence\": \"generated_high\",\n\"phone\": \"\",\n\"department\": \"Foreclosure / Creditors Rights\",\n\"quote\": \"Experienced paralegal with prior roles as Paralegal at Crawford Law LLC and Legal Assistant II.\",\n\"Best_match\": \"True\",\n\"Priority_score\": \"10\"\n},\n{\n\"name\": \"James Bodrock\",\n\"title\": \"Legal Assistant\",\n\"email\": \"jbodrock@sandhu-law.com\",\n\"email_options\": [\"jbodrock@sandhu-law.com\", \"james.bodrock@sandhu-law.com\", \"james@sandhu-law.com\"],\n\"email_confidence\": \"generated_high\",\n\"phone\": \"\",\n\"department\": \"Foreclosure / Creditors Rights\",\n\"quote\": \"\",\n\"Best_match\": \"False\",\n\"Priority_score\": \"7\"\n},\n{\n\"name\": \"Julian Sellars\",\n\"title\": \"Legal Assistant\",\n\"email\": \"jsellars@sandhu-law.com\",\n\"email_options\": [\"jsellars@sandhu-law.com\", \"julian.sellars@sandhu-law.com\", \"julian@sandhu-law.com\"],\n\"email_confidence\": \"generated_high\",\n\"phone\": \"\",\n\"department\": \"Foreclosure / Creditors Rights\",\n\"quote\": \"\",\n\"Best_match\": \"False\",\n\"Priority_score\": \"6\"\n},\n{\n\"name\": \"Jessie Wright\",\n\"title\": \"Legal Assistant\",\n\"email\": \"jwright@sandhu-law.com\",\n\"email_options\": [\"jwright@sandhu-law.com\", \"jessie.wright@sandhu-law.com\", \"jessie@sandhu-law.com\"],\n\"email_confidence\": \"generated_high\",\n\"phone\": \"\",\n\"department\": \"Foreclosure / Creditors Rights\",\n\"quote\": \"Recent graduate with a B.A. in Psychology and a minor in Criminal Justice.\",\n\"Best_match\": \"False\",\n\"Priority_score\": \"5\"\n},\n{\n\"name\": \"Jennifer Silva\",\n\"title\": \"Administrative Assistant\",\n\"email\": \"jsilva@sandhu-law.com\",\n\"email_options\": [\"jsilva@sandhu-law.com\", \"jennifer.silva@sandhu-law.com\", \"jennifer@sandhu-law.com\"],\n\"email_confidence\": \"found\",\n\"phone\": \"\",\n\"department\": \"Client Services / Administrative\",\n\"quote\": \"\",\n\"Best_match\": \"False\",\n\"Priority_score\": \"9\"\n}\n],\n\"best_contact_reasoning\": \"Shannon Kilbane was selected as the best match due to her role as a paralegal with over 9 years of experience at the firm, plus prior relevant experience in legal support roles. This seniority positions her as the most likely to handle new client intake, make decisions on foreclosure cases, manage client communications, and have deep knowledge of the firm's practice area.\",\n\"search_notes\": \"The main website provided limited staff details, mentioning only general team composition without specifics. LinkedIn searches yielded the majority of support staff profiles. Legal directories like Avvo and FindLaw listed attorneys but no support staff. Social media searches on Facebook, Instagram, and X did not reveal additional staff mentions. Court filings referenced attorneys only. Email patterns were derived from known attorney and contact emails on the site.\"\n}\n3 𝕏 posts\n64 web pages\n1.4s\nExpert\nQuick Answer\nHow can Grok help?\nAuto",
    "extraction_timestamp": "2025-10-18T03:00:01.016072",
    "raw_file": "grok_paralegal_search_results\\grok_raw_results_20251018_030001.txt"
  },
  "search_completed_at": "2025-10-18T03:00:01.039142",
  "associated_cases": 1,
  "result_file": "grok_paralegal_search_results\\grok_paralegal_search_sandhu-law_com_20251018_030001_w0.json"
}