{
  "domain": "ldvlaw.com",
  "search_url": "ldvlaw.com",
  "attorney_info": {
    "original_website": "ldvlaw.com",
    "attorney_name": "Jackson T. Moyer",
    "attorney_email": "info@ldvlaw.com",
    "phone": "(888) 322-3922",
    "firm_name": "Lyons, Doughty & Veldhuis, P.C.",
    "practice_area": "DEBT_COLLECTION",
    "case_id": "",
    "row_data": {
      "Case Number": "",
      "Filing Date": "2025-10-15",
      "Case Type": "DEBT_COLLECTION",
      "Court": "CUYAHOGA COUNTY COMMON PLEAS COURT",
      "County": "CUYAHOGA",
      "Plaintiff": "JPMORGAN CHASE BANK, N.A.",
      "Primary Defendant": "JASON BINETTE",
      "Attorney Name": "Jackson T. Moyer",
      "Attorney Office": "Lyons, Doughty & Veldhuis, P.C.",
      "Attorney Email": "info@ldvlaw.com",
      "Attorney Phone": "(888) 322-3922",
      "Attorney Website": "ldvlaw.com",
      "Relief Requested": "$17,655.76",
      "Processed At": "2025-10-18T01:04:31.766112",
      "Folder Name": "case_3647113",
      "Paralegal Name": "",
      "Paralegal Email": "",
      "Email-2": "",
      "Email-3": "",
      "Email-4": "",
      "Email-5": "",
      "Paralegal Number": "",
      "Department": "",
      "Paralegal Website Page Link": "",
      "Email Sent?": "",
      "Email Replied?": "",
      "Paralegal email": "",
      "Phone call?": ""
    }
  },
  "search_message": "COMPREHENSIVE PARALEGAL SEARCH REQUEST\n\nMISSION: Find ALL paralegals, legal assistants, and support staff for this law firm\n\nFIRM DETAILS:\n- Attorney: Jackson T. Moyer\n- Email: info@ldvlaw.com\n- Phone: (888) 322-3922\n- Website: ldvlaw.com\n- Firm: Lyons, Doughty & Veldhuis, P.C.\n- Practice Area: DEBT_COLLECTION\n\nSEARCH REQUIREMENTS:\n1. PRIMARY: Search the main website (ldvlaw.com) thoroughly for ALL staff\n2. DEEP SEARCH: If website has limited info, search these sources:\n   - LinkedIn company page and employee profiles\n   - Facebook business page and staff mentions\n   - Instagram business account\n   - Google Business listings\n   - Legal directories (Avvo, FindLaw, Lawyers.com)\n   - Bar association listings\n   - Court filing documents (if accessible)\n\nTARGET ROLES TO FIND:\n- Paralegals (all levels: senior, junior, certified)\n- Legal Assistants\n- Legal Secretaries\n- Case Managers\n- Document Specialists  \n- Litigation Support Staff\n- Client Services Coordinators\n- Administrative Assistants (in legal capacity)\n\nREQUIRED INFORMATION for each person:\n- Full Name (required)\n- Job Title/Role (required) \n- Direct Email (if available) + GENERATED EMAIL OPTIONS (see below)\n- Direct Phone/Extension (if available)\n- Department/Practice Area\n- Professional Background/Quote (if available)\n\nCRITICAL EMAIL REQUIREMENTS:\n1. If direct email found: Use the actual email\n2. If NO email found: Generate 2-3 probable email options using the attorney's email format\n3. Email generation patterns to try:\n   - firstname.lastname@domain.com\n   - firstinitiallastname@domain.com  \n   - firstname@domain.com\n   - staff.firstname@domain.com\n   - paralegal.firstname@domain.com\n4. Extract domain from attorney email: info@ldvlaw.com and use it for all generated emails\n5. or use common formats based on firm domain\n\nBEST CONTACT IDENTIFICATION:\nAnalyze the staff and identify the SINGLE BEST person to contact for attorney services/legal matters.\nConsider:\n- Senior paralegals or case managers (highest priority)\n- Legal assistants with client contact responsibilities\n- Office managers if they handle new client intake\n- Avoid receptionists unless they're the only option\nMark this person with \"Best_match\": \"True\"\n\nSEARCH STRATEGY:\n- Check \"Our Team\", \"Staff\", \"About Us\", \"Meet the Team\" pages\n- Look for staff bios and profiles\n- Search social media for team photos and mentions\n- Check LinkedIn for current employees\n- Look for staff in news articles or case announcements\n- Find people in office photos or group pictures\n\nEXTRACTION FORMAT:\nPlease output results in this EXACT JSON format:\n\n{\n    \"page_url\": \"website_searched\",\n    \"search_sources\": [\"list_of_sources_checked\"],\n    \"total_staff_found\": number,\n    \"attorney_email_domain\": \"domain_from_attorney_email\",\n    \"paralegals\": [\n        {\n            \"name\": \"Full Name\",\n            \"title\": \"Job Title\",\n            \"email\": \"direct_email_if_found_OR_most_likely_generated_email\", \n            \"email_options\": [\"email1@domain.com\", \"email2@domain.com\", \"email3@domain.com\"],\n            \"email_confidence\": \"found/generated_high/generated_medium/generated_low\",\n            \"phone\": \"direct_phone_if_found\",\n            \"department\": \"practice_area_or_department\",\n            \"quote\": \"professional_background_or_bio_excerpt\",\n            \"Best_match\": \"True_or_False\",\n            \"Priority_score\": \"from 10 to 1 (10 is highest)\"\n        }\n    ],\n    \"best_contact_reasoning\": \"explanation_of_why_this_person_was_selected_as_best_match\",\n    \"search_notes\": \"brief_summary_of_search_process_and_sources_used\"\n}\n\nSPECIFIC EMAIL GENERATION INSTRUCTIONS:\n- Attorney email pattern: info@ldvlaw.com\n- Extract domain from attorney email and use for all staff emails if it is right/accurate coz sometimes email's person name or domain can be little miscalculated because of OCR issues mostly it is accurate (domain).\n- For \"John Smith\" generate these patterns: [\"john.smith@domain.com\", \"jsmith@domain.com\", \"john@domain.com\"]\n- Always provide 2-3 email options per person (more if unsure)\n- Mark confidence level: \"found\" (actual email found), \"generated_high\" (strong pattern match), \"generated_medium\" (reasonable guess), \"generated_low\" (last resort)\n\nBEST MATCH SELECTION CRITERIA:\nBased on the case information (Practice Area: DEBT_COLLECTION), select the staff member who would be:\n1. Most likely to handle new client intake for this practice area\n2. Senior enough to make decisions about new cases  \n3. Specifically responsible for client communications\n4. Has experience in the relevant practice area\n\nIMPORTANT: Be thorough and creative! Many firms hide staff information, so use multiple search angles. If the main website is limited, definitely search social media and professional networks. We need to find as many legal support staff as possible!\n\nCRITICAL: \n- ALWAYS generate email options even if no direct emails found\n- ALWAYS select exactly ONE person as \"Best_match\": \"True\" \n- ALWAYS explain your reasoning for the best match selection\n- MUST MAKE SURE: ALWAYS THINK HARDER\n\nSTART COMPREHENSIVE SEARCH NOW for: ldvlaw.com",
  "results": {
    "page_url": "",
    "search_sources": [],
    "total_staff_found": 8,
    "paralegals": [
      {
        "name": "Full Name",
        "title": "Job Title",
        "email": "direct_email_if_found_OR_most_likely_generated_email",
        "email_options": [
          "email1@domain.com",
          "email2@domain.com",
          "email3@domain.com"
        ],
        "email_confidence": "found/generated_high/generated_medium/generated_low",
        "phone": "direct_phone_if_found",
        "department": "practice_area_or_department",
        "quote": "professional_background_or_bio_excerpt",
        "Best_match": "True_or_False",
        "Priority_score": "from 10 to 1 (10 is highest)"
      },
      {
        "name": "Brian Todd",
        "title": "Director of Client Services",
        "email": "brian.todd@ldvlaw.com",
        "email_options": [
          "brian.todd@ldvlaw.com",
          "btodd@ldvlaw.com",
          "brian@ldvlaw.com"
        ],
        "email_confidence": "generated_medium",
        "phone": "",
        "department": "Client Services",
        "quote": "",
        "Best_match": "True",
        "Priority_score": "10"
      },
      {
        "name": "Elizabeth Kerr",
        "title": "Client Liaison",
        "email": "elizabeth.kerr@ldvlaw.com",
        "email_options": [
          "elizabeth.kerr@ldvlaw.com",
          "ekerr@ldvlaw.com",
          "elizabeth@ldvlaw.com"
        ],
        "email_confidence": "generated_medium",
        "phone": "",
        "department": "Client Services",
        "quote": "Skilled in escalated communication and conflict resolution. Experienced in identifying and resolving issues to ensure customer satisfaction.",
        "Best_match": "False",
        "Priority_score": "8"
      },
      {
        "name": "Joseph Trantas",
        "title": "Client Liaison",
        "email": "joseph.trantas@ldvlaw.com",
        "email_options": [
          "joseph.trantas@ldvlaw.com",
          "jtrantas@ldvlaw.com",
          "joseph@ldvlaw.com"
        ],
        "email_confidence": "generated_medium",
        "phone": "",
        "department": "Client Services",
        "quote": "Experiences in multiple fields of work, also a musician for many years.",
        "Best_match": "False",
        "Priority_score": "7"
      },
      {
        "name": "Glennys Cuevas-Marrero",
        "title": "Client Support Specialist",
        "email": "glennys.cuevas-marrero@ldvlaw.com",
        "email_options": [
          "glennys.cuevas-marrero@ldvlaw.com",
          "gcuevas-marrero@ldvlaw.com",
          "glennys@ldvlaw.com"
        ],
        "email_confidence": "generated_medium",
        "phone": "",
        "department": "Client Services",
        "quote": "",
        "Best_match": "False",
        "Priority_score": "6"
      },
      {
        "name": "Jessica Hopely",
        "title": "Clerical Unit",
        "email": "jessica.hopely@ldvlaw.com",
        "email_options": [
          "jessica.hopely@ldvlaw.com",
          "jhopely@ldvlaw.com",
          "jessica@ldvlaw.com"
        ],
        "email_confidence": "generated_medium",
        "phone": "",
        "department": "Administrative",
        "quote": "",
        "Best_match": "False",
        "Priority_score": "5"
      },
      {
        "name": "Heather Hester",
        "title": "Client Services",
        "email": "heather.hester@ldvlaw.com",
        "email_options": [
          "heather.hester@ldvlaw.com",
          "hhester@ldvlaw.com",
          "heather@ldvlaw.com"
        ],
        "email_confidence": "generated_medium",
        "phone": "",
        "department": "Client Services",
        "quote": "",
        "Best_match": "False",
        "Priority_score": "6"
      },
      {
        "name": "Tara Snyder",
        "title": "Client Support Specialist",
        "email": "tara.snyder@ldvlaw.com",
        "email_options": [
          "tara.snyder@ldvlaw.com",
          "tsnyder@ldvlaw.com",
          "tara@ldvlaw.com"
        ],
        "email_confidence": "generated_medium",
        "phone": "",
        "department": "Client Services",
        "quote": "Detail-oriented and dependable professional with over a decade of experience spanning legal client support, data entry, and customer service. Proficient in utilizing various software applications, including Microsoft Office, and adept at handling sensitive information with confidentiality.",
        "Best_match": "False",
        "Priority_score": "8"
      }
    ],
    "search_notes": "",
    "raw_content": "Share\nSign up\nSign in\nCOMPREHENSIVE PARALEGAL SEARCH REQUEST\n\nMISSION: Find ALL paralegals, legal assistants, and support staff for this law firm\n\nFIRM DETAILS:\n- Attorney: Jackson T. Moyer\n- Email: info@ldvlaw.com\n- Phone: (888) 322-3922\n- Website: ldvlaw.com\n- Firm: Lyons, Doughty & Veldhuis, P.C.\n- Practice Area: DEBT_COLLECTION\n\nSEARCH REQUIREMENTS:\n1. PRIMARY: Search the main website (ldvlaw.com) thoroughly for ALL staff\n2. DEEP SEARCH: If website has limited info, search these sources:\n   - LinkedIn company page and employee profiles\n   - Facebook business page and staff mentions\n   - Instagram business account\n   - Google Business listings\n   - Legal directories (Avvo, FindLaw, Lawyers.com)\n   - Bar association listings\n   - Court filing documents (if accessible)\n\nTARGET ROLES TO FIND:\n- Paralegals (all levels: senior, junior, certified)\n- Legal Assistants\n- Legal Secretaries\n- Case Managers\n- Document Specialists  \n- Litigation Support Staff\n- Client Services Coordinators\n- Administrative Assistants (in legal capacity)\n\nREQUIRED INFORMATION for each person:\n- Full Name (required)\n- Job Title/Role (required) \n- Direct Email (if available) + GENERATED EMAIL OPTIONS (see below)\n- Direct Phone/Extension (if available)\n- Department/Practice Area\n- Professional Background/Quote (if available)\n\nCRITICAL EMAIL REQUIREMENTS:\n1. If direct email found: Use the actual email\n2. If NO email found: Generate 2-3 probable email options using the attorney's email format\n3. Email generation patterns to try:\n   - firstname.lastname@domain.com\n   - firstinitiallastname@domain.com  \n   - firstname@domain.com\n   - staff.firstname@domain.com\n   - paralegal.firstname@domain.com\n4. Extract domain from attorney email: info@ldvlaw.com and use it for all generated emails\n5. or use common formats based on firm domain\n\nBEST CONTACT IDENTIFICATION:\nAnalyze the staff and identify the SINGLE BEST person to contact for attorney services/legal matters.\nConsider:\n- Senior paralegals or case managers (highest priority)\n- Legal assistants with client contact responsibilities\n- Office managers if they handle new client intake\n- Avoid receptionists unless they're the only option\nMark this person with \"Best_match\": \"True\"\n\nSEARCH STRATEGY:\n- Check \"Our Team\", \"Staff\", \"About Us\", \"Meet the Team\" pages\n- Look for staff bios and profiles\n- Search social media for team photos and mentions\n- Check LinkedIn for current employees\n- Look for staff in news articles or case announcements\n- Find people in office photos or group pictures\n\nEXTRACTION FORMAT:\nPlease output results in this EXACT JSON format:\n\n{\n    \"page_url\": \"website_searched\",\n    \"search_sources\": [\"list_of_sources_checked\"],\n    \"total_staff_found\": number,\n    \"attorney_email_domain\": \"domain_from_attorney_email\",\n    \"paralegals\": [\n        {\n            \"name\": \"Full Name\",\n            \"title\": \"Job Title\",\n            \"email\": \"direct_email_if_found_OR_most_likely_generated_email\", \n            \"email_options\": [\"email1@domain.com\", \"email2@domain.com\", \"email3@domain.com\"],\n            \"email_confidence\": \"found/generated_high/generated_medium/generated_low\",\n            \"phone\": \"direct_phone_if_found\",\n            \"department\": \"practice_area_or_department\",\n            \"quote\": \"professional_background_or_bio_excerpt\",\n            \"Best_match\": \"True_or_False\",\n            \"Priority_score\": \"from 10 to 1 (10 is highest)\"\n        }\n    ],\n    \"best_contact_reasoning\": \"explanation_of_why_this_person_was_selected_as_best_match\",\n    \"search_notes\": \"brief_summary_of_search_process_and_sources_used\"\n}\n\nSPECIFIC EMAIL GENERATION INSTRUCTIONS:\n- Attorney email pattern: info@ldvlaw.com\n- Extract domain from attorney email and use for all staff emails if it is right/accurate coz sometimes email's person name or domain can be little miscalculated because of OCR issues mostly it is accurate (domain).\n- For \"John Smith\" generate these patterns: [\"john.smith@domain.com\", \"jsmith@domain.com\", \"john@domain.com\"]\n- Always provide 2-3 email options per person (more if unsure)\n- Mark confidence level: \"found\" (actual email found), \"generated_high\" (strong pattern match), \"generated_medium\" (reasonable guess), \"generated_low\" (last resort)\n\nBEST MATCH SELECTION CRITERIA:\nBased on the case information (Practice Area: DEBT_COLLECTION), select the staff member who would be:\n1. Most likely to handle new client intake for this practice area\n2. Senior enough to make decisions about new cases  \n3. Specifically responsible for client communications\n4. Has experience in the relevant practice area\n\nIMPORTANT: Be thorough and creative! Many firms hide staff information, so use multiple search angles. If the main website is limited, definitely search social media and professional networks. We need to find as many legal support staff as possible!\n\nCRITICAL: \n- ALWAYS generate email options even if no direct emails found\n- ALWAYS select exactly ONE person as \"Best_match\": \"True\" \n- ALWAYS explain your reasoning for the best match selection\n- MUST MAKE SURE: ALWAYS THINK HARDER\n\nSTART COMPREHENSIVE SEARCH NOW for: ldvlaw.com\nThought for 2m 18s\n{\n\"page_url\": \"https://ldvlaw.com\",\n\"search_sources\": [\"https://ldvlaw.com\", \"linkedin.com\", \"avvo.com\", \"lawyers.com\", \"findlaw.com\", \"bbb.org\", \"justia.com\", \"trellis.law\"],\n\"total_staff_found\": 7,\n\"attorney_email_domain\": \"ldvlaw.com\",\n\"paralegals\": [\n{\n\"name\": \"Brian Todd\",\n\"title\": \"Director of Client Services\",\n\"email\": \"brian.todd@ldvlaw.com\",\n\"email_options\": [\"brian.todd@ldvlaw.com\", \"btodd@ldvlaw.com\", \"brian@ldvlaw.com\"],\n\"email_confidence\": \"generated_medium\",\n\"phone\": \"\",\n\"department\": \"Client Services\",\n\"quote\": \"\",\n\"Best_match\": \"True\",\n\"Priority_score\": \"10\"\n},\n{\n\"name\": \"Elizabeth Kerr\",\n\"title\": \"Client Liaison\",\n\"email\": \"elizabeth.kerr@ldvlaw.com\",\n\"email_options\": [\"elizabeth.kerr@ldvlaw.com\", \"ekerr@ldvlaw.com\", \"elizabeth@ldvlaw.com\"],\n\"email_confidence\": \"generated_medium\",\n\"phone\": \"\",\n\"department\": \"Client Services\",\n\"quote\": \"Skilled in escalated communication and conflict resolution. Experienced in identifying and resolving issues to ensure customer satisfaction.\",\n\"Best_match\": \"False\",\n\"Priority_score\": \"8\"\n},\n{\n\"name\": \"Joseph Trantas\",\n\"title\": \"Client Liaison\",\n\"email\": \"joseph.trantas@ldvlaw.com\",\n\"email_options\": [\"joseph.trantas@ldvlaw.com\", \"jtrantas@ldvlaw.com\", \"joseph@ldvlaw.com\"],\n\"email_confidence\": \"generated_medium\",\n\"phone\": \"\",\n\"department\": \"Client Services\",\n\"quote\": \"Experiences in multiple fields of work, also a musician for many years.\",\n\"Best_match\": \"False\",\n\"Priority_score\": \"7\"\n},\n{\n\"name\": \"Glennys Cuevas-Marrero\",\n\"title\": \"Client Support Specialist\",\n\"email\": \"glennys.cuevas-marrero@ldvlaw.com\",\n\"email_options\": [\"glennys.cuevas-marrero@ldvlaw.com\", \"gcuevas-marrero@ldvlaw.com\", \"glennys@ldvlaw.com\"],\n\"email_confidence\": \"generated_medium\",\n\"phone\": \"\",\n\"department\": \"Client Services\",\n\"quote\": \"\",\n\"Best_match\": \"False\",\n\"Priority_score\": \"6\"\n},\n{\n\"name\": \"Jessica Hopely\",\n\"title\": \"Clerical Unit\",\n\"email\": \"jessica.hopely@ldvlaw.com\",\n\"email_options\": [\"jessica.hopely@ldvlaw.com\", \"jhopely@ldvlaw.com\", \"jessica@ldvlaw.com\"],\n\"email_confidence\": \"generated_medium\",\n\"phone\": \"\",\n\"department\": \"Administrative\",\n\"quote\": \"\",\n\"Best_match\": \"False\",\n\"Priority_score\": \"5\"\n},\n{\n\"name\": \"Heather Hester\",\n\"title\": \"Client Services\",\n\"email\": \"heather.hester@ldvlaw.com\",\n\"email_options\": [\"heather.hester@ldvlaw.com\", \"hhester@ldvlaw.com\", \"heather@ldvlaw.com\"],\n\"email_confidence\": \"generated_medium\",\n\"phone\": \"\",\n\"department\": \"Client Services\",\n\"quote\": \"\",\n\"Best_match\": \"False\",\n\"Priority_score\": \"6\"\n},\n{\n\"name\": \"Tara Snyder\",\n\"title\": \"Client Support Specialist\",\n\"email\": \"tara.snyder@ldvlaw.com\",\n\"email_options\": [\"tara.snyder@ldvlaw.com\", \"tsnyder@ldvlaw.com\", \"tara@ldvlaw.com\"],\n\"email_confidence\": \"generated_medium\",\n\"phone\": \"\",\n\"department\": \"Client Services\",\n\"quote\": \"Detail-oriented and dependable professional with over a decade of experience spanning legal client support, data entry, and customer service. Proficient in utilizing various software applications, including Microsoft Office, and adept at handling sensitive information with confidentiality.\",\n\"Best_match\": \"False\",\n\"Priority_score\": \"8\"\n}\n],\n\"best_contact_reasoning\": \"As the Director of Client Services, Brian Todd holds a senior position likely responsible for overseeing client intake, communications, and case management in the debt collection practice area, making him the most suitable for handling new legal matters.\",\n\"search_notes\": \"The firm's website ldvlaw.com does not list any staff. No social media business pages found with staff information. All staff identified through LinkedIn profiles via web searches. Focused on support staff in client services roles, as no current paralegals or legal assistants were publicly listed. Checked legal directories and court filings, but no additional support staff found.\"\n}\n82 web pages\n1.5s\nExpert\nVerify email formats with patterns\nSearch for paralegals at firm\nHow can Grok help?\nAuto",
    "extraction_timestamp": "2025-10-18T02:46:37.236409",
    "raw_file": "grok_paralegal_search_results\\grok_raw_results_20251018_024637.txt"
  },
  "search_completed_at": "2025-10-18T02:46:37.297025",
  "associated_cases": 2,
  "result_file": "grok_paralegal_search_results\\grok_paralegal_search_ldvlaw_com_20251018_024637_w2.json"
}