{
  "domain": "slaterzurz.com",
  "search_url": "slaterzurz.com",
  "attorney_info": {
    "original_website": "slaterzurz.com",
    "attorney_name": "BRANDON M. DEAN",
    "attorney_email": "bdean@slaterzurz.com",
    "phone": "(330) 762-0700",
    "firm_name": "SLATER & ZURZ LLP",
    "practice_area": "PERSONAL_INJURY",
    "case_id": "",
    "row_data": {
      "Case Number": "",
      "Filing Date": "",
      "Case Type": "PERSONAL_INJURY",
      "Court": "IN THE COURT OF COMMON PLEAS CIVIL DIVISION CUYAHOGA COUNTY, OHIO",
      "County": "CUYAHOGA",
      "Plaintiff": "RICHARD V. ZURZ, JR., Fiduciary, the E/O Derrick Peterson, Deceased",
      "Primary Defendant": "WESTCHESTER HEALTH CARE, INC.",
      "Attorney Name": "BRANDON M. DEAN",
      "Attorney Office": "SLATER & ZURZ LLP",
      "Attorney Email": "bdean@slaterzurz.com",
      "Attorney Phone": "(330) 762-0700",
      "Attorney Website": "slaterzurz.com",
      "Relief Requested": "$25,000.00",
      "Processed At": "2025-10-18T01:04:33.066838",
      "Folder Name": "case_3648222",
      "Paralegal Name": "",
      "Paralegal Email": "",
      "Email-2": "",
      "Email-3": "",
      "Email-4": "",
      "Email-5": "",
      "Paralegal Number": "",
      "Department": "",
      "Paralegal Website Page Link": "",
      "Email Sent?": "",
      "Email Replied?": "",
      "Paralegal email": "",
      "Phone call?": ""
    }
  },
  "search_message": "COMPREHENSIVE PARALEGAL SEARCH REQUEST\n\nMISSION: Find ALL paralegals, legal assistants, and support staff for this law firm\n\nFIRM DETAILS:\n- Attorney: BRANDON M. DEAN\n- Email: bdean@slaterzurz.com\n- Phone: (330) 762-0700\n- Website: slaterzurz.com\n- Firm: SLATER & ZURZ LLP\n- Practice Area: PERSONAL_INJURY\n\nSEARCH REQUIREMENTS:\n1. PRIMARY: Search the main website (slaterzurz.com) thoroughly for ALL staff\n2. DEEP SEARCH: If website has limited info, search these sources:\n   - LinkedIn company page and employee profiles\n   - Facebook business page and staff mentions\n   - Instagram business account\n   - Google Business listings\n   - Legal directories (Avvo, FindLaw, Lawyers.com)\n   - Bar association listings\n   - Court filing documents (if accessible)\n\nTARGET ROLES TO FIND:\n- Paralegals (all levels: senior, junior, certified)\n- Legal Assistants\n- Legal Secretaries\n- Case Managers\n- Document Specialists  \n- Litigation Support Staff\n- Client Services Coordinators\n- Administrative Assistants (in legal capacity)\n\nREQUIRED INFORMATION for each person:\n- Full Name (required)\n- Job Title/Role (required) \n- Direct Email (if available) + GENERATED EMAIL OPTIONS (see below)\n- Direct Phone/Extension (if available)\n- Department/Practice Area\n- Professional Background/Quote (if available)\n\nCRITICAL EMAIL REQUIREMENTS:\n1. If direct email found: Use the actual email\n2. If NO email found: Generate 2-3 probable email options using the attorney's email format\n3. Email generation patterns to try:\n   - firstname.lastname@domain.com\n   - firstinitiallastname@domain.com  \n   - firstname@domain.com\n   - staff.firstname@domain.com\n   - paralegal.firstname@domain.com\n4. Extract domain from attorney email: bdean@slaterzurz.com and use it for all generated emails\n5. or use common formats based on firm domain\n\nBEST CONTACT IDENTIFICATION:\nAnalyze the staff and identify the SINGLE BEST person to contact for attorney services/legal matters.\nConsider:\n- Senior paralegals or case managers (highest priority)\n- Legal assistants with client contact responsibilities\n- Office managers if they handle new client intake\n- Avoid receptionists unless they're the only option\nMark this person with \"Best_match\": \"True\"\n\nSEARCH STRATEGY:\n- Check \"Our Team\", \"Staff\", \"About Us\", \"Meet the Team\" pages\n- Look for staff bios and profiles\n- Search social media for team photos and mentions\n- Check LinkedIn for current employees\n- Look for staff in news articles or case announcements\n- Find people in office photos or group pictures\n\nEXTRACTION FORMAT:\nPlease output results in this EXACT JSON format:\n\n{\n    \"page_url\": \"website_searched\",\n    \"search_sources\": [\"list_of_sources_checked\"],\n    \"total_staff_found\": number,\n    \"attorney_email_domain\": \"domain_from_attorney_email\",\n    \"paralegals\": [\n        {\n            \"name\": \"Full Name\",\n            \"title\": \"Job Title\",\n            \"email\": \"direct_email_if_found_OR_most_likely_generated_email\", \n            \"email_options\": [\"email1@domain.com\", \"email2@domain.com\", \"email3@domain.com\"],\n            \"email_confidence\": \"found/generated_high/generated_medium/generated_low\",\n            \"phone\": \"direct_phone_if_found\",\n            \"department\": \"practice_area_or_department\",\n            \"quote\": \"professional_background_or_bio_excerpt\",\n            \"Best_match\": \"True_or_False\",\n            \"Priority_score\": \"from 10 to 1 (10 is highest)\"\n        }\n    ],\n    \"best_contact_reasoning\": \"explanation_of_why_this_person_was_selected_as_best_match\",\n    \"search_notes\": \"brief_summary_of_search_process_and_sources_used\"\n}\n\nSPECIFIC EMAIL GENERATION INSTRUCTIONS:\n- Attorney email pattern: bdean@slaterzurz.com\n- Extract domain from attorney email and use for all staff emails if it is right/accurate coz sometimes email's person name or domain can be little miscalculated because of OCR issues mostly it is accurate (domain).\n- For \"John Smith\" generate these patterns: [\"john.smith@domain.com\", \"jsmith@domain.com\", \"john@domain.com\"]\n- Always provide 2-3 email options per person (more if unsure)\n- Mark confidence level: \"found\" (actual email found), \"generated_high\" (strong pattern match), \"generated_medium\" (reasonable guess), \"generated_low\" (last resort)\n\nBEST MATCH SELECTION CRITERIA:\nBased on the case information (Practice Area: PERSONAL_INJURY), select the staff member who would be:\n1. Most likely to handle new client intake for this practice area\n2. Senior enough to make decisions about new cases  \n3. Specifically responsible for client communications\n4. Has experience in the relevant practice area\n\nIMPORTANT: Be thorough and creative! Many firms hide staff information, so use multiple search angles. If the main website is limited, definitely search social media and professional networks. We need to find as many legal support staff as possible!\n\nCRITICAL: \n- ALWAYS generate email options even if no direct emails found\n- ALWAYS select exactly ONE person as \"Best_match\": \"True\" \n- ALWAYS explain your reasoning for the best match selection\n- MUST MAKE SURE: ALWAYS THINK HARDER\n\nSTART COMPREHENSIVE SEARCH NOW for: slaterzurz.com",
  "results": {
    "page_url": "",
    "search_sources": [],
    "total_staff_found": 6,
    "paralegals": [
      {
        "name": "Full Name",
        "title": "Job Title",
        "email": "direct_email_if_found_OR_most_likely_generated_email",
        "email_options": [
          "email1@domain.com",
          "email2@domain.com",
          "email3@domain.com"
        ],
        "email_confidence": "found/generated_high/generated_medium/generated_low",
        "phone": "direct_phone_if_found",
        "department": "practice_area_or_department",
        "quote": "professional_background_or_bio_excerpt",
        "Best_match": "True_or_False",
        "Priority_score": "from 10 to 1 (10 is highest)"
      },
      {
        "name": "Charnise Wells",
        "title": "Legal Assistant & Paralegal",
        "email": "cwells@slaterzurz.com",
        "email_options": [
          "cwells@slaterzurz.com",
          "charnise.wells@slaterzurz.com",
          "charnise@slaterzurz.com"
        ],
        "email_confidence": "generated_medium",
        "phone": "",
        "department": "PERSONAL_INJURY",
        "quote": "",
        "Best_match": "True",
        "Priority_score": "10"
      },
      {
        "name": "Joseph Distel",
        "title": "Paralegal",
        "email": "jdistel@slaterzurz.com",
        "email_options": [
          "jdistel@slaterzurz.com",
          "joseph.distel@slaterzurz.com",
          "joseph@slaterzurz.com"
        ],
        "email_confidence": "generated_medium",
        "phone": "",
        "department": "PERSONAL_INJURY",
        "quote": "",
        "Best_match": "False",
        "Priority_score": "9"
      },
      {
        "name": "Sandy Zdelar",
        "title": "Legal Assistant",
        "email": "szdelar@slaterzurz.com",
        "email_options": [
          "szdelar@slaterzurz.com",
          "sandy.zdelar@slaterzurz.com",
          "sandy@slaterzurz.com"
        ],
        "email_confidence": "generated_medium",
        "phone": "",
        "department": "PERSONAL_INJURY",
        "quote": "",
        "Best_match": "False",
        "Priority_score": "8"
      },
      {
        "name": "Kim White",
        "title": "Client Relations Coordinator",
        "email": "kwhite@slaterzurz.com",
        "email_options": [
          "kwhite@slaterzurz.com",
          "kim.white@slaterzurz.com",
          "kim@slaterzurz.com"
        ],
        "email_confidence": "generated_medium",
        "phone": "",
        "department": "PERSONAL_INJURY",
        "quote": "",
        "Best_match": "False",
        "Priority_score": "7"
      },
      {
        "name": "Anne Williams",
        "title": "Legal Assistant",
        "email": "awilliams@slaterzurz.com",
        "email_options": [
          "awilliams@slaterzurz.com",
          "anne.williams@slaterzurz.com",
          "anne@slaterzurz.com"
        ],
        "email_confidence": "generated_medium",
        "phone": "",
        "department": "PERSONAL_INJURY",
        "quote": "",
        "Best_match": "False",
        "Priority_score": "6"
      }
    ],
    "search_notes": "",
    "raw_content": "Share\nSign up\nSign in\nCOMPREHENSIVE PARALEGAL SEARCH REQUEST\n\nMISSION: Find ALL paralegals, legal assistants, and support staff for this law firm\n\nFIRM DETAILS:\n- Attorney: BRANDON M. DEAN\n- Email: bdean@slaterzurz.com\n- Phone: (330) 762-0700\n- Website: slaterzurz.com\n- Firm: SLATER & ZURZ LLP\n- Practice Area: PERSONAL_INJURY\n\nSEARCH REQUIREMENTS:\n1. PRIMARY: Search the main website (slaterzurz.com) thoroughly for ALL staff\n2. DEEP SEARCH: If website has limited info, search these sources:\n   - LinkedIn company page and employee profiles\n   - Facebook business page and staff mentions\n   - Instagram business account\n   - Google Business listings\n   - Legal directories (Avvo, FindLaw, Lawyers.com)\n   - Bar association listings\n   - Court filing documents (if accessible)\n\nTARGET ROLES TO FIND:\n- Paralegals (all levels: senior, junior, certified)\n- Legal Assistants\n- Legal Secretaries\n- Case Managers\n- Document Specialists  \n- Litigation Support Staff\n- Client Services Coordinators\n- Administrative Assistants (in legal capacity)\n\nREQUIRED INFORMATION for each person:\n- Full Name (required)\n- Job Title/Role (required) \n- Direct Email (if available) + GENERATED EMAIL OPTIONS (see below)\n- Direct Phone/Extension (if available)\n- Department/Practice Area\n- Professional Background/Quote (if available)\n\nCRITICAL EMAIL REQUIREMENTS:\n1. If direct email found: Use the actual email\n2. If NO email found: Generate 2-3 probable email options using the attorney's email format\n3. Email generation patterns to try:\n   - firstname.lastname@domain.com\n   - firstinitiallastname@domain.com  \n   - firstname@domain.com\n   - staff.firstname@domain.com\n   - paralegal.firstname@domain.com\n4. Extract domain from attorney email: bdean@slaterzurz.com and use it for all generated emails\n5. or use common formats based on firm domain\n\nBEST CONTACT IDENTIFICATION:\nAnalyze the staff and identify the SINGLE BEST person to contact for attorney services/legal matters.\nConsider:\n- Senior paralegals or case managers (highest priority)\n- Legal assistants with client contact responsibilities\n- Office managers if they handle new client intake\n- Avoid receptionists unless they're the only option\nMark this person with \"Best_match\": \"True\"\n\nSEARCH STRATEGY:\n- Check \"Our Team\", \"Staff\", \"About Us\", \"Meet the Team\" pages\n- Look for staff bios and profiles\n- Search social media for team photos and mentions\n- Check LinkedIn for current employees\n- Look for staff in news articles or case announcements\n- Find people in office photos or group pictures\n\nEXTRACTION FORMAT:\nPlease output results in this EXACT JSON format:\n\n{\n    \"page_url\": \"website_searched\",\n    \"search_sources\": [\"list_of_sources_checked\"],\n    \"total_staff_found\": number,\n    \"attorney_email_domain\": \"domain_from_attorney_email\",\n    \"paralegals\": [\n        {\n            \"name\": \"Full Name\",\n            \"title\": \"Job Title\",\n            \"email\": \"direct_email_if_found_OR_most_likely_generated_email\", \n            \"email_options\": [\"email1@domain.com\", \"email2@domain.com\", \"email3@domain.com\"],\n            \"email_confidence\": \"found/generated_high/generated_medium/generated_low\",\n            \"phone\": \"direct_phone_if_found\",\n            \"department\": \"practice_area_or_department\",\n            \"quote\": \"professional_background_or_bio_excerpt\",\n            \"Best_match\": \"True_or_False\",\n            \"Priority_score\": \"from 10 to 1 (10 is highest)\"\n        }\n    ],\n    \"best_contact_reasoning\": \"explanation_of_why_this_person_was_selected_as_best_match\",\n    \"search_notes\": \"brief_summary_of_search_process_and_sources_used\"\n}\n\nSPECIFIC EMAIL GENERATION INSTRUCTIONS:\n- Attorney email pattern: bdean@slaterzurz.com\n- Extract domain from attorney email and use for all staff emails if it is right/accurate coz sometimes email's person name or domain can be little miscalculated because of OCR issues mostly it is accurate (domain).\n- For \"John Smith\" generate these patterns: [\"john.smith@domain.com\", \"jsmith@domain.com\", \"john@domain.com\"]\n- Always provide 2-3 email options per person (more if unsure)\n- Mark confidence level: \"found\" (actual email found), \"generated_high\" (strong pattern match), \"generated_medium\" (reasonable guess), \"generated_low\" (last resort)\n\nBEST MATCH SELECTION CRITERIA:\nBased on the case information (Practice Area: PERSONAL_INJURY), select the staff member who would be:\n1. Most likely to handle new client intake for this practice area\n2. Senior enough to make decisions about new cases  \n3. Specifically responsible for client communications\n4. Has experience in the relevant practice area\n\nIMPORTANT: Be thorough and creative! Many firms hide staff information, so use multiple search angles. If the main website is limited, definitely search social media and professional networks. We need to find as many legal support staff as possible!\n\nCRITICAL: \n- ALWAYS generate email options even if no direct emails found\n- ALWAYS select exactly ONE person as \"Best_match\": \"True\" \n- ALWAYS explain your reasoning for the best match selection\n- MUST MAKE SURE: ALWAYS THINK HARDER\n\nSTART COMPREHENSIVE SEARCH NOW for: slaterzurz.com\nThought for 2m 49s\n{\n\"page_url\": \"https://slaterzurz.com\",\n\"search_sources\": [\"slaterzurz.com\", \"linkedin.com\", \"zoominfo.com\", \"datanyze.com\", \"dnb.com\", \"avvo.com\", \"lawyers.com\"],\n\"total_staff_found\": 5,\n\"attorney_email_domain\": \"slaterzurz.com\",\n\"paralegals\": [\n{\n\"name\": \"Charnise Wells\",\n\"title\": \"Legal Assistant & Paralegal\",\n\"email\": \"cwells@slaterzurz.com\",\n\"email_options\": [\"cwells@slaterzurz.com\", \"charnise.wells@slaterzurz.com\", \"charnise@slaterzurz.com\"],\n\"email_confidence\": \"generated_medium\",\n\"phone\": \"\",\n\"department\": \"PERSONAL_INJURY\",\n\"quote\": \"\",\n\"Best_match\": \"True\",\n\"Priority_score\": \"10\"\n},\n{\n\"name\": \"Joseph Distel\",\n\"title\": \"Paralegal\",\n\"email\": \"jdistel@slaterzurz.com\",\n\"email_options\": [\"jdistel@slaterzurz.com\", \"joseph.distel@slaterzurz.com\", \"joseph@slaterzurz.com\"],\n\"email_confidence\": \"generated_medium\",\n\"phone\": \"\",\n\"department\": \"PERSONAL_INJURY\",\n\"quote\": \"\",\n\"Best_match\": \"False\",\n\"Priority_score\": \"9\"\n},\n{\n\"name\": \"Sandy Zdelar\",\n\"title\": \"Legal Assistant\",\n\"email\": \"szdelar@slaterzurz.com\",\n\"email_options\": [\"szdelar@slaterzurz.com\", \"sandy.zdelar@slaterzurz.com\", \"sandy@slaterzurz.com\"],\n\"email_confidence\": \"generated_medium\",\n\"phone\": \"\",\n\"department\": \"PERSONAL_INJURY\",\n\"quote\": \"\",\n\"Best_match\": \"False\",\n\"Priority_score\": \"8\"\n},\n{\n\"name\": \"Kim White\",\n\"title\": \"Client Relations Coordinator\",\n\"email\": \"kwhite@slaterzurz.com\",\n\"email_options\": [\"kwhite@slaterzurz.com\", \"kim.white@slaterzurz.com\", \"kim@slaterzurz.com\"],\n\"email_confidence\": \"generated_medium\",\n\"phone\": \"\",\n\"department\": \"PERSONAL_INJURY\",\n\"quote\": \"\",\n\"Best_match\": \"False\",\n\"Priority_score\": \"7\"\n},\n{\n\"name\": \"Anne Williams\",\n\"title\": \"Legal Assistant\",\n\"email\": \"awilliams@slaterzurz.com\",\n\"email_options\": [\"awilliams@slaterzurz.com\", \"anne.williams@slaterzurz.com\", \"anne@slaterzurz.com\"],\n\"email_confidence\": \"generated_medium\",\n\"phone\": \"\",\n\"department\": \"PERSONAL_INJURY\",\n\"quote\": \"\",\n\"Best_match\": \"False\",\n\"Priority_score\": \"6\"\n}\n],\n\"best_contact_reasoning\": \"Charnise Wells was selected as the best match because her dual role as Legal Assistant & Paralegal indicates she is senior enough to handle case management, client communications, and potentially new client intake in the personal injury practice area. This aligns with the criteria for someone likely to manage new cases and have relevant experience.\",\n\"search_notes\": \"The firm's website primarily lists attorneys with no support staff details. LinkedIn profiles and searches revealed some staff members. Directories like ZoomInfo, Datanyze, and DNB provided additional names and titles. Client reviews on Avvo and Lawyers.com mentioned Anne Williams in a supporting role. Social media and other legal directories yielded no additional staff information. Focused on generating emails based on the provided pattern since no direct emails were found.\"\n}\n99 web pages\n1.3s\nExpert\nExtract Charnise Wells LinkedIn details\nSearch Slater & Zurz attorneys\nHow can Grok help?\nAuto",
    "extraction_timestamp": "2025-10-18T03:17:18.064157",
    "raw_file": "grok_paralegal_search_results\\grok_raw_results_20251018_031718.txt"
  },
  "search_completed_at": "2025-10-18T03:17:18.148626",
  "associated_cases": 4,
  "result_file": "grok_paralegal_search_results\\grok_paralegal_search_slaterzurz_com_20251018_031718_w3.json"
}