{
  "domain": "dobbinslawohio.com",
  "search_url": "dobbinslawohio.com",
  "attorney_info": {
    "original_website": "dobbinslawohio.com",
    "attorney_name": "Elizabeth A. Dobbins",
    "attorney_email": "edobbins@dobbinslawohio.com",
    "phone": "(330) 631-4613",
    "firm_name": "Dobbins Law",
    "practice_area": "ADMINISTRATIVE APPEAL",
    "case_id": "CV-2025-10-5038",
    "row_data": {
      "Case Number": "CV-2025-10-5038",
      "Filing Date": "10/16/2025",
      "Case Type": "ADMINISTRATIVE APPEAL",
      "Court": "COURT OF COMMON PLEAS, SUMMIT COUNTY, OHIO",
      "County": "SUMMIT",
      "Plaintiff": "CRAIG SKOREPA",
      "Primary Defendant": "SCOTT PETERS",
      "Attorney Name": "Elizabeth A. Dobbins",
      "Attorney Office": "Dobbins Law",
      "Attorney Email": "edobbins@dobbinslawohio.com",
      "Attorney Phone": "(330) 631-4613",
      "Attorney Website": "dobbinslawohio.com",
      "Relief Requested": "Reversal of the final decision of the Northfield Center Township Zoning Board of Appeals, Grant of a conditional use/similar use building certificate for the structure at 8090 Brandywine Road, Issuance of a building permit",
      "Processed At": "2025-10-17T21:33:24.414736",
      "Folder Name": "CV-2025-10-5038_10_16_2025",
      "Paralegal Name": "",
      "Paralegal Email": "",
      "Email-2": "",
      "Email-3": "",
      "Email-4": "",
      "Email-5": "",
      "Paralegal Number": "",
      "Department": "",
      "Paralegal Website Page Link": "",
      "Email Sent?": "",
      "Email Replied?": "",
      "Paralegal email": "",
      "Phone call?": ""
    }
  },
  "search_message": "COMPREHENSIVE PARALEGAL SEARCH REQUEST\n\nMISSION: Find ALL paralegals, legal assistants, and support staff for this law firm\n\nFIRM DETAILS:\n- Attorney: Elizabeth A. Dobbins\n- Email: edobbins@dobbinslawohio.com\n- Phone: (330) 631-4613\n- Website: dobbinslawohio.com\n- Firm: Dobbins Law\n- Practice Area: ADMINISTRATIVE APPEAL\n\nSEARCH REQUIREMENTS:\n1. PRIMARY: Search the main website (dobbinslawohio.com) thoroughly for ALL staff\n2. DEEP SEARCH: If website has limited info, search these sources:\n   - LinkedIn company page and employee profiles\n   - Facebook business page and staff mentions\n   - Instagram business account\n   - Google Business listings\n   - Legal directories (Avvo, FindLaw, Lawyers.com)\n   - Bar association listings\n   - Court filing documents (if accessible)\n\nTARGET ROLES TO FIND:\n- Paralegals (all levels: senior, junior, certified)\n- Legal Assistants\n- Legal Secretaries\n- Case Managers\n- Document Specialists  \n- Litigation Support Staff\n- Client Services Coordinators\n- Administrative Assistants (in legal capacity)\n\nREQUIRED INFORMATION for each person:\n- Full Name (required)\n- Job Title/Role (required) \n- Direct Email (if available) + GENERATED EMAIL OPTIONS (see below)\n- Direct Phone/Extension (if available)\n- Department/Practice Area\n- Professional Background/Quote (if available)\n\nCRITICAL EMAIL REQUIREMENTS:\n1. If direct email found: Use the actual email\n2. If NO email found: Generate 2-3 probable email options using the attorney's email format\n3. Email generation patterns to try:\n   - firstname.lastname@domain.com\n   - firstinitiallastname@domain.com  \n   - firstname@domain.com\n   - staff.firstname@domain.com\n   - paralegal.firstname@domain.com\n4. Extract domain from attorney email: edobbins@dobbinslawohio.com and use it for all generated emails\n5. or use common formats based on firm domain\n\nBEST CONTACT IDENTIFICATION:\nAnalyze the staff and identify the SINGLE BEST person to contact for attorney services/legal matters.\nConsider:\n- Senior paralegals or case managers (highest priority)\n- Legal assistants with client contact responsibilities\n- Office managers if they handle new client intake\n- Avoid receptionists unless they're the only option\nMark this person with \"Best_match\": \"True\"\n\nSEARCH STRATEGY:\n- Check \"Our Team\", \"Staff\", \"About Us\", \"Meet the Team\" pages\n- Look for staff bios and profiles\n- Search social media for team photos and mentions\n- Check LinkedIn for current employees\n- Look for staff in news articles or case announcements\n- Find people in office photos or group pictures\n\nEXTRACTION FORMAT:\nPlease output results in this EXACT JSON format:\n\n{\n    \"page_url\": \"website_searched\",\n    \"search_sources\": [\"list_of_sources_checked\"],\n    \"total_staff_found\": number,\n    \"attorney_email_domain\": \"domain_from_attorney_email\",\n    \"paralegals\": [\n        {\n            \"name\": \"Full Name\",\n            \"title\": \"Job Title\",\n            \"email\": \"direct_email_if_found_OR_most_likely_generated_email\", \n            \"email_options\": [\"email1@domain.com\", \"email2@domain.com\", \"email3@domain.com\"],\n            \"email_confidence\": \"found/generated_high/generated_medium/generated_low\",\n            \"phone\": \"direct_phone_if_found\",\n            \"department\": \"practice_area_or_department\",\n            \"quote\": \"professional_background_or_bio_excerpt\",\n            \"Best_match\": \"True_or_False\",\n            \"Priority_score\": \"from 10 to 1 (10 is highest)\"\n        }\n    ],\n    \"best_contact_reasoning\": \"explanation_of_why_this_person_was_selected_as_best_match\",\n    \"search_notes\": \"brief_summary_of_search_process_and_sources_used\"\n}\n\nSPECIFIC EMAIL GENERATION INSTRUCTIONS:\n- Attorney email pattern: edobbins@dobbinslawohio.com\n- Extract domain from attorney email and use for all staff emails if it is right/accurate coz sometimes email's person name or domain can be little miscalculated because of OCR issues mostly it is accurate (domain).\n- For \"John Smith\" generate these patterns: [\"john.smith@domain.com\", \"jsmith@domain.com\", \"john@domain.com\"]\n- Always provide 2-3 email options per person (more if unsure)\n- Mark confidence level: \"found\" (actual email found), \"generated_high\" (strong pattern match), \"generated_medium\" (reasonable guess), \"generated_low\" (last resort)\n\nBEST MATCH SELECTION CRITERIA:\nBased on the case information (Practice Area: ADMINISTRATIVE APPEAL), select the staff member who would be:\n1. Most likely to handle new client intake for this practice area\n2. Senior enough to make decisions about new cases  \n3. Specifically responsible for client communications\n4. Has experience in the relevant practice area\n\nIMPORTANT: Be thorough and creative! Many firms hide staff information, so use multiple search angles. If the main website is limited, definitely search social media and professional networks. We need to find as many legal support staff as possible!\n\nCRITICAL: \n- ALWAYS generate email options even if no direct emails found\n- ALWAYS select exactly ONE person as \"Best_match\": \"True\" \n- ALWAYS explain your reasoning for the best match selection\n- MUST MAKE SURE: ALWAYS THINK HARDER\n\nSTART COMPREHENSIVE SEARCH NOW for: dobbinslawohio.com",
  "results": {
    "page_url": "https://dobbinslawohio.com",
    "search_sources": [
      "https://dobbinslawohio.com",
      "LinkedIn profiles and searches",
      "Facebook searches",
      "Instagram searches",
      "Google Business listings",
      "Avvo",
      "FindLaw",
      "Lawyers.com",
      "Ohio bar association listings",
      "ZoomInfo",
      "General web searches for staff",
      "Court filings searches"
    ],
    "total_staff_found": 1,
    "paralegals": [
      {
        "name": "Full Name",
        "title": "Job Title",
        "email": "direct_email_if_found_OR_most_likely_generated_email",
        "phone": "direct_phone_if_found",
        "department": "practice_area_or_department",
        "quote": "professional_background_or_bio_excerpt"
      }
    ],
    "search_notes": "The firm's website only mentions the attorney and no staff. LinkedIn shows only Elizabeth Dobbins associated with Dobbins Law in Ohio. No staff profiles found on social media or directories. ZoomInfo mentioned 12 employees but no details retrieved, likely aggregated error or confusion with other firms. Court filings and other searches yielded no staff mentions for this firm.",
    "raw_content": "Share\nSign up\nSign in\nCOMPREHENSIVE PARALEGAL SEARCH REQUEST\n\nMISSION: Find ALL paralegals, legal assistants, and support staff for this law firm\n\nFIRM DETAILS:\n- Attorney: Elizabeth A. Dobbins\n- Email: edobbins@dobbinslawohio.com\n- Phone: (330) 631-4613\n- Website: dobbinslawohio.com\n- Firm: Dobbins Law\n- Practice Area: ADMINISTRATIVE APPEAL\n\nSEARCH REQUIREMENTS:\n1. PRIMARY: Search the main website (dobbinslawohio.com) thoroughly for ALL staff\n2. DEEP SEARCH: If website has limited info, search these sources:\n   - LinkedIn company page and employee profiles\n   - Facebook business page and staff mentions\n   - Instagram business account\n   - Google Business listings\n   - Legal directories (Avvo, FindLaw, Lawyers.com)\n   - Bar association listings\n   - Court filing documents (if accessible)\n\nTARGET ROLES TO FIND:\n- Paralegals (all levels: senior, junior, certified)\n- Legal Assistants\n- Legal Secretaries\n- Case Managers\n- Document Specialists  \n- Litigation Support Staff\n- Client Services Coordinators\n- Administrative Assistants (in legal capacity)\n\nREQUIRED INFORMATION for each person:\n- Full Name (required)\n- Job Title/Role (required) \n- Direct Email (if available) + GENERATED EMAIL OPTIONS (see below)\n- Direct Phone/Extension (if available)\n- Department/Practice Area\n- Professional Background/Quote (if available)\n\nCRITICAL EMAIL REQUIREMENTS:\n1. If direct email found: Use the actual email\n2. If NO email found: Generate 2-3 probable email options using the attorney's email format\n3. Email generation patterns to try:\n   - firstname.lastname@domain.com\n   - firstinitiallastname@domain.com  \n   - firstname@domain.com\n   - staff.firstname@domain.com\n   - paralegal.firstname@domain.com\n4. Extract domain from attorney email: edobbins@dobbinslawohio.com and use it for all generated emails\n5. or use common formats based on firm domain\n\nBEST CONTACT IDENTIFICATION:\nAnalyze the staff and identify the SINGLE BEST person to contact for attorney services/legal matters.\nConsider:\n- Senior paralegals or case managers (highest priority)\n- Legal assistants with client contact responsibilities\n- Office managers if they handle new client intake\n- Avoid receptionists unless they're the only option\nMark this person with \"Best_match\": \"True\"\n\nSEARCH STRATEGY:\n- Check \"Our Team\", \"Staff\", \"About Us\", \"Meet the Team\" pages\n- Look for staff bios and profiles\n- Search social media for team photos and mentions\n- Check LinkedIn for current employees\n- Look for staff in news articles or case announcements\n- Find people in office photos or group pictures\n\nEXTRACTION FORMAT:\nPlease output results in this EXACT JSON format:\n\n{\n    \"page_url\": \"website_searched\",\n    \"search_sources\": [\"list_of_sources_checked\"],\n    \"total_staff_found\": number,\n    \"attorney_email_domain\": \"domain_from_attorney_email\",\n    \"paralegals\": [\n        {\n            \"name\": \"Full Name\",\n            \"title\": \"Job Title\",\n            \"email\": \"direct_email_if_found_OR_most_likely_generated_email\", \n            \"email_options\": [\"email1@domain.com\", \"email2@domain.com\", \"email3@domain.com\"],\n            \"email_confidence\": \"found/generated_high/generated_medium/generated_low\",\n            \"phone\": \"direct_phone_if_found\",\n            \"department\": \"practice_area_or_department\",\n            \"quote\": \"professional_background_or_bio_excerpt\",\n            \"Best_match\": \"True_or_False\",\n            \"Priority_score\": \"from 10 to 1 (10 is highest)\"\n        }\n    ],\n    \"best_contact_reasoning\": \"explanation_of_why_this_person_was_selected_as_best_match\",\n    \"search_notes\": \"brief_summary_of_search_process_and_sources_used\"\n}\n\nSPECIFIC EMAIL GENERATION INSTRUCTIONS:\n- Attorney email pattern: edobbins@dobbinslawohio.com\n- Extract domain from attorney email and use for all staff emails if it is right/accurate coz sometimes email's person name or domain can be little miscalculated because of OCR issues mostly it is accurate (domain).\n- For \"John Smith\" generate these patterns: [\"john.smith@domain.com\", \"jsmith@domain.com\", \"john@domain.com\"]\n- Always provide 2-3 email options per person (more if unsure)\n- Mark confidence level: \"found\" (actual email found), \"generated_high\" (strong pattern match), \"generated_medium\" (reasonable guess), \"generated_low\" (last resort)\n\nBEST MATCH SELECTION CRITERIA:\nBased on the case information (Practice Area: ADMINISTRATIVE APPEAL), select the staff member who would be:\n1. Most likely to handle new client intake for this practice area\n2. Senior enough to make decisions about new cases  \n3. Specifically responsible for client communications\n4. Has experience in the relevant practice area\n\nIMPORTANT: Be thorough and creative! Many firms hide staff information, so use multiple search angles. If the main website is limited, definitely search social media and professional networks. We need to find as many legal support staff as possible!\n\nCRITICAL: \n- ALWAYS generate email options even if no direct emails found\n- ALWAYS select exactly ONE person as \"Best_match\": \"True\" \n- ALWAYS explain your reasoning for the best match selection\n- MUST MAKE SURE: ALWAYS THINK HARDER\n\nSTART COMPREHENSIVE SEARCH NOW for: dobbinslawohio.com\nThought for 2m 5s\n{\n\"page_url\": \"https://dobbinslawohio.com\",\n\"search_sources\": [\"https://dobbinslawohio.com\", \"LinkedIn profiles and searches\", \"Facebook searches\", \"Instagram searches\", \"Google Business listings\", \"Avvo\", \"FindLaw\", \"Lawyers.com\", \"Ohio bar association listings\", \"ZoomInfo\", \"General web searches for staff\", \"Court filings searches\"],\n\"total_staff_found\": 0,\n\"attorney_email_domain\": \"dobbinslawohio.com\",\n\"paralegals\": [],\n\"best_contact_reasoning\": \"No paralegals, legal assistants, or support staff were identified in any sources despite extensive searches across the firm's website, professional directories, social media, and other online resources. The firm appears to be a solo practice operated by Elizabeth A. Dobbins. As such, no best match could be selected from the target roles; contact the attorney directly for administrative appeal matters.\",\n\"search_notes\": \"The firm's website only mentions the attorney and no staff. LinkedIn shows only Elizabeth Dobbins associated with Dobbins Law in Ohio. No staff profiles found on social media or directories. ZoomInfo mentioned 12 employees but no details retrieved, likely aggregated error or confusion with other firms. Court filings and other searches yielded no staff mentions for this firm.\"\n}\n107 web pages\n1.9s\nExpert\nExplore Elizabeth Dobbins' prior experience\nCompare with Akron area law firms\nHow can Grok help?\nAuto",
    "extraction_timestamp": "2025-10-18T03:26:49.449586",
    "raw_file": "grok_paralegal_search_results\\grok_raw_results_20251018_032649.txt"
  },
  "search_completed_at": "2025-10-18T03:26:49.455730",
  "associated_cases": 1,
  "result_file": "grok_paralegal_search_results\\grok_paralegal_search_dobbinslawohio_com_20251018_032649_w0.json"
}