{
  "domain": "sstrialattorneys.com",
  "search_url": "sstrialattorneys.com",
  "attorney_info": {
    "original_website": "sstrialattorneys.com",
    "attorney_name": "Sean C. Mowery",
    "attorney_email": "smowery@sstrialattorneys.com",
    "phone": "(380) 201-6957",
    "firm_name": "Schuerger Shunnarah Trial Attorneys LLC",
    "practice_area": "PERSONAL_INJURY",
    "case_id": "",
    "row_data": {
      "Case Number": "",
      "Filing Date": "",
      "Case Type": "PERSONAL_INJURY",
      "Court": "CUYAHOGA COUNTY COMMON PLEAS COURT CIVIL DIVISION",
      "County": "CUYAHOGA",
      "Plaintiff": "KATHY VAN DEUSEN",
      "Primary Defendant": "JAMES E. HENDERSON",
      "Attorney Name": "Sean C. Mowery",
      "Attorney Office": "Schuerger Shunnarah Trial Attorneys LLC",
      "Attorney Email": "smowery@sstrialattorneys.com",
      "Attorney Phone": "(380) 201-6957",
      "Attorney Website": "sstrialattorneys.com",
      "Relief Requested": "$25,000.00",
      "Processed At": "2025-10-18T01:04:32.897752",
      "Folder Name": "case_3648182",
      "Paralegal Name": "",
      "Paralegal Email": "",
      "Email-2": "",
      "Email-3": "",
      "Email-4": "",
      "Email-5": "",
      "Paralegal Number": "",
      "Department": "",
      "Paralegal Website Page Link": "",
      "Email Sent?": "",
      "Email Replied?": "",
      "Paralegal email": "",
      "Phone call?": ""
    }
  },
  "search_message": "COMPREHENSIVE PARALEGAL SEARCH REQUEST\n\nMISSION: Find ALL paralegals, legal assistants, and support staff for this law firm\n\nFIRM DETAILS:\n- Attorney: Sean C. Mowery\n- Email: smowery@sstrialattorneys.com\n- Phone: (380) 201-6957\n- Website: sstrialattorneys.com\n- Firm: Schuerger Shunnarah Trial Attorneys LLC\n- Practice Area: PERSONAL_INJURY\n\nSEARCH REQUIREMENTS:\n1. PRIMARY: Search the main website (sstrialattorneys.com) thoroughly for ALL staff\n2. DEEP SEARCH: If website has limited info, search these sources:\n   - LinkedIn company page and employee profiles\n   - Facebook business page and staff mentions\n   - Instagram business account\n   - Google Business listings\n   - Legal directories (Avvo, FindLaw, Lawyers.com)\n   - Bar association listings\n   - Court filing documents (if accessible)\n\nTARGET ROLES TO FIND:\n- Paralegals (all levels: senior, junior, certified)\n- Legal Assistants\n- Legal Secretaries\n- Case Managers\n- Document Specialists  \n- Litigation Support Staff\n- Client Services Coordinators\n- Administrative Assistants (in legal capacity)\n\nREQUIRED INFORMATION for each person:\n- Full Name (required)\n- Job Title/Role (required) \n- Direct Email (if available) + GENERATED EMAIL OPTIONS (see below)\n- Direct Phone/Extension (if available)\n- Department/Practice Area\n- Professional Background/Quote (if available)\n\nCRITICAL EMAIL REQUIREMENTS:\n1. If direct email found: Use the actual email\n2. If NO email found: Generate 2-3 probable email options using the attorney's email format\n3. Email generation patterns to try:\n   - firstname.lastname@domain.com\n   - firstinitiallastname@domain.com  \n   - firstname@domain.com\n   - staff.firstname@domain.com\n   - paralegal.firstname@domain.com\n4. Extract domain from attorney email: smowery@sstrialattorneys.com and use it for all generated emails\n5. or use common formats based on firm domain\n\nBEST CONTACT IDENTIFICATION:\nAnalyze the staff and identify the SINGLE BEST person to contact for attorney services/legal matters.\nConsider:\n- Senior paralegals or case managers (highest priority)\n- Legal assistants with client contact responsibilities\n- Office managers if they handle new client intake\n- Avoid receptionists unless they're the only option\nMark this person with \"Best_match\": \"True\"\n\nSEARCH STRATEGY:\n- Check \"Our Team\", \"Staff\", \"About Us\", \"Meet the Team\" pages\n- Look for staff bios and profiles\n- Search social media for team photos and mentions\n- Check LinkedIn for current employees\n- Look for staff in news articles or case announcements\n- Find people in office photos or group pictures\n\nEXTRACTION FORMAT:\nPlease output results in this EXACT JSON format:\n\n{\n    \"page_url\": \"website_searched\",\n    \"search_sources\": [\"list_of_sources_checked\"],\n    \"total_staff_found\": number,\n    \"attorney_email_domain\": \"domain_from_attorney_email\",\n    \"paralegals\": [\n        {\n            \"name\": \"Full Name\",\n            \"title\": \"Job Title\",\n            \"email\": \"direct_email_if_found_OR_most_likely_generated_email\", \n            \"email_options\": [\"email1@domain.com\", \"email2@domain.com\", \"email3@domain.com\"],\n            \"email_confidence\": \"found/generated_high/generated_medium/generated_low\",\n            \"phone\": \"direct_phone_if_found\",\n            \"department\": \"practice_area_or_department\",\n            \"quote\": \"professional_background_or_bio_excerpt\",\n            \"Best_match\": \"True_or_False\",\n            \"Priority_score\": \"from 10 to 1 (10 is highest)\"\n        }\n    ],\n    \"best_contact_reasoning\": \"explanation_of_why_this_person_was_selected_as_best_match\",\n    \"search_notes\": \"brief_summary_of_search_process_and_sources_used\"\n}\n\nSPECIFIC EMAIL GENERATION INSTRUCTIONS:\n- Attorney email pattern: smowery@sstrialattorneys.com\n- Extract domain from attorney email and use for all staff emails if it is right/accurate coz sometimes email's person name or domain can be little miscalculated because of OCR issues mostly it is accurate (domain).\n- For \"John Smith\" generate these patterns: [\"john.smith@domain.com\", \"jsmith@domain.com\", \"john@domain.com\"]\n- Always provide 2-3 email options per person (more if unsure)\n- Mark confidence level: \"found\" (actual email found), \"generated_high\" (strong pattern match), \"generated_medium\" (reasonable guess), \"generated_low\" (last resort)\n\nBEST MATCH SELECTION CRITERIA:\nBased on the case information (Practice Area: PERSONAL_INJURY), select the staff member who would be:\n1. Most likely to handle new client intake for this practice area\n2. Senior enough to make decisions about new cases  \n3. Specifically responsible for client communications\n4. Has experience in the relevant practice area\n\nIMPORTANT: Be thorough and creative! Many firms hide staff information, so use multiple search angles. If the main website is limited, definitely search social media and professional networks. We need to find as many legal support staff as possible!\n\nCRITICAL: \n- ALWAYS generate email options even if no direct emails found\n- ALWAYS select exactly ONE person as \"Best_match\": \"True\" \n- ALWAYS explain your reasoning for the best match selection\n- MUST MAKE SURE: ALWAYS THINK HARDER\n\nSTART COMPREHENSIVE SEARCH NOW for: sstrialattorneys.com",
  "results": {
    "page_url": "",
    "search_sources": [],
    "total_staff_found": 7,
    "paralegals": [
      {
        "name": "Full Name",
        "title": "Job Title",
        "email": "direct_email_if_found_OR_most_likely_generated_email",
        "email_options": [
          "email1@domain.com",
          "email2@domain.com",
          "email3@domain.com"
        ],
        "email_confidence": "found/generated_high/generated_medium/generated_low",
        "phone": "direct_phone_if_found",
        "department": "practice_area_or_department",
        "quote": "professional_background_or_bio_excerpt",
        "Best_match": "True_or_False",
        "Priority_score": "from 10 to 1 (10 is highest)"
      },
      {
        "name": "Nicole Rollins",
        "title": "Director of Operations",
        "email": "nrollins@sstrialattorneys.com",
        "email_options": [
          "nicole.rollins@sstrialattorneys.com",
          "nrollins@sstrialattorneys.com",
          "nicole@sstrialattorneys.com"
        ],
        "email_confidence": "generated_high",
        "phone": "",
        "department": "Personal Injury",
        "quote": "Director of Operations at Schuerger Shunnarah Trial Attorneys since Jan 2022.",
        "Best_match": "True",
        "Priority_score": "10"
      },
      {
        "name": "Dane Smith",
        "title": "Team Lead Case Manager",
        "email": "dsmith@sstrialattorneys.com",
        "email_options": [
          "dane.smith@sstrialattorneys.com",
          "dsmith@sstrialattorneys.com",
          "dane@sstrialattorneys.com"
        ],
        "email_confidence": "generated_high",
        "phone": "",
        "department": "Personal Injury",
        "quote": "Manages between 150-250 clients at a time in the Personal Injury Department.",
        "Best_match": "False",
        "Priority_score": "9"
      },
      {
        "name": "Maria Gielink",
        "title": "Pre-Suit Manager",
        "email": "mgielink@sstrialattorneys.com",
        "email_options": [
          "maria.gielink@sstrialattorneys.com",
          "mgielink@sstrialattorneys.com",
          "maria@sstrialattorneys.com"
        ],
        "email_confidence": "generated_high",
        "phone": "",
        "department": "Personal Injury",
        "quote": "Pre-Suit Manager since May 2024, previously Law Firm Administrator.",
        "Best_match": "False",
        "Priority_score": "8"
      },
      {
        "name": "Carly Hodge",
        "title": "Case Manager/Paralegal",
        "email": "chodge@sstrialattorneys.com",
        "email_options": [
          "carly.hodge@sstrialattorneys.com",
          "chodge@sstrialattorneys.com",
          "carly@sstrialattorneys.com"
        ],
        "email_confidence": "generated_high",
        "phone": "",
        "department": "Personal Injury",
        "quote": "",
        "Best_match": "False",
        "Priority_score": "7"
      },
      {
        "name": "Brittany Tolle",
        "title": "Personal Injury Case Manager",
        "email": "btolle@sstrialattorneys.com",
        "email_options": [
          "brittany.tolle@sstrialattorneys.com",
          "btolle@sstrialattorneys.com",
          "brittany@sstrialattorneys.com"
        ],
        "email_confidence": "generated_high",
        "phone": "",
        "department": "Personal Injury",
        "quote": "Manages a case load of 200+ plaintiff personal injury cases.",
        "Best_match": "False",
        "Priority_score": "6"
      },
      {
        "name": "Jessica LoPiccolo",
        "title": "Case Manager",
        "email": "jlopiccolo@sstrialattorneys.com",
        "email_options": [
          "jessica.lopiccolo@sstrialattorneys.com",
          "jlopiccolo@sstrialattorneys.com",
          "jessica@sstrialattorneys.com"
        ],
        "email_confidence": "generated_high",
        "phone": "",
        "department": "Personal Injury",
        "quote": "",
        "Best_match": "False",
        "Priority_score": "5"
      }
    ],
    "search_notes": "",
    "raw_content": "Share\nSign up\nSign in\nCOMPREHENSIVE PARALEGAL SEARCH REQUEST\n\nMISSION: Find ALL paralegals, legal assistants, and support staff for this law firm\n\nFIRM DETAILS:\n- Attorney: Sean C. Mowery\n- Email: smowery@sstrialattorneys.com\n- Phone: (380) 201-6957\n- Website: sstrialattorneys.com\n- Firm: Schuerger Shunnarah Trial Attorneys LLC\n- Practice Area: PERSONAL_INJURY\n\nSEARCH REQUIREMENTS:\n1. PRIMARY: Search the main website (sstrialattorneys.com) thoroughly for ALL staff\n2. DEEP SEARCH: If website has limited info, search these sources:\n   - LinkedIn company page and employee profiles\n   - Facebook business page and staff mentions\n   - Instagram business account\n   - Google Business listings\n   - Legal directories (Avvo, FindLaw, Lawyers.com)\n   - Bar association listings\n   - Court filing documents (if accessible)\n\nTARGET ROLES TO FIND:\n- Paralegals (all levels: senior, junior, certified)\n- Legal Assistants\n- Legal Secretaries\n- Case Managers\n- Document Specialists  \n- Litigation Support Staff\n- Client Services Coordinators\n- Administrative Assistants (in legal capacity)\n\nREQUIRED INFORMATION for each person:\n- Full Name (required)\n- Job Title/Role (required) \n- Direct Email (if available) + GENERATED EMAIL OPTIONS (see below)\n- Direct Phone/Extension (if available)\n- Department/Practice Area\n- Professional Background/Quote (if available)\n\nCRITICAL EMAIL REQUIREMENTS:\n1. If direct email found: Use the actual email\n2. If NO email found: Generate 2-3 probable email options using the attorney's email format\n3. Email generation patterns to try:\n   - firstname.lastname@domain.com\n   - firstinitiallastname@domain.com  \n   - firstname@domain.com\n   - staff.firstname@domain.com\n   - paralegal.firstname@domain.com\n4. Extract domain from attorney email: smowery@sstrialattorneys.com and use it for all generated emails\n5. or use common formats based on firm domain\n\nBEST CONTACT IDENTIFICATION:\nAnalyze the staff and identify the SINGLE BEST person to contact for attorney services/legal matters.\nConsider:\n- Senior paralegals or case managers (highest priority)\n- Legal assistants with client contact responsibilities\n- Office managers if they handle new client intake\n- Avoid receptionists unless they're the only option\nMark this person with \"Best_match\": \"True\"\n\nSEARCH STRATEGY:\n- Check \"Our Team\", \"Staff\", \"About Us\", \"Meet the Team\" pages\n- Look for staff bios and profiles\n- Search social media for team photos and mentions\n- Check LinkedIn for current employees\n- Look for staff in news articles or case announcements\n- Find people in office photos or group pictures\n\nEXTRACTION FORMAT:\nPlease output results in this EXACT JSON format:\n\n{\n    \"page_url\": \"website_searched\",\n    \"search_sources\": [\"list_of_sources_checked\"],\n    \"total_staff_found\": number,\n    \"attorney_email_domain\": \"domain_from_attorney_email\",\n    \"paralegals\": [\n        {\n            \"name\": \"Full Name\",\n            \"title\": \"Job Title\",\n            \"email\": \"direct_email_if_found_OR_most_likely_generated_email\", \n            \"email_options\": [\"email1@domain.com\", \"email2@domain.com\", \"email3@domain.com\"],\n            \"email_confidence\": \"found/generated_high/generated_medium/generated_low\",\n            \"phone\": \"direct_phone_if_found\",\n            \"department\": \"practice_area_or_department\",\n            \"quote\": \"professional_background_or_bio_excerpt\",\n            \"Best_match\": \"True_or_False\",\n            \"Priority_score\": \"from 10 to 1 (10 is highest)\"\n        }\n    ],\n    \"best_contact_reasoning\": \"explanation_of_why_this_person_was_selected_as_best_match\",\n    \"search_notes\": \"brief_summary_of_search_process_and_sources_used\"\n}\n\nSPECIFIC EMAIL GENERATION INSTRUCTIONS:\n- Attorney email pattern: smowery@sstrialattorneys.com\n- Extract domain from attorney email and use for all staff emails if it is right/accurate coz sometimes email's person name or domain can be little miscalculated because of OCR issues mostly it is accurate (domain).\n- For \"John Smith\" generate these patterns: [\"john.smith@domain.com\", \"jsmith@domain.com\", \"john@domain.com\"]\n- Always provide 2-3 email options per person (more if unsure)\n- Mark confidence level: \"found\" (actual email found), \"generated_high\" (strong pattern match), \"generated_medium\" (reasonable guess), \"generated_low\" (last resort)\n\nBEST MATCH SELECTION CRITERIA:\nBased on the case information (Practice Area: PERSONAL_INJURY), select the staff member who would be:\n1. Most likely to handle new client intake for this practice area\n2. Senior enough to make decisions about new cases  \n3. Specifically responsible for client communications\n4. Has experience in the relevant practice area\n\nIMPORTANT: Be thorough and creative! Many firms hide staff information, so use multiple search angles. If the main website is limited, definitely search social media and professional networks. We need to find as many legal support staff as possible!\n\nCRITICAL: \n- ALWAYS generate email options even if no direct emails found\n- ALWAYS select exactly ONE person as \"Best_match\": \"True\" \n- ALWAYS explain your reasoning for the best match selection\n- MUST MAKE SURE: ALWAYS THINK HARDER\n\nSTART COMPREHENSIVE SEARCH NOW for: sstrialattorneys.com\nThought for 3m 3s\n{\n\"page_url\": \"sstrialattorneys.com\",\n\"search_sources\": [\"sstrialattorneys.com\", \"warforyou.com\", \"linkedin.com\", \"facebook.com\", \"instagram.com\", \"zoominfo.com\"],\n\"total_staff_found\": 6,\n\"attorney_email_domain\": \"sstrialattorneys.com\",\n\"paralegals\": [\n{\n\"name\": \"Nicole Rollins\",\n\"title\": \"Director of Operations\",\n\"email\": \"nrollins@sstrialattorneys.com\",\n\"email_options\": [\"nicole.rollins@sstrialattorneys.com\", \"nrollins@sstrialattorneys.com\", \"nicole@sstrialattorneys.com\"],\n\"email_confidence\": \"generated_high\",\n\"phone\": \"\",\n\"department\": \"Personal Injury\",\n\"quote\": \"Director of Operations at Schuerger Shunnarah Trial Attorneys since Jan 2022.\",\n\"Best_match\": \"True\",\n\"Priority_score\": \"10\"\n},\n{\n\"name\": \"Dane Smith\",\n\"title\": \"Team Lead Case Manager\",\n\"email\": \"dsmith@sstrialattorneys.com\",\n\"email_options\": [\"dane.smith@sstrialattorneys.com\", \"dsmith@sstrialattorneys.com\", \"dane@sstrialattorneys.com\"],\n\"email_confidence\": \"generated_high\",\n\"phone\": \"\",\n\"department\": \"Personal Injury\",\n\"quote\": \"Manages between 150-250 clients at a time in the Personal Injury Department.\",\n\"Best_match\": \"False\",\n\"Priority_score\": \"9\"\n},\n{\n\"name\": \"Maria Gielink\",\n\"title\": \"Pre-Suit Manager\",\n\"email\": \"mgielink@sstrialattorneys.com\",\n\"email_options\": [\"maria.gielink@sstrialattorneys.com\", \"mgielink@sstrialattorneys.com\", \"maria@sstrialattorneys.com\"],\n\"email_confidence\": \"generated_high\",\n\"phone\": \"\",\n\"department\": \"Personal Injury\",\n\"quote\": \"Pre-Suit Manager since May 2024, previously Law Firm Administrator.\",\n\"Best_match\": \"False\",\n\"Priority_score\": \"8\"\n},\n{\n\"name\": \"Carly Hodge\",\n\"title\": \"Case Manager/Paralegal\",\n\"email\": \"chodge@sstrialattorneys.com\",\n\"email_options\": [\"carly.hodge@sstrialattorneys.com\", \"chodge@sstrialattorneys.com\", \"carly@sstrialattorneys.com\"],\n\"email_confidence\": \"generated_high\",\n\"phone\": \"\",\n\"department\": \"Personal Injury\",\n\"quote\": \"\",\n\"Best_match\": \"False\",\n\"Priority_score\": \"7\"\n},\n{\n\"name\": \"Brittany Tolle\",\n\"title\": \"Personal Injury Case Manager\",\n\"email\": \"btolle@sstrialattorneys.com\",\n\"email_options\": [\"brittany.tolle@sstrialattorneys.com\", \"btolle@sstrialattorneys.com\", \"brittany@sstrialattorneys.com\"],\n\"email_confidence\": \"generated_high\",\n\"phone\": \"\",\n\"department\": \"Personal Injury\",\n\"quote\": \"Manages a case load of 200+ plaintiff personal injury cases.\",\n\"Best_match\": \"False\",\n\"Priority_score\": \"6\"\n},\n{\n\"name\": \"Jessica LoPiccolo\",\n\"title\": \"Case Manager\",\n\"email\": \"jlopiccolo@sstrialattorneys.com\",\n\"email_options\": [\"jessica.lopiccolo@sstrialattorneys.com\", \"jlopiccolo@sstrialattorneys.com\", \"jessica@sstrialattorneys.com\"],\n\"email_confidence\": \"generated_high\",\n\"phone\": \"\",\n\"department\": \"Personal Injury\",\n\"quote\": \"\",\n\"Best_match\": \"False\",\n\"Priority_score\": \"5\"\n}\n],\n\"best_contact_reasoning\": \"Nicole Rollins, as Director of Operations, is the most senior staff member identified and is likely responsible for overseeing new client intake, client communications, and decision-making regarding new cases in the personal injury practice area.\",\n\"search_notes\": \"Initial search on sstrialattorneys.com yielded limited staff information, appearing to share content with warforyou.com. Deep search via LinkedIn profiles through web searches revealed support staff. Additional sources like Facebook, Instagram, and ZoomInfo were checked for mentions. No direct emails or phones found; all emails generated based on the provided attorney email pattern.\"\n}\n57 web pages\n2 / 2\n1.3s\nExpert\nBrowse ZoomInfo for more staff\nSearch for attorneys at firm\nAdd phone numbers if available\nHow can Grok help?\nAuto",
    "extraction_timestamp": "2025-10-18T03:10:50.837520",
    "raw_file": "grok_paralegal_search_results\\grok_raw_results_20251018_031050.txt"
  },
  "search_completed_at": "2025-10-18T03:10:50.904296",
  "associated_cases": 1,
  "result_file": "grok_paralegal_search_results\\grok_paralegal_search_sstrialattorneys_com_20251018_031050_w0.json"
}