{
  "domain": "ritaohio.com",
  "search_url": "ritaohio.com",
  "attorney_info": {
    "original_website": "ritaohio.com",
    "attorney_name": "BRITTANY D. CARABALLO",
    "attorney_email": "legal@ritaohio.com",
    "phone": "(440) 922.3282",
    "firm_name": "REGIONAL INCOME TAX AGENCY",
    "practice_area": "DEBT_COLLECTION",
    "case_id": "",
    "row_data": {
      "Case Number": "",
      "Filing Date": "",
      "Case Type": "DEBT_COLLECTION",
      "Court": "IN THE COURT OF COMMON PLEAS CUYAHOGA COUNTY, OHIO",
      "County": "CUYAHOGA",
      "Plaintiff": "CITY OF SOUTH EUCLID, OHIO",
      "Primary Defendant": "LILLIAN YOUNG-MILLER",
      "Attorney Name": "BRITTANY D. CARABALLO",
      "Attorney Office": "REGIONAL INCOME TAX AGENCY",
      "Attorney Email": "legal@ritaohio.com",
      "Attorney Phone": "(440) 922.3282",
      "Attorney Website": "ritaohio.com",
      "Relief Requested": "$12,687.00",
      "Processed At": "2025-10-18T01:04:32.400567",
      "Folder Name": "case_3647549",
      "Paralegal Name": "",
      "Paralegal Email": "",
      "Email-2": "",
      "Email-3": "",
      "Email-4": "",
      "Email-5": "",
      "Paralegal Number": "",
      "Department": "",
      "Paralegal Website Page Link": "",
      "Email Sent?": "",
      "Email Replied?": "",
      "Paralegal email": "",
      "Phone call?": ""
    }
  },
  "search_message": "COMPREHENSIVE PARALEGAL SEARCH REQUEST\n\nMISSION: Find ALL paralegals, legal assistants, and support staff for this law firm\n\nFIRM DETAILS:\n- Attorney: BRITTANY D. CARABALLO\n- Email: legal@ritaohio.com\n- Phone: (440) 922.3282\n- Website: ritaohio.com\n- Firm: REGIONAL INCOME TAX AGENCY\n- Practice Area: DEBT_COLLECTION\n\nSEARCH REQUIREMENTS:\n1. PRIMARY: Search the main website (ritaohio.com) thoroughly for ALL staff\n2. DEEP SEARCH: If website has limited info, search these sources:\n   - LinkedIn company page and employee profiles\n   - Facebook business page and staff mentions\n   - Instagram business account\n   - Google Business listings\n   - Legal directories (Avvo, FindLaw, Lawyers.com)\n   - Bar association listings\n   - Court filing documents (if accessible)\n\nTARGET ROLES TO FIND:\n- Paralegals (all levels: senior, junior, certified)\n- Legal Assistants\n- Legal Secretaries\n- Case Managers\n- Document Specialists  \n- Litigation Support Staff\n- Client Services Coordinators\n- Administrative Assistants (in legal capacity)\n\nREQUIRED INFORMATION for each person:\n- Full Name (required)\n- Job Title/Role (required) \n- Direct Email (if available) + GENERATED EMAIL OPTIONS (see below)\n- Direct Phone/Extension (if available)\n- Department/Practice Area\n- Professional Background/Quote (if available)\n\nCRITICAL EMAIL REQUIREMENTS:\n1. If direct email found: Use the actual email\n2. If NO email found: Generate 2-3 probable email options using the attorney's email format\n3. Email generation patterns to try:\n   - firstname.lastname@domain.com\n   - firstinitiallastname@domain.com  \n   - firstname@domain.com\n   - staff.firstname@domain.com\n   - paralegal.firstname@domain.com\n4. Extract domain from attorney email: legal@ritaohio.com and use it for all generated emails\n5. or use common formats based on firm domain\n\nBEST CONTACT IDENTIFICATION:\nAnalyze the staff and identify the SINGLE BEST person to contact for attorney services/legal matters.\nConsider:\n- Senior paralegals or case managers (highest priority)\n- Legal assistants with client contact responsibilities\n- Office managers if they handle new client intake\n- Avoid receptionists unless they're the only option\nMark this person with \"Best_match\": \"True\"\n\nSEARCH STRATEGY:\n- Check \"Our Team\", \"Staff\", \"About Us\", \"Meet the Team\" pages\n- Look for staff bios and profiles\n- Search social media for team photos and mentions\n- Check LinkedIn for current employees\n- Look for staff in news articles or case announcements\n- Find people in office photos or group pictures\n\nEXTRACTION FORMAT:\nPlease output results in this EXACT JSON format:\n\n{\n    \"page_url\": \"website_searched\",\n    \"search_sources\": [\"list_of_sources_checked\"],\n    \"total_staff_found\": number,\n    \"attorney_email_domain\": \"domain_from_attorney_email\",\n    \"paralegals\": [\n        {\n            \"name\": \"Full Name\",\n            \"title\": \"Job Title\",\n            \"email\": \"direct_email_if_found_OR_most_likely_generated_email\", \n            \"email_options\": [\"email1@domain.com\", \"email2@domain.com\", \"email3@domain.com\"],\n            \"email_confidence\": \"found/generated_high/generated_medium/generated_low\",\n            \"phone\": \"direct_phone_if_found\",\n            \"department\": \"practice_area_or_department\",\n            \"quote\": \"professional_background_or_bio_excerpt\",\n            \"Best_match\": \"True_or_False\",\n            \"Priority_score\": \"from 10 to 1 (10 is highest)\"\n        }\n    ],\n    \"best_contact_reasoning\": \"explanation_of_why_this_person_was_selected_as_best_match\",\n    \"search_notes\": \"brief_summary_of_search_process_and_sources_used\"\n}\n\nSPECIFIC EMAIL GENERATION INSTRUCTIONS:\n- Attorney email pattern: legal@ritaohio.com\n- Extract domain from attorney email and use for all staff emails if it is right/accurate coz sometimes email's person name or domain can be little miscalculated because of OCR issues mostly it is accurate (domain).\n- For \"John Smith\" generate these patterns: [\"john.smith@domain.com\", \"jsmith@domain.com\", \"john@domain.com\"]\n- Always provide 2-3 email options per person (more if unsure)\n- Mark confidence level: \"found\" (actual email found), \"generated_high\" (strong pattern match), \"generated_medium\" (reasonable guess), \"generated_low\" (last resort)\n\nBEST MATCH SELECTION CRITERIA:\nBased on the case information (Practice Area: DEBT_COLLECTION), select the staff member who would be:\n1. Most likely to handle new client intake for this practice area\n2. Senior enough to make decisions about new cases  \n3. Specifically responsible for client communications\n4. Has experience in the relevant practice area\n\nIMPORTANT: Be thorough and creative! Many firms hide staff information, so use multiple search angles. If the main website is limited, definitely search social media and professional networks. We need to find as many legal support staff as possible!\n\nCRITICAL: \n- ALWAYS generate email options even if no direct emails found\n- ALWAYS select exactly ONE person as \"Best_match\": \"True\" \n- ALWAYS explain your reasoning for the best match selection\n- MUST MAKE SURE: ALWAYS THINK HARDER\n\nSTART COMPREHENSIVE SEARCH NOW for: ritaohio.com",
  "results": {
    "page_url": "",
    "search_sources": [],
    "total_staff_found": 7,
    "paralegals": [
      {
        "name": "Full Name",
        "title": "Job Title",
        "email": "direct_email_if_found_OR_most_likely_generated_email",
        "email_options": [
          "email1@domain.com",
          "email2@domain.com",
          "email3@domain.com"
        ],
        "email_confidence": "found/generated_high/generated_medium/generated_low",
        "phone": "direct_phone_if_found",
        "department": "practice_area_or_department",
        "quote": "professional_background_or_bio_excerpt",
        "Best_match": "True_or_False",
        "Priority_score": "from 10 to 1 (10 is highest)"
      },
      {
        "name": "Helen Steiner",
        "title": "Paralegal",
        "email": "helen.steiner@ritaohio.com",
        "email_options": [
          "helen.steiner@ritaohio.com",
          "hsteiner@ritaohio.com",
          "helen@ritaohio.com"
        ],
        "email_confidence": "generated_medium",
        "phone": "",
        "department": "Legal / Debt Collection",
        "quote": "Working with others. Helping others. Focus on my job and work hard to make sure I meet deadlines. Associate's degree Legal Assistant/Paralegal. 2016 - 2018.",
        "Best_match": "False",
        "Priority_score": "8"
      },
      {
        "name": "Helen Cutting",
        "title": "Paralegal",
        "email": "helen.cutting@ritaohio.com",
        "email_options": [
          "helen.cutting@ritaohio.com",
          "hcutting@ritaohio.com",
          "helen@ritaohio.com"
        ],
        "email_confidence": "generated_medium",
        "phone": "",
        "department": "Legal / Debt Collection",
        "quote": "Paralegal at Regional Income Tax Agency (RITA) · Experience: Regional Income Tax Agency (RITA) · Location: North Canton.",
        "Best_match": "False",
        "Priority_score": "7"
      },
      {
        "name": "Maria Liggins",
        "title": "Paralegal / Legal Assistant",
        "email": "maria.liggins@ritaohio.com",
        "email_options": [
          "maria.liggins@ritaohio.com",
          "mliggins@ritaohio.com",
          "maria@ritaohio.com"
        ],
        "email_confidence": "generated_medium",
        "phone": "",
        "department": "Legal / Debt Collection",
        "quote": "Paralegal/ Legal Assistant. Regional Income Tax Agency (RITA) Cleveland State University. Willoughby, Ohio, United States.",
        "Best_match": "False",
        "Priority_score": "8"
      },
      {
        "name": "Ellie Kaloudis",
        "title": "Paralegal",
        "email": "ellie.kaloudis@ritaohio.com",
        "email_options": [
          "ellie.kaloudis@ritaohio.com",
          "ekaloudis@ritaohio.com",
          "ellie@ritaohio.com"
        ],
        "email_confidence": "generated_medium",
        "phone": "",
        "department": "Legal / Debt Collection",
        "quote": "Paralegal. Regional Income Tax Agency (RITA). Mar 2023 - Present 2 years 8 months.",
        "Best_match": "False",
        "Priority_score": "6"
      },
      {
        "name": "Sara Bukszar Linville",
        "title": "Paralegal",
        "email": "sara.bukszarlinville@ritaohio.com",
        "email_options": [
          "sara.bukszarlinville@ritaohio.com",
          "sbukszarlinville@ritaohio.com",
          "sara@ritaohio.com"
        ],
        "email_confidence": "generated_medium",
        "phone": "",
        "department": "Legal / Debt Collection",
        "quote": "I graduated in 2014 from an ABA accredited paralegal program and immediately started working for the Regional Income Tax Agency. While being employed at ...",
        "Best_match": "True",
        "Priority_score": "10"
      },
      {
        "name": "John Wood",
        "title": "Records Clerk",
        "email": "john.wood@ritaohio.com",
        "email_options": [
          "john.wood@ritaohio.com",
          "jwood@ritaohio.com",
          "john@ritaohio.com"
        ],
        "email_confidence": "generated_medium",
        "phone": "",
        "department": "Legal / Debt Collection",
        "quote": "Records Clerk at Regional Income Tax Agency · A creative support professional with attention to detail, organizational, communicational and problem solving ...",
        "Best_match": "False",
        "Priority_score": "5"
      }
    ],
    "search_notes": "",
    "raw_content": "Share\nSign up\nSign in\nCOMPREHENSIVE PARALEGAL SEARCH REQUEST\n\nMISSION: Find ALL paralegals, legal assistants, and support staff for this law firm\n\nFIRM DETAILS:\n- Attorney: BRITTANY D. CARABALLO\n- Email: legal@ritaohio.com\n- Phone: (440) 922.3282\n- Website: ritaohio.com\n- Firm: REGIONAL INCOME TAX AGENCY\n- Practice Area: DEBT_COLLECTION\n\nSEARCH REQUIREMENTS:\n1. PRIMARY: Search the main website (ritaohio.com) thoroughly for ALL staff\n2. DEEP SEARCH: If website has limited info, search these sources:\n   - LinkedIn company page and employee profiles\n   - Facebook business page and staff mentions\n   - Instagram business account\n   - Google Business listings\n   - Legal directories (Avvo, FindLaw, Lawyers.com)\n   - Bar association listings\n   - Court filing documents (if accessible)\n\nTARGET ROLES TO FIND:\n- Paralegals (all levels: senior, junior, certified)\n- Legal Assistants\n- Legal Secretaries\n- Case Managers\n- Document Specialists  \n- Litigation Support Staff\n- Client Services Coordinators\n- Administrative Assistants (in legal capacity)\n\nREQUIRED INFORMATION for each person:\n- Full Name (required)\n- Job Title/Role (required) \n- Direct Email (if available) + GENERATED EMAIL OPTIONS (see below)\n- Direct Phone/Extension (if available)\n- Department/Practice Area\n- Professional Background/Quote (if available)\n\nCRITICAL EMAIL REQUIREMENTS:\n1. If direct email found: Use the actual email\n2. If NO email found: Generate 2-3 probable email options using the attorney's email format\n3. Email generation patterns to try:\n   - firstname.lastname@domain.com\n   - firstinitiallastname@domain.com  \n   - firstname@domain.com\n   - staff.firstname@domain.com\n   - paralegal.firstname@domain.com\n4. Extract domain from attorney email: legal@ritaohio.com and use it for all generated emails\n5. or use common formats based on firm domain\n\nBEST CONTACT IDENTIFICATION:\nAnalyze the staff and identify the SINGLE BEST person to contact for attorney services/legal matters.\nConsider:\n- Senior paralegals or case managers (highest priority)\n- Legal assistants with client contact responsibilities\n- Office managers if they handle new client intake\n- Avoid receptionists unless they're the only option\nMark this person with \"Best_match\": \"True\"\n\nSEARCH STRATEGY:\n- Check \"Our Team\", \"Staff\", \"About Us\", \"Meet the Team\" pages\n- Look for staff bios and profiles\n- Search social media for team photos and mentions\n- Check LinkedIn for current employees\n- Look for staff in news articles or case announcements\n- Find people in office photos or group pictures\n\nEXTRACTION FORMAT:\nPlease output results in this EXACT JSON format:\n\n{\n    \"page_url\": \"website_searched\",\n    \"search_sources\": [\"list_of_sources_checked\"],\n    \"total_staff_found\": number,\n    \"attorney_email_domain\": \"domain_from_attorney_email\",\n    \"paralegals\": [\n        {\n            \"name\": \"Full Name\",\n            \"title\": \"Job Title\",\n            \"email\": \"direct_email_if_found_OR_most_likely_generated_email\", \n            \"email_options\": [\"email1@domain.com\", \"email2@domain.com\", \"email3@domain.com\"],\n            \"email_confidence\": \"found/generated_high/generated_medium/generated_low\",\n            \"phone\": \"direct_phone_if_found\",\n            \"department\": \"practice_area_or_department\",\n            \"quote\": \"professional_background_or_bio_excerpt\",\n            \"Best_match\": \"True_or_False\",\n            \"Priority_score\": \"from 10 to 1 (10 is highest)\"\n        }\n    ],\n    \"best_contact_reasoning\": \"explanation_of_why_this_person_was_selected_as_best_match\",\n    \"search_notes\": \"brief_summary_of_search_process_and_sources_used\"\n}\n\nSPECIFIC EMAIL GENERATION INSTRUCTIONS:\n- Attorney email pattern: legal@ritaohio.com\n- Extract domain from attorney email and use for all staff emails if it is right/accurate coz sometimes email's person name or domain can be little miscalculated because of OCR issues mostly it is accurate (domain).\n- For \"John Smith\" generate these patterns: [\"john.smith@domain.com\", \"jsmith@domain.com\", \"john@domain.com\"]\n- Always provide 2-3 email options per person (more if unsure)\n- Mark confidence level: \"found\" (actual email found), \"generated_high\" (strong pattern match), \"generated_medium\" (reasonable guess), \"generated_low\" (last resort)\n\nBEST MATCH SELECTION CRITERIA:\nBased on the case information (Practice Area: DEBT_COLLECTION), select the staff member who would be:\n1. Most likely to handle new client intake for this practice area\n2. Senior enough to make decisions about new cases  \n3. Specifically responsible for client communications\n4. Has experience in the relevant practice area\n\nIMPORTANT: Be thorough and creative! Many firms hide staff information, so use multiple search angles. If the main website is limited, definitely search social media and professional networks. We need to find as many legal support staff as possible!\n\nCRITICAL: \n- ALWAYS generate email options even if no direct emails found\n- ALWAYS select exactly ONE person as \"Best_match\": \"True\" \n- ALWAYS explain your reasoning for the best match selection\n- MUST MAKE SURE: ALWAYS THINK HARDER\n\nSTART COMPREHENSIVE SEARCH NOW for: ritaohio.com\nThought for 1m 55s\n{\n\"page_url\": \"https://www.ritaohio.com/\",\n\"search_sources\": [\"https://www.ritaohio.com/\", \"https://www.linkedin.com\", \"https://www.facebook.com\", \"https://www.instagram.com\", \"https://www.avvo.com\", \"https://www.findlaw.com\", \"https://www.lawyers.com\", \"https://www.ohiobar.org\"],\n\"total_staff_found\": 6,\n\"attorney_email_domain\": \"ritaohio.com\",\n\"paralegals\": [\n{\n\"name\": \"Helen Steiner\",\n\"title\": \"Paralegal\",\n\"email\": \"helen.steiner@ritaohio.com\",\n\"email_options\": [\"helen.steiner@ritaohio.com\", \"hsteiner@ritaohio.com\", \"helen@ritaohio.com\"],\n\"email_confidence\": \"generated_medium\",\n\"phone\": \"\",\n\"department\": \"Legal / Debt Collection\",\n\"quote\": \"Working with others. Helping others. Focus on my job and work hard to make sure I meet deadlines. Associate's degree Legal Assistant/Paralegal. 2016 - 2018.\",\n\"Best_match\": \"False\",\n\"Priority_score\": \"8\"\n},\n{\n\"name\": \"Helen Cutting\",\n\"title\": \"Paralegal\",\n\"email\": \"helen.cutting@ritaohio.com\",\n\"email_options\": [\"helen.cutting@ritaohio.com\", \"hcutting@ritaohio.com\", \"helen@ritaohio.com\"],\n\"email_confidence\": \"generated_medium\",\n\"phone\": \"\",\n\"department\": \"Legal / Debt Collection\",\n\"quote\": \"Paralegal at Regional Income Tax Agency (RITA) · Experience: Regional Income Tax Agency (RITA) · Location: North Canton.\",\n\"Best_match\": \"False\",\n\"Priority_score\": \"7\"\n},\n{\n\"name\": \"Maria Liggins\",\n\"title\": \"Paralegal / Legal Assistant\",\n\"email\": \"maria.liggins@ritaohio.com\",\n\"email_options\": [\"maria.liggins@ritaohio.com\", \"mliggins@ritaohio.com\", \"maria@ritaohio.com\"],\n\"email_confidence\": \"generated_medium\",\n\"phone\": \"\",\n\"department\": \"Legal / Debt Collection\",\n\"quote\": \"Paralegal/ Legal Assistant. Regional Income Tax Agency (RITA) Cleveland State University. Willoughby, Ohio, United States.\",\n\"Best_match\": \"False\",\n\"Priority_score\": \"8\"\n},\n{\n\"name\": \"Ellie Kaloudis\",\n\"title\": \"Paralegal\",\n\"email\": \"ellie.kaloudis@ritaohio.com\",\n\"email_options\": [\"ellie.kaloudis@ritaohio.com\", \"ekaloudis@ritaohio.com\", \"ellie@ritaohio.com\"],\n\"email_confidence\": \"generated_medium\",\n\"phone\": \"\",\n\"department\": \"Legal / Debt Collection\",\n\"quote\": \"Paralegal. Regional Income Tax Agency (RITA). Mar 2023 - Present 2 years 8 months.\",\n\"Best_match\": \"False\",\n\"Priority_score\": \"6\"\n},\n{\n\"name\": \"Sara Bukszar Linville\",\n\"title\": \"Paralegal\",\n\"email\": \"sara.bukszarlinville@ritaohio.com\",\n\"email_options\": [\"sara.bukszarlinville@ritaohio.com\", \"sbukszarlinville@ritaohio.com\", \"sara@ritaohio.com\"],\n\"email_confidence\": \"generated_medium\",\n\"phone\": \"\",\n\"department\": \"Legal / Debt Collection\",\n\"quote\": \"I graduated in 2014 from an ABA accredited paralegal program and immediately started working for the Regional Income Tax Agency. While being employed at ...\",\n\"Best_match\": \"True\",\n\"Priority_score\": \"10\"\n},\n{\n\"name\": \"John Wood\",\n\"title\": \"Records Clerk\",\n\"email\": \"john.wood@ritaohio.com\",\n\"email_options\": [\"john.wood@ritaohio.com\", \"jwood@ritaohio.com\", \"john@ritaohio.com\"],\n\"email_confidence\": \"generated_medium\",\n\"phone\": \"\",\n\"department\": \"Legal / Debt Collection\",\n\"quote\": \"Records Clerk at Regional Income Tax Agency · A creative support professional with attention to detail, organizational, communicational and problem solving ...\",\n\"Best_match\": \"False\",\n\"Priority_score\": \"5\"\n}\n],\n\"best_contact_reasoning\": \"Sara Bukszar Linville was selected as the best match because she has the longest implied tenure, having started at the agency immediately after graduating from a paralegal program in 2014, making her likely a senior paralegal with extensive experience in municipal tax debt collection. This positions her as senior enough to handle new client intake, make decisions on cases, and manage client communications in the debt collection practice area.\",\n\"search_notes\": \"Searched main website ritaohio.com and contact pages, found no individual staff listings, only department contacts. Used web searches on LinkedIn to find employee profiles, identifying current paralegals and support staff through snippets. Checked social media (Facebook, Instagram) for mentions but found none relevant to staff. Searched legal directories and bar associations but no additional staff info. Relied primarily on LinkedIn profiles for staff details; no direct emails or phones found, so generated email options based on domain.\"\n}\n57 web pages\n1.4s\nExpert\nParalegal roles in tax debt\nOhio tax collection agencies\nHow can Grok help?\nAuto",
    "extraction_timestamp": "2025-10-18T02:54:48.713604",
    "raw_file": "grok_paralegal_search_results\\grok_raw_results_20251018_025448.txt"
  },
  "search_completed_at": "2025-10-18T02:54:48.739647",
  "associated_cases": 3,
  "result_file": "grok_paralegal_search_results\\grok_paralegal_search_ritaohio_com_20251018_025448_w0.json"
}