{
  "domain": "elkandelk.com",
  "search_url": "elkandelk.com",
  "attorney_info": {
    "original_website": "elkandelk.com",
    "attorney_name": "William P. Campbell",
    "attorney_email": "Bcampbell@elkandelk.com",
    "phone": "(440) 442-6677",
    "firm_name": "ELK AND ELK CO., LTD.",
    "practice_area": "PERSONAL_INJURY",
    "case_id": "",
    "row_data": {
      "Case Number": "",
      "Filing Date": "",
      "Case Type": "PERSONAL_INJURY",
      "Court": "COURT OF COMMON PLEAS, CUYAHOGA COUNTY, OHIO",
      "County": "CUYAHOGA",
      "Plaintiff": "STEPHANIE SIMONE-BERARDINELLI",
      "Primary Defendant": "CLEVELAND CLINIC HILLCREST HOSPITAL",
      "Attorney Name": "William P. Campbell",
      "Attorney Office": "ELK AND ELK CO., LTD.",
      "Attorney Email": "Bcampbell@elkandelk.com",
      "Attorney Phone": "(440) 442-6677",
      "Attorney Website": "elkandelk.com",
      "Relief Requested": "$25,000.00",
      "Processed At": "2025-10-18T01:04:31.329572",
      "Folder Name": "case_3646760",
      "Paralegal Name": "",
      "Paralegal Email": "",
      "Email-2": "",
      "Email-3": "",
      "Email-4": "",
      "Email-5": "",
      "Paralegal Number": "",
      "Department": "",
      "Paralegal Website Page Link": "",
      "Email Sent?": "",
      "Email Replied?": "",
      "Paralegal email": "",
      "Phone call?": ""
    }
  },
  "search_message": "COMPREHENSIVE PARALEGAL SEARCH REQUEST\n\nMISSION: Find ALL paralegals, legal assistants, and support staff for this law firm\n\nFIRM DETAILS:\n- Attorney: William P. Campbell\n- Email: Bcampbell@elkandelk.com\n- Phone: (440) 442-6677\n- Website: elkandelk.com\n- Firm: ELK AND ELK CO., LTD.\n- Practice Area: PERSONAL_INJURY\n\nSEARCH REQUIREMENTS:\n1. PRIMARY: Search the main website (elkandelk.com) thoroughly for ALL staff\n2. DEEP SEARCH: If website has limited info, search these sources:\n   - LinkedIn company page and employee profiles\n   - Facebook business page and staff mentions\n   - Instagram business account\n   - Google Business listings\n   - Legal directories (Avvo, FindLaw, Lawyers.com)\n   - Bar association listings\n   - Court filing documents (if accessible)\n\nTARGET ROLES TO FIND:\n- Paralegals (all levels: senior, junior, certified)\n- Legal Assistants\n- Legal Secretaries\n- Case Managers\n- Document Specialists  \n- Litigation Support Staff\n- Client Services Coordinators\n- Administrative Assistants (in legal capacity)\n\nREQUIRED INFORMATION for each person:\n- Full Name (required)\n- Job Title/Role (required) \n- Direct Email (if available) + GENERATED EMAIL OPTIONS (see below)\n- Direct Phone/Extension (if available)\n- Department/Practice Area\n- Professional Background/Quote (if available)\n\nCRITICAL EMAIL REQUIREMENTS:\n1. If direct email found: Use the actual email\n2. If NO email found: Generate 2-3 probable email options using the attorney's email format\n3. Email generation patterns to try:\n   - firstname.lastname@domain.com\n   - firstinitiallastname@domain.com  \n   - firstname@domain.com\n   - staff.firstname@domain.com\n   - paralegal.firstname@domain.com\n4. Extract domain from attorney email: Bcampbell@elkandelk.com and use it for all generated emails\n5. or use common formats based on firm domain\n\nBEST CONTACT IDENTIFICATION:\nAnalyze the staff and identify the SINGLE BEST person to contact for attorney services/legal matters.\nConsider:\n- Senior paralegals or case managers (highest priority)\n- Legal assistants with client contact responsibilities\n- Office managers if they handle new client intake\n- Avoid receptionists unless they're the only option\nMark this person with \"Best_match\": \"True\"\n\nSEARCH STRATEGY:\n- Check \"Our Team\", \"Staff\", \"About Us\", \"Meet the Team\" pages\n- Look for staff bios and profiles\n- Search social media for team photos and mentions\n- Check LinkedIn for current employees\n- Look for staff in news articles or case announcements\n- Find people in office photos or group pictures\n\nEXTRACTION FORMAT:\nPlease output results in this EXACT JSON format:\n\n{\n    \"page_url\": \"website_searched\",\n    \"search_sources\": [\"list_of_sources_checked\"],\n    \"total_staff_found\": number,\n    \"attorney_email_domain\": \"domain_from_attorney_email\",\n    \"paralegals\": [\n        {\n            \"name\": \"Full Name\",\n            \"title\": \"Job Title\",\n            \"email\": \"direct_email_if_found_OR_most_likely_generated_email\", \n            \"email_options\": [\"email1@domain.com\", \"email2@domain.com\", \"email3@domain.com\"],\n            \"email_confidence\": \"found/generated_high/generated_medium/generated_low\",\n            \"phone\": \"direct_phone_if_found\",\n            \"department\": \"practice_area_or_department\",\n            \"quote\": \"professional_background_or_bio_excerpt\",\n            \"Best_match\": \"True_or_False\",\n            \"Priority_score\": \"from 10 to 1 (10 is highest)\"\n        }\n    ],\n    \"best_contact_reasoning\": \"explanation_of_why_this_person_was_selected_as_best_match\",\n    \"search_notes\": \"brief_summary_of_search_process_and_sources_used\"\n}\n\nSPECIFIC EMAIL GENERATION INSTRUCTIONS:\n- Attorney email pattern: Bcampbell@elkandelk.com\n- Extract domain from attorney email and use for all staff emails if it is right/accurate coz sometimes email's person name or domain can be little miscalculated because of OCR issues mostly it is accurate (domain).\n- For \"John Smith\" generate these patterns: [\"john.smith@domain.com\", \"jsmith@domain.com\", \"john@domain.com\"]\n- Always provide 2-3 email options per person (more if unsure)\n- Mark confidence level: \"found\" (actual email found), \"generated_high\" (strong pattern match), \"generated_medium\" (reasonable guess), \"generated_low\" (last resort)\n\nBEST MATCH SELECTION CRITERIA:\nBased on the case information (Practice Area: PERSONAL_INJURY), select the staff member who would be:\n1. Most likely to handle new client intake for this practice area\n2. Senior enough to make decisions about new cases  \n3. Specifically responsible for client communications\n4. Has experience in the relevant practice area\n\nIMPORTANT: Be thorough and creative! Many firms hide staff information, so use multiple search angles. If the main website is limited, definitely search social media and professional networks. We need to find as many legal support staff as possible!\n\nCRITICAL: \n- ALWAYS generate email options even if no direct emails found\n- ALWAYS select exactly ONE person as \"Best_match\": \"True\" \n- ALWAYS explain your reasoning for the best match selection\n- MUST MAKE SURE: ALWAYS THINK HARDER\n\nSTART COMPREHENSIVE SEARCH NOW for: elkandelk.com",
  "results": {
    "page_url": "",
    "search_sources": [],
    "total_staff_found": 12,
    "paralegals": [
      {
        "name": "Full Name",
        "title": "Job Title",
        "email": "direct_email_if_found_OR_most_likely_generated_email",
        "email_options": [
          "email1@domain.com",
          "email2@domain.com",
          "email3@domain.com"
        ],
        "email_confidence": "found/generated_high/generated_medium/generated_low",
        "phone": "direct_phone_if_found",
        "department": "practice_area_or_department",
        "quote": "professional_background_or_bio_excerpt",
        "Best_match": "True_or_False",
        "Priority_score": "from 10 to 1 (10 is highest)"
      },
      {
        "name": "Theresa Arcaro",
        "title": "Paralegal",
        "email": "tarcaro@elkandelk.com",
        "email_options": [
          "theresa.arcaro@elkandelk.com",
          "tarcaro@elkandelk.com",
          "theresa@elkandelk.com"
        ],
        "email_confidence": "generated_medium",
        "phone": "",
        "department": "Personal Injury",
        "quote": "Earned OSBA Paralegal Certification",
        "Best_match": "False",
        "Priority_score": "8"
      },
      {
        "name": "Maria Ferguson",
        "title": "Paralegal",
        "email": "mferguson@elkandelk.com",
        "email_options": [
          "maria.ferguson@elkandelk.com",
          "mferguson@elkandelk.com",
          "maria@elkandelk.com"
        ],
        "email_confidence": "generated_medium",
        "phone": "",
        "department": "Personal Injury",
        "quote": "Earned OSBA Paralegal Certification",
        "Best_match": "False",
        "Priority_score": "8"
      },
      {
        "name": "Stacy Joyce",
        "title": "Paralegal",
        "email": "sjoyce@elkandelk.com",
        "email_options": [
          "stacy.joyce@elkandelk.com",
          "sjoyce@elkandelk.com",
          "stacy@elkandelk.com"
        ],
        "email_confidence": "generated_medium",
        "phone": "",
        "department": "Personal Injury",
        "quote": "Earned OSBA Paralegal Certification",
        "Best_match": "False",
        "Priority_score": "8"
      },
      {
        "name": "Sue Laske",
        "title": "Paralegal",
        "email": "slaske@elkandelk.com",
        "email_options": [
          "sue.laske@elkandelk.com",
          "slaske@elkandelk.com",
          "sue@elkandelk.com"
        ],
        "email_confidence": "generated_medium",
        "phone": "",
        "department": "Personal Injury",
        "quote": "Earned OSBA Paralegal Certification",
        "Best_match": "False",
        "Priority_score": "8"
      },
      {
        "name": "Cheryl Machesky",
        "title": "Paralegal",
        "email": "cmachesky@elkandelk.com",
        "email_options": [
          "cheryl.machesky@elkandelk.com",
          "cmachesky@elkandelk.com",
          "cheryl@elkandelk.com"
        ],
        "email_confidence": "generated_medium",
        "phone": "",
        "department": "Personal Injury",
        "quote": "Earned OSBA Paralegal Certification",
        "Best_match": "False",
        "Priority_score": "8"
      },
      {
        "name": "Denise Pickett",
        "title": "Paralegal",
        "email": "dpickett@elkandelk.com",
        "email_options": [
          "denise.pickett@elkandelk.com",
          "dpickett@elkandelk.com",
          "denise@elkandelk.com"
        ],
        "email_confidence": "generated_medium",
        "phone": "",
        "department": "Personal Injury",
        "quote": "Earned OSBA Paralegal Certification",
        "Best_match": "False",
        "Priority_score": "8"
      },
      {
        "name": "Elizabeth Vurusic",
        "title": "Paralegal",
        "email": "evurusic@elkandelk.com",
        "email_options": [
          "elizabeth.vurusic@elkandelk.com",
          "evurusic@elkandelk.com",
          "elizabeth@elkandelk.com"
        ],
        "email_confidence": "generated_medium",
        "phone": "",
        "department": "Personal Injury",
        "quote": "Earned OSBA Paralegal Certification",
        "Best_match": "False",
        "Priority_score": "8"
      },
      {
        "name": "Janell Zbasnik",
        "title": "Paralegal",
        "email": "jzbasnik@elkandelk.com",
        "email_options": [
          "janell.zbasnik@elkandelk.com",
          "jzbasnik@elkandelk.com",
          "janell@elkandelk.com"
        ],
        "email_confidence": "generated_medium",
        "phone": "",
        "department": "Personal Injury",
        "quote": "Earned OSBA Paralegal Certification",
        "Best_match": "False",
        "Priority_score": "8"
      },
      {
        "name": "Lyndsay Pavlak",
        "title": "Paralegal",
        "email": "lpavlak@elkandelk.com",
        "email_options": [
          "lyndsay.pavlak@elkandelk.com",
          "lpavlak@elkandelk.com",
          "lyndsay@elkandelk.com"
        ],
        "email_confidence": "generated_medium",
        "phone": "",
        "department": "Personal Injury",
        "quote": "Paralegal at Elk and Elk",
        "Best_match": "False",
        "Priority_score": "9"
      },
      {
        "name": "Jacqueline Reblin",
        "title": "Litigation Paralegal",
        "email": "jreblin@elkandelk.com",
        "email_options": [
          "jacqueline.reblin@elkandelk.com",
          "jreblin@elkandelk.com",
          "jacqueline@elkandelk.com"
        ],
        "email_confidence": "generated_medium",
        "phone": "",
        "department": "Personal Injury",
        "quote": "Paralegal that handles litigation files as well as pre-litigation files. Prepares court documents, briefs, motions, discovery, reviews medical records, prepares trial exhibits.",
        "Best_match": "True",
        "Priority_score": "10"
      },
      {
        "name": "Constance Streble",
        "title": "Administrative Assistant",
        "email": "cstreble@elkandelk.com",
        "email_options": [
          "constance.streble@elkandelk.com",
          "cstreble@elkandelk.com",
          "constance@elkandelk.com"
        ],
        "email_confidence": "generated_medium",
        "phone": "",
        "department": "Personal Injury",
        "quote": "Administrative Assistant at Elk and Elk Law Firm",
        "Best_match": "False",
        "Priority_score": "5"
      }
    ],
    "search_notes": "",
    "raw_content": "Share\nSign up\nSign in\nCOMPREHENSIVE PARALEGAL SEARCH REQUEST\n\nMISSION: Find ALL paralegals, legal assistants, and support staff for this law firm\n\nFIRM DETAILS:\n- Attorney: William P. Campbell\n- Email: Bcampbell@elkandelk.com\n- Phone: (440) 442-6677\n- Website: elkandelk.com\n- Firm: ELK AND ELK CO., LTD.\n- Practice Area: PERSONAL_INJURY\n\nSEARCH REQUIREMENTS:\n1. PRIMARY: Search the main website (elkandelk.com) thoroughly for ALL staff\n2. DEEP SEARCH: If website has limited info, search these sources:\n   - LinkedIn company page and employee profiles\n   - Facebook business page and staff mentions\n   - Instagram business account\n   - Google Business listings\n   - Legal directories (Avvo, FindLaw, Lawyers.com)\n   - Bar association listings\n   - Court filing documents (if accessible)\n\nTARGET ROLES TO FIND:\n- Paralegals (all levels: senior, junior, certified)\n- Legal Assistants\n- Legal Secretaries\n- Case Managers\n- Document Specialists  \n- Litigation Support Staff\n- Client Services Coordinators\n- Administrative Assistants (in legal capacity)\n\nREQUIRED INFORMATION for each person:\n- Full Name (required)\n- Job Title/Role (required) \n- Direct Email (if available) + GENERATED EMAIL OPTIONS (see below)\n- Direct Phone/Extension (if available)\n- Department/Practice Area\n- Professional Background/Quote (if available)\n\nCRITICAL EMAIL REQUIREMENTS:\n1. If direct email found: Use the actual email\n2. If NO email found: Generate 2-3 probable email options using the attorney's email format\n3. Email generation patterns to try:\n   - firstname.lastname@domain.com\n   - firstinitiallastname@domain.com  \n   - firstname@domain.com\n   - staff.firstname@domain.com\n   - paralegal.firstname@domain.com\n4. Extract domain from attorney email: Bcampbell@elkandelk.com and use it for all generated emails\n5. or use common formats based on firm domain\n\nBEST CONTACT IDENTIFICATION:\nAnalyze the staff and identify the SINGLE BEST person to contact for attorney services/legal matters.\nConsider:\n- Senior paralegals or case managers (highest priority)\n- Legal assistants with client contact responsibilities\n- Office managers if they handle new client intake\n- Avoid receptionists unless they're the only option\nMark this person with \"Best_match\": \"True\"\n\nSEARCH STRATEGY:\n- Check \"Our Team\", \"Staff\", \"About Us\", \"Meet the Team\" pages\n- Look for staff bios and profiles\n- Search social media for team photos and mentions\n- Check LinkedIn for current employees\n- Look for staff in news articles or case announcements\n- Find people in office photos or group pictures\n\nEXTRACTION FORMAT:\nPlease output results in this EXACT JSON format:\n\n{\n    \"page_url\": \"website_searched\",\n    \"search_sources\": [\"list_of_sources_checked\"],\n    \"total_staff_found\": number,\n    \"attorney_email_domain\": \"domain_from_attorney_email\",\n    \"paralegals\": [\n        {\n            \"name\": \"Full Name\",\n            \"title\": \"Job Title\",\n            \"email\": \"direct_email_if_found_OR_most_likely_generated_email\", \n            \"email_options\": [\"email1@domain.com\", \"email2@domain.com\", \"email3@domain.com\"],\n            \"email_confidence\": \"found/generated_high/generated_medium/generated_low\",\n            \"phone\": \"direct_phone_if_found\",\n            \"department\": \"practice_area_or_department\",\n            \"quote\": \"professional_background_or_bio_excerpt\",\n            \"Best_match\": \"True_or_False\",\n            \"Priority_score\": \"from 10 to 1 (10 is highest)\"\n        }\n    ],\n    \"best_contact_reasoning\": \"explanation_of_why_this_person_was_selected_as_best_match\",\n    \"search_notes\": \"brief_summary_of_search_process_and_sources_used\"\n}\n\nSPECIFIC EMAIL GENERATION INSTRUCTIONS:\n- Attorney email pattern: Bcampbell@elkandelk.com\n- Extract domain from attorney email and use for all staff emails if it is right/accurate coz sometimes email's person name or domain can be little miscalculated because of OCR issues mostly it is accurate (domain).\n- For \"John Smith\" generate these patterns: [\"john.smith@domain.com\", \"jsmith@domain.com\", \"john@domain.com\"]\n- Always provide 2-3 email options per person (more if unsure)\n- Mark confidence level: \"found\" (actual email found), \"generated_high\" (strong pattern match), \"generated_medium\" (reasonable guess), \"generated_low\" (last resort)\n\nBEST MATCH SELECTION CRITERIA:\nBased on the case information (Practice Area: PERSONAL_INJURY), select the staff member who would be:\n1. Most likely to handle new client intake for this practice area\n2. Senior enough to make decisions about new cases  \n3. Specifically responsible for client communications\n4. Has experience in the relevant practice area\n\nIMPORTANT: Be thorough and creative! Many firms hide staff information, so use multiple search angles. If the main website is limited, definitely search social media and professional networks. We need to find as many legal support staff as possible!\n\nCRITICAL: \n- ALWAYS generate email options even if no direct emails found\n- ALWAYS select exactly ONE person as \"Best_match\": \"True\" \n- ALWAYS explain your reasoning for the best match selection\n- MUST MAKE SURE: ALWAYS THINK HARDER\n\nSTART COMPREHENSIVE SEARCH NOW for: elkandelk.com\nThought for 2m 55s\n{\n\"page_url\": \"elkandelk.com\",\n\"search_sources\": [\"elkandelk.com\", \"linkedin.com\", \"avvo.com\", \"lawyers.com\", \"findlaw.com\", \"facebook.com\", \"instagram.com\"],\n\"total_staff_found\": 11,\n\"attorney_email_domain\": \"elkandelk.com\",\n\"paralegals\": [\n{\n\"name\": \"Theresa Arcaro\",\n\"title\": \"Paralegal\",\n\"email\": \"tarcaro@elkandelk.com\",\n\"email_options\": [\"theresa.arcaro@elkandelk.com\", \"tarcaro@elkandelk.com\", \"theresa@elkandelk.com\"],\n\"email_confidence\": \"generated_medium\",\n\"phone\": \"\",\n\"department\": \"Personal Injury\",\n\"quote\": \"Earned OSBA Paralegal Certification\",\n\"Best_match\": \"False\",\n\"Priority_score\": \"8\"\n},\n{\n\"name\": \"Maria Ferguson\",\n\"title\": \"Paralegal\",\n\"email\": \"mferguson@elkandelk.com\",\n\"email_options\": [\"maria.ferguson@elkandelk.com\", \"mferguson@elkandelk.com\", \"maria@elkandelk.com\"],\n\"email_confidence\": \"generated_medium\",\n\"phone\": \"\",\n\"department\": \"Personal Injury\",\n\"quote\": \"Earned OSBA Paralegal Certification\",\n\"Best_match\": \"False\",\n\"Priority_score\": \"8\"\n},\n{\n\"name\": \"Stacy Joyce\",\n\"title\": \"Paralegal\",\n\"email\": \"sjoyce@elkandelk.com\",\n\"email_options\": [\"stacy.joyce@elkandelk.com\", \"sjoyce@elkandelk.com\", \"stacy@elkandelk.com\"],\n\"email_confidence\": \"generated_medium\",\n\"phone\": \"\",\n\"department\": \"Personal Injury\",\n\"quote\": \"Earned OSBA Paralegal Certification\",\n\"Best_match\": \"False\",\n\"Priority_score\": \"8\"\n},\n{\n\"name\": \"Sue Laske\",\n\"title\": \"Paralegal\",\n\"email\": \"slaske@elkandelk.com\",\n\"email_options\": [\"sue.laske@elkandelk.com\", \"slaske@elkandelk.com\", \"sue@elkandelk.com\"],\n\"email_confidence\": \"generated_medium\",\n\"phone\": \"\",\n\"department\": \"Personal Injury\",\n\"quote\": \"Earned OSBA Paralegal Certification\",\n\"Best_match\": \"False\",\n\"Priority_score\": \"8\"\n},\n{\n\"name\": \"Cheryl Machesky\",\n\"title\": \"Paralegal\",\n\"email\": \"cmachesky@elkandelk.com\",\n\"email_options\": [\"cheryl.machesky@elkandelk.com\", \"cmachesky@elkandelk.com\", \"cheryl@elkandelk.com\"],\n\"email_confidence\": \"generated_medium\",\n\"phone\": \"\",\n\"department\": \"Personal Injury\",\n\"quote\": \"Earned OSBA Paralegal Certification\",\n\"Best_match\": \"False\",\n\"Priority_score\": \"8\"\n},\n{\n\"name\": \"Denise Pickett\",\n\"title\": \"Paralegal\",\n\"email\": \"dpickett@elkandelk.com\",\n\"email_options\": [\"denise.pickett@elkandelk.com\", \"dpickett@elkandelk.com\", \"denise@elkandelk.com\"],\n\"email_confidence\": \"generated_medium\",\n\"phone\": \"\",\n\"department\": \"Personal Injury\",\n\"quote\": \"Earned OSBA Paralegal Certification\",\n\"Best_match\": \"False\",\n\"Priority_score\": \"8\"\n},\n{\n\"name\": \"Elizabeth Vurusic\",\n\"title\": \"Paralegal\",\n\"email\": \"evurusic@elkandelk.com\",\n\"email_options\": [\"elizabeth.vurusic@elkandelk.com\", \"evurusic@elkandelk.com\", \"elizabeth@elkandelk.com\"],\n\"email_confidence\": \"generated_medium\",\n\"phone\": \"\",\n\"department\": \"Personal Injury\",\n\"quote\": \"Earned OSBA Paralegal Certification\",\n\"Best_match\": \"False\",\n\"Priority_score\": \"8\"\n},\n{\n\"name\": \"Janell Zbasnik\",\n\"title\": \"Paralegal\",\n\"email\": \"jzbasnik@elkandelk.com\",\n\"email_options\": [\"janell.zbasnik@elkandelk.com\", \"jzbasnik@elkandelk.com\", \"janell@elkandelk.com\"],\n\"email_confidence\": \"generated_medium\",\n\"phone\": \"\",\n\"department\": \"Personal Injury\",\n\"quote\": \"Earned OSBA Paralegal Certification\",\n\"Best_match\": \"False\",\n\"Priority_score\": \"8\"\n},\n{\n\"name\": \"Lyndsay Pavlak\",\n\"title\": \"Paralegal\",\n\"email\": \"lpavlak@elkandelk.com\",\n\"email_options\": [\"lyndsay.pavlak@elkandelk.com\", \"lpavlak@elkandelk.com\", \"lyndsay@elkandelk.com\"],\n\"email_confidence\": \"generated_medium\",\n\"phone\": \"\",\n\"department\": \"Personal Injury\",\n\"quote\": \"Paralegal at Elk and Elk\",\n\"Best_match\": \"False\",\n\"Priority_score\": \"9\"\n},\n{\n\"name\": \"Jacqueline Reblin\",\n\"title\": \"Litigation Paralegal\",\n\"email\": \"jreblin@elkandelk.com\",\n\"email_options\": [\"jacqueline.reblin@elkandelk.com\", \"jreblin@elkandelk.com\", \"jacqueline@elkandelk.com\"],\n\"email_confidence\": \"generated_medium\",\n\"phone\": \"\",\n\"department\": \"Personal Injury\",\n\"quote\": \"Paralegal that handles litigation files as well as pre-litigation files. Prepares court documents, briefs, motions, discovery, reviews medical records, prepares trial exhibits.\",\n\"Best_match\": \"True\",\n\"Priority_score\": \"10\"\n},\n{\n\"name\": \"Constance Streble\",\n\"title\": \"Administrative Assistant\",\n\"email\": \"cstreble@elkandelk.com\",\n\"email_options\": [\"constance.streble@elkandelk.com\", \"cstreble@elkandelk.com\", \"constance@elkandelk.com\"],\n\"email_confidence\": \"generated_medium\",\n\"phone\": \"\",\n\"department\": \"Personal Injury\",\n\"quote\": \"Administrative Assistant at Elk and Elk Law Firm\",\n\"Best_match\": \"False\",\n\"Priority_score\": \"5\"\n}\n],\n\"best_contact_reasoning\": \"Jacqueline Reblin was selected as the best match because her role as a Litigation Paralegal involves handling both litigation and pre-litigation files, preparing legal documents, reviewing medical records, and preparing trial exhibits. In a personal injury firm, this indicates direct involvement in case management, client-related tasks, and potentially new client intake or communications, making her senior enough to handle or influence decisions on new cases in the personal injury practice area.\",\n\"search_notes\": \"Thorough search of the firm website revealed attorney profiles but no direct staff listings; a 2019 blog post provided names of certified paralegals. LinkedIn searches uncovered additional current paralegals and an administrative assistant. Social media and legal directories yielded no additional staff details. No direct emails or phones found for staff; all emails generated based on attorney pattern.\"\n}\n85 web pages\n9.6s\nExpert\nDetails on OSBA Paralegal Certification\nOther Ohio personal injury firms\nHow can Grok help?\nAuto",
    "extraction_timestamp": "2025-10-18T02:31:40.408360",
    "raw_file": "grok_paralegal_search_results\\grok_raw_results_20251018_023140.txt"
  },
  "search_completed_at": "2025-10-18T02:31:40.474829",
  "associated_cases": 1,
  "result_file": "grok_paralegal_search_results\\grok_paralegal_search_elkandelk_com_20251018_023140_w2.json"
}