{
  "domain": "perantinides.com",
  "search_url": "perantinides.com",
  "attorney_info": {
    "original_website": "perantinides.com",
    "attorney_name": "PAUL G. PERANTINIDES",
    "attorney_email": "pgp@perantinides.com",
    "phone": "(330) 253-5454",
    "firm_name": "PERANTINIDES & NOLAN CO., L.P.A.",
    "practice_area": "PERSONAL_INJURY",
    "case_id": "",
    "row_data": {
      "Case Number": "",
      "Filing Date": "",
      "Case Type": "PERSONAL_INJURY",
      "Court": "COURT OF COMMON PLEAS, CUYAHOGA COUNTY, OHIO",
      "County": "CUYAHOGA",
      "Plaintiff": "CHEYENNE E. MYERS",
      "Primary Defendant": "CLEVELAND CLINIC FOUNDATION",
      "Attorney Name": "PAUL G. PERANTINIDES",
      "Attorney Office": "PERANTINIDES & NOLAN CO., L.P.A.",
      "Attorney Email": "pgp@perantinides.com",
      "Attorney Phone": "(330) 253-5454",
      "Attorney Website": "perantinides.com",
      "Relief Requested": "$25,000.00",
      "Processed At": "2025-10-18T01:04:31.047762",
      "Folder Name": "case_3646509",
      "Paralegal Name": "",
      "Paralegal Email": "",
      "Email-2": "",
      "Email-3": "",
      "Email-4": "",
      "Email-5": "",
      "Paralegal Number": "",
      "Department": "",
      "Paralegal Website Page Link": "",
      "Email Sent?": "",
      "Email Replied?": "",
      "Paralegal email": "",
      "Phone call?": ""
    }
  },
  "search_message": "COMPREHENSIVE PARALEGAL SEARCH REQUEST\n\nMISSION: Find ALL paralegals, legal assistants, and support staff for this law firm\n\nFIRM DETAILS:\n- Attorney: PAUL G. PERANTINIDES\n- Email: pgp@perantinides.com\n- Phone: (330) 253-5454\n- Website: perantinides.com\n- Firm: PERANTINIDES & NOLAN CO., L.P.A.\n- Practice Area: PERSONAL_INJURY\n\nSEARCH REQUIREMENTS:\n1. PRIMARY: Search the main website (perantinides.com) thoroughly for ALL staff\n2. DEEP SEARCH: If website has limited info, search these sources:\n   - LinkedIn company page and employee profiles\n   - Facebook business page and staff mentions\n   - Instagram business account\n   - Google Business listings\n   - Legal directories (Avvo, FindLaw, Lawyers.com)\n   - Bar association listings\n   - Court filing documents (if accessible)\n\nTARGET ROLES TO FIND:\n- Paralegals (all levels: senior, junior, certified)\n- Legal Assistants\n- Legal Secretaries\n- Case Managers\n- Document Specialists  \n- Litigation Support Staff\n- Client Services Coordinators\n- Administrative Assistants (in legal capacity)\n\nREQUIRED INFORMATION for each person:\n- Full Name (required)\n- Job Title/Role (required) \n- Direct Email (if available) + GENERATED EMAIL OPTIONS (see below)\n- Direct Phone/Extension (if available)\n- Department/Practice Area\n- Professional Background/Quote (if available)\n\nCRITICAL EMAIL REQUIREMENTS:\n1. If direct email found: Use the actual email\n2. If NO email found: Generate 2-3 probable email options using the attorney's email format\n3. Email generation patterns to try:\n   - firstname.lastname@domain.com\n   - firstinitiallastname@domain.com  \n   - firstname@domain.com\n   - staff.firstname@domain.com\n   - paralegal.firstname@domain.com\n4. Extract domain from attorney email: pgp@perantinides.com and use it for all generated emails\n5. or use common formats based on firm domain\n\nBEST CONTACT IDENTIFICATION:\nAnalyze the staff and identify the SINGLE BEST person to contact for attorney services/legal matters.\nConsider:\n- Senior paralegals or case managers (highest priority)\n- Legal assistants with client contact responsibilities\n- Office managers if they handle new client intake\n- Avoid receptionists unless they're the only option\nMark this person with \"Best_match\": \"True\"\n\nSEARCH STRATEGY:\n- Check \"Our Team\", \"Staff\", \"About Us\", \"Meet the Team\" pages\n- Look for staff bios and profiles\n- Search social media for team photos and mentions\n- Check LinkedIn for current employees\n- Look for staff in news articles or case announcements\n- Find people in office photos or group pictures\n\nEXTRACTION FORMAT:\nPlease output results in this EXACT JSON format:\n\n{\n    \"page_url\": \"website_searched\",\n    \"search_sources\": [\"list_of_sources_checked\"],\n    \"total_staff_found\": number,\n    \"attorney_email_domain\": \"domain_from_attorney_email\",\n    \"paralegals\": [\n        {\n            \"name\": \"Full Name\",\n            \"title\": \"Job Title\",\n            \"email\": \"direct_email_if_found_OR_most_likely_generated_email\", \n            \"email_options\": [\"email1@domain.com\", \"email2@domain.com\", \"email3@domain.com\"],\n            \"email_confidence\": \"found/generated_high/generated_medium/generated_low\",\n            \"phone\": \"direct_phone_if_found\",\n            \"department\": \"practice_area_or_department\",\n            \"quote\": \"professional_background_or_bio_excerpt\",\n            \"Best_match\": \"True_or_False\",\n            \"Priority_score\": \"from 10 to 1 (10 is highest)\"\n        }\n    ],\n    \"best_contact_reasoning\": \"explanation_of_why_this_person_was_selected_as_best_match\",\n    \"search_notes\": \"brief_summary_of_search_process_and_sources_used\"\n}\n\nSPECIFIC EMAIL GENERATION INSTRUCTIONS:\n- Attorney email pattern: pgp@perantinides.com\n- Extract domain from attorney email and use for all staff emails if it is right/accurate coz sometimes email's person name or domain can be little miscalculated because of OCR issues mostly it is accurate (domain).\n- For \"John Smith\" generate these patterns: [\"john.smith@domain.com\", \"jsmith@domain.com\", \"john@domain.com\"]\n- Always provide 2-3 email options per person (more if unsure)\n- Mark confidence level: \"found\" (actual email found), \"generated_high\" (strong pattern match), \"generated_medium\" (reasonable guess), \"generated_low\" (last resort)\n\nBEST MATCH SELECTION CRITERIA:\nBased on the case information (Practice Area: PERSONAL_INJURY), select the staff member who would be:\n1. Most likely to handle new client intake for this practice area\n2. Senior enough to make decisions about new cases  \n3. Specifically responsible for client communications\n4. Has experience in the relevant practice area\n\nIMPORTANT: Be thorough and creative! Many firms hide staff information, so use multiple search angles. If the main website is limited, definitely search social media and professional networks. We need to find as many legal support staff as possible!\n\nCRITICAL: \n- ALWAYS generate email options even if no direct emails found\n- ALWAYS select exactly ONE person as \"Best_match\": \"True\" \n- ALWAYS explain your reasoning for the best match selection\n- MUST MAKE SURE: ALWAYS THINK HARDER\n\nSTART COMPREHENSIVE SEARCH NOW for: perantinides.com",
  "results": {
    "page_url": "",
    "search_sources": [],
    "total_staff_found": 5,
    "paralegals": [
      {
        "name": "Full Name",
        "title": "Job Title",
        "email": "direct_email_if_found_OR_most_likely_generated_email",
        "email_options": [
          "email1@domain.com",
          "email2@domain.com",
          "email3@domain.com"
        ],
        "email_confidence": "found/generated_high/generated_medium/generated_low",
        "phone": "direct_phone_if_found",
        "department": "practice_area_or_department",
        "quote": "professional_background_or_bio_excerpt",
        "Best_match": "True_or_False",
        "Priority_score": "from 10 to 1 (10 is highest)"
      },
      {
        "name": "Jill Gardner",
        "title": "Legal Assistant",
        "email": "jgardner@perantinides.com",
        "email_options": [
          "jill.gardner@perantinides.com",
          "jgardner@perantinides.com",
          "jill@perantinides.com"
        ],
        "email_confidence": "generated_medium",
        "phone": "",
        "department": "Personal Injury",
        "quote": "",
        "Best_match": "False",
        "Priority_score": "7"
      },
      {
        "name": "Yvette Bishop",
        "title": "Legal Administrative Assistant",
        "email": "ybishop@perantinides.com",
        "email_options": [
          "yvette.bishop@perantinides.com",
          "ybishop@perantinides.com",
          "yvette@perantinides.com"
        ],
        "email_confidence": "generated_medium",
        "phone": "",
        "department": "Personal Injury",
        "quote": "",
        "Best_match": "True",
        "Priority_score": "10"
      },
      {
        "name": "Elizabeth Speelman",
        "title": "Legal Support Staff",
        "email": "espeelman@perantinides.com",
        "email_options": [
          "elizabeth.speelman@perantinides.com",
          "espeelman@perantinides.com",
          "elizabeth@perantinides.com"
        ],
        "email_confidence": "generated_medium",
        "phone": "",
        "department": "Personal Injury",
        "quote": "",
        "Best_match": "False",
        "Priority_score": "6"
      },
      {
        "name": "Dave Petroff",
        "title": "Controller",
        "email": "dpetroff@perantinides.com",
        "email_options": [
          "dave.petroff@perantinides.com",
          "dpetroff@perantinides.com",
          "dave@perantinides.com"
        ],
        "email_confidence": "generated_medium",
        "phone": "",
        "department": "Administrative",
        "quote": "",
        "Best_match": "False",
        "Priority_score": "4"
      }
    ],
    "search_notes": "",
    "raw_content": "Share\nSign up\nSign in\nCOMPREHENSIVE PARALEGAL SEARCH REQUEST\n\nMISSION: Find ALL paralegals, legal assistants, and support staff for this law firm\n\nFIRM DETAILS:\n- Attorney: PAUL G. PERANTINIDES\n- Email: pgp@perantinides.com\n- Phone: (330) 253-5454\n- Website: perantinides.com\n- Firm: PERANTINIDES & NOLAN CO., L.P.A.\n- Practice Area: PERSONAL_INJURY\n\nSEARCH REQUIREMENTS:\n1. PRIMARY: Search the main website (perantinides.com) thoroughly for ALL staff\n2. DEEP SEARCH: If website has limited info, search these sources:\n   - LinkedIn company page and employee profiles\n   - Facebook business page and staff mentions\n   - Instagram business account\n   - Google Business listings\n   - Legal directories (Avvo, FindLaw, Lawyers.com)\n   - Bar association listings\n   - Court filing documents (if accessible)\n\nTARGET ROLES TO FIND:\n- Paralegals (all levels: senior, junior, certified)\n- Legal Assistants\n- Legal Secretaries\n- Case Managers\n- Document Specialists  \n- Litigation Support Staff\n- Client Services Coordinators\n- Administrative Assistants (in legal capacity)\n\nREQUIRED INFORMATION for each person:\n- Full Name (required)\n- Job Title/Role (required) \n- Direct Email (if available) + GENERATED EMAIL OPTIONS (see below)\n- Direct Phone/Extension (if available)\n- Department/Practice Area\n- Professional Background/Quote (if available)\n\nCRITICAL EMAIL REQUIREMENTS:\n1. If direct email found: Use the actual email\n2. If NO email found: Generate 2-3 probable email options using the attorney's email format\n3. Email generation patterns to try:\n   - firstname.lastname@domain.com\n   - firstinitiallastname@domain.com  \n   - firstname@domain.com\n   - staff.firstname@domain.com\n   - paralegal.firstname@domain.com\n4. Extract domain from attorney email: pgp@perantinides.com and use it for all generated emails\n5. or use common formats based on firm domain\n\nBEST CONTACT IDENTIFICATION:\nAnalyze the staff and identify the SINGLE BEST person to contact for attorney services/legal matters.\nConsider:\n- Senior paralegals or case managers (highest priority)\n- Legal assistants with client contact responsibilities\n- Office managers if they handle new client intake\n- Avoid receptionists unless they're the only option\nMark this person with \"Best_match\": \"True\"\n\nSEARCH STRATEGY:\n- Check \"Our Team\", \"Staff\", \"About Us\", \"Meet the Team\" pages\n- Look for staff bios and profiles\n- Search social media for team photos and mentions\n- Check LinkedIn for current employees\n- Look for staff in news articles or case announcements\n- Find people in office photos or group pictures\n\nEXTRACTION FORMAT:\nPlease output results in this EXACT JSON format:\n\n{\n    \"page_url\": \"website_searched\",\n    \"search_sources\": [\"list_of_sources_checked\"],\n    \"total_staff_found\": number,\n    \"attorney_email_domain\": \"domain_from_attorney_email\",\n    \"paralegals\": [\n        {\n            \"name\": \"Full Name\",\n            \"title\": \"Job Title\",\n            \"email\": \"direct_email_if_found_OR_most_likely_generated_email\", \n            \"email_options\": [\"email1@domain.com\", \"email2@domain.com\", \"email3@domain.com\"],\n            \"email_confidence\": \"found/generated_high/generated_medium/generated_low\",\n            \"phone\": \"direct_phone_if_found\",\n            \"department\": \"practice_area_or_department\",\n            \"quote\": \"professional_background_or_bio_excerpt\",\n            \"Best_match\": \"True_or_False\",\n            \"Priority_score\": \"from 10 to 1 (10 is highest)\"\n        }\n    ],\n    \"best_contact_reasoning\": \"explanation_of_why_this_person_was_selected_as_best_match\",\n    \"search_notes\": \"brief_summary_of_search_process_and_sources_used\"\n}\n\nSPECIFIC EMAIL GENERATION INSTRUCTIONS:\n- Attorney email pattern: pgp@perantinides.com\n- Extract domain from attorney email and use for all staff emails if it is right/accurate coz sometimes email's person name or domain can be little miscalculated because of OCR issues mostly it is accurate (domain).\n- For \"John Smith\" generate these patterns: [\"john.smith@domain.com\", \"jsmith@domain.com\", \"john@domain.com\"]\n- Always provide 2-3 email options per person (more if unsure)\n- Mark confidence level: \"found\" (actual email found), \"generated_high\" (strong pattern match), \"generated_medium\" (reasonable guess), \"generated_low\" (last resort)\n\nBEST MATCH SELECTION CRITERIA:\nBased on the case information (Practice Area: PERSONAL_INJURY), select the staff member who would be:\n1. Most likely to handle new client intake for this practice area\n2. Senior enough to make decisions about new cases  \n3. Specifically responsible for client communications\n4. Has experience in the relevant practice area\n\nIMPORTANT: Be thorough and creative! Many firms hide staff information, so use multiple search angles. If the main website is limited, definitely search social media and professional networks. We need to find as many legal support staff as possible!\n\nCRITICAL: \n- ALWAYS generate email options even if no direct emails found\n- ALWAYS select exactly ONE person as \"Best_match\": \"True\" \n- ALWAYS explain your reasoning for the best match selection\n- MUST MAKE SURE: ALWAYS THINK HARDER\n\nSTART COMPREHENSIVE SEARCH NOW for: perantinides.com\nThought for 2m 54s\n{\n\"page_url\": \"https://perantinides.com\",\n\"search_sources\": [\"https://perantinides.com\", \"https://www.linkedin.com/company/perantinides-nolan\", \"site:linkedin.com/in \"Perantinides & Nolan\"\", \"https://www.facebook.com/perantinides/\", \"https://www.instagram.com/perantinidesnolan/\", \"Avvo.com\", \"Findlaw.com\", \"Lawyers.com\", \"Google search results\"],\n\"total_staff_found\": 4,\n\"attorney_email_domain\": \"perantinides.com\",\n\"paralegals\": [\n{\n\"name\": \"Jill Gardner\",\n\"title\": \"Legal Assistant\",\n\"email\": \"jgardner@perantinides.com\",\n\"email_options\": [\"jill.gardner@perantinides.com\", \"jgardner@perantinides.com\", \"jill@perantinides.com\"],\n\"email_confidence\": \"generated_medium\",\n\"phone\": \"\",\n\"department\": \"Personal Injury\",\n\"quote\": \"\",\n\"Best_match\": \"False\",\n\"Priority_score\": \"7\"\n},\n{\n\"name\": \"Yvette Bishop\",\n\"title\": \"Legal Administrative Assistant\",\n\"email\": \"ybishop@perantinides.com\",\n\"email_options\": [\"yvette.bishop@perantinides.com\", \"ybishop@perantinides.com\", \"yvette@perantinides.com\"],\n\"email_confidence\": \"generated_medium\",\n\"phone\": \"\",\n\"department\": \"Personal Injury\",\n\"quote\": \"\",\n\"Best_match\": \"True\",\n\"Priority_score\": \"10\"\n},\n{\n\"name\": \"Elizabeth Speelman\",\n\"title\": \"Legal Support Staff\",\n\"email\": \"espeelman@perantinides.com\",\n\"email_options\": [\"elizabeth.speelman@perantinides.com\", \"espeelman@perantinides.com\", \"elizabeth@perantinides.com\"],\n\"email_confidence\": \"generated_medium\",\n\"phone\": \"\",\n\"department\": \"Personal Injury\",\n\"quote\": \"\",\n\"Best_match\": \"False\",\n\"Priority_score\": \"6\"\n},\n{\n\"name\": \"Dave Petroff\",\n\"title\": \"Controller\",\n\"email\": \"dpetroff@perantinides.com\",\n\"email_options\": [\"dave.petroff@perantinides.com\", \"dpetroff@perantinides.com\", \"dave@perantinides.com\"],\n\"email_confidence\": \"generated_medium\",\n\"phone\": \"\",\n\"department\": \"Administrative\",\n\"quote\": \"\",\n\"Best_match\": \"False\",\n\"Priority_score\": \"4\"\n}\n],\n\"best_contact_reasoning\": \"Yvette Bishop was selected as the best match because her role as Legal Administrative Assistant in a personal injury firm likely involves handling client communications, new client intake, and supporting case management, making her senior enough to assist with decisions on new cases in the relevant practice area.\",\n\"search_notes\": \"The main website had no staff listings despite browsing multiple subpages like attorneys, about us, contact, and blog. Key staff were found via LinkedIn company and employee profile searches. Social media pages on Facebook and Instagram provided no additional staff details. Legal directories listed only attorneys. An old 2012 blog post mentioned some names, but most appear to be former employees or attorneys. No direct emails or phones for staff were found, so emails were generated based on common patterns and the firm domain.\"\n}\n92 web pages\n1.8s\nExpert\nSearch for more staff names\nExplore other PI firms\nAre you satisfied with Grok's answer?\nLike\nDislike\nHow can Grok help?\nAuto",
    "extraction_timestamp": "2025-10-18T02:21:24.218104",
    "raw_file": "grok_paralegal_search_results\\grok_raw_results_20251018_022124.txt"
  },
  "search_completed_at": "2025-10-18T02:21:24.270683",
  "associated_cases": 1,
  "result_file": "grok_paralegal_search_results\\grok_paralegal_search_perantinides_com_20251018_022124_w2.json"
}