{
  "domain": "kleincarneylaw.com",
  "search_url": "kleincarneylaw.com",
  "attorney_info": {
    "original_website": "kleincarneylaw.com",
    "attorney_name": "Christopher J. Carney",
    "attorney_email": "chris@kleincarneylaw.com",
    "phone": "216.861-0111",
    "firm_name": "KLEIN & CARNEY, CO., LLC",
    "practice_area": "PERSONAL_INJURY",
    "case_id": "",
    "row_data": {
      "Case Number": "",
      "Filing Date": "",
      "Case Type": "PERSONAL_INJURY",
      "Court": "COURT OF COMMON PLEAS CUYAHOGA COUNTY, OHIO",
      "County": "CUYAHOGA",
      "Plaintiff": "LARISA MCMULLEN",
      "Primary Defendant": "HONG QIU",
      "Attorney Name": "Christopher J. Carney",
      "Attorney Office": "KLEIN & CARNEY, CO., LLC",
      "Attorney Email": "chris@kleincarneylaw.com",
      "Attorney Phone": "216.861-0111",
      "Attorney Website": "kleincarneylaw.com",
      "Relief Requested": "$25,000.00",
      "Processed At": "2025-10-18T01:04:30.800666",
      "Folder Name": "case_3646139",
      "Paralegal Name": "",
      "Paralegal Email": "",
      "Email-2": "",
      "Email-3": "",
      "Email-4": "",
      "Email-5": "",
      "Paralegal Number": "",
      "Department": "",
      "Paralegal Website Page Link": "",
      "Email Sent?": "",
      "Email Replied?": "",
      "Paralegal email": "",
      "Phone call?": ""
    }
  },
  "search_message": "COMPREHENSIVE PARALEGAL SEARCH REQUEST\n\nMISSION: Find ALL paralegals, legal assistants, and support staff for this law firm\n\nFIRM DETAILS:\n- Attorney: Christopher J. Carney\n- Email: chris@kleincarneylaw.com\n- Phone: 216.861-0111\n- Website: kleincarneylaw.com\n- Firm: KLEIN & CARNEY, CO., LLC\n- Practice Area: PERSONAL_INJURY\n\nSEARCH REQUIREMENTS:\n1. PRIMARY: Search the main website (kleincarneylaw.com) thoroughly for ALL staff\n2. DEEP SEARCH: If website has limited info, search these sources:\n   - LinkedIn company page and employee profiles\n   - Facebook business page and staff mentions\n   - Instagram business account\n   - Google Business listings\n   - Legal directories (Avvo, FindLaw, Lawyers.com)\n   - Bar association listings\n   - Court filing documents (if accessible)\n\nTARGET ROLES TO FIND:\n- Paralegals (all levels: senior, junior, certified)\n- Legal Assistants\n- Legal Secretaries\n- Case Managers\n- Document Specialists  \n- Litigation Support Staff\n- Client Services Coordinators\n- Administrative Assistants (in legal capacity)\n\nREQUIRED INFORMATION for each person:\n- Full Name (required)\n- Job Title/Role (required) \n- Direct Email (if available) + GENERATED EMAIL OPTIONS (see below)\n- Direct Phone/Extension (if available)\n- Department/Practice Area\n- Professional Background/Quote (if available)\n\nCRITICAL EMAIL REQUIREMENTS:\n1. If direct email found: Use the actual email\n2. If NO email found: Generate 2-3 probable email options using the attorney's email format\n3. Email generation patterns to try:\n   - firstname.lastname@domain.com\n   - firstinitiallastname@domain.com  \n   - firstname@domain.com\n   - staff.firstname@domain.com\n   - paralegal.firstname@domain.com\n4. Extract domain from attorney email: chris@kleincarneylaw.com and use it for all generated emails\n5. or use common formats based on firm domain\n\nBEST CONTACT IDENTIFICATION:\nAnalyze the staff and identify the SINGLE BEST person to contact for attorney services/legal matters.\nConsider:\n- Senior paralegals or case managers (highest priority)\n- Legal assistants with client contact responsibilities\n- Office managers if they handle new client intake\n- Avoid receptionists unless they're the only option\nMark this person with \"Best_match\": \"True\"\n\nSEARCH STRATEGY:\n- Check \"Our Team\", \"Staff\", \"About Us\", \"Meet the Team\" pages\n- Look for staff bios and profiles\n- Search social media for team photos and mentions\n- Check LinkedIn for current employees\n- Look for staff in news articles or case announcements\n- Find people in office photos or group pictures\n\nEXTRACTION FORMAT:\nPlease output results in this EXACT JSON format:\n\n{\n    \"page_url\": \"website_searched\",\n    \"search_sources\": [\"list_of_sources_checked\"],\n    \"total_staff_found\": number,\n    \"attorney_email_domain\": \"domain_from_attorney_email\",\n    \"paralegals\": [\n        {\n            \"name\": \"Full Name\",\n            \"title\": \"Job Title\",\n            \"email\": \"direct_email_if_found_OR_most_likely_generated_email\", \n            \"email_options\": [\"email1@domain.com\", \"email2@domain.com\", \"email3@domain.com\"],\n            \"email_confidence\": \"found/generated_high/generated_medium/generated_low\",\n            \"phone\": \"direct_phone_if_found\",\n            \"department\": \"practice_area_or_department\",\n            \"quote\": \"professional_background_or_bio_excerpt\",\n            \"Best_match\": \"True_or_False\",\n            \"Priority_score\": \"from 10 to 1 (10 is highest)\"\n        }\n    ],\n    \"best_contact_reasoning\": \"explanation_of_why_this_person_was_selected_as_best_match\",\n    \"search_notes\": \"brief_summary_of_search_process_and_sources_used\"\n}\n\nSPECIFIC EMAIL GENERATION INSTRUCTIONS:\n- Attorney email pattern: chris@kleincarneylaw.com\n- Extract domain from attorney email and use for all staff emails if it is right/accurate coz sometimes email's person name or domain can be little miscalculated because of OCR issues mostly it is accurate (domain).\n- For \"John Smith\" generate these patterns: [\"john.smith@domain.com\", \"jsmith@domain.com\", \"john@domain.com\"]\n- Always provide 2-3 email options per person (more if unsure)\n- Mark confidence level: \"found\" (actual email found), \"generated_high\" (strong pattern match), \"generated_medium\" (reasonable guess), \"generated_low\" (last resort)\n\nBEST MATCH SELECTION CRITERIA:\nBased on the case information (Practice Area: PERSONAL_INJURY), select the staff member who would be:\n1. Most likely to handle new client intake for this practice area\n2. Senior enough to make decisions about new cases  \n3. Specifically responsible for client communications\n4. Has experience in the relevant practice area\n\nIMPORTANT: Be thorough and creative! Many firms hide staff information, so use multiple search angles. If the main website is limited, definitely search social media and professional networks. We need to find as many legal support staff as possible!\n\nCRITICAL: \n- ALWAYS generate email options even if no direct emails found\n- ALWAYS select exactly ONE person as \"Best_match\": \"True\" \n- ALWAYS explain your reasoning for the best match selection\n- MUST MAKE SURE: ALWAYS THINK HARDER\n\nSTART COMPREHENSIVE SEARCH NOW for: kleincarneylaw.com",
  "results": {
    "page_url": "",
    "search_sources": [],
    "total_staff_found": 4,
    "paralegals": [
      {
        "name": "Full Name",
        "title": "Job Title",
        "email": "direct_email_if_found_OR_most_likely_generated_email",
        "email_options": [
          "email1@domain.com",
          "email2@domain.com",
          "email3@domain.com"
        ],
        "email_confidence": "found/generated_high/generated_medium/generated_low",
        "phone": "direct_phone_if_found",
        "department": "practice_area_or_department",
        "quote": "professional_background_or_bio_excerpt",
        "Best_match": "True_or_False",
        "Priority_score": "from 10 to 1 (10 is highest)"
      },
      {
        "name": "Amanda Latta",
        "title": "Paralegal",
        "email": "amanda@kleincarneylaw.com",
        "email_options": [
          "amanda@kleincarneylaw.com",
          "amanda.latta@kleincarneylaw.com",
          "alatta@kleincarneylaw.com"
        ],
        "email_confidence": "generated_medium",
        "phone": "",
        "department": "Personal Injury",
        "quote": "Amanda is a dedicated paralegal with a passion for law and a background in biological sciences. Graduating from The Ohio State University in 2022 with a Bachelor’s degree, Amanda’s academic journey laid a strong foundation in the sciences. During her time in college, Amanda’s enthusiasm for learning extended beyond her own studies as she served as a Teaching Assistant, specializing in anatomy.",
        "Best_match": "False",
        "Priority_score": "8"
      },
      {
        "name": "Janki Patel",
        "title": "Paralegal/Office Manager",
        "email": "janki@kleincarneylaw.com",
        "email_options": [
          "janki@kleincarneylaw.com",
          "janki.patel@kleincarneylaw.com",
          "jpatel@kleincarneylaw.com"
        ],
        "email_confidence": "generated_medium",
        "phone": "",
        "department": "Personal Injury",
        "quote": "Janki Patel is a passionate paralegal dedicated to supporting Klein & Carney, Co., LLC in their pursuit of justice. As a first-generation child of immigrants, she has deep roots in Cleveland, where she developed a strong sense of community and responsibility. With a Bachelor’s degree in Political Science Criminal Justice and a Minor in Forensic Studies from The University of Akron, Janki possesses a solid foundation in legal principles and procedures.",
        "Best_match": "True",
        "Priority_score": "10"
      },
      {
        "name": "Yuliana Hernandez",
        "title": "Legal Secretary",
        "email": "yuliana@kleincarneylaw.com",
        "email_options": [
          "yuliana@kleincarneylaw.com",
          "yuliana.hernandez@kleincarneylaw.com",
          "yhernandez@kleincarneylaw.com"
        ],
        "email_confidence": "generated_medium",
        "phone": "",
        "department": "Personal Injury",
        "quote": "",
        "Best_match": "False",
        "Priority_score": "5"
      }
    ],
    "search_notes": "",
    "raw_content": "Share\nSign up\nSign in\nCOMPREHENSIVE PARALEGAL SEARCH REQUEST\n\nMISSION: Find ALL paralegals, legal assistants, and support staff for this law firm\n\nFIRM DETAILS:\n- Attorney: Christopher J. Carney\n- Email: chris@kleincarneylaw.com\n- Phone: 216.861-0111\n- Website: kleincarneylaw.com\n- Firm: KLEIN & CARNEY, CO., LLC\n- Practice Area: PERSONAL_INJURY\n\nSEARCH REQUIREMENTS:\n1. PRIMARY: Search the main website (kleincarneylaw.com) thoroughly for ALL staff\n2. DEEP SEARCH: If website has limited info, search these sources:\n   - LinkedIn company page and employee profiles\n   - Facebook business page and staff mentions\n   - Instagram business account\n   - Google Business listings\n   - Legal directories (Avvo, FindLaw, Lawyers.com)\n   - Bar association listings\n   - Court filing documents (if accessible)\n\nTARGET ROLES TO FIND:\n- Paralegals (all levels: senior, junior, certified)\n- Legal Assistants\n- Legal Secretaries\n- Case Managers\n- Document Specialists  \n- Litigation Support Staff\n- Client Services Coordinators\n- Administrative Assistants (in legal capacity)\n\nREQUIRED INFORMATION for each person:\n- Full Name (required)\n- Job Title/Role (required) \n- Direct Email (if available) + GENERATED EMAIL OPTIONS (see below)\n- Direct Phone/Extension (if available)\n- Department/Practice Area\n- Professional Background/Quote (if available)\n\nCRITICAL EMAIL REQUIREMENTS:\n1. If direct email found: Use the actual email\n2. If NO email found: Generate 2-3 probable email options using the attorney's email format\n3. Email generation patterns to try:\n   - firstname.lastname@domain.com\n   - firstinitiallastname@domain.com  \n   - firstname@domain.com\n   - staff.firstname@domain.com\n   - paralegal.firstname@domain.com\n4. Extract domain from attorney email: chris@kleincarneylaw.com and use it for all generated emails\n5. or use common formats based on firm domain\n\nBEST CONTACT IDENTIFICATION:\nAnalyze the staff and identify the SINGLE BEST person to contact for attorney services/legal matters.\nConsider:\n- Senior paralegals or case managers (highest priority)\n- Legal assistants with client contact responsibilities\n- Office managers if they handle new client intake\n- Avoid receptionists unless they're the only option\nMark this person with \"Best_match\": \"True\"\n\nSEARCH STRATEGY:\n- Check \"Our Team\", \"Staff\", \"About Us\", \"Meet the Team\" pages\n- Look for staff bios and profiles\n- Search social media for team photos and mentions\n- Check LinkedIn for current employees\n- Look for staff in news articles or case announcements\n- Find people in office photos or group pictures\n\nEXTRACTION FORMAT:\nPlease output results in this EXACT JSON format:\n\n{\n    \"page_url\": \"website_searched\",\n    \"search_sources\": [\"list_of_sources_checked\"],\n    \"total_staff_found\": number,\n    \"attorney_email_domain\": \"domain_from_attorney_email\",\n    \"paralegals\": [\n        {\n            \"name\": \"Full Name\",\n            \"title\": \"Job Title\",\n            \"email\": \"direct_email_if_found_OR_most_likely_generated_email\", \n            \"email_options\": [\"email1@domain.com\", \"email2@domain.com\", \"email3@domain.com\"],\n            \"email_confidence\": \"found/generated_high/generated_medium/generated_low\",\n            \"phone\": \"direct_phone_if_found\",\n            \"department\": \"practice_area_or_department\",\n            \"quote\": \"professional_background_or_bio_excerpt\",\n            \"Best_match\": \"True_or_False\",\n            \"Priority_score\": \"from 10 to 1 (10 is highest)\"\n        }\n    ],\n    \"best_contact_reasoning\": \"explanation_of_why_this_person_was_selected_as_best_match\",\n    \"search_notes\": \"brief_summary_of_search_process_and_sources_used\"\n}\n\nSPECIFIC EMAIL GENERATION INSTRUCTIONS:\n- Attorney email pattern: chris@kleincarneylaw.com\n- Extract domain from attorney email and use for all staff emails if it is right/accurate coz sometimes email's person name or domain can be little miscalculated because of OCR issues mostly it is accurate (domain).\n- For \"John Smith\" generate these patterns: [\"john.smith@domain.com\", \"jsmith@domain.com\", \"john@domain.com\"]\n- Always provide 2-3 email options per person (more if unsure)\n- Mark confidence level: \"found\" (actual email found), \"generated_high\" (strong pattern match), \"generated_medium\" (reasonable guess), \"generated_low\" (last resort)\n\nBEST MATCH SELECTION CRITERIA:\nBased on the case information (Practice Area: PERSONAL_INJURY), select the staff member who would be:\n1. Most likely to handle new client intake for this practice area\n2. Senior enough to make decisions about new cases  \n3. Specifically responsible for client communications\n4. Has experience in the relevant practice area\n\nIMPORTANT: Be thorough and creative! Many firms hide staff information, so use multiple search angles. If the main website is limited, definitely search social media and professional networks. We need to find as many legal support staff as possible!\n\nCRITICAL: \n- ALWAYS generate email options even if no direct emails found\n- ALWAYS select exactly ONE person as \"Best_match\": \"True\" \n- ALWAYS explain your reasoning for the best match selection\n- MUST MAKE SURE: ALWAYS THINK HARDER\n\nSTART COMPREHENSIVE SEARCH NOW for: kleincarneylaw.com\nThought for 2m 36s\n{\n\"page_url\": \"https://www.kleinandcarney.com/about/\",\n\"search_sources\": [\"https://www.kleinandcarney.com/\", \"https://www.kleinandcarney.com/about/\", \"https://www.kleinandcarney.com/amanda-latta-paralegal/\", \"https://www.kleinandcarney.com/janki-patel-paralegal/\", \"ZoomInfo.com\", \"FindLaw.com\", \"LinkedIn.com\", \"Avvo.com\", \"Facebook.com/KleinandCarney/\", \"Web searches on Google\"],\n\"total_staff_found\": 3,\n\"attorney_email_domain\": \"kleincarneylaw.com\",\n\"paralegals\": [\n{\n\"name\": \"Amanda Latta\",\n\"title\": \"Paralegal\",\n\"email\": \"amanda@kleincarneylaw.com\",\n\"email_options\": [\"amanda@kleincarneylaw.com\", \"amanda.latta@kleincarneylaw.com\", \"alatta@kleincarneylaw.com\"],\n\"email_confidence\": \"generated_medium\",\n\"phone\": \"\",\n\"department\": \"Personal Injury\",\n\"quote\": \"Amanda is a dedicated paralegal with a passion for law and a background in biological sciences. Graduating from The Ohio State University in 2022 with a Bachelor’s degree, Amanda’s academic journey laid a strong foundation in the sciences. During her time in college, Amanda’s enthusiasm for learning extended beyond her own studies as she served as a Teaching Assistant, specializing in anatomy.\",\n\"Best_match\": \"False\",\n\"Priority_score\": \"8\"\n},\n{\n\"name\": \"Janki Patel\",\n\"title\": \"Paralegal/Office Manager\",\n\"email\": \"janki@kleincarneylaw.com\",\n\"email_options\": [\"janki@kleincarneylaw.com\", \"janki.patel@kleincarneylaw.com\", \"jpatel@kleincarneylaw.com\"],\n\"email_confidence\": \"generated_medium\",\n\"phone\": \"\",\n\"department\": \"Personal Injury\",\n\"quote\": \"Janki Patel is a passionate paralegal dedicated to supporting Klein & Carney, Co., LLC in their pursuit of justice. As a first-generation child of immigrants, she has deep roots in Cleveland, where she developed a strong sense of community and responsibility. With a Bachelor’s degree in Political Science Criminal Justice and a Minor in Forensic Studies from The University of Akron, Janki possesses a solid foundation in legal principles and procedures.\",\n\"Best_match\": \"True\",\n\"Priority_score\": \"10\"\n},\n{\n\"name\": \"Yuliana Hernandez\",\n\"title\": \"Legal Secretary\",\n\"email\": \"yuliana@kleincarneylaw.com\",\n\"email_options\": [\"yuliana@kleincarneylaw.com\", \"yuliana.hernandez@kleincarneylaw.com\", \"yhernandez@kleincarneylaw.com\"],\n\"email_confidence\": \"generated_medium\",\n\"phone\": \"\",\n\"department\": \"Personal Injury\",\n\"quote\": \"\",\n\"Best_match\": \"False\",\n\"Priority_score\": \"5\"\n}\n],\n\"best_contact_reasoning\": \"Janki Patel is the Paralegal/Office Manager, which suggests she has administrative responsibilities likely including client intake and coordination in a small firm specializing in personal injury. This makes her the most suitable for handling new client matters and communications related to potential cases.\",\n\"search_notes\": \"Initial website URL provided was incorrect; discovered correct site as kleinandcarney.com via web searches. Staff details found on About page and individual profiles. Additional staff identified via ZoomInfo. No social media yielded extra staff info. Legal directories confirmed the same staff.\"\n}\n19 𝕏 posts\n87 web pages\nExpert\nPersonal Injury Case Intake Process\nOhio Paralegal Certification Requirements\nMake JSON More Concise\nHow can Grok help?\nAuto",
    "extraction_timestamp": "2025-10-18T02:12:57.431948",
    "raw_file": "grok_paralegal_search_results\\grok_raw_results_20251018_021257.txt"
  },
  "search_completed_at": "2025-10-18T02:12:57.445923",
  "associated_cases": 1,
  "result_file": "grok_paralegal_search_results\\grok_paralegal_search_kleincarneylaw_com_20251018_021257_w2.json"
}