{
  "domain": "buckeyelawgroup.com",
  "search_url": "buckeyelawgroup.com",
  "attorney_info": {
    "original_website": "buckeyelawgroup.com",
    "attorney_name": "Gregory E. Gudin",
    "attorney_email": "Eservice@buckeyelawgroup.com",
    "phone": "(330) 639-0269",
    "firm_name": "The Buckeye Law Group, Inc.",
    "practice_area": "PERSONAL_INJURY",
    "case_id": "",
    "row_data": {
      "Case Number": "",
      "Filing Date": "",
      "Case Type": "PERSONAL_INJURY",
      "Court": "COURT OF COMMON PLEAS, CUYAHOGA COUNTY, OHIO",
      "County": "CUYAHOGA",
      "Plaintiff": "RICARDO SIMMONDS",
      "Primary Defendant": "THOMAS SUSANEK",
      "Attorney Name": "Gregory E. Gudin",
      "Attorney Office": "The Buckeye Law Group, Inc.",
      "Attorney Email": "Eservice@buckeyelawgroup.com",
      "Attorney Phone": "(330) 639-0269",
      "Attorney Website": "buckeyelawgroup.com",
      "Relief Requested": "$25,000.00",
      "Processed At": "2025-10-18T01:04:30.837568",
      "Folder Name": "case_3646112",
      "Paralegal Name": "",
      "Paralegal Email": "",
      "Email-2": "",
      "Email-3": "",
      "Email-4": "",
      "Email-5": "",
      "Paralegal Number": "",
      "Department": "",
      "Paralegal Website Page Link": "",
      "Email Sent?": "",
      "Email Replied?": "",
      "Paralegal email": "",
      "Phone call?": ""
    }
  },
  "search_message": "COMPREHENSIVE PARALEGAL SEARCH REQUEST\n\nMISSION: Find ALL paralegals, legal assistants, and support staff for this law firm\n\nFIRM DETAILS:\n- Attorney: Gregory E. Gudin\n- Email: Eservice@buckeyelawgroup.com\n- Phone: (330) 639-0269\n- Website: buckeyelawgroup.com\n- Firm: The Buckeye Law Group, Inc.\n- Practice Area: PERSONAL_INJURY\n\nSEARCH REQUIREMENTS:\n1. PRIMARY: Search the main website (buckeyelawgroup.com) thoroughly for ALL staff\n2. DEEP SEARCH: If website has limited info, search these sources:\n   - LinkedIn company page and employee profiles\n   - Facebook business page and staff mentions\n   - Instagram business account\n   - Google Business listings\n   - Legal directories (Avvo, FindLaw, Lawyers.com)\n   - Bar association listings\n   - Court filing documents (if accessible)\n\nTARGET ROLES TO FIND:\n- Paralegals (all levels: senior, junior, certified)\n- Legal Assistants\n- Legal Secretaries\n- Case Managers\n- Document Specialists  \n- Litigation Support Staff\n- Client Services Coordinators\n- Administrative Assistants (in legal capacity)\n\nREQUIRED INFORMATION for each person:\n- Full Name (required)\n- Job Title/Role (required) \n- Direct Email (if available) + GENERATED EMAIL OPTIONS (see below)\n- Direct Phone/Extension (if available)\n- Department/Practice Area\n- Professional Background/Quote (if available)\n\nCRITICAL EMAIL REQUIREMENTS:\n1. If direct email found: Use the actual email\n2. If NO email found: Generate 2-3 probable email options using the attorney's email format\n3. Email generation patterns to try:\n   - firstname.lastname@domain.com\n   - firstinitiallastname@domain.com  \n   - firstname@domain.com\n   - staff.firstname@domain.com\n   - paralegal.firstname@domain.com\n4. Extract domain from attorney email: Eservice@buckeyelawgroup.com and use it for all generated emails\n5. or use common formats based on firm domain\n\nBEST CONTACT IDENTIFICATION:\nAnalyze the staff and identify the SINGLE BEST person to contact for attorney services/legal matters.\nConsider:\n- Senior paralegals or case managers (highest priority)\n- Legal assistants with client contact responsibilities\n- Office managers if they handle new client intake\n- Avoid receptionists unless they're the only option\nMark this person with \"Best_match\": \"True\"\n\nSEARCH STRATEGY:\n- Check \"Our Team\", \"Staff\", \"About Us\", \"Meet the Team\" pages\n- Look for staff bios and profiles\n- Search social media for team photos and mentions\n- Check LinkedIn for current employees\n- Look for staff in news articles or case announcements\n- Find people in office photos or group pictures\n\nEXTRACTION FORMAT:\nPlease output results in this EXACT JSON format:\n\n{\n    \"page_url\": \"website_searched\",\n    \"search_sources\": [\"list_of_sources_checked\"],\n    \"total_staff_found\": number,\n    \"attorney_email_domain\": \"domain_from_attorney_email\",\n    \"paralegals\": [\n        {\n            \"name\": \"Full Name\",\n            \"title\": \"Job Title\",\n            \"email\": \"direct_email_if_found_OR_most_likely_generated_email\", \n            \"email_options\": [\"email1@domain.com\", \"email2@domain.com\", \"email3@domain.com\"],\n            \"email_confidence\": \"found/generated_high/generated_medium/generated_low\",\n            \"phone\": \"direct_phone_if_found\",\n            \"department\": \"practice_area_or_department\",\n            \"quote\": \"professional_background_or_bio_excerpt\",\n            \"Best_match\": \"True_or_False\",\n            \"Priority_score\": \"from 10 to 1 (10 is highest)\"\n        }\n    ],\n    \"best_contact_reasoning\": \"explanation_of_why_this_person_was_selected_as_best_match\",\n    \"search_notes\": \"brief_summary_of_search_process_and_sources_used\"\n}\n\nSPECIFIC EMAIL GENERATION INSTRUCTIONS:\n- Attorney email pattern: Eservice@buckeyelawgroup.com\n- Extract domain from attorney email and use for all staff emails if it is right/accurate coz sometimes email's person name or domain can be little miscalculated because of OCR issues mostly it is accurate (domain).\n- For \"John Smith\" generate these patterns: [\"john.smith@domain.com\", \"jsmith@domain.com\", \"john@domain.com\"]\n- Always provide 2-3 email options per person (more if unsure)\n- Mark confidence level: \"found\" (actual email found), \"generated_high\" (strong pattern match), \"generated_medium\" (reasonable guess), \"generated_low\" (last resort)\n\nBEST MATCH SELECTION CRITERIA:\nBased on the case information (Practice Area: PERSONAL_INJURY), select the staff member who would be:\n1. Most likely to handle new client intake for this practice area\n2. Senior enough to make decisions about new cases  \n3. Specifically responsible for client communications\n4. Has experience in the relevant practice area\n\nIMPORTANT: Be thorough and creative! Many firms hide staff information, so use multiple search angles. If the main website is limited, definitely search social media and professional networks. We need to find as many legal support staff as possible!\n\nCRITICAL: \n- ALWAYS generate email options even if no direct emails found\n- ALWAYS select exactly ONE person as \"Best_match\": \"True\" \n- ALWAYS explain your reasoning for the best match selection\n- MUST MAKE SURE: ALWAYS THINK HARDER\n\nSTART COMPREHENSIVE SEARCH NOW for: buckeyelawgroup.com",
  "results": {
    "page_url": "",
    "search_sources": [],
    "total_staff_found": 6,
    "paralegals": [
      {
        "name": "Full Name",
        "title": "Job Title",
        "email": "direct_email_if_found_OR_most_likely_generated_email",
        "email_options": [
          "email1@domain.com",
          "email2@domain.com",
          "email3@domain.com"
        ],
        "email_confidence": "found/generated_high/generated_medium/generated_low",
        "phone": "direct_phone_if_found",
        "department": "practice_area_or_department",
        "quote": "professional_background_or_bio_excerpt",
        "Best_match": "True_or_False",
        "Priority_score": "from 10 to 1 (10 is highest)"
      },
      {
        "name": "Tifa Aden",
        "title": "Paralegal",
        "email": "tifa.aden@buckeyelawgroup.com",
        "email_options": [
          "tifa.aden@buckeyelawgroup.com",
          "taden@buckeyelawgroup.com",
          "tifa@buckeyelawgroup.com"
        ],
        "email_confidence": "generated_medium",
        "phone": "",
        "department": "Personal Injury",
        "quote": "Paralegal @ The Buckeye Law Group, Inc. | Client Relations, Account Management",
        "Best_match": "True",
        "Priority_score": "10"
      },
      {
        "name": "Brooke Pristas",
        "title": "Litigation Assistant",
        "email": "brooke.pristas@buckeyelawgroup.com",
        "email_options": [
          "brooke.pristas@buckeyelawgroup.com",
          "bpristas@buckeyelawgroup.com",
          "brooke@buckeyelawgroup.com"
        ],
        "email_confidence": "generated_medium",
        "phone": "",
        "department": "Personal Injury",
        "quote": "I have experience in a Personal Injury firm and specialize in litigation.",
        "Best_match": "False",
        "Priority_score": "8"
      },
      {
        "name": "Tiffany Clacken-Brissett",
        "title": "Legal Assistant",
        "email": "tiffany.clacken-brissett@buckeyelawgroup.com",
        "email_options": [
          "tiffany.clacken-brissett@buckeyelawgroup.com",
          "tclacken-brissett@buckeyelawgroup.com",
          "tiffany@buckeyelawgroup.com"
        ],
        "email_confidence": "generated_medium",
        "phone": "",
        "department": "Personal Injury",
        "quote": "",
        "Best_match": "False",
        "Priority_score": "7"
      },
      {
        "name": "Arielle Reynolds",
        "title": "Paralegal",
        "email": "arielle.reynolds@buckeyelawgroup.com",
        "email_options": [
          "arielle.reynolds@buckeyelawgroup.com",
          "areynolds@buckeyelawgroup.com",
          "arielle@buckeyelawgroup.com"
        ],
        "email_confidence": "generated_medium",
        "phone": "",
        "department": "Personal Injury",
        "quote": "",
        "Best_match": "False",
        "Priority_score": "9"
      },
      {
        "name": "Sue Laske",
        "title": "Paralegal",
        "email": "sue.laske@buckeyelawgroup.com",
        "email_options": [
          "sue.laske@buckeyelawgroup.com",
          "slaske@buckeyelawgroup.com",
          "sue@buckeyelawgroup.com"
        ],
        "email_confidence": "generated_medium",
        "phone": "",
        "department": "Personal Injury",
        "quote": "OSBA Certified Paralegal Notary Public: State of Ohio",
        "Best_match": "False",
        "Priority_score": "9"
      }
    ],
    "search_notes": "",
    "raw_content": "Share\nSign up\nSign in\nCOMPREHENSIVE PARALEGAL SEARCH REQUEST\n\nMISSION: Find ALL paralegals, legal assistants, and support staff for this law firm\n\nFIRM DETAILS:\n- Attorney: Gregory E. Gudin\n- Email: Eservice@buckeyelawgroup.com\n- Phone: (330) 639-0269\n- Website: buckeyelawgroup.com\n- Firm: The Buckeye Law Group, Inc.\n- Practice Area: PERSONAL_INJURY\n\nSEARCH REQUIREMENTS:\n1. PRIMARY: Search the main website (buckeyelawgroup.com) thoroughly for ALL staff\n2. DEEP SEARCH: If website has limited info, search these sources:\n   - LinkedIn company page and employee profiles\n   - Facebook business page and staff mentions\n   - Instagram business account\n   - Google Business listings\n   - Legal directories (Avvo, FindLaw, Lawyers.com)\n   - Bar association listings\n   - Court filing documents (if accessible)\n\nTARGET ROLES TO FIND:\n- Paralegals (all levels: senior, junior, certified)\n- Legal Assistants\n- Legal Secretaries\n- Case Managers\n- Document Specialists  \n- Litigation Support Staff\n- Client Services Coordinators\n- Administrative Assistants (in legal capacity)\n\nREQUIRED INFORMATION for each person:\n- Full Name (required)\n- Job Title/Role (required) \n- Direct Email (if available) + GENERATED EMAIL OPTIONS (see below)\n- Direct Phone/Extension (if available)\n- Department/Practice Area\n- Professional Background/Quote (if available)\n\nCRITICAL EMAIL REQUIREMENTS:\n1. If direct email found: Use the actual email\n2. If NO email found: Generate 2-3 probable email options using the attorney's email format\n3. Email generation patterns to try:\n   - firstname.lastname@domain.com\n   - firstinitiallastname@domain.com  \n   - firstname@domain.com\n   - staff.firstname@domain.com\n   - paralegal.firstname@domain.com\n4. Extract domain from attorney email: Eservice@buckeyelawgroup.com and use it for all generated emails\n5. or use common formats based on firm domain\n\nBEST CONTACT IDENTIFICATION:\nAnalyze the staff and identify the SINGLE BEST person to contact for attorney services/legal matters.\nConsider:\n- Senior paralegals or case managers (highest priority)\n- Legal assistants with client contact responsibilities\n- Office managers if they handle new client intake\n- Avoid receptionists unless they're the only option\nMark this person with \"Best_match\": \"True\"\n\nSEARCH STRATEGY:\n- Check \"Our Team\", \"Staff\", \"About Us\", \"Meet the Team\" pages\n- Look for staff bios and profiles\n- Search social media for team photos and mentions\n- Check LinkedIn for current employees\n- Look for staff in news articles or case announcements\n- Find people in office photos or group pictures\n\nEXTRACTION FORMAT:\nPlease output results in this EXACT JSON format:\n\n{\n    \"page_url\": \"website_searched\",\n    \"search_sources\": [\"list_of_sources_checked\"],\n    \"total_staff_found\": number,\n    \"attorney_email_domain\": \"domain_from_attorney_email\",\n    \"paralegals\": [\n        {\n            \"name\": \"Full Name\",\n            \"title\": \"Job Title\",\n            \"email\": \"direct_email_if_found_OR_most_likely_generated_email\", \n            \"email_options\": [\"email1@domain.com\", \"email2@domain.com\", \"email3@domain.com\"],\n            \"email_confidence\": \"found/generated_high/generated_medium/generated_low\",\n            \"phone\": \"direct_phone_if_found\",\n            \"department\": \"practice_area_or_department\",\n            \"quote\": \"professional_background_or_bio_excerpt\",\n            \"Best_match\": \"True_or_False\",\n            \"Priority_score\": \"from 10 to 1 (10 is highest)\"\n        }\n    ],\n    \"best_contact_reasoning\": \"explanation_of_why_this_person_was_selected_as_best_match\",\n    \"search_notes\": \"brief_summary_of_search_process_and_sources_used\"\n}\n\nSPECIFIC EMAIL GENERATION INSTRUCTIONS:\n- Attorney email pattern: Eservice@buckeyelawgroup.com\n- Extract domain from attorney email and use for all staff emails if it is right/accurate coz sometimes email's person name or domain can be little miscalculated because of OCR issues mostly it is accurate (domain).\n- For \"John Smith\" generate these patterns: [\"john.smith@domain.com\", \"jsmith@domain.com\", \"john@domain.com\"]\n- Always provide 2-3 email options per person (more if unsure)\n- Mark confidence level: \"found\" (actual email found), \"generated_high\" (strong pattern match), \"generated_medium\" (reasonable guess), \"generated_low\" (last resort)\n\nBEST MATCH SELECTION CRITERIA:\nBased on the case information (Practice Area: PERSONAL_INJURY), select the staff member who would be:\n1. Most likely to handle new client intake for this practice area\n2. Senior enough to make decisions about new cases  \n3. Specifically responsible for client communications\n4. Has experience in the relevant practice area\n\nIMPORTANT: Be thorough and creative! Many firms hide staff information, so use multiple search angles. If the main website is limited, definitely search social media and professional networks. We need to find as many legal support staff as possible!\n\nCRITICAL: \n- ALWAYS generate email options even if no direct emails found\n- ALWAYS select exactly ONE person as \"Best_match\": \"True\" \n- ALWAYS explain your reasoning for the best match selection\n- MUST MAKE SURE: ALWAYS THINK HARDER\n\nSTART COMPREHENSIVE SEARCH NOW for: buckeyelawgroup.com\nThought for 2m 56s\n{\n\"page_url\": \"buckeyelawgroup.com\",\n\"search_sources\": [\"buckeyelawgroup.com\", \"buckeyeaccidentattorneys.com\", \"linkedin.com\", \"facebook.com\", \"instagram.com\", \"findlaw.com\"],\n\"total_staff_found\": 5,\n\"attorney_email_domain\": \"buckeyelawgroup.com\",\n\"paralegals\": [\n{\n\"name\": \"Tifa Aden\",\n\"title\": \"Paralegal\",\n\"email\": \"tifa.aden@buckeyelawgroup.com\",\n\"email_options\": [\"tifa.aden@buckeyelawgroup.com\", \"taden@buckeyelawgroup.com\", \"tifa@buckeyelawgroup.com\"],\n\"email_confidence\": \"generated_medium\",\n\"phone\": \"\",\n\"department\": \"Personal Injury\",\n\"quote\": \"Paralegal @ The Buckeye Law Group, Inc. | Client Relations, Account Management\",\n\"Best_match\": \"True\",\n\"Priority_score\": \"10\"\n},\n{\n\"name\": \"Brooke Pristas\",\n\"title\": \"Litigation Assistant\",\n\"email\": \"brooke.pristas@buckeyelawgroup.com\",\n\"email_options\": [\"brooke.pristas@buckeyelawgroup.com\", \"bpristas@buckeyelawgroup.com\", \"brooke@buckeyelawgroup.com\"],\n\"email_confidence\": \"generated_medium\",\n\"phone\": \"\",\n\"department\": \"Personal Injury\",\n\"quote\": \"I have experience in a Personal Injury firm and specialize in litigation.\",\n\"Best_match\": \"False\",\n\"Priority_score\": \"8\"\n},\n{\n\"name\": \"Tiffany Clacken-Brissett\",\n\"title\": \"Legal Assistant\",\n\"email\": \"tiffany.clacken-brissett@buckeyelawgroup.com\",\n\"email_options\": [\"tiffany.clacken-brissett@buckeyelawgroup.com\", \"tclacken-brissett@buckeyelawgroup.com\", \"tiffany@buckeyelawgroup.com\"],\n\"email_confidence\": \"generated_medium\",\n\"phone\": \"\",\n\"department\": \"Personal Injury\",\n\"quote\": \"\",\n\"Best_match\": \"False\",\n\"Priority_score\": \"7\"\n},\n{\n\"name\": \"Arielle Reynolds\",\n\"title\": \"Paralegal\",\n\"email\": \"arielle.reynolds@buckeyelawgroup.com\",\n\"email_options\": [\"arielle.reynolds@buckeyelawgroup.com\", \"areynolds@buckeyelawgroup.com\", \"arielle@buckeyelawgroup.com\"],\n\"email_confidence\": \"generated_medium\",\n\"phone\": \"\",\n\"department\": \"Personal Injury\",\n\"quote\": \"\",\n\"Best_match\": \"False\",\n\"Priority_score\": \"9\"\n},\n{\n\"name\": \"Sue Laske\",\n\"title\": \"Paralegal\",\n\"email\": \"sue.laske@buckeyelawgroup.com\",\n\"email_options\": [\"sue.laske@buckeyelawgroup.com\", \"slaske@buckeyelawgroup.com\", \"sue@buckeyelawgroup.com\"],\n\"email_confidence\": \"generated_medium\",\n\"phone\": \"\",\n\"department\": \"Personal Injury\",\n\"quote\": \"OSBA Certified Paralegal Notary Public: State of Ohio\",\n\"Best_match\": \"False\",\n\"Priority_score\": \"9\"\n}\n],\n\"best_contact_reasoning\": \"Tifa Aden is selected as the best match because her professional headline emphasizes client relations and account management, indicating she likely handles client intake, communications, and new case matters in the personal injury practice area. As a paralegal with these responsibilities, she aligns with the criteria for being senior enough to manage new clients and having direct involvement in client services.\",\n\"search_notes\": \"Thorough search of the firm's websites (buckeyelawgroup.com and buckeyeaccidentattorneys.com) revealed only attorneys, with no support staff listed on team or about pages. Deep search via web queries on LinkedIn uncovered several current and recent support staff profiles. Social media pages on Facebook and Instagram focused on attorneys and general posts, with no staff mentions. Legal directories like FindLaw listed attorneys but no support staff. No accessible court documents or additional sources yielded staff information.\"\n}\n56 web pages\n2 / 2\n3.6s\nExpert\nHow can Grok help?\nAuto",
    "extraction_timestamp": "2025-10-18T02:12:53.409932",
    "raw_file": "grok_paralegal_search_results\\grok_raw_results_20251018_021253.txt"
  },
  "search_completed_at": "2025-10-18T02:12:53.443999",
  "associated_cases": 2,
  "result_file": "grok_paralegal_search_results\\grok_paralegal_search_buckeyelawgroup_com_20251018_021253_w1.json"
}