{
  "domain": "squirepb.com",
  "search_url": "squirepb.com",
  "attorney_info": {
    "original_website": "squirepb.com",
    "attorney_name": "Steven M. Auvil",
    "attorney_email": "steven.auvil@squirepb.com",
    "phone": "+1 216 479 8500",
    "firm_name": "SQUIRE PATTON BOGGS (US) LLP",
    "practice_area": "OTHER",
    "case_id": "",
    "row_data": {
      "Case Number": "",
      "Filing Date": "2025-10-16",
      "Case Type": "OTHER",
      "Court": "COURT OF COMMON PLEAS, CUYAHOGA COUNTY, OHIO",
      "County": "CUYAHOGA",
      "Plaintiff": "DANIEL O’CONNOR",
      "Primary Defendant": "MIDDOUGH INC.",
      "Attorney Name": "Steven M. Auvil",
      "Attorney Office": "SQUIRE PATTON BOGGS (US) LLP",
      "Attorney Email": "steven.auvil@squirepb.com",
      "Attorney Phone": "+1 216 479 8500",
      "Attorney Website": "squirepb.com",
      "Relief Requested": "$21,000,000.00",
      "Processed At": "2025-10-18T01:04:31.502749",
      "Folder Name": "case_3646995",
      "Paralegal Name": "",
      "Paralegal Email": "",
      "Email-2": "",
      "Email-3": "",
      "Email-4": "",
      "Email-5": "",
      "Paralegal Number": "",
      "Department": "",
      "Paralegal Website Page Link": "",
      "Email Sent?": "",
      "Email Replied?": "",
      "Paralegal email": "",
      "Phone call?": ""
    }
  },
  "search_message": "COMPREHENSIVE PARALEGAL SEARCH REQUEST\n\nMISSION: Find ALL paralegals, legal assistants, and support staff for this law firm\n\nFIRM DETAILS:\n- Attorney: Steven M. Auvil\n- Email: steven.auvil@squirepb.com\n- Phone: +1 216 479 8500\n- Website: squirepb.com\n- Firm: SQUIRE PATTON BOGGS (US) LLP\n- Practice Area: OTHER\n\nSEARCH REQUIREMENTS:\n1. PRIMARY: Search the main website (squirepb.com) thoroughly for ALL staff\n2. DEEP SEARCH: If website has limited info, search these sources:\n   - LinkedIn company page and employee profiles\n   - Facebook business page and staff mentions\n   - Instagram business account\n   - Google Business listings\n   - Legal directories (Avvo, FindLaw, Lawyers.com)\n   - Bar association listings\n   - Court filing documents (if accessible)\n\nTARGET ROLES TO FIND:\n- Paralegals (all levels: senior, junior, certified)\n- Legal Assistants\n- Legal Secretaries\n- Case Managers\n- Document Specialists  \n- Litigation Support Staff\n- Client Services Coordinators\n- Administrative Assistants (in legal capacity)\n\nREQUIRED INFORMATION for each person:\n- Full Name (required)\n- Job Title/Role (required) \n- Direct Email (if available) + GENERATED EMAIL OPTIONS (see below)\n- Direct Phone/Extension (if available)\n- Department/Practice Area\n- Professional Background/Quote (if available)\n\nCRITICAL EMAIL REQUIREMENTS:\n1. If direct email found: Use the actual email\n2. If NO email found: Generate 2-3 probable email options using the attorney's email format\n3. Email generation patterns to try:\n   - firstname.lastname@domain.com\n   - firstinitiallastname@domain.com  \n   - firstname@domain.com\n   - staff.firstname@domain.com\n   - paralegal.firstname@domain.com\n4. Extract domain from attorney email: steven.auvil@squirepb.com and use it for all generated emails\n5. or use common formats based on firm domain\n\nBEST CONTACT IDENTIFICATION:\nAnalyze the staff and identify the SINGLE BEST person to contact for attorney services/legal matters.\nConsider:\n- Senior paralegals or case managers (highest priority)\n- Legal assistants with client contact responsibilities\n- Office managers if they handle new client intake\n- Avoid receptionists unless they're the only option\nMark this person with \"Best_match\": \"True\"\n\nSEARCH STRATEGY:\n- Check \"Our Team\", \"Staff\", \"About Us\", \"Meet the Team\" pages\n- Look for staff bios and profiles\n- Search social media for team photos and mentions\n- Check LinkedIn for current employees\n- Look for staff in news articles or case announcements\n- Find people in office photos or group pictures\n\nEXTRACTION FORMAT:\nPlease output results in this EXACT JSON format:\n\n{\n    \"page_url\": \"website_searched\",\n    \"search_sources\": [\"list_of_sources_checked\"],\n    \"total_staff_found\": number,\n    \"attorney_email_domain\": \"domain_from_attorney_email\",\n    \"paralegals\": [\n        {\n            \"name\": \"Full Name\",\n            \"title\": \"Job Title\",\n            \"email\": \"direct_email_if_found_OR_most_likely_generated_email\", \n            \"email_options\": [\"email1@domain.com\", \"email2@domain.com\", \"email3@domain.com\"],\n            \"email_confidence\": \"found/generated_high/generated_medium/generated_low\",\n            \"phone\": \"direct_phone_if_found\",\n            \"department\": \"practice_area_or_department\",\n            \"quote\": \"professional_background_or_bio_excerpt\",\n            \"Best_match\": \"True_or_False\",\n            \"Priority_score\": \"from 10 to 1 (10 is highest)\"\n        }\n    ],\n    \"best_contact_reasoning\": \"explanation_of_why_this_person_was_selected_as_best_match\",\n    \"search_notes\": \"brief_summary_of_search_process_and_sources_used\"\n}\n\nSPECIFIC EMAIL GENERATION INSTRUCTIONS:\n- Attorney email pattern: steven.auvil@squirepb.com\n- Extract domain from attorney email and use for all staff emails if it is right/accurate coz sometimes email's person name or domain can be little miscalculated because of OCR issues mostly it is accurate (domain).\n- For \"John Smith\" generate these patterns: [\"john.smith@domain.com\", \"jsmith@domain.com\", \"john@domain.com\"]\n- Always provide 2-3 email options per person (more if unsure)\n- Mark confidence level: \"found\" (actual email found), \"generated_high\" (strong pattern match), \"generated_medium\" (reasonable guess), \"generated_low\" (last resort)\n\nBEST MATCH SELECTION CRITERIA:\nBased on the case information (Practice Area: OTHER), select the staff member who would be:\n1. Most likely to handle new client intake for this practice area\n2. Senior enough to make decisions about new cases  \n3. Specifically responsible for client communications\n4. Has experience in the relevant practice area\n\nIMPORTANT: Be thorough and creative! Many firms hide staff information, so use multiple search angles. If the main website is limited, definitely search social media and professional networks. We need to find as many legal support staff as possible!\n\nCRITICAL: \n- ALWAYS generate email options even if no direct emails found\n- ALWAYS select exactly ONE person as \"Best_match\": \"True\" \n- ALWAYS explain your reasoning for the best match selection\n- MUST MAKE SURE: ALWAYS THINK HARDER\n\nSTART COMPREHENSIVE SEARCH NOW for: squirepb.com",
  "results": {
    "page_url": "",
    "search_sources": [],
    "total_staff_found": 6,
    "paralegals": [
      {
        "name": "Full Name",
        "title": "Job Title",
        "email": "direct_email_if_found_OR_most_likely_generated_email",
        "email_options": [
          "email1@domain.com",
          "email2@domain.com",
          "email3@domain.com"
        ],
        "email_confidence": "found/generated_high/generated_medium/generated_low",
        "phone": "direct_phone_if_found",
        "department": "practice_area_or_department",
        "quote": "professional_background_or_bio_excerpt",
        "Best_match": "True_or_False",
        "Priority_score": "from 10 to 1 (10 is highest)"
      },
      {
        "name": "Aisha Aumran",
        "title": "Paralegal",
        "email": "aisha.aumran@squirepb.com",
        "email_options": [
          "aisha.aumran@squirepb.com",
          "aaumran@squirepb.com",
          "aisha@squirepb.com"
        ],
        "email_confidence": "generated_high",
        "phone": "",
        "department": "General Legal",
        "quote": "I have had the opportunity to improve on my professional, legal and analytical skills through client interaction, document drafting, negotiating and litigating.",
        "Best_match": "False",
        "Priority_score": "7"
      },
      {
        "name": "Théodora Elie",
        "title": "Paralegal",
        "email": "theodora.elie@squirepb.com",
        "email_options": [
          "theodora.elie@squirepb.com",
          "telie@squirepb.com",
          "theodora@squirepb.com"
        ],
        "email_confidence": "generated_high",
        "phone": "",
        "department": "Arbitrage International",
        "quote": "",
        "Best_match": "False",
        "Priority_score": "6"
      },
      {
        "name": "Rachel Murray",
        "title": "Trademark Paralegal",
        "email": "rachel.murray@squirepb.com",
        "email_options": [
          "rachel.murray@squirepb.com",
          "rmurray@squirepb.com",
          "rachel@squirepb.com"
        ],
        "email_confidence": "generated_high",
        "phone": "",
        "department": "Intellectual Property",
        "quote": "Performs paralegal duties under the direction of the IP attorney. Dockets USPTO correspondence.",
        "Best_match": "False",
        "Priority_score": "8"
      },
      {
        "name": "Jennifer Conner",
        "title": "Legal Secretary",
        "email": "jennifer.conner@squirepb.com",
        "email_options": [
          "jennifer.conner@squirepb.com",
          "jconner@squirepb.com",
          "jennifer@squirepb.com"
        ],
        "email_confidence": "generated_high",
        "phone": "",
        "department": "General Legal",
        "quote": "Experienced Legal Secretary with a demonstrated history of working in the legal services industry.",
        "Best_match": "False",
        "Priority_score": "5"
      },
      {
        "name": "Julie Matthews",
        "title": "Patent Assistant",
        "email": "julie.matthews@squirepb.com",
        "email_options": [
          "julie.matthews@squirepb.com",
          "jmatthews@squirepb.com",
          "julie@squirepb.com"
        ],
        "email_confidence": "generated_high",
        "phone": "",
        "department": "Intellectual Property",
        "quote": "22 years experience in U.S., foreign and trademark prosecution.",
        "Best_match": "True",
        "Priority_score": "10"
      }
    ],
    "search_notes": "",
    "raw_content": "Share\nSign up\nSign in\nCOMPREHENSIVE PARALEGAL SEARCH REQUEST\n\nMISSION: Find ALL paralegals, legal assistants, and support staff for this law firm\n\nFIRM DETAILS:\n- Attorney: Steven M. Auvil\n- Email: steven.auvil@squirepb.com\n- Phone: +1 216 479 8500\n- Website: squirepb.com\n- Firm: SQUIRE PATTON BOGGS (US) LLP\n- Practice Area: OTHER\n\nSEARCH REQUIREMENTS:\n1. PRIMARY: Search the main website (squirepb.com) thoroughly for ALL staff\n2. DEEP SEARCH: If website has limited info, search these sources:\n   - LinkedIn company page and employee profiles\n   - Facebook business page and staff mentions\n   - Instagram business account\n   - Google Business listings\n   - Legal directories (Avvo, FindLaw, Lawyers.com)\n   - Bar association listings\n   - Court filing documents (if accessible)\n\nTARGET ROLES TO FIND:\n- Paralegals (all levels: senior, junior, certified)\n- Legal Assistants\n- Legal Secretaries\n- Case Managers\n- Document Specialists  \n- Litigation Support Staff\n- Client Services Coordinators\n- Administrative Assistants (in legal capacity)\n\nREQUIRED INFORMATION for each person:\n- Full Name (required)\n- Job Title/Role (required) \n- Direct Email (if available) + GENERATED EMAIL OPTIONS (see below)\n- Direct Phone/Extension (if available)\n- Department/Practice Area\n- Professional Background/Quote (if available)\n\nCRITICAL EMAIL REQUIREMENTS:\n1. If direct email found: Use the actual email\n2. If NO email found: Generate 2-3 probable email options using the attorney's email format\n3. Email generation patterns to try:\n   - firstname.lastname@domain.com\n   - firstinitiallastname@domain.com  \n   - firstname@domain.com\n   - staff.firstname@domain.com\n   - paralegal.firstname@domain.com\n4. Extract domain from attorney email: steven.auvil@squirepb.com and use it for all generated emails\n5. or use common formats based on firm domain\n\nBEST CONTACT IDENTIFICATION:\nAnalyze the staff and identify the SINGLE BEST person to contact for attorney services/legal matters.\nConsider:\n- Senior paralegals or case managers (highest priority)\n- Legal assistants with client contact responsibilities\n- Office managers if they handle new client intake\n- Avoid receptionists unless they're the only option\nMark this person with \"Best_match\": \"True\"\n\nSEARCH STRATEGY:\n- Check \"Our Team\", \"Staff\", \"About Us\", \"Meet the Team\" pages\n- Look for staff bios and profiles\n- Search social media for team photos and mentions\n- Check LinkedIn for current employees\n- Look for staff in news articles or case announcements\n- Find people in office photos or group pictures\n\nEXTRACTION FORMAT:\nPlease output results in this EXACT JSON format:\n\n{\n    \"page_url\": \"website_searched\",\n    \"search_sources\": [\"list_of_sources_checked\"],\n    \"total_staff_found\": number,\n    \"attorney_email_domain\": \"domain_from_attorney_email\",\n    \"paralegals\": [\n        {\n            \"name\": \"Full Name\",\n            \"title\": \"Job Title\",\n            \"email\": \"direct_email_if_found_OR_most_likely_generated_email\", \n            \"email_options\": [\"email1@domain.com\", \"email2@domain.com\", \"email3@domain.com\"],\n            \"email_confidence\": \"found/generated_high/generated_medium/generated_low\",\n            \"phone\": \"direct_phone_if_found\",\n            \"department\": \"practice_area_or_department\",\n            \"quote\": \"professional_background_or_bio_excerpt\",\n            \"Best_match\": \"True_or_False\",\n            \"Priority_score\": \"from 10 to 1 (10 is highest)\"\n        }\n    ],\n    \"best_contact_reasoning\": \"explanation_of_why_this_person_was_selected_as_best_match\",\n    \"search_notes\": \"brief_summary_of_search_process_and_sources_used\"\n}\n\nSPECIFIC EMAIL GENERATION INSTRUCTIONS:\n- Attorney email pattern: steven.auvil@squirepb.com\n- Extract domain from attorney email and use for all staff emails if it is right/accurate coz sometimes email's person name or domain can be little miscalculated because of OCR issues mostly it is accurate (domain).\n- For \"John Smith\" generate these patterns: [\"john.smith@domain.com\", \"jsmith@domain.com\", \"john@domain.com\"]\n- Always provide 2-3 email options per person (more if unsure)\n- Mark confidence level: \"found\" (actual email found), \"generated_high\" (strong pattern match), \"generated_medium\" (reasonable guess), \"generated_low\" (last resort)\n\nBEST MATCH SELECTION CRITERIA:\nBased on the case information (Practice Area: OTHER), select the staff member who would be:\n1. Most likely to handle new client intake for this practice area\n2. Senior enough to make decisions about new cases  \n3. Specifically responsible for client communications\n4. Has experience in the relevant practice area\n\nIMPORTANT: Be thorough and creative! Many firms hide staff information, so use multiple search angles. If the main website is limited, definitely search social media and professional networks. We need to find as many legal support staff as possible!\n\nCRITICAL: \n- ALWAYS generate email options even if no direct emails found\n- ALWAYS select exactly ONE person as \"Best_match\": \"True\" \n- ALWAYS explain your reasoning for the best match selection\n- MUST MAKE SURE: ALWAYS THINK HARDER\n\nSTART COMPREHENSIVE SEARCH NOW for: squirepb.com\nThought for 1m 49s\n{\n\"page_url\": \"https://www.squirepattonboggs.com/\",\n\"search_sources\": [\"https://www.squirepattonboggs.com/\", \"https://www.linkedin.com/\", \"https://x.com/\"],\n\"total_staff_found\": 5,\n\"attorney_email_domain\": \"squirepb.com\",\n\"paralegals\": [\n{\n\"name\": \"Aisha Aumran\",\n\"title\": \"Paralegal\",\n\"email\": \"aisha.aumran@squirepb.com\",\n\"email_options\": [\"aisha.aumran@squirepb.com\", \"aaumran@squirepb.com\", \"aisha@squirepb.com\"],\n\"email_confidence\": \"generated_high\",\n\"phone\": \"\",\n\"department\": \"General Legal\",\n\"quote\": \"I have had the opportunity to improve on my professional, legal and analytical skills through client interaction, document drafting, negotiating and litigating.\",\n\"Best_match\": \"False\",\n\"Priority_score\": \"7\"\n},\n{\n\"name\": \"Théodora Elie\",\n\"title\": \"Paralegal\",\n\"email\": \"theodora.elie@squirepb.com\",\n\"email_options\": [\"theodora.elie@squirepb.com\", \"telie@squirepb.com\", \"theodora@squirepb.com\"],\n\"email_confidence\": \"generated_high\",\n\"phone\": \"\",\n\"department\": \"Arbitrage International\",\n\"quote\": \"\",\n\"Best_match\": \"False\",\n\"Priority_score\": \"6\"\n},\n{\n\"name\": \"Rachel Murray\",\n\"title\": \"Trademark Paralegal\",\n\"email\": \"rachel.murray@squirepb.com\",\n\"email_options\": [\"rachel.murray@squirepb.com\", \"rmurray@squirepb.com\", \"rachel@squirepb.com\"],\n\"email_confidence\": \"generated_high\",\n\"phone\": \"\",\n\"department\": \"Intellectual Property\",\n\"quote\": \"Performs paralegal duties under the direction of the IP attorney. Dockets USPTO correspondence.\",\n\"Best_match\": \"False\",\n\"Priority_score\": \"8\"\n},\n{\n\"name\": \"Jennifer Conner\",\n\"title\": \"Legal Secretary\",\n\"email\": \"jennifer.conner@squirepb.com\",\n\"email_options\": [\"jennifer.conner@squirepb.com\", \"jconner@squirepb.com\", \"jennifer@squirepb.com\"],\n\"email_confidence\": \"generated_high\",\n\"phone\": \"\",\n\"department\": \"General Legal\",\n\"quote\": \"Experienced Legal Secretary with a demonstrated history of working in the legal services industry.\",\n\"Best_match\": \"False\",\n\"Priority_score\": \"5\"\n},\n{\n\"name\": \"Julie Matthews\",\n\"title\": \"Patent Assistant\",\n\"email\": \"julie.matthews@squirepb.com\",\n\"email_options\": [\"julie.matthews@squirepb.com\", \"jmatthews@squirepb.com\", \"julie@squirepb.com\"],\n\"email_confidence\": \"generated_high\",\n\"phone\": \"\",\n\"department\": \"Intellectual Property\",\n\"quote\": \"22 years experience in U.S., foreign and trademark prosecution.\",\n\"Best_match\": \"True\",\n\"Priority_score\": \"10\"\n}\n],\n\"best_contact_reasoning\": \"Julie Matthews was selected as the best match due to her extensive 22 years of experience in patent prosecution, indicating a senior role likely involving case management, client communications, and decision-making support in legal matters. Given the vague 'OTHER' practice area, her seniority makes her suitable for handling new client intake and relevant cases.\",\n\"search_notes\": \"Searched the firm's website for staff listings but found only general mentions of paralegals and support roles without specific names. Utilized LinkedIn searches to identify current employees in target roles via profiles and job postings. X searches yielded no specific staff information, focusing instead on firm news and events.\"\n}\n30 𝕏 posts\n26 web pages\n1.6s\nExpert\nFind Cleveland paralegals\nCompare to Latham & Watkins staff\nAdd phone numbers to list\nHow can Grok help?\nAuto",
    "extraction_timestamp": "2025-10-18T02:38:05.290003",
    "raw_file": "grok_paralegal_search_results\\grok_raw_results_20251018_023805.txt"
  },
  "search_completed_at": "2025-10-18T02:38:05.327420",
  "associated_cases": 1,
  "result_file": "grok_paralegal_search_results\\grok_paralegal_search_squirepb_com_20251018_023805_w0.json"
}