{
  "domain": "smdklaw.com",
  "search_url": "smdklaw.com",
  "attorney_info": {
    "original_website": "smdklaw.com",
    "attorney_name": "Michael R. Stavnicky",
    "attorney_email": "mstavnickY@smdklaw.com",
    "phone": "(216) 292-5807",
    "firm_name": "Singerman, Mills, Desberg & Kauntz Co., L.P.A.",
    "practice_area": "OTHER",
    "case_id": "",
    "row_data": {
      "Case Number": "",
      "Filing Date": "",
      "Case Type": "OTHER",
      "Court": "COURT OF COMMON PLEAS, CUYAHOGA COUNTY, OHIO",
      "County": "CUYAHOGA",
      "Plaintiff": "FARGO DEVELOPMENT COMPANY, LLC",
      "Primary Defendant": "SUEHR CARGO SERVICES, INC.",
      "Attorney Name": "Michael R. Stavnicky",
      "Attorney Office": "Singerman, Mills, Desberg & Kauntz Co., L.P.A.",
      "Attorney Email": "mstavnickY@smdklaw.com",
      "Attorney Phone": "(216) 292-5807",
      "Attorney Website": "smdklaw.com",
      "Relief Requested": "$25,000.00",
      "Processed At": "2025-10-18T01:04:32.657885",
      "Folder Name": "case_3647793",
      "Paralegal Name": "",
      "Paralegal Email": "",
      "Email-2": "",
      "Email-3": "",
      "Email-4": "",
      "Email-5": "",
      "Paralegal Number": "",
      "Department": "",
      "Paralegal Website Page Link": "",
      "Email Sent?": "",
      "Email Replied?": "",
      "Paralegal email": "",
      "Phone call?": ""
    }
  },
  "search_message": "COMPREHENSIVE PARALEGAL SEARCH REQUEST\n\nMISSION: Find ALL paralegals, legal assistants, and support staff for this law firm\n\nFIRM DETAILS:\n- Attorney: Michael R. Stavnicky\n- Email: mstavnickY@smdklaw.com\n- Phone: (216) 292-5807\n- Website: smdklaw.com\n- Firm: Singerman, Mills, Desberg & Kauntz Co., L.P.A.\n- Practice Area: OTHER\n\nSEARCH REQUIREMENTS:\n1. PRIMARY: Search the main website (smdklaw.com) thoroughly for ALL staff\n2. DEEP SEARCH: If website has limited info, search these sources:\n   - LinkedIn company page and employee profiles\n   - Facebook business page and staff mentions\n   - Instagram business account\n   - Google Business listings\n   - Legal directories (Avvo, FindLaw, Lawyers.com)\n   - Bar association listings\n   - Court filing documents (if accessible)\n\nTARGET ROLES TO FIND:\n- Paralegals (all levels: senior, junior, certified)\n- Legal Assistants\n- Legal Secretaries\n- Case Managers\n- Document Specialists  \n- Litigation Support Staff\n- Client Services Coordinators\n- Administrative Assistants (in legal capacity)\n\nREQUIRED INFORMATION for each person:\n- Full Name (required)\n- Job Title/Role (required) \n- Direct Email (if available) + GENERATED EMAIL OPTIONS (see below)\n- Direct Phone/Extension (if available)\n- Department/Practice Area\n- Professional Background/Quote (if available)\n\nCRITICAL EMAIL REQUIREMENTS:\n1. If direct email found: Use the actual email\n2. If NO email found: Generate 2-3 probable email options using the attorney's email format\n3. Email generation patterns to try:\n   - firstname.lastname@domain.com\n   - firstinitiallastname@domain.com  \n   - firstname@domain.com\n   - staff.firstname@domain.com\n   - paralegal.firstname@domain.com\n4. Extract domain from attorney email: mstavnickY@smdklaw.com and use it for all generated emails\n5. or use common formats based on firm domain\n\nBEST CONTACT IDENTIFICATION:\nAnalyze the staff and identify the SINGLE BEST person to contact for attorney services/legal matters.\nConsider:\n- Senior paralegals or case managers (highest priority)\n- Legal assistants with client contact responsibilities\n- Office managers if they handle new client intake\n- Avoid receptionists unless they're the only option\nMark this person with \"Best_match\": \"True\"\n\nSEARCH STRATEGY:\n- Check \"Our Team\", \"Staff\", \"About Us\", \"Meet the Team\" pages\n- Look for staff bios and profiles\n- Search social media for team photos and mentions\n- Check LinkedIn for current employees\n- Look for staff in news articles or case announcements\n- Find people in office photos or group pictures\n\nEXTRACTION FORMAT:\nPlease output results in this EXACT JSON format:\n\n{\n    \"page_url\": \"website_searched\",\n    \"search_sources\": [\"list_of_sources_checked\"],\n    \"total_staff_found\": number,\n    \"attorney_email_domain\": \"domain_from_attorney_email\",\n    \"paralegals\": [\n        {\n            \"name\": \"Full Name\",\n            \"title\": \"Job Title\",\n            \"email\": \"direct_email_if_found_OR_most_likely_generated_email\", \n            \"email_options\": [\"email1@domain.com\", \"email2@domain.com\", \"email3@domain.com\"],\n            \"email_confidence\": \"found/generated_high/generated_medium/generated_low\",\n            \"phone\": \"direct_phone_if_found\",\n            \"department\": \"practice_area_or_department\",\n            \"quote\": \"professional_background_or_bio_excerpt\",\n            \"Best_match\": \"True_or_False\",\n            \"Priority_score\": \"from 10 to 1 (10 is highest)\"\n        }\n    ],\n    \"best_contact_reasoning\": \"explanation_of_why_this_person_was_selected_as_best_match\",\n    \"search_notes\": \"brief_summary_of_search_process_and_sources_used\"\n}\n\nSPECIFIC EMAIL GENERATION INSTRUCTIONS:\n- Attorney email pattern: mstavnickY@smdklaw.com\n- Extract domain from attorney email and use for all staff emails if it is right/accurate coz sometimes email's person name or domain can be little miscalculated because of OCR issues mostly it is accurate (domain).\n- For \"John Smith\" generate these patterns: [\"john.smith@domain.com\", \"jsmith@domain.com\", \"john@domain.com\"]\n- Always provide 2-3 email options per person (more if unsure)\n- Mark confidence level: \"found\" (actual email found), \"generated_high\" (strong pattern match), \"generated_medium\" (reasonable guess), \"generated_low\" (last resort)\n\nBEST MATCH SELECTION CRITERIA:\nBased on the case information (Practice Area: OTHER), select the staff member who would be:\n1. Most likely to handle new client intake for this practice area\n2. Senior enough to make decisions about new cases  \n3. Specifically responsible for client communications\n4. Has experience in the relevant practice area\n\nIMPORTANT: Be thorough and creative! Many firms hide staff information, so use multiple search angles. If the main website is limited, definitely search social media and professional networks. We need to find as many legal support staff as possible!\n\nCRITICAL: \n- ALWAYS generate email options even if no direct emails found\n- ALWAYS select exactly ONE person as \"Best_match\": \"True\" \n- ALWAYS explain your reasoning for the best match selection\n- MUST MAKE SURE: ALWAYS THINK HARDER\n\nSTART COMPREHENSIVE SEARCH NOW for: smdklaw.com",
  "results": {
    "page_url": "",
    "search_sources": [],
    "total_staff_found": 4,
    "paralegals": [
      {
        "name": "Full Name",
        "title": "Job Title",
        "email": "direct_email_if_found_OR_most_likely_generated_email",
        "email_options": [
          "email1@domain.com",
          "email2@domain.com",
          "email3@domain.com"
        ],
        "email_confidence": "found/generated_high/generated_medium/generated_low",
        "phone": "direct_phone_if_found",
        "department": "practice_area_or_department",
        "quote": "professional_background_or_bio_excerpt",
        "Best_match": "True_or_False",
        "Priority_score": "from 10 to 1 (10 is highest)"
      },
      {
        "name": "Hope Cloud",
        "title": "Litigation Paralegal",
        "email": "hcloud@smdklaw.com",
        "email_options": [
          "hcloud@smdklaw.com",
          "hope.cloud@smdklaw.com",
          "hope@smdklaw.com"
        ],
        "email_confidence": "generated_high",
        "phone": "",
        "department": "Litigation",
        "quote": "Litigation Paralegal with experience at Singerman, Mills, Desberg & Kauntz Co., L.P.A. since March 2017; previously at FCM Claims Services LLC and Frantz Ward LLP.",
        "Best_match": "True",
        "Priority_score": "10"
      },
      {
        "name": "Kathleen Marotta",
        "title": "Legal Administrative Assistant",
        "email": "kmarotta@smdklaw.com",
        "email_options": [
          "kmarotta@smdklaw.com",
          "kathleen.marotta@smdklaw.com",
          "kathleen@smdklaw.com"
        ],
        "email_confidence": "generated_high",
        "phone": "",
        "department": "Civil Litigation / Workers' Compensation",
        "quote": "Legal Administrative Assistant specializing in civil litigation and asbestos-related workers' compensation.",
        "Best_match": "False",
        "Priority_score": "8"
      },
      {
        "name": "Bonnie Korponic",
        "title": "Support Staff",
        "email": "bkorponic@smdklaw.com",
        "email_options": [
          "bkorponic@smdklaw.com",
          "bonnie.korponic@smdklaw.com",
          "bonnie@smdklaw.com"
        ],
        "email_confidence": "generated_medium",
        "phone": "",
        "department": "",
        "quote": "",
        "Best_match": "False",
        "Priority_score": "5"
      }
    ],
    "search_notes": "",
    "raw_content": "Share\nSign up\nSign in\nCOMPREHENSIVE PARALEGAL SEARCH REQUEST\n\nMISSION: Find ALL paralegals, legal assistants, and support staff for this law firm\n\nFIRM DETAILS:\n- Attorney: Michael R. Stavnicky\n- Email: mstavnickY@smdklaw.com\n- Phone: (216) 292-5807\n- Website: smdklaw.com\n- Firm: Singerman, Mills, Desberg & Kauntz Co., L.P.A.\n- Practice Area: OTHER\n\nSEARCH REQUIREMENTS:\n1. PRIMARY: Search the main website (smdklaw.com) thoroughly for ALL staff\n2. DEEP SEARCH: If website has limited info, search these sources:\n   - LinkedIn company page and employee profiles\n   - Facebook business page and staff mentions\n   - Instagram business account\n   - Google Business listings\n   - Legal directories (Avvo, FindLaw, Lawyers.com)\n   - Bar association listings\n   - Court filing documents (if accessible)\n\nTARGET ROLES TO FIND:\n- Paralegals (all levels: senior, junior, certified)\n- Legal Assistants\n- Legal Secretaries\n- Case Managers\n- Document Specialists  \n- Litigation Support Staff\n- Client Services Coordinators\n- Administrative Assistants (in legal capacity)\n\nREQUIRED INFORMATION for each person:\n- Full Name (required)\n- Job Title/Role (required) \n- Direct Email (if available) + GENERATED EMAIL OPTIONS (see below)\n- Direct Phone/Extension (if available)\n- Department/Practice Area\n- Professional Background/Quote (if available)\n\nCRITICAL EMAIL REQUIREMENTS:\n1. If direct email found: Use the actual email\n2. If NO email found: Generate 2-3 probable email options using the attorney's email format\n3. Email generation patterns to try:\n   - firstname.lastname@domain.com\n   - firstinitiallastname@domain.com  \n   - firstname@domain.com\n   - staff.firstname@domain.com\n   - paralegal.firstname@domain.com\n4. Extract domain from attorney email: mstavnickY@smdklaw.com and use it for all generated emails\n5. or use common formats based on firm domain\n\nBEST CONTACT IDENTIFICATION:\nAnalyze the staff and identify the SINGLE BEST person to contact for attorney services/legal matters.\nConsider:\n- Senior paralegals or case managers (highest priority)\n- Legal assistants with client contact responsibilities\n- Office managers if they handle new client intake\n- Avoid receptionists unless they're the only option\nMark this person with \"Best_match\": \"True\"\n\nSEARCH STRATEGY:\n- Check \"Our Team\", \"Staff\", \"About Us\", \"Meet the Team\" pages\n- Look for staff bios and profiles\n- Search social media for team photos and mentions\n- Check LinkedIn for current employees\n- Look for staff in news articles or case announcements\n- Find people in office photos or group pictures\n\nEXTRACTION FORMAT:\nPlease output results in this EXACT JSON format:\n\n{\n    \"page_url\": \"website_searched\",\n    \"search_sources\": [\"list_of_sources_checked\"],\n    \"total_staff_found\": number,\n    \"attorney_email_domain\": \"domain_from_attorney_email\",\n    \"paralegals\": [\n        {\n            \"name\": \"Full Name\",\n            \"title\": \"Job Title\",\n            \"email\": \"direct_email_if_found_OR_most_likely_generated_email\", \n            \"email_options\": [\"email1@domain.com\", \"email2@domain.com\", \"email3@domain.com\"],\n            \"email_confidence\": \"found/generated_high/generated_medium/generated_low\",\n            \"phone\": \"direct_phone_if_found\",\n            \"department\": \"practice_area_or_department\",\n            \"quote\": \"professional_background_or_bio_excerpt\",\n            \"Best_match\": \"True_or_False\",\n            \"Priority_score\": \"from 10 to 1 (10 is highest)\"\n        }\n    ],\n    \"best_contact_reasoning\": \"explanation_of_why_this_person_was_selected_as_best_match\",\n    \"search_notes\": \"brief_summary_of_search_process_and_sources_used\"\n}\n\nSPECIFIC EMAIL GENERATION INSTRUCTIONS:\n- Attorney email pattern: mstavnickY@smdklaw.com\n- Extract domain from attorney email and use for all staff emails if it is right/accurate coz sometimes email's person name or domain can be little miscalculated because of OCR issues mostly it is accurate (domain).\n- For \"John Smith\" generate these patterns: [\"john.smith@domain.com\", \"jsmith@domain.com\", \"john@domain.com\"]\n- Always provide 2-3 email options per person (more if unsure)\n- Mark confidence level: \"found\" (actual email found), \"generated_high\" (strong pattern match), \"generated_medium\" (reasonable guess), \"generated_low\" (last resort)\n\nBEST MATCH SELECTION CRITERIA:\nBased on the case information (Practice Area: OTHER), select the staff member who would be:\n1. Most likely to handle new client intake for this practice area\n2. Senior enough to make decisions about new cases  \n3. Specifically responsible for client communications\n4. Has experience in the relevant practice area\n\nIMPORTANT: Be thorough and creative! Many firms hide staff information, so use multiple search angles. If the main website is limited, definitely search social media and professional networks. We need to find as many legal support staff as possible!\n\nCRITICAL: \n- ALWAYS generate email options even if no direct emails found\n- ALWAYS select exactly ONE person as \"Best_match\": \"True\" \n- ALWAYS explain your reasoning for the best match selection\n- MUST MAKE SURE: ALWAYS THINK HARDER\n\nSTART COMPREHENSIVE SEARCH NOW for: smdklaw.com\nThought for 2m 32s\n{\n\"page_url\": \"https://smdklaw.com\",\n\"search_sources\": [\"https://smdklaw.com\", \"https://www.linkedin.com/company/smdklaw\", \"LinkedIn profiles via web search\", \"ZoomInfo\", \"Avvo\", \"FindLaw\", \"Lawyers.com\", \"Facebook mentions\", \"Instagram mentions\", \"Google Business searches\", \"X searches\"],\n\"total_staff_found\": 3,\n\"attorney_email_domain\": \"smdklaw.com\",\n\"paralegals\": [\n{\n\"name\": \"Hope Cloud\",\n\"title\": \"Litigation Paralegal\",\n\"email\": \"hcloud@smdklaw.com\",\n\"email_options\": [\"hcloud@smdklaw.com\", \"hope.cloud@smdklaw.com\", \"hope@smdklaw.com\"],\n\"email_confidence\": \"generated_high\",\n\"phone\": \"\",\n\"department\": \"Litigation\",\n\"quote\": \"Litigation Paralegal with experience at Singerman, Mills, Desberg & Kauntz Co., L.P.A. since March 2017; previously at FCM Claims Services LLC and Frantz Ward LLP.\",\n\"Best_match\": \"True\",\n\"Priority_score\": \"10\"\n},\n{\n\"name\": \"Kathleen Marotta\",\n\"title\": \"Legal Administrative Assistant\",\n\"email\": \"kmarotta@smdklaw.com\",\n\"email_options\": [\"kmarotta@smdklaw.com\", \"kathleen.marotta@smdklaw.com\", \"kathleen@smdklaw.com\"],\n\"email_confidence\": \"generated_high\",\n\"phone\": \"\",\n\"department\": \"Civil Litigation / Workers' Compensation\",\n\"quote\": \"Legal Administrative Assistant specializing in civil litigation and asbestos-related workers' compensation.\",\n\"Best_match\": \"False\",\n\"Priority_score\": \"8\"\n},\n{\n\"name\": \"Bonnie Korponic\",\n\"title\": \"Support Staff\",\n\"email\": \"bkorponic@smdklaw.com\",\n\"email_options\": [\"bkorponic@smdklaw.com\", \"bonnie.korponic@smdklaw.com\", \"bonnie@smdklaw.com\"],\n\"email_confidence\": \"generated_medium\",\n\"phone\": \"\",\n\"department\": \"\",\n\"quote\": \"\",\n\"Best_match\": \"False\",\n\"Priority_score\": \"5\"\n}\n],\n\"best_contact_reasoning\": \"Hope Cloud was selected as the best match because she is a Litigation Paralegal, which aligns with senior paralegal roles having higher priority for handling new client intake, case management, and client communications. The firm's practice includes litigation, and as a paralegal with long tenure at the firm, she is likely senior enough to assist with legal matters in the 'OTHER' practice area. Kathleen Marotta is an administrative assistant, which is lower priority, and Bonnie Korponic's exact role is unclear, making Hope the most suitable.\",\n\"search_notes\": \"The main website (smdklaw.com) and its subpages (attorneys, about, contact) provided no detailed staff listings, only general mentions of paralegals and support staff in news articles. Deep search via LinkedIn yielded the most results, identifying support staff through employee profiles. Other sources like Facebook, Instagram, Google Business, and legal directories primarily listed attorneys or firm overviews with no additional support staff details. X searches returned no results. Emails were generated based on the consistent pattern observed in attorney emails (firstinitiallastname@smdklaw.com).\"\n}\n49 web pages\nExpert\nHow can Grok help?\nAuto",
    "extraction_timestamp": "2025-10-18T03:01:28.366244",
    "raw_file": "grok_paralegal_search_results\\grok_raw_results_20251018_030128.txt"
  },
  "search_completed_at": "2025-10-18T03:01:28.465075",
  "associated_cases": 1,
  "result_file": "grok_paralegal_search_results\\grok_paralegal_search_smdklaw_com_20251018_030128_w1.json"
}