{
  "domain": "gpblaw.com",
  "search_url": "gpblaw.com",
  "attorney_info": {
    "original_website": "gpblaw.com",
    "attorney_name": "Johna M. Bella",
    "attorney_email": "jbella@gpblaw.com",
    "phone": "(419) 244-9500",
    "firm_name": "Goranson Parker & Bella Co., L.P.A.",
    "practice_area": "FORECLOSURE",
    "case_id": "",
    "row_data": {
      "Case Number": "",
      "Filing Date": "",
      "Case Type": "FORECLOSURE",
      "Court": "COURT OF COMMON PLEAS OF CUYAHOGA COUNTY, OHIO",
      "County": "CUYAHOGA",
      "Plaintiff": "Citizens Bank, NA",
      "Primary Defendant": "Brian K. Hicks",
      "Attorney Name": "Johna M. Bella",
      "Attorney Office": "Goranson Parker & Bella Co., L.P.A.",
      "Attorney Email": "jbella@gpblaw.com",
      "Attorney Phone": "(419) 244-9500",
      "Attorney Website": "gpblaw.com",
      "Relief Requested": "$153,972.70",
      "Processed At": "2025-10-18T01:04:31.521224",
      "Folder Name": "case_3647042",
      "Paralegal Name": "",
      "Paralegal Email": "",
      "Email-2": "",
      "Email-3": "",
      "Email-4": "",
      "Email-5": "",
      "Paralegal Number": "",
      "Department": "",
      "Paralegal Website Page Link": "",
      "Email Sent?": "",
      "Email Replied?": "",
      "Paralegal email": "",
      "Phone call?": ""
    }
  },
  "search_message": "COMPREHENSIVE PARALEGAL SEARCH REQUEST\n\nMISSION: Find ALL paralegals, legal assistants, and support staff for this law firm\n\nFIRM DETAILS:\n- Attorney: Johna M. Bella\n- Email: jbella@gpblaw.com\n- Phone: (419) 244-9500\n- Website: gpblaw.com\n- Firm: Goranson Parker & Bella Co., L.P.A.\n- Practice Area: FORECLOSURE\n\nSEARCH REQUIREMENTS:\n1. PRIMARY: Search the main website (gpblaw.com) thoroughly for ALL staff\n2. DEEP SEARCH: If website has limited info, search these sources:\n   - LinkedIn company page and employee profiles\n   - Facebook business page and staff mentions\n   - Instagram business account\n   - Google Business listings\n   - Legal directories (Avvo, FindLaw, Lawyers.com)\n   - Bar association listings\n   - Court filing documents (if accessible)\n\nTARGET ROLES TO FIND:\n- Paralegals (all levels: senior, junior, certified)\n- Legal Assistants\n- Legal Secretaries\n- Case Managers\n- Document Specialists  \n- Litigation Support Staff\n- Client Services Coordinators\n- Administrative Assistants (in legal capacity)\n\nREQUIRED INFORMATION for each person:\n- Full Name (required)\n- Job Title/Role (required) \n- Direct Email (if available) + GENERATED EMAIL OPTIONS (see below)\n- Direct Phone/Extension (if available)\n- Department/Practice Area\n- Professional Background/Quote (if available)\n\nCRITICAL EMAIL REQUIREMENTS:\n1. If direct email found: Use the actual email\n2. If NO email found: Generate 2-3 probable email options using the attorney's email format\n3. Email generation patterns to try:\n   - firstname.lastname@domain.com\n   - firstinitiallastname@domain.com  \n   - firstname@domain.com\n   - staff.firstname@domain.com\n   - paralegal.firstname@domain.com\n4. Extract domain from attorney email: jbella@gpblaw.com and use it for all generated emails\n5. or use common formats based on firm domain\n\nBEST CONTACT IDENTIFICATION:\nAnalyze the staff and identify the SINGLE BEST person to contact for attorney services/legal matters.\nConsider:\n- Senior paralegals or case managers (highest priority)\n- Legal assistants with client contact responsibilities\n- Office managers if they handle new client intake\n- Avoid receptionists unless they're the only option\nMark this person with \"Best_match\": \"True\"\n\nSEARCH STRATEGY:\n- Check \"Our Team\", \"Staff\", \"About Us\", \"Meet the Team\" pages\n- Look for staff bios and profiles\n- Search social media for team photos and mentions\n- Check LinkedIn for current employees\n- Look for staff in news articles or case announcements\n- Find people in office photos or group pictures\n\nEXTRACTION FORMAT:\nPlease output results in this EXACT JSON format:\n\n{\n    \"page_url\": \"website_searched\",\n    \"search_sources\": [\"list_of_sources_checked\"],\n    \"total_staff_found\": number,\n    \"attorney_email_domain\": \"domain_from_attorney_email\",\n    \"paralegals\": [\n        {\n            \"name\": \"Full Name\",\n            \"title\": \"Job Title\",\n            \"email\": \"direct_email_if_found_OR_most_likely_generated_email\", \n            \"email_options\": [\"email1@domain.com\", \"email2@domain.com\", \"email3@domain.com\"],\n            \"email_confidence\": \"found/generated_high/generated_medium/generated_low\",\n            \"phone\": \"direct_phone_if_found\",\n            \"department\": \"practice_area_or_department\",\n            \"quote\": \"professional_background_or_bio_excerpt\",\n            \"Best_match\": \"True_or_False\",\n            \"Priority_score\": \"from 10 to 1 (10 is highest)\"\n        }\n    ],\n    \"best_contact_reasoning\": \"explanation_of_why_this_person_was_selected_as_best_match\",\n    \"search_notes\": \"brief_summary_of_search_process_and_sources_used\"\n}\n\nSPECIFIC EMAIL GENERATION INSTRUCTIONS:\n- Attorney email pattern: jbella@gpblaw.com\n- Extract domain from attorney email and use for all staff emails if it is right/accurate coz sometimes email's person name or domain can be little miscalculated because of OCR issues mostly it is accurate (domain).\n- For \"John Smith\" generate these patterns: [\"john.smith@domain.com\", \"jsmith@domain.com\", \"john@domain.com\"]\n- Always provide 2-3 email options per person (more if unsure)\n- Mark confidence level: \"found\" (actual email found), \"generated_high\" (strong pattern match), \"generated_medium\" (reasonable guess), \"generated_low\" (last resort)\n\nBEST MATCH SELECTION CRITERIA:\nBased on the case information (Practice Area: FORECLOSURE), select the staff member who would be:\n1. Most likely to handle new client intake for this practice area\n2. Senior enough to make decisions about new cases  \n3. Specifically responsible for client communications\n4. Has experience in the relevant practice area\n\nIMPORTANT: Be thorough and creative! Many firms hide staff information, so use multiple search angles. If the main website is limited, definitely search social media and professional networks. We need to find as many legal support staff as possible!\n\nCRITICAL: \n- ALWAYS generate email options even if no direct emails found\n- ALWAYS select exactly ONE person as \"Best_match\": \"True\" \n- ALWAYS explain your reasoning for the best match selection\n- MUST MAKE SURE: ALWAYS THINK HARDER\n\nSTART COMPREHENSIVE SEARCH NOW for: gpblaw.com",
  "results": {
    "page_url": "",
    "search_sources": [],
    "total_staff_found": 2,
    "paralegals": [
      {
        "name": "Full Name",
        "title": "Job Title",
        "email": "direct_email_if_found_OR_most_likely_generated_email",
        "email_options": [
          "email1@domain.com",
          "email2@domain.com",
          "email3@domain.com"
        ],
        "email_confidence": "found/generated_high/generated_medium/generated_low",
        "phone": "direct_phone_if_found",
        "department": "practice_area_or_department",
        "quote": "professional_background_or_bio_excerpt",
        "Best_match": "True_or_False",
        "Priority_score": "from 10 to 1 (10 is highest)"
      },
      {
        "name": "Susan Perry",
        "title": "Legal Secretary",
        "email": "sperry@gpblaw.com",
        "email_options": [
          "sperry@gpblaw.com",
          "susan.perry@gpblaw.com",
          "susan@gpblaw.com"
        ],
        "email_confidence": "generated_high",
        "phone": "",
        "department": "Foreclosure",
        "quote": "Legal Secretary at Goranson Parker & Bella with education from University of Toledo.",
        "Best_match": "True",
        "Priority_score": "10"
      }
    ],
    "search_notes": "",
    "raw_content": "Share\nSign up\nSign in\nCOMPREHENSIVE PARALEGAL SEARCH REQUEST\n\nMISSION: Find ALL paralegals, legal assistants, and support staff for this law firm\n\nFIRM DETAILS:\n- Attorney: Johna M. Bella\n- Email: jbella@gpblaw.com\n- Phone: (419) 244-9500\n- Website: gpblaw.com\n- Firm: Goranson Parker & Bella Co., L.P.A.\n- Practice Area: FORECLOSURE\n\nSEARCH REQUIREMENTS:\n1. PRIMARY: Search the main website (gpblaw.com) thoroughly for ALL staff\n2. DEEP SEARCH: If website has limited info, search these sources:\n   - LinkedIn company page and employee profiles\n   - Facebook business page and staff mentions\n   - Instagram business account\n   - Google Business listings\n   - Legal directories (Avvo, FindLaw, Lawyers.com)\n   - Bar association listings\n   - Court filing documents (if accessible)\n\nTARGET ROLES TO FIND:\n- Paralegals (all levels: senior, junior, certified)\n- Legal Assistants\n- Legal Secretaries\n- Case Managers\n- Document Specialists  \n- Litigation Support Staff\n- Client Services Coordinators\n- Administrative Assistants (in legal capacity)\n\nREQUIRED INFORMATION for each person:\n- Full Name (required)\n- Job Title/Role (required) \n- Direct Email (if available) + GENERATED EMAIL OPTIONS (see below)\n- Direct Phone/Extension (if available)\n- Department/Practice Area\n- Professional Background/Quote (if available)\n\nCRITICAL EMAIL REQUIREMENTS:\n1. If direct email found: Use the actual email\n2. If NO email found: Generate 2-3 probable email options using the attorney's email format\n3. Email generation patterns to try:\n   - firstname.lastname@domain.com\n   - firstinitiallastname@domain.com  \n   - firstname@domain.com\n   - staff.firstname@domain.com\n   - paralegal.firstname@domain.com\n4. Extract domain from attorney email: jbella@gpblaw.com and use it for all generated emails\n5. or use common formats based on firm domain\n\nBEST CONTACT IDENTIFICATION:\nAnalyze the staff and identify the SINGLE BEST person to contact for attorney services/legal matters.\nConsider:\n- Senior paralegals or case managers (highest priority)\n- Legal assistants with client contact responsibilities\n- Office managers if they handle new client intake\n- Avoid receptionists unless they're the only option\nMark this person with \"Best_match\": \"True\"\n\nSEARCH STRATEGY:\n- Check \"Our Team\", \"Staff\", \"About Us\", \"Meet the Team\" pages\n- Look for staff bios and profiles\n- Search social media for team photos and mentions\n- Check LinkedIn for current employees\n- Look for staff in news articles or case announcements\n- Find people in office photos or group pictures\n\nEXTRACTION FORMAT:\nPlease output results in this EXACT JSON format:\n\n{\n    \"page_url\": \"website_searched\",\n    \"search_sources\": [\"list_of_sources_checked\"],\n    \"total_staff_found\": number,\n    \"attorney_email_domain\": \"domain_from_attorney_email\",\n    \"paralegals\": [\n        {\n            \"name\": \"Full Name\",\n            \"title\": \"Job Title\",\n            \"email\": \"direct_email_if_found_OR_most_likely_generated_email\", \n            \"email_options\": [\"email1@domain.com\", \"email2@domain.com\", \"email3@domain.com\"],\n            \"email_confidence\": \"found/generated_high/generated_medium/generated_low\",\n            \"phone\": \"direct_phone_if_found\",\n            \"department\": \"practice_area_or_department\",\n            \"quote\": \"professional_background_or_bio_excerpt\",\n            \"Best_match\": \"True_or_False\",\n            \"Priority_score\": \"from 10 to 1 (10 is highest)\"\n        }\n    ],\n    \"best_contact_reasoning\": \"explanation_of_why_this_person_was_selected_as_best_match\",\n    \"search_notes\": \"brief_summary_of_search_process_and_sources_used\"\n}\n\nSPECIFIC EMAIL GENERATION INSTRUCTIONS:\n- Attorney email pattern: jbella@gpblaw.com\n- Extract domain from attorney email and use for all staff emails if it is right/accurate coz sometimes email's person name or domain can be little miscalculated because of OCR issues mostly it is accurate (domain).\n- For \"John Smith\" generate these patterns: [\"john.smith@domain.com\", \"jsmith@domain.com\", \"john@domain.com\"]\n- Always provide 2-3 email options per person (more if unsure)\n- Mark confidence level: \"found\" (actual email found), \"generated_high\" (strong pattern match), \"generated_medium\" (reasonable guess), \"generated_low\" (last resort)\n\nBEST MATCH SELECTION CRITERIA:\nBased on the case information (Practice Area: FORECLOSURE), select the staff member who would be:\n1. Most likely to handle new client intake for this practice area\n2. Senior enough to make decisions about new cases  \n3. Specifically responsible for client communications\n4. Has experience in the relevant practice area\n\nIMPORTANT: Be thorough and creative! Many firms hide staff information, so use multiple search angles. If the main website is limited, definitely search social media and professional networks. We need to find as many legal support staff as possible!\n\nCRITICAL: \n- ALWAYS generate email options even if no direct emails found\n- ALWAYS select exactly ONE person as \"Best_match\": \"True\" \n- ALWAYS explain your reasoning for the best match selection\n- MUST MAKE SURE: ALWAYS THINK HARDER\n\nSTART COMPREHENSIVE SEARCH NOW for: gpblaw.com\nThought for 2m 8s\n{\n\"page_url\": \"https://www.gpblaw.com\",\n\"search_sources\": [\"Web search\", \"LinkedIn profiles\", \"Martindale-Hubbell\", \"Lawyers.com\", \"FindLaw\", \"Toledo Bar Association newsletter\", \"ABLE annual reports\"],\n\"total_staff_found\": 1,\n\"attorney_email_domain\": \"gpblaw.com\",\n\"paralegals\": [\n{\n\"name\": \"Susan Perry\",\n\"title\": \"Legal Secretary\",\n\"email\": \"sperry@gpblaw.com\",\n\"email_options\": [\"sperry@gpblaw.com\", \"susan.perry@gpblaw.com\", \"susan@gpblaw.com\"],\n\"email_confidence\": \"generated_high\",\n\"phone\": \"\",\n\"department\": \"Foreclosure\",\n\"quote\": \"Legal Secretary at Goranson Parker & Bella with education from University of Toledo.\",\n\"Best_match\": \"True\",\n\"Priority_score\": \"10\"\n}\n],\n\"best_contact_reasoning\": \"Susan Perry is the only support staff member identified through extensive searches. As a Legal Secretary in a firm specializing in foreclosure, she is likely involved in client communications, case management, and administrative support for new matters, making her the most suitable contact for attorney services or legal inquiries in this practice area.\",\n\"search_notes\": \"Attempted to browse the firm website (gpblaw.com and www.gpblaw.com) but retrieval failed. Conducted multiple web searches targeting LinkedIn, where Susan Perry's profile as current Legal Secretary was discovered. Checked legal directories like Martindale-Hubbell, Lawyers.com, and FindLaw, which primarily listed attorneys but no additional support staff. Searched Facebook and Instagram with no relevant business pages or staff mentions. Reviewed Toledo Bar Association newsletter and ABLE reports for potential staff references, but none were associated with the firm beyond attorney presentations. No paralegals or other support roles found beyond Susan Perry; former employees like Kelly Reef (Legal Assistant 2002-2006) were noted but excluded as not current.\"\n}\n38 web pages\n2s\nExpert\nVerify Susan Perry's email\nSearch other Toledo firms\nEnhance JSON formatting\nHow can Grok help?\nAuto",
    "extraction_timestamp": "2025-10-18T02:43:26.570925",
    "raw_file": "grok_paralegal_search_results\\grok_raw_results_20251018_024326.txt"
  },
  "search_completed_at": "2025-10-18T02:43:26.834795",
  "associated_cases": 1,
  "result_file": "grok_paralegal_search_results\\grok_paralegal_search_gpblaw_com_20251018_024326_w0.json"
}