{
  "domain": "reimerlaw.com",
  "search_url": "reimerlaw.com",
  "attorney_info": {
    "original_website": "reimerlaw.com",
    "attorney_name": "Joshua J. Epling",
    "attorney_email": "jepling@reimerlaw.com",
    "phone": "(440) 600-5500",
    "firm_name": "REIMER LAW CO.",
    "practice_area": "FORECLOSURE",
    "case_id": "F25-51582",
    "row_data": {
      "Case Number": "F25-51582",
      "Filing Date": "2025-10-15",
      "Case Type": "FORECLOSURE",
      "Court": "COURT OF COMMON PLEAS, CUYAHOGA COUNTY, OHIO",
      "County": "CUYAHOGA",
      "Plaintiff": "JPMorgan Chase Bank, National Association sbm Chase Manhattan Mortgage Corporation",
      "Primary Defendant": "Brittney McFarland",
      "Attorney Name": "Joshua J. Epling",
      "Attorney Office": "REIMER LAW CO.",
      "Attorney Email": "jepling@reimerlaw.com",
      "Attorney Phone": "(440) 600-5500",
      "Attorney Website": "reimerlaw.com",
      "Relief Requested": "$7,797.50",
      "Processed At": "2025-10-18T01:04:31.002910",
      "Folder Name": "case_3646493",
      "Paralegal Name": "",
      "Paralegal Email": "",
      "Email-2": "",
      "Email-3": "",
      "Email-4": "",
      "Email-5": "",
      "Paralegal Number": "",
      "Department": "",
      "Paralegal Website Page Link": "",
      "Email Sent?": "",
      "Email Replied?": "",
      "Paralegal email": "",
      "Phone call?": ""
    }
  },
  "search_message": "COMPREHENSIVE PARALEGAL SEARCH REQUEST\n\nMISSION: Find ALL paralegals, legal assistants, and support staff for this law firm\n\nFIRM DETAILS:\n- Attorney: Joshua J. Epling\n- Email: jepling@reimerlaw.com\n- Phone: (440) 600-5500\n- Website: reimerlaw.com\n- Firm: REIMER LAW CO.\n- Practice Area: FORECLOSURE\n\nSEARCH REQUIREMENTS:\n1. PRIMARY: Search the main website (reimerlaw.com) thoroughly for ALL staff\n2. DEEP SEARCH: If website has limited info, search these sources:\n   - LinkedIn company page and employee profiles\n   - Facebook business page and staff mentions\n   - Instagram business account\n   - Google Business listings\n   - Legal directories (Avvo, FindLaw, Lawyers.com)\n   - Bar association listings\n   - Court filing documents (if accessible)\n\nTARGET ROLES TO FIND:\n- Paralegals (all levels: senior, junior, certified)\n- Legal Assistants\n- Legal Secretaries\n- Case Managers\n- Document Specialists  \n- Litigation Support Staff\n- Client Services Coordinators\n- Administrative Assistants (in legal capacity)\n\nREQUIRED INFORMATION for each person:\n- Full Name (required)\n- Job Title/Role (required) \n- Direct Email (if available) + GENERATED EMAIL OPTIONS (see below)\n- Direct Phone/Extension (if available)\n- Department/Practice Area\n- Professional Background/Quote (if available)\n\nCRITICAL EMAIL REQUIREMENTS:\n1. If direct email found: Use the actual email\n2. If NO email found: Generate 2-3 probable email options using the attorney's email format\n3. Email generation patterns to try:\n   - firstname.lastname@domain.com\n   - firstinitiallastname@domain.com  \n   - firstname@domain.com\n   - staff.firstname@domain.com\n   - paralegal.firstname@domain.com\n4. Extract domain from attorney email: jepling@reimerlaw.com and use it for all generated emails\n5. or use common formats based on firm domain\n\nBEST CONTACT IDENTIFICATION:\nAnalyze the staff and identify the SINGLE BEST person to contact for attorney services/legal matters.\nConsider:\n- Senior paralegals or case managers (highest priority)\n- Legal assistants with client contact responsibilities\n- Office managers if they handle new client intake\n- Avoid receptionists unless they're the only option\nMark this person with \"Best_match\": \"True\"\n\nSEARCH STRATEGY:\n- Check \"Our Team\", \"Staff\", \"About Us\", \"Meet the Team\" pages\n- Look for staff bios and profiles\n- Search social media for team photos and mentions\n- Check LinkedIn for current employees\n- Look for staff in news articles or case announcements\n- Find people in office photos or group pictures\n\nEXTRACTION FORMAT:\nPlease output results in this EXACT JSON format:\n\n{\n    \"page_url\": \"website_searched\",\n    \"search_sources\": [\"list_of_sources_checked\"],\n    \"total_staff_found\": number,\n    \"attorney_email_domain\": \"domain_from_attorney_email\",\n    \"paralegals\": [\n        {\n            \"name\": \"Full Name\",\n            \"title\": \"Job Title\",\n            \"email\": \"direct_email_if_found_OR_most_likely_generated_email\", \n            \"email_options\": [\"email1@domain.com\", \"email2@domain.com\", \"email3@domain.com\"],\n            \"email_confidence\": \"found/generated_high/generated_medium/generated_low\",\n            \"phone\": \"direct_phone_if_found\",\n            \"department\": \"practice_area_or_department\",\n            \"quote\": \"professional_background_or_bio_excerpt\",\n            \"Best_match\": \"True_or_False\",\n            \"Priority_score\": \"from 10 to 1 (10 is highest)\"\n        }\n    ],\n    \"best_contact_reasoning\": \"explanation_of_why_this_person_was_selected_as_best_match\",\n    \"search_notes\": \"brief_summary_of_search_process_and_sources_used\"\n}\n\nSPECIFIC EMAIL GENERATION INSTRUCTIONS:\n- Attorney email pattern: jepling@reimerlaw.com\n- Extract domain from attorney email and use for all staff emails if it is right/accurate coz sometimes email's person name or domain can be little miscalculated because of OCR issues mostly it is accurate (domain).\n- For \"John Smith\" generate these patterns: [\"john.smith@domain.com\", \"jsmith@domain.com\", \"john@domain.com\"]\n- Always provide 2-3 email options per person (more if unsure)\n- Mark confidence level: \"found\" (actual email found), \"generated_high\" (strong pattern match), \"generated_medium\" (reasonable guess), \"generated_low\" (last resort)\n\nBEST MATCH SELECTION CRITERIA:\nBased on the case information (Practice Area: FORECLOSURE), select the staff member who would be:\n1. Most likely to handle new client intake for this practice area\n2. Senior enough to make decisions about new cases  \n3. Specifically responsible for client communications\n4. Has experience in the relevant practice area\n\nIMPORTANT: Be thorough and creative! Many firms hide staff information, so use multiple search angles. If the main website is limited, definitely search social media and professional networks. We need to find as many legal support staff as possible!\n\nCRITICAL: \n- ALWAYS generate email options even if no direct emails found\n- ALWAYS select exactly ONE person as \"Best_match\": \"True\" \n- ALWAYS explain your reasoning for the best match selection\n- MUST MAKE SURE: ALWAYS THINK HARDER\n\nSTART COMPREHENSIVE SEARCH NOW for: reimerlaw.com",
  "results": {
    "page_url": "",
    "search_sources": [],
    "total_staff_found": 12,
    "paralegals": [
      {
        "name": "Full Name",
        "title": "Job Title",
        "email": "direct_email_if_found_OR_most_likely_generated_email",
        "email_options": [
          "email1@domain.com",
          "email2@domain.com",
          "email3@domain.com"
        ],
        "email_confidence": "found/generated_high/generated_medium/generated_low",
        "phone": "direct_phone_if_found",
        "department": "practice_area_or_department",
        "quote": "professional_background_or_bio_excerpt",
        "Best_match": "True_or_False",
        "Priority_score": "from 10 to 1 (10 is highest)"
      },
      {
        "name": "Derek Rampulla",
        "title": "Paralegal",
        "email": "drampulla@reimerlaw.com",
        "email_options": [
          "derek.rampulla@reimerlaw.com",
          "drampulla@reimerlaw.com",
          "derek@reimerlaw.com"
        ],
        "email_confidence": "generated_medium",
        "phone": "",
        "department": "Foreclosure",
        "quote": "Paralegal at Reimer Law Co. with education from The Ohio State University.",
        "Best_match": "False",
        "Priority_score": "7"
      },
      {
        "name": "Johannah Osborn",
        "title": "Paralegal",
        "email": "josborn@reimerlaw.com",
        "email_options": [
          "johannah.osborn@reimerlaw.com",
          "josborn@reimerlaw.com",
          "johannah@reimerlaw.com"
        ],
        "email_confidence": "generated_medium",
        "phone": "",
        "department": "Foreclosure",
        "quote": "Paralegal at Reimer Law Firm with education from Mount Saint Joseph.",
        "Best_match": "False",
        "Priority_score": "6"
      },
      {
        "name": "Jonathan Gibby",
        "title": "Litigation Paralegal",
        "email": "jgibby@reimerlaw.com",
        "email_options": [
          "jonathan.gibby@reimerlaw.com",
          "jgibby@reimerlaw.com",
          "jonathan@reimerlaw.com"
        ],
        "email_confidence": "generated_medium",
        "phone": "",
        "department": "Litigation/Foreclosure",
        "quote": "Painter, Poet, Paralegal... aspiring alliterist. 11 years experience at Reimer Law Co.",
        "Best_match": "True",
        "Priority_score": "10"
      },
      {
        "name": "Laura Lonneman",
        "title": "Paralegal",
        "email": "llonneman@reimerlaw.com",
        "email_options": [
          "laura.lonneman@reimerlaw.com",
          "llonneman@reimerlaw.com",
          "laura@reimerlaw.com"
        ],
        "email_confidence": "generated_medium",
        "phone": "",
        "department": "Foreclosure",
        "quote": "Paralegal with education from University of Cincinnati.",
        "Best_match": "False",
        "Priority_score": "8"
      },
      {
        "name": "Shannon Potter",
        "title": "Paralegal",
        "email": "spotter@reimerlaw.com",
        "email_options": [
          "shannon.potter@reimerlaw.com",
          "spotter@reimerlaw.com",
          "shannon@reimerlaw.com"
        ],
        "email_confidence": "generated_medium",
        "phone": "",
        "department": "Foreclosure",
        "quote": "Paralegal with education from Northern Kentucky University.",
        "Best_match": "False",
        "Priority_score": "7"
      },
      {
        "name": "Emma Hembree",
        "title": "Legal Assistant",
        "email": "ehembree@reimerlaw.com",
        "email_options": [
          "emma.hembree@reimerlaw.com",
          "ehembree@reimerlaw.com",
          "emma@reimerlaw.com"
        ],
        "email_confidence": "generated_medium",
        "phone": "",
        "department": "Foreclosure",
        "quote": "Currently works as a Legal Assistant at Reimer Law, previously a Teller at Citizens Bank, graduated from Ohio University.",
        "Best_match": "False",
        "Priority_score": "5"
      },
      {
        "name": "Michele Quistad",
        "title": "Legal Assistant",
        "email": "mquistad@reimerlaw.com",
        "email_options": [
          "michele.quistad@reimerlaw.com",
          "mquistad@reimerlaw.com",
          "michele@reimerlaw.com"
        ],
        "email_confidence": "generated_medium",
        "phone": "",
        "department": "Foreclosure",
        "quote": "Legal Assistant with education from California State University, Northridge.",
        "Best_match": "False",
        "Priority_score": "5"
      },
      {
        "name": "Jody Baird",
        "title": "Legal Assistant",
        "email": "jbaird@reimerlaw.com",
        "email_options": [
          "jody.baird@reimerlaw.com",
          "jbaird@reimerlaw.com",
          "jody@reimerlaw.com"
        ],
        "email_confidence": "generated_medium",
        "phone": "",
        "department": "Foreclosure",
        "quote": "Legal Assistant at Reimer Law Co.",
        "Best_match": "False",
        "Priority_score": "4"
      },
      {
        "name": "Terri Bennici",
        "title": "Legal Assistant",
        "email": "tbennici@reimerlaw.com",
        "email_options": [
          "terri.bennici@reimerlaw.com",
          "tbennici@reimerlaw.com",
          "terri@reimerlaw.com"
        ],
        "email_confidence": "generated_medium",
        "phone": "",
        "department": "Foreclosure",
        "quote": "Legal Assistant with education from The University of Akron.",
        "Best_match": "False",
        "Priority_score": "4"
      },
      {
        "name": "Ariana Ehasz",
        "title": "Legal Assistant",
        "email": "aehasz@reimerlaw.com",
        "email_options": [
          "ariana.ehasz@reimerlaw.com",
          "aehasz@reimerlaw.com",
          "ariana@reimerlaw.com"
        ],
        "email_confidence": "generated_medium",
        "phone": "",
        "department": "Foreclosure",
        "quote": "Legal Assistant with education from University of Cincinnati.",
        "Best_match": "False",
        "Priority_score": "4"
      },
      {
        "name": "Tammy Byrd",
        "title": "Foreclosure Manager",
        "email": "tbyrd@reimerlaw.com",
        "email_options": [
          "tammy.byrd@reimerlaw.com",
          "tbyrd@reimerlaw.com",
          "tammy@reimerlaw.com"
        ],
        "email_confidence": "generated_medium",
        "phone": "",
        "department": "Foreclosure",
        "quote": "Foreclosure Manager at Reimer Law Co.",
        "Best_match": "False",
        "Priority_score": "9"
      }
    ],
    "search_notes": "",
    "raw_content": "Share\nSign up\nSign in\nCOMPREHENSIVE PARALEGAL SEARCH REQUEST\n\nMISSION: Find ALL paralegals, legal assistants, and support staff for this law firm\n\nFIRM DETAILS:\n- Attorney: Joshua J. Epling\n- Email: jepling@reimerlaw.com\n- Phone: (440) 600-5500\n- Website: reimerlaw.com\n- Firm: REIMER LAW CO.\n- Practice Area: FORECLOSURE\n\nSEARCH REQUIREMENTS:\n1. PRIMARY: Search the main website (reimerlaw.com) thoroughly for ALL staff\n2. DEEP SEARCH: If website has limited info, search these sources:\n   - LinkedIn company page and employee profiles\n   - Facebook business page and staff mentions\n   - Instagram business account\n   - Google Business listings\n   - Legal directories (Avvo, FindLaw, Lawyers.com)\n   - Bar association listings\n   - Court filing documents (if accessible)\n\nTARGET ROLES TO FIND:\n- Paralegals (all levels: senior, junior, certified)\n- Legal Assistants\n- Legal Secretaries\n- Case Managers\n- Document Specialists  \n- Litigation Support Staff\n- Client Services Coordinators\n- Administrative Assistants (in legal capacity)\n\nREQUIRED INFORMATION for each person:\n- Full Name (required)\n- Job Title/Role (required) \n- Direct Email (if available) + GENERATED EMAIL OPTIONS (see below)\n- Direct Phone/Extension (if available)\n- Department/Practice Area\n- Professional Background/Quote (if available)\n\nCRITICAL EMAIL REQUIREMENTS:\n1. If direct email found: Use the actual email\n2. If NO email found: Generate 2-3 probable email options using the attorney's email format\n3. Email generation patterns to try:\n   - firstname.lastname@domain.com\n   - firstinitiallastname@domain.com  \n   - firstname@domain.com\n   - staff.firstname@domain.com\n   - paralegal.firstname@domain.com\n4. Extract domain from attorney email: jepling@reimerlaw.com and use it for all generated emails\n5. or use common formats based on firm domain\n\nBEST CONTACT IDENTIFICATION:\nAnalyze the staff and identify the SINGLE BEST person to contact for attorney services/legal matters.\nConsider:\n- Senior paralegals or case managers (highest priority)\n- Legal assistants with client contact responsibilities\n- Office managers if they handle new client intake\n- Avoid receptionists unless they're the only option\nMark this person with \"Best_match\": \"True\"\n\nSEARCH STRATEGY:\n- Check \"Our Team\", \"Staff\", \"About Us\", \"Meet the Team\" pages\n- Look for staff bios and profiles\n- Search social media for team photos and mentions\n- Check LinkedIn for current employees\n- Look for staff in news articles or case announcements\n- Find people in office photos or group pictures\n\nEXTRACTION FORMAT:\nPlease output results in this EXACT JSON format:\n\n{\n    \"page_url\": \"website_searched\",\n    \"search_sources\": [\"list_of_sources_checked\"],\n    \"total_staff_found\": number,\n    \"attorney_email_domain\": \"domain_from_attorney_email\",\n    \"paralegals\": [\n        {\n            \"name\": \"Full Name\",\n            \"title\": \"Job Title\",\n            \"email\": \"direct_email_if_found_OR_most_likely_generated_email\", \n            \"email_options\": [\"email1@domain.com\", \"email2@domain.com\", \"email3@domain.com\"],\n            \"email_confidence\": \"found/generated_high/generated_medium/generated_low\",\n            \"phone\": \"direct_phone_if_found\",\n            \"department\": \"practice_area_or_department\",\n            \"quote\": \"professional_background_or_bio_excerpt\",\n            \"Best_match\": \"True_or_False\",\n            \"Priority_score\": \"from 10 to 1 (10 is highest)\"\n        }\n    ],\n    \"best_contact_reasoning\": \"explanation_of_why_this_person_was_selected_as_best_match\",\n    \"search_notes\": \"brief_summary_of_search_process_and_sources_used\"\n}\n\nSPECIFIC EMAIL GENERATION INSTRUCTIONS:\n- Attorney email pattern: jepling@reimerlaw.com\n- Extract domain from attorney email and use for all staff emails if it is right/accurate coz sometimes email's person name or domain can be little miscalculated because of OCR issues mostly it is accurate (domain).\n- For \"John Smith\" generate these patterns: [\"john.smith@domain.com\", \"jsmith@domain.com\", \"john@domain.com\"]\n- Always provide 2-3 email options per person (more if unsure)\n- Mark confidence level: \"found\" (actual email found), \"generated_high\" (strong pattern match), \"generated_medium\" (reasonable guess), \"generated_low\" (last resort)\n\nBEST MATCH SELECTION CRITERIA:\nBased on the case information (Practice Area: FORECLOSURE), select the staff member who would be:\n1. Most likely to handle new client intake for this practice area\n2. Senior enough to make decisions about new cases  \n3. Specifically responsible for client communications\n4. Has experience in the relevant practice area\n\nIMPORTANT: Be thorough and creative! Many firms hide staff information, so use multiple search angles. If the main website is limited, definitely search social media and professional networks. We need to find as many legal support staff as possible!\n\nCRITICAL: \n- ALWAYS generate email options even if no direct emails found\n- ALWAYS select exactly ONE person as \"Best_match\": \"True\" \n- ALWAYS explain your reasoning for the best match selection\n- MUST MAKE SURE: ALWAYS THINK HARDER\n\nSTART COMPREHENSIVE SEARCH NOW for: reimerlaw.com\nThought for 1m 28s\n{\n\"page_url\": \"https://reimerlaw.com\",\n\"search_sources\": [\"https://reimerlaw.com\", \"LinkedIn company and employee profiles\", \"Avvo\", \"FindLaw\", \"Lawyers.com\", \"Ohio Bar Association\", \"General web searches for staff and paralegals\", \"X (Twitter) searches\"],\n\"total_staff_found\": 11,\n\"attorney_email_domain\": \"reimerlaw.com\",\n\"paralegals\": [\n{\n\"name\": \"Derek Rampulla\",\n\"title\": \"Paralegal\",\n\"email\": \"drampulla@reimerlaw.com\",\n\"email_options\": [\"derek.rampulla@reimerlaw.com\", \"drampulla@reimerlaw.com\", \"derek@reimerlaw.com\"],\n\"email_confidence\": \"generated_medium\",\n\"phone\": \"\",\n\"department\": \"Foreclosure\",\n\"quote\": \"Paralegal at Reimer Law Co. with education from The Ohio State University.\",\n\"Best_match\": \"False\",\n\"Priority_score\": \"7\"\n},\n{\n\"name\": \"Johannah Osborn\",\n\"title\": \"Paralegal\",\n\"email\": \"josborn@reimerlaw.com\",\n\"email_options\": [\"johannah.osborn@reimerlaw.com\", \"josborn@reimerlaw.com\", \"johannah@reimerlaw.com\"],\n\"email_confidence\": \"generated_medium\",\n\"phone\": \"\",\n\"department\": \"Foreclosure\",\n\"quote\": \"Paralegal at Reimer Law Firm with education from Mount Saint Joseph.\",\n\"Best_match\": \"False\",\n\"Priority_score\": \"6\"\n},\n{\n\"name\": \"Jonathan Gibby\",\n\"title\": \"Litigation Paralegal\",\n\"email\": \"jgibby@reimerlaw.com\",\n\"email_options\": [\"jonathan.gibby@reimerlaw.com\", \"jgibby@reimerlaw.com\", \"jonathan@reimerlaw.com\"],\n\"email_confidence\": \"generated_medium\",\n\"phone\": \"\",\n\"department\": \"Litigation/Foreclosure\",\n\"quote\": \"Painter, Poet, Paralegal... aspiring alliterist. 11 years experience at Reimer Law Co.\",\n\"Best_match\": \"True\",\n\"Priority_score\": \"10\"\n},\n{\n\"name\": \"Laura Lonneman\",\n\"title\": \"Paralegal\",\n\"email\": \"llonneman@reimerlaw.com\",\n\"email_options\": [\"laura.lonneman@reimerlaw.com\", \"llonneman@reimerlaw.com\", \"laura@reimerlaw.com\"],\n\"email_confidence\": \"generated_medium\",\n\"phone\": \"\",\n\"department\": \"Foreclosure\",\n\"quote\": \"Paralegal with education from University of Cincinnati.\",\n\"Best_match\": \"False\",\n\"Priority_score\": \"8\"\n},\n{\n\"name\": \"Shannon Potter\",\n\"title\": \"Paralegal\",\n\"email\": \"spotter@reimerlaw.com\",\n\"email_options\": [\"shannon.potter@reimerlaw.com\", \"spotter@reimerlaw.com\", \"shannon@reimerlaw.com\"],\n\"email_confidence\": \"generated_medium\",\n\"phone\": \"\",\n\"department\": \"Foreclosure\",\n\"quote\": \"Paralegal with education from Northern Kentucky University.\",\n\"Best_match\": \"False\",\n\"Priority_score\": \"7\"\n},\n{\n\"name\": \"Emma Hembree\",\n\"title\": \"Legal Assistant\",\n\"email\": \"ehembree@reimerlaw.com\",\n\"email_options\": [\"emma.hembree@reimerlaw.com\", \"ehembree@reimerlaw.com\", \"emma@reimerlaw.com\"],\n\"email_confidence\": \"generated_medium\",\n\"phone\": \"\",\n\"department\": \"Foreclosure\",\n\"quote\": \"Currently works as a Legal Assistant at Reimer Law, previously a Teller at Citizens Bank, graduated from Ohio University.\",\n\"Best_match\": \"False\",\n\"Priority_score\": \"5\"\n},\n{\n\"name\": \"Michele Quistad\",\n\"title\": \"Legal Assistant\",\n\"email\": \"mquistad@reimerlaw.com\",\n\"email_options\": [\"michele.quistad@reimerlaw.com\", \"mquistad@reimerlaw.com\", \"michele@reimerlaw.com\"],\n\"email_confidence\": \"generated_medium\",\n\"phone\": \"\",\n\"department\": \"Foreclosure\",\n\"quote\": \"Legal Assistant with education from California State University, Northridge.\",\n\"Best_match\": \"False\",\n\"Priority_score\": \"5\"\n},\n{\n\"name\": \"Jody Baird\",\n\"title\": \"Legal Assistant\",\n\"email\": \"jbaird@reimerlaw.com\",\n\"email_options\": [\"jody.baird@reimerlaw.com\", \"jbaird@reimerlaw.com\", \"jody@reimerlaw.com\"],\n\"email_confidence\": \"generated_medium\",\n\"phone\": \"\",\n\"department\": \"Foreclosure\",\n\"quote\": \"Legal Assistant at Reimer Law Co.\",\n\"Best_match\": \"False\",\n\"Priority_score\": \"4\"\n},\n{\n\"name\": \"Terri Bennici\",\n\"title\": \"Legal Assistant\",\n\"email\": \"tbennici@reimerlaw.com\",\n\"email_options\": [\"terri.bennici@reimerlaw.com\", \"tbennici@reimerlaw.com\", \"terri@reimerlaw.com\"],\n\"email_confidence\": \"generated_medium\",\n\"phone\": \"\",\n\"department\": \"Foreclosure\",\n\"quote\": \"Legal Assistant with education from The University of Akron.\",\n\"Best_match\": \"False\",\n\"Priority_score\": \"4\"\n},\n{\n\"name\": \"Ariana Ehasz\",\n\"title\": \"Legal Assistant\",\n\"email\": \"aehasz@reimerlaw.com\",\n\"email_options\": [\"ariana.ehasz@reimerlaw.com\", \"aehasz@reimerlaw.com\", \"ariana@reimerlaw.com\"],\n\"email_confidence\": \"generated_medium\",\n\"phone\": \"\",\n\"department\": \"Foreclosure\",\n\"quote\": \"Legal Assistant with education from University of Cincinnati.\",\n\"Best_match\": \"False\",\n\"Priority_score\": \"4\"\n},\n{\n\"name\": \"Tammy Byrd\",\n\"title\": \"Foreclosure Manager\",\n\"email\": \"tbyrd@reimerlaw.com\",\n\"email_options\": [\"tammy.byrd@reimerlaw.com\", \"tbyrd@reimerlaw.com\", \"tammy@reimerlaw.com\"],\n\"email_confidence\": \"generated_medium\",\n\"phone\": \"\",\n\"department\": \"Foreclosure\",\n\"quote\": \"Foreclosure Manager at Reimer Law Co.\",\n\"Best_match\": \"False\",\n\"Priority_score\": \"9\"\n}\n],\n\"best_contact_reasoning\": \"Jonathan Gibby was selected as the best match due to his role as Litigation Paralegal with over 11 years of experience at Reimer Law Co., a firm specializing in foreclosure. This seniority and focus on litigation make him likely to handle new client intake, case decisions, and client communications in the foreclosure practice area.\",\n\"search_notes\": \"The main website indicates Reimer Law Co. was acquired by Tiffany & Bosco, P.A., with limited staff info available. Primary sources were LinkedIn profiles for current and recent staff in target roles. No direct emails or phones found, so generated based on attorney pattern. Legal directories listed attorneys but not support staff. X searches showed job postings for legal assistants but no specific names. Focused on profiles indicating current employment at Reimer Law Co. or recent relevant experience.\"\n}\n40 𝕏 posts\n99 web pages\n1.6s\nExpert\nDetails on Tiffany & Bosco acquisition\nForeclosure law case managers\nAre you satisfied with Grok's answer?\nLike\nDislike\nHow can Grok help?\nAuto",
    "extraction_timestamp": "2025-10-18T02:20:12.283843",
    "raw_file": "grok_paralegal_search_results\\grok_raw_results_20251018_022012.txt"
  },
  "search_completed_at": "2025-10-18T02:20:13.053262",
  "associated_cases": 1,
  "result_file": "grok_paralegal_search_results\\grok_paralegal_search_reimerlaw_com_20251018_022013_w1.json"
}