{
  "domain": "lawdonnell.com",
  "search_url": "lawdonnell.com",
  "attorney_info": {
    "original_website": "lawdonnell.com",
    "attorney_name": "Titus G. Donnell",
    "attorney_email": "titus@lawdonnell.com",
    "phone": "614.420.4966",
    "firm_name": "THE DONNELL LAW GROUP LLC",
    "practice_area": "DEBT_COLLECTION",
    "case_id": "",
    "row_data": {
      "Case Number": "",
      "Filing Date": "",
      "Case Type": "DEBT_COLLECTION",
      "Court": "CUYAHOGA COUNTY, OHIO COURT OF COMMON PLEAS CIVIL DIVISION",
      "County": "CUYAHOGA",
      "Plaintiff": "Streetsboro Opco LLC DBA Arbors at Streetsboro",
      "Primary Defendant": "Paul Smith",
      "Attorney Name": "Titus G. Donnell",
      "Attorney Office": "THE DONNELL LAW GROUP LLC",
      "Attorney Email": "titus@lawdonnell.com",
      "Attorney Phone": "614.420.4966",
      "Attorney Website": "lawdonnell.com",
      "Relief Requested": "$145,060.00",
      "Processed At": "2025-10-18T01:04:31.850830",
      "Folder Name": "case_3647288",
      "Paralegal Name": "",
      "Paralegal Email": "",
      "Email-2": "",
      "Email-3": "",
      "Email-4": "",
      "Email-5": "",
      "Paralegal Number": "",
      "Department": "",
      "Paralegal Website Page Link": "",
      "Email Sent?": "",
      "Email Replied?": "",
      "Paralegal email": "",
      "Phone call?": ""
    }
  },
  "search_message": "COMPREHENSIVE PARALEGAL SEARCH REQUEST\n\nMISSION: Find ALL paralegals, legal assistants, and support staff for this law firm\n\nFIRM DETAILS:\n- Attorney: Titus G. Donnell\n- Email: titus@lawdonnell.com\n- Phone: 614.420.4966\n- Website: lawdonnell.com\n- Firm: THE DONNELL LAW GROUP LLC\n- Practice Area: DEBT_COLLECTION\n\nSEARCH REQUIREMENTS:\n1. PRIMARY: Search the main website (lawdonnell.com) thoroughly for ALL staff\n2. DEEP SEARCH: If website has limited info, search these sources:\n   - LinkedIn company page and employee profiles\n   - Facebook business page and staff mentions\n   - Instagram business account\n   - Google Business listings\n   - Legal directories (Avvo, FindLaw, Lawyers.com)\n   - Bar association listings\n   - Court filing documents (if accessible)\n\nTARGET ROLES TO FIND:\n- Paralegals (all levels: senior, junior, certified)\n- Legal Assistants\n- Legal Secretaries\n- Case Managers\n- Document Specialists  \n- Litigation Support Staff\n- Client Services Coordinators\n- Administrative Assistants (in legal capacity)\n\nREQUIRED INFORMATION for each person:\n- Full Name (required)\n- Job Title/Role (required) \n- Direct Email (if available) + GENERATED EMAIL OPTIONS (see below)\n- Direct Phone/Extension (if available)\n- Department/Practice Area\n- Professional Background/Quote (if available)\n\nCRITICAL EMAIL REQUIREMENTS:\n1. If direct email found: Use the actual email\n2. If NO email found: Generate 2-3 probable email options using the attorney's email format\n3. Email generation patterns to try:\n   - firstname.lastname@domain.com\n   - firstinitiallastname@domain.com  \n   - firstname@domain.com\n   - staff.firstname@domain.com\n   - paralegal.firstname@domain.com\n4. Extract domain from attorney email: titus@lawdonnell.com and use it for all generated emails\n5. or use common formats based on firm domain\n\nBEST CONTACT IDENTIFICATION:\nAnalyze the staff and identify the SINGLE BEST person to contact for attorney services/legal matters.\nConsider:\n- Senior paralegals or case managers (highest priority)\n- Legal assistants with client contact responsibilities\n- Office managers if they handle new client intake\n- Avoid receptionists unless they're the only option\nMark this person with \"Best_match\": \"True\"\n\nSEARCH STRATEGY:\n- Check \"Our Team\", \"Staff\", \"About Us\", \"Meet the Team\" pages\n- Look for staff bios and profiles\n- Search social media for team photos and mentions\n- Check LinkedIn for current employees\n- Look for staff in news articles or case announcements\n- Find people in office photos or group pictures\n\nEXTRACTION FORMAT:\nPlease output results in this EXACT JSON format:\n\n{\n    \"page_url\": \"website_searched\",\n    \"search_sources\": [\"list_of_sources_checked\"],\n    \"total_staff_found\": number,\n    \"attorney_email_domain\": \"domain_from_attorney_email\",\n    \"paralegals\": [\n        {\n            \"name\": \"Full Name\",\n            \"title\": \"Job Title\",\n            \"email\": \"direct_email_if_found_OR_most_likely_generated_email\", \n            \"email_options\": [\"email1@domain.com\", \"email2@domain.com\", \"email3@domain.com\"],\n            \"email_confidence\": \"found/generated_high/generated_medium/generated_low\",\n            \"phone\": \"direct_phone_if_found\",\n            \"department\": \"practice_area_or_department\",\n            \"quote\": \"professional_background_or_bio_excerpt\",\n            \"Best_match\": \"True_or_False\",\n            \"Priority_score\": \"from 10 to 1 (10 is highest)\"\n        }\n    ],\n    \"best_contact_reasoning\": \"explanation_of_why_this_person_was_selected_as_best_match\",\n    \"search_notes\": \"brief_summary_of_search_process_and_sources_used\"\n}\n\nSPECIFIC EMAIL GENERATION INSTRUCTIONS:\n- Attorney email pattern: titus@lawdonnell.com\n- Extract domain from attorney email and use for all staff emails if it is right/accurate coz sometimes email's person name or domain can be little miscalculated because of OCR issues mostly it is accurate (domain).\n- For \"John Smith\" generate these patterns: [\"john.smith@domain.com\", \"jsmith@domain.com\", \"john@domain.com\"]\n- Always provide 2-3 email options per person (more if unsure)\n- Mark confidence level: \"found\" (actual email found), \"generated_high\" (strong pattern match), \"generated_medium\" (reasonable guess), \"generated_low\" (last resort)\n\nBEST MATCH SELECTION CRITERIA:\nBased on the case information (Practice Area: DEBT_COLLECTION), select the staff member who would be:\n1. Most likely to handle new client intake for this practice area\n2. Senior enough to make decisions about new cases  \n3. Specifically responsible for client communications\n4. Has experience in the relevant practice area\n\nIMPORTANT: Be thorough and creative! Many firms hide staff information, so use multiple search angles. If the main website is limited, definitely search social media and professional networks. We need to find as many legal support staff as possible!\n\nCRITICAL: \n- ALWAYS generate email options even if no direct emails found\n- ALWAYS select exactly ONE person as \"Best_match\": \"True\" \n- ALWAYS explain your reasoning for the best match selection\n- MUST MAKE SURE: ALWAYS THINK HARDER\n\nSTART COMPREHENSIVE SEARCH NOW for: lawdonnell.com",
  "results": {
    "page_url": "https://lawdonnell.com",
    "search_sources": [
      "https://lawdonnell.com",
      "https://www.lawdonnell.com",
      "https://www.linkedin.com/company/donnellthomaslaw",
      "https://www.linkedin.com/in/titus-donnell-a3519739",
      "https://www.facebook.com/lawdonnell/",
      "https://www.avvo.com/attorneys/43215-oh-titus-donnell-1939571.html",
      "https://lawyers.findlaw.com/profile/view/4864182_1",
      "https://rthomaslaw.com",
      "https://www.linkedin.com/in/kellee-dehainaut-723b764b",
      "Web searches for LinkedIn, Facebook, Instagram, Google Business, Avvo, FindLaw, Lawyers.com, Ohio Bar, staff, employees, paralegals",
      "X keyword and semantic searches",
      "Web searches for court filings and debt collection cases"
    ],
    "total_staff_found": 1,
    "paralegals": [
      {
        "name": "Full Name",
        "title": "Job Title",
        "email": "direct_email_if_found_OR_most_likely_generated_email",
        "phone": "direct_phone_if_found",
        "department": "practice_area_or_department",
        "quote": "professional_background_or_bio_excerpt"
      }
    ],
    "search_notes": "Conducted comprehensive searches including browsing the firm website (fetch unsuccessful, possibly inactive), LinkedIn company and personal profiles, Facebook page, legal directories (Avvo, FindLaw, Lawyers.com), Ohio State Bar Association, general web searches for staff and employees, X (Twitter) searches for mentions, and queries for court filings related to debt collection. The firm appears to be a small boutique operation led by partners Titus Donnell and Ryan Thomas, specializing in civil litigation, criminal defense, personal injury, and potentially debt collection, but no public information on paralegals or support staff was found. Firm size estimated at 2-10 employees, but no specific names or details available.",
    "raw_content": "Share\nSign up\nSign in\nCOMPREHENSIVE PARALEGAL SEARCH REQUEST\n\nMISSION: Find ALL paralegals, legal assistants, and support staff for this law firm\n\nFIRM DETAILS:\n- Attorney: Titus G. Donnell\n- Email: titus@lawdonnell.com\n- Phone: 614.420.4966\n- Website: lawdonnell.com\n- Firm: THE DONNELL LAW GROUP LLC\n- Practice Area: DEBT_COLLECTION\n\nSEARCH REQUIREMENTS:\n1. PRIMARY: Search the main website (lawdonnell.com) thoroughly for ALL staff\n2. DEEP SEARCH: If website has limited info, search these sources:\n   - LinkedIn company page and employee profiles\n   - Facebook business page and staff mentions\n   - Instagram business account\n   - Google Business listings\n   - Legal directories (Avvo, FindLaw, Lawyers.com)\n   - Bar association listings\n   - Court filing documents (if accessible)\n\nTARGET ROLES TO FIND:\n- Paralegals (all levels: senior, junior, certified)\n- Legal Assistants\n- Legal Secretaries\n- Case Managers\n- Document Specialists  \n- Litigation Support Staff\n- Client Services Coordinators\n- Administrative Assistants (in legal capacity)\n\nREQUIRED INFORMATION for each person:\n- Full Name (required)\n- Job Title/Role (required) \n- Direct Email (if available) + GENERATED EMAIL OPTIONS (see below)\n- Direct Phone/Extension (if available)\n- Department/Practice Area\n- Professional Background/Quote (if available)\n\nCRITICAL EMAIL REQUIREMENTS:\n1. If direct email found: Use the actual email\n2. If NO email found: Generate 2-3 probable email options using the attorney's email format\n3. Email generation patterns to try:\n   - firstname.lastname@domain.com\n   - firstinitiallastname@domain.com  \n   - firstname@domain.com\n   - staff.firstname@domain.com\n   - paralegal.firstname@domain.com\n4. Extract domain from attorney email: titus@lawdonnell.com and use it for all generated emails\n5. or use common formats based on firm domain\n\nBEST CONTACT IDENTIFICATION:\nAnalyze the staff and identify the SINGLE BEST person to contact for attorney services/legal matters.\nConsider:\n- Senior paralegals or case managers (highest priority)\n- Legal assistants with client contact responsibilities\n- Office managers if they handle new client intake\n- Avoid receptionists unless they're the only option\nMark this person with \"Best_match\": \"True\"\n\nSEARCH STRATEGY:\n- Check \"Our Team\", \"Staff\", \"About Us\", \"Meet the Team\" pages\n- Look for staff bios and profiles\n- Search social media for team photos and mentions\n- Check LinkedIn for current employees\n- Look for staff in news articles or case announcements\n- Find people in office photos or group pictures\n\nEXTRACTION FORMAT:\nPlease output results in this EXACT JSON format:\n\n{\n    \"page_url\": \"website_searched\",\n    \"search_sources\": [\"list_of_sources_checked\"],\n    \"total_staff_found\": number,\n    \"attorney_email_domain\": \"domain_from_attorney_email\",\n    \"paralegals\": [\n        {\n            \"name\": \"Full Name\",\n            \"title\": \"Job Title\",\n            \"email\": \"direct_email_if_found_OR_most_likely_generated_email\", \n            \"email_options\": [\"email1@domain.com\", \"email2@domain.com\", \"email3@domain.com\"],\n            \"email_confidence\": \"found/generated_high/generated_medium/generated_low\",\n            \"phone\": \"direct_phone_if_found\",\n            \"department\": \"practice_area_or_department\",\n            \"quote\": \"professional_background_or_bio_excerpt\",\n            \"Best_match\": \"True_or_False\",\n            \"Priority_score\": \"from 10 to 1 (10 is highest)\"\n        }\n    ],\n    \"best_contact_reasoning\": \"explanation_of_why_this_person_was_selected_as_best_match\",\n    \"search_notes\": \"brief_summary_of_search_process_and_sources_used\"\n}\n\nSPECIFIC EMAIL GENERATION INSTRUCTIONS:\n- Attorney email pattern: titus@lawdonnell.com\n- Extract domain from attorney email and use for all staff emails if it is right/accurate coz sometimes email's person name or domain can be little miscalculated because of OCR issues mostly it is accurate (domain).\n- For \"John Smith\" generate these patterns: [\"john.smith@domain.com\", \"jsmith@domain.com\", \"john@domain.com\"]\n- Always provide 2-3 email options per person (more if unsure)\n- Mark confidence level: \"found\" (actual email found), \"generated_high\" (strong pattern match), \"generated_medium\" (reasonable guess), \"generated_low\" (last resort)\n\nBEST MATCH SELECTION CRITERIA:\nBased on the case information (Practice Area: DEBT_COLLECTION), select the staff member who would be:\n1. Most likely to handle new client intake for this practice area\n2. Senior enough to make decisions about new cases  \n3. Specifically responsible for client communications\n4. Has experience in the relevant practice area\n\nIMPORTANT: Be thorough and creative! Many firms hide staff information, so use multiple search angles. If the main website is limited, definitely search social media and professional networks. We need to find as many legal support staff as possible!\n\nCRITICAL: \n- ALWAYS generate email options even if no direct emails found\n- ALWAYS select exactly ONE person as \"Best_match\": \"True\" \n- ALWAYS explain your reasoning for the best match selection\n- MUST MAKE SURE: ALWAYS THINK HARDER\n\nSTART COMPREHENSIVE SEARCH NOW for: lawdonnell.com\nThought for 2m 33s\n{\n\"page_url\": \"https://lawdonnell.com\",\n\"search_sources\": [\"https://lawdonnell.com\", \"https://www.lawdonnell.com\", \"https://www.linkedin.com/company/donnellthomaslaw\", \"https://www.linkedin.com/in/titus-donnell-a3519739\", \"https://www.facebook.com/lawdonnell/\", \"https://www.avvo.com/attorneys/43215-oh-titus-donnell-1939571.html\", \"https://lawyers.findlaw.com/profile/view/4864182_1\", \"https://rthomaslaw.com\", \"https://www.linkedin.com/in/kellee-dehainaut-723b764b\", \"Web searches for LinkedIn, Facebook, Instagram, Google Business, Avvo, FindLaw, Lawyers.com, Ohio Bar, staff, employees, paralegals\", \"X keyword and semantic searches\", \"Web searches for court filings and debt collection cases\"],\n\"total_staff_found\": 0,\n\"attorney_email_domain\": \"lawdonnell.com\",\n\"paralegals\": [],\n\"best_contact_reasoning\": \"No paralegals, legal assistants, or support staff were identified despite extensive searches across multiple sources. Therefore, unable to select a best match from the target roles. Recommend contacting the attorney Titus G. Donnell directly for inquiries.\",\n\"search_notes\": \"Conducted comprehensive searches including browsing the firm website (fetch unsuccessful, possibly inactive), LinkedIn company and personal profiles, Facebook page, legal directories (Avvo, FindLaw, Lawyers.com), Ohio State Bar Association, general web searches for staff and employees, X (Twitter) searches for mentions, and queries for court filings related to debt collection. The firm appears to be a small boutique operation led by partners Titus Donnell and Ryan Thomas, specializing in civil litigation, criminal defense, personal injury, and potentially debt collection, but no public information on paralegals or support staff was found. Firm size estimated at 2-10 employees, but no specific names or details available.\"\n}\n12 𝕏 posts\n113 web pages\n1.5s\nExpert\nSearch Ohio Bar staff directory\nCompare with Smitherman Law Group\nMake JSON more concise\nHow can Grok help?\nAuto",
    "extraction_timestamp": "2025-10-18T02:48:17.286373",
    "raw_file": "grok_paralegal_search_results\\grok_raw_results_20251018_024817.txt"
  },
  "search_completed_at": "2025-10-18T02:48:17.333992",
  "associated_cases": 1,
  "result_file": "grok_paralegal_search_results\\grok_paralegal_search_lawdonnell_com_20251018_024817_w0.json"
}