{
  "domain": "216lawyers.com",
  "search_url": "216lawyers.com",
  "attorney_info": {
    "original_website": "216lawyers.com",
    "attorney_name": "ALEXANDER LASZLO PAL",
    "attorney_email": "Apal@216lawyers.com",
    "phone": "(216) 529-9377",
    "firm_name": "OBRAL, SILK & PAL, LLC",
    "practice_area": "PERSONAL_INJURY",
    "case_id": "",
    "row_data": {
      "Case Number": "",
      "Filing Date": "",
      "Case Type": "PERSONAL_INJURY",
      "Court": "COURT OF COMMON PLEAS, CUYAHOGA COUNTY, OHIO",
      "County": "CUYAHOGA",
      "Plaintiff": "SARA LYNN KOPREK and CRAIG KOPREK",
      "Primary Defendant": "TRENT DANIEL DONOVAN",
      "Attorney Name": "ALEXANDER LASZLO PAL",
      "Attorney Office": "OBRAL, SILK & PAL, LLC",
      "Attorney Email": "Apal@216lawyers.com",
      "Attorney Phone": "(216) 529-9377",
      "Attorney Website": "216lawyers.com",
      "Relief Requested": "$25,000.00",
      "Processed At": "2025-10-18T01:04:31.728550",
      "Folder Name": "case_3647166",
      "Paralegal Name": "",
      "Paralegal Email": "",
      "Email-2": "",
      "Email-3": "",
      "Email-4": "",
      "Email-5": "",
      "Paralegal Number": "",
      "Department": "",
      "Paralegal Website Page Link": "",
      "Email Sent?": "",
      "Email Replied?": "",
      "Paralegal email": "",
      "Phone call?": ""
    }
  },
  "search_message": "COMPREHENSIVE PARALEGAL SEARCH REQUEST\n\nMISSION: Find ALL paralegals, legal assistants, and support staff for this law firm\n\nFIRM DETAILS:\n- Attorney: ALEXANDER LASZLO PAL\n- Email: Apal@216lawyers.com\n- Phone: (216) 529-9377\n- Website: 216lawyers.com\n- Firm: OBRAL, SILK & PAL, LLC\n- Practice Area: PERSONAL_INJURY\n\nSEARCH REQUIREMENTS:\n1. PRIMARY: Search the main website (216lawyers.com) thoroughly for ALL staff\n2. DEEP SEARCH: If website has limited info, search these sources:\n   - LinkedIn company page and employee profiles\n   - Facebook business page and staff mentions\n   - Instagram business account\n   - Google Business listings\n   - Legal directories (Avvo, FindLaw, Lawyers.com)\n   - Bar association listings\n   - Court filing documents (if accessible)\n\nTARGET ROLES TO FIND:\n- Paralegals (all levels: senior, junior, certified)\n- Legal Assistants\n- Legal Secretaries\n- Case Managers\n- Document Specialists  \n- Litigation Support Staff\n- Client Services Coordinators\n- Administrative Assistants (in legal capacity)\n\nREQUIRED INFORMATION for each person:\n- Full Name (required)\n- Job Title/Role (required) \n- Direct Email (if available) + GENERATED EMAIL OPTIONS (see below)\n- Direct Phone/Extension (if available)\n- Department/Practice Area\n- Professional Background/Quote (if available)\n\nCRITICAL EMAIL REQUIREMENTS:\n1. If direct email found: Use the actual email\n2. If NO email found: Generate 2-3 probable email options using the attorney's email format\n3. Email generation patterns to try:\n   - firstname.lastname@domain.com\n   - firstinitiallastname@domain.com  \n   - firstname@domain.com\n   - staff.firstname@domain.com\n   - paralegal.firstname@domain.com\n4. Extract domain from attorney email: Apal@216lawyers.com and use it for all generated emails\n5. or use common formats based on firm domain\n\nBEST CONTACT IDENTIFICATION:\nAnalyze the staff and identify the SINGLE BEST person to contact for attorney services/legal matters.\nConsider:\n- Senior paralegals or case managers (highest priority)\n- Legal assistants with client contact responsibilities\n- Office managers if they handle new client intake\n- Avoid receptionists unless they're the only option\nMark this person with \"Best_match\": \"True\"\n\nSEARCH STRATEGY:\n- Check \"Our Team\", \"Staff\", \"About Us\", \"Meet the Team\" pages\n- Look for staff bios and profiles\n- Search social media for team photos and mentions\n- Check LinkedIn for current employees\n- Look for staff in news articles or case announcements\n- Find people in office photos or group pictures\n\nEXTRACTION FORMAT:\nPlease output results in this EXACT JSON format:\n\n{\n    \"page_url\": \"website_searched\",\n    \"search_sources\": [\"list_of_sources_checked\"],\n    \"total_staff_found\": number,\n    \"attorney_email_domain\": \"domain_from_attorney_email\",\n    \"paralegals\": [\n        {\n            \"name\": \"Full Name\",\n            \"title\": \"Job Title\",\n            \"email\": \"direct_email_if_found_OR_most_likely_generated_email\", \n            \"email_options\": [\"email1@domain.com\", \"email2@domain.com\", \"email3@domain.com\"],\n            \"email_confidence\": \"found/generated_high/generated_medium/generated_low\",\n            \"phone\": \"direct_phone_if_found\",\n            \"department\": \"practice_area_or_department\",\n            \"quote\": \"professional_background_or_bio_excerpt\",\n            \"Best_match\": \"True_or_False\",\n            \"Priority_score\": \"from 10 to 1 (10 is highest)\"\n        }\n    ],\n    \"best_contact_reasoning\": \"explanation_of_why_this_person_was_selected_as_best_match\",\n    \"search_notes\": \"brief_summary_of_search_process_and_sources_used\"\n}\n\nSPECIFIC EMAIL GENERATION INSTRUCTIONS:\n- Attorney email pattern: Apal@216lawyers.com\n- Extract domain from attorney email and use for all staff emails if it is right/accurate coz sometimes email's person name or domain can be little miscalculated because of OCR issues mostly it is accurate (domain).\n- For \"John Smith\" generate these patterns: [\"john.smith@domain.com\", \"jsmith@domain.com\", \"john@domain.com\"]\n- Always provide 2-3 email options per person (more if unsure)\n- Mark confidence level: \"found\" (actual email found), \"generated_high\" (strong pattern match), \"generated_medium\" (reasonable guess), \"generated_low\" (last resort)\n\nBEST MATCH SELECTION CRITERIA:\nBased on the case information (Practice Area: PERSONAL_INJURY), select the staff member who would be:\n1. Most likely to handle new client intake for this practice area\n2. Senior enough to make decisions about new cases  \n3. Specifically responsible for client communications\n4. Has experience in the relevant practice area\n\nIMPORTANT: Be thorough and creative! Many firms hide staff information, so use multiple search angles. If the main website is limited, definitely search social media and professional networks. We need to find as many legal support staff as possible!\n\nCRITICAL: \n- ALWAYS generate email options even if no direct emails found\n- ALWAYS select exactly ONE person as \"Best_match\": \"True\" \n- ALWAYS explain your reasoning for the best match selection\n- MUST MAKE SURE: ALWAYS THINK HARDER\n\nSTART COMPREHENSIVE SEARCH NOW for: 216lawyers.com",
  "results": {
    "page_url": "",
    "search_sources": [],
    "total_staff_found": 5,
    "paralegals": [
      {
        "name": "Full Name",
        "title": "Job Title",
        "email": "direct_email_if_found_OR_most_likely_generated_email",
        "email_options": [
          "email1@domain.com",
          "email2@domain.com",
          "email3@domain.com"
        ],
        "email_confidence": "found/generated_high/generated_medium/generated_low",
        "phone": "direct_phone_if_found",
        "department": "practice_area_or_department",
        "quote": "professional_background_or_bio_excerpt",
        "Best_match": "True_or_False",
        "Priority_score": "from 10 to 1 (10 is highest)"
      },
      {
        "name": "Emily Ponti",
        "title": "Case Manager",
        "email": "eponti@216lawyers.com",
        "email_options": [
          "eponti@216lawyers.com",
          "emily.ponti@216lawyers.com",
          "emily@216lawyers.com"
        ],
        "email_confidence": "generated_high",
        "phone": "",
        "department": "Personal Injury",
        "quote": "Jordan and Case Manager Emily Ponti would keep me updated through the whole process.",
        "Best_match": "True",
        "Priority_score": "10"
      },
      {
        "name": "Shannon Smith",
        "title": "Paralegal",
        "email": "ssmith@216lawyers.com",
        "email_options": [
          "ssmith@216lawyers.com",
          "shannon.smith@216lawyers.com",
          "shannon@216lawyers.com"
        ],
        "email_confidence": "generated_high",
        "phone": "",
        "department": "Personal Injury",
        "quote": "Strong work ethic, customer service skills, prepared, coordinated, work extremely well under pressure.",
        "Best_match": "False",
        "Priority_score": "9"
      },
      {
        "name": "Mikayla Davidson",
        "title": "Legal Assistant",
        "email": "mdavidson@216lawyers.com",
        "email_options": [
          "mdavidson@216lawyers.com",
          "mikayla.davidson@216lawyers.com",
          "mikayla@216lawyers.com"
        ],
        "email_confidence": "generated_high",
        "phone": "",
        "department": "Personal Injury",
        "quote": "",
        "Best_match": "False",
        "Priority_score": "7"
      },
      {
        "name": "Linsey Schepis",
        "title": "Legal Marketing Manager",
        "email": "lschepis@216lawyers.com",
        "email_options": [
          "lschepis@216lawyers.com",
          "linsey.schepis@216lawyers.com",
          "linsey@216lawyers.com"
        ],
        "email_confidence": "generated_high",
        "phone": "",
        "department": "Personal Injury",
        "quote": "",
        "Best_match": "False",
        "Priority_score": "5"
      }
    ],
    "search_notes": "",
    "raw_content": "Share\nSign up\nSign in\nCOMPREHENSIVE PARALEGAL SEARCH REQUEST\n\nMISSION: Find ALL paralegals, legal assistants, and support staff for this law firm\n\nFIRM DETAILS:\n- Attorney: ALEXANDER LASZLO PAL\n- Email: Apal@216lawyers.com\n- Phone: (216) 529-9377\n- Website: 216lawyers.com\n- Firm: OBRAL, SILK & PAL, LLC\n- Practice Area: PERSONAL_INJURY\n\nSEARCH REQUIREMENTS:\n1. PRIMARY: Search the main website (216lawyers.com) thoroughly for ALL staff\n2. DEEP SEARCH: If website has limited info, search these sources:\n   - LinkedIn company page and employee profiles\n   - Facebook business page and staff mentions\n   - Instagram business account\n   - Google Business listings\n   - Legal directories (Avvo, FindLaw, Lawyers.com)\n   - Bar association listings\n   - Court filing documents (if accessible)\n\nTARGET ROLES TO FIND:\n- Paralegals (all levels: senior, junior, certified)\n- Legal Assistants\n- Legal Secretaries\n- Case Managers\n- Document Specialists  \n- Litigation Support Staff\n- Client Services Coordinators\n- Administrative Assistants (in legal capacity)\n\nREQUIRED INFORMATION for each person:\n- Full Name (required)\n- Job Title/Role (required) \n- Direct Email (if available) + GENERATED EMAIL OPTIONS (see below)\n- Direct Phone/Extension (if available)\n- Department/Practice Area\n- Professional Background/Quote (if available)\n\nCRITICAL EMAIL REQUIREMENTS:\n1. If direct email found: Use the actual email\n2. If NO email found: Generate 2-3 probable email options using the attorney's email format\n3. Email generation patterns to try:\n   - firstname.lastname@domain.com\n   - firstinitiallastname@domain.com  \n   - firstname@domain.com\n   - staff.firstname@domain.com\n   - paralegal.firstname@domain.com\n4. Extract domain from attorney email: Apal@216lawyers.com and use it for all generated emails\n5. or use common formats based on firm domain\n\nBEST CONTACT IDENTIFICATION:\nAnalyze the staff and identify the SINGLE BEST person to contact for attorney services/legal matters.\nConsider:\n- Senior paralegals or case managers (highest priority)\n- Legal assistants with client contact responsibilities\n- Office managers if they handle new client intake\n- Avoid receptionists unless they're the only option\nMark this person with \"Best_match\": \"True\"\n\nSEARCH STRATEGY:\n- Check \"Our Team\", \"Staff\", \"About Us\", \"Meet the Team\" pages\n- Look for staff bios and profiles\n- Search social media for team photos and mentions\n- Check LinkedIn for current employees\n- Look for staff in news articles or case announcements\n- Find people in office photos or group pictures\n\nEXTRACTION FORMAT:\nPlease output results in this EXACT JSON format:\n\n{\n    \"page_url\": \"website_searched\",\n    \"search_sources\": [\"list_of_sources_checked\"],\n    \"total_staff_found\": number,\n    \"attorney_email_domain\": \"domain_from_attorney_email\",\n    \"paralegals\": [\n        {\n            \"name\": \"Full Name\",\n            \"title\": \"Job Title\",\n            \"email\": \"direct_email_if_found_OR_most_likely_generated_email\", \n            \"email_options\": [\"email1@domain.com\", \"email2@domain.com\", \"email3@domain.com\"],\n            \"email_confidence\": \"found/generated_high/generated_medium/generated_low\",\n            \"phone\": \"direct_phone_if_found\",\n            \"department\": \"practice_area_or_department\",\n            \"quote\": \"professional_background_or_bio_excerpt\",\n            \"Best_match\": \"True_or_False\",\n            \"Priority_score\": \"from 10 to 1 (10 is highest)\"\n        }\n    ],\n    \"best_contact_reasoning\": \"explanation_of_why_this_person_was_selected_as_best_match\",\n    \"search_notes\": \"brief_summary_of_search_process_and_sources_used\"\n}\n\nSPECIFIC EMAIL GENERATION INSTRUCTIONS:\n- Attorney email pattern: Apal@216lawyers.com\n- Extract domain from attorney email and use for all staff emails if it is right/accurate coz sometimes email's person name or domain can be little miscalculated because of OCR issues mostly it is accurate (domain).\n- For \"John Smith\" generate these patterns: [\"john.smith@domain.com\", \"jsmith@domain.com\", \"john@domain.com\"]\n- Always provide 2-3 email options per person (more if unsure)\n- Mark confidence level: \"found\" (actual email found), \"generated_high\" (strong pattern match), \"generated_medium\" (reasonable guess), \"generated_low\" (last resort)\n\nBEST MATCH SELECTION CRITERIA:\nBased on the case information (Practice Area: PERSONAL_INJURY), select the staff member who would be:\n1. Most likely to handle new client intake for this practice area\n2. Senior enough to make decisions about new cases  \n3. Specifically responsible for client communications\n4. Has experience in the relevant practice area\n\nIMPORTANT: Be thorough and creative! Many firms hide staff information, so use multiple search angles. If the main website is limited, definitely search social media and professional networks. We need to find as many legal support staff as possible!\n\nCRITICAL: \n- ALWAYS generate email options even if no direct emails found\n- ALWAYS select exactly ONE person as \"Best_match\": \"True\" \n- ALWAYS explain your reasoning for the best match selection\n- MUST MAKE SURE: ALWAYS THINK HARDER\n\nSTART COMPREHENSIVE SEARCH NOW for: 216lawyers.com\nThought for 2m 38s\n{\n\"page_url\": \"216lawyers.com\",\n\"search_sources\": [\"216lawyers.com\", \"linkedin.com\", \"yelp.com\"],\n\"total_staff_found\": 4,\n\"attorney_email_domain\": \"216lawyers.com\",\n\"paralegals\": [\n{\n\"name\": \"Emily Ponti\",\n\"title\": \"Case Manager\",\n\"email\": \"eponti@216lawyers.com\",\n\"email_options\": [\"eponti@216lawyers.com\", \"emily.ponti@216lawyers.com\", \"emily@216lawyers.com\"],\n\"email_confidence\": \"generated_high\",\n\"phone\": \"\",\n\"department\": \"Personal Injury\",\n\"quote\": \"Jordan and Case Manager Emily Ponti would keep me updated through the whole process.\",\n\"Best_match\": \"True\",\n\"Priority_score\": \"10\"\n},\n{\n\"name\": \"Shannon Smith\",\n\"title\": \"Paralegal\",\n\"email\": \"ssmith@216lawyers.com\",\n\"email_options\": [\"ssmith@216lawyers.com\", \"shannon.smith@216lawyers.com\", \"shannon@216lawyers.com\"],\n\"email_confidence\": \"generated_high\",\n\"phone\": \"\",\n\"department\": \"Personal Injury\",\n\"quote\": \"Strong work ethic, customer service skills, prepared, coordinated, work extremely well under pressure.\",\n\"Best_match\": \"False\",\n\"Priority_score\": \"9\"\n},\n{\n\"name\": \"Mikayla Davidson\",\n\"title\": \"Legal Assistant\",\n\"email\": \"mdavidson@216lawyers.com\",\n\"email_options\": [\"mdavidson@216lawyers.com\", \"mikayla.davidson@216lawyers.com\", \"mikayla@216lawyers.com\"],\n\"email_confidence\": \"generated_high\",\n\"phone\": \"\",\n\"department\": \"Personal Injury\",\n\"quote\": \"\",\n\"Best_match\": \"False\",\n\"Priority_score\": \"7\"\n},\n{\n\"name\": \"Linsey Schepis\",\n\"title\": \"Legal Marketing Manager\",\n\"email\": \"lschepis@216lawyers.com\",\n\"email_options\": [\"lschepis@216lawyers.com\", \"linsey.schepis@216lawyers.com\", \"linsey@216lawyers.com\"],\n\"email_confidence\": \"generated_high\",\n\"phone\": \"\",\n\"department\": \"Personal Injury\",\n\"quote\": \"\",\n\"Best_match\": \"False\",\n\"Priority_score\": \"5\"\n}\n],\n\"best_contact_reasoning\": \"Emily Ponti was selected as the best match because, as a Case Manager in a personal injury firm, she is likely responsible for handling new client intake, coordinating cases, and managing client communications, which aligns with the criteria for someone senior enough to make decisions about new cases in the relevant practice area.\",\n\"search_notes\": \"Searched the firm's website (216lawyers.com) including homepage, contact, and attempted team page, but found only attorneys and no support staff details. Used web searches on LinkedIn to identify Shannon Smith (Paralegal), Mikayla Davidson (Legal Assistant), and Linsey Schepis (Legal Marketing Manager). Discovered Emily Ponti (Case Manager) from a Yelp review mentioning her role in client updates. Social media (Facebook, Instagram) and other directories yielded no additional staff information. No direct emails or phones found, so generated based on attorney's email pattern.\"\n}\n82 web pages\n2 / 2\n1.3s\nExpert\nVerify Emily Ponti identity\nContact other PI firms\nHow can Grok help?\nAuto",
    "extraction_timestamp": "2025-10-18T02:47:52.246175",
    "raw_file": "grok_paralegal_search_results\\grok_raw_results_20251018_024752.txt"
  },
  "search_completed_at": "2025-10-18T02:47:52.287096",
  "associated_cases": 1,
  "result_file": "grok_paralegal_search_results\\grok_paralegal_search_216lawyers_com_20251018_024752_w3.json"
}