{
  "domain": "tmslaw.net",
  "search_url": "tmslaw.net",
  "attorney_info": {
    "original_website": "tmslaw.net",
    "attorney_name": "Jeffrey L. Koberg",
    "attorney_email": "courts@tmslaw.net",
    "phone": "(216)762-1700",
    "firm_name": "Law Offices of Timothy M. Sullivan",
    "practice_area": "DEBT_COLLECTION",
    "case_id": "",
    "row_data": {
      "Case Number": "",
      "Filing Date": "",
      "Case Type": "DEBT_COLLECTION",
      "Court": "CUYAHOGA COUNTY COMMON PLEAS COURT, CUYAHOGA COUNTY, OHIO",
      "County": "CUYAHOGA",
      "Plaintiff": "SCHINDLER ELEVATOR CORPORATION",
      "Primary Defendant": "RAINBOW GROUP APARTMENTS LIMITED PARTNERSHIP",
      "Attorney Name": "Jeffrey L. Koberg",
      "Attorney Office": "Law Offices of Timothy M. Sullivan",
      "Attorney Email": "courts@tmslaw.net",
      "Attorney Phone": "(216)762-1700",
      "Attorney Website": "tmslaw.net",
      "Relief Requested": "$66,862.46",
      "Processed At": "2025-10-18T01:04:31.367122",
      "Folder Name": "case_3646785",
      "Paralegal Name": "",
      "Paralegal Email": "",
      "Email-2": "",
      "Email-3": "",
      "Email-4": "",
      "Email-5": "",
      "Paralegal Number": "",
      "Department": "",
      "Paralegal Website Page Link": "",
      "Email Sent?": "",
      "Email Replied?": "",
      "Paralegal email": "",
      "Phone call?": ""
    }
  },
  "search_message": "COMPREHENSIVE PARALEGAL SEARCH REQUEST\n\nMISSION: Find ALL paralegals, legal assistants, and support staff for this law firm\n\nFIRM DETAILS:\n- Attorney: Jeffrey L. Koberg\n- Email: courts@tmslaw.net\n- Phone: (216)762-1700\n- Website: tmslaw.net\n- Firm: Law Offices of Timothy M. Sullivan\n- Practice Area: DEBT_COLLECTION\n\nSEARCH REQUIREMENTS:\n1. PRIMARY: Search the main website (tmslaw.net) thoroughly for ALL staff\n2. DEEP SEARCH: If website has limited info, search these sources:\n   - LinkedIn company page and employee profiles\n   - Facebook business page and staff mentions\n   - Instagram business account\n   - Google Business listings\n   - Legal directories (Avvo, FindLaw, Lawyers.com)\n   - Bar association listings\n   - Court filing documents (if accessible)\n\nTARGET ROLES TO FIND:\n- Paralegals (all levels: senior, junior, certified)\n- Legal Assistants\n- Legal Secretaries\n- Case Managers\n- Document Specialists  \n- Litigation Support Staff\n- Client Services Coordinators\n- Administrative Assistants (in legal capacity)\n\nREQUIRED INFORMATION for each person:\n- Full Name (required)\n- Job Title/Role (required) \n- Direct Email (if available) + GENERATED EMAIL OPTIONS (see below)\n- Direct Phone/Extension (if available)\n- Department/Practice Area\n- Professional Background/Quote (if available)\n\nCRITICAL EMAIL REQUIREMENTS:\n1. If direct email found: Use the actual email\n2. If NO email found: Generate 2-3 probable email options using the attorney's email format\n3. Email generation patterns to try:\n   - firstname.lastname@domain.com\n   - firstinitiallastname@domain.com  \n   - firstname@domain.com\n   - staff.firstname@domain.com\n   - paralegal.firstname@domain.com\n4. Extract domain from attorney email: courts@tmslaw.net and use it for all generated emails\n5. or use common formats based on firm domain\n\nBEST CONTACT IDENTIFICATION:\nAnalyze the staff and identify the SINGLE BEST person to contact for attorney services/legal matters.\nConsider:\n- Senior paralegals or case managers (highest priority)\n- Legal assistants with client contact responsibilities\n- Office managers if they handle new client intake\n- Avoid receptionists unless they're the only option\nMark this person with \"Best_match\": \"True\"\n\nSEARCH STRATEGY:\n- Check \"Our Team\", \"Staff\", \"About Us\", \"Meet the Team\" pages\n- Look for staff bios and profiles\n- Search social media for team photos and mentions\n- Check LinkedIn for current employees\n- Look for staff in news articles or case announcements\n- Find people in office photos or group pictures\n\nEXTRACTION FORMAT:\nPlease output results in this EXACT JSON format:\n\n{\n    \"page_url\": \"website_searched\",\n    \"search_sources\": [\"list_of_sources_checked\"],\n    \"total_staff_found\": number,\n    \"attorney_email_domain\": \"domain_from_attorney_email\",\n    \"paralegals\": [\n        {\n            \"name\": \"Full Name\",\n            \"title\": \"Job Title\",\n            \"email\": \"direct_email_if_found_OR_most_likely_generated_email\", \n            \"email_options\": [\"email1@domain.com\", \"email2@domain.com\", \"email3@domain.com\"],\n            \"email_confidence\": \"found/generated_high/generated_medium/generated_low\",\n            \"phone\": \"direct_phone_if_found\",\n            \"department\": \"practice_area_or_department\",\n            \"quote\": \"professional_background_or_bio_excerpt\",\n            \"Best_match\": \"True_or_False\",\n            \"Priority_score\": \"from 10 to 1 (10 is highest)\"\n        }\n    ],\n    \"best_contact_reasoning\": \"explanation_of_why_this_person_was_selected_as_best_match\",\n    \"search_notes\": \"brief_summary_of_search_process_and_sources_used\"\n}\n\nSPECIFIC EMAIL GENERATION INSTRUCTIONS:\n- Attorney email pattern: courts@tmslaw.net\n- Extract domain from attorney email and use for all staff emails if it is right/accurate coz sometimes email's person name or domain can be little miscalculated because of OCR issues mostly it is accurate (domain).\n- For \"John Smith\" generate these patterns: [\"john.smith@domain.com\", \"jsmith@domain.com\", \"john@domain.com\"]\n- Always provide 2-3 email options per person (more if unsure)\n- Mark confidence level: \"found\" (actual email found), \"generated_high\" (strong pattern match), \"generated_medium\" (reasonable guess), \"generated_low\" (last resort)\n\nBEST MATCH SELECTION CRITERIA:\nBased on the case information (Practice Area: DEBT_COLLECTION), select the staff member who would be:\n1. Most likely to handle new client intake for this practice area\n2. Senior enough to make decisions about new cases  \n3. Specifically responsible for client communications\n4. Has experience in the relevant practice area\n\nIMPORTANT: Be thorough and creative! Many firms hide staff information, so use multiple search angles. If the main website is limited, definitely search social media and professional networks. We need to find as many legal support staff as possible!\n\nCRITICAL: \n- ALWAYS generate email options even if no direct emails found\n- ALWAYS select exactly ONE person as \"Best_match\": \"True\" \n- ALWAYS explain your reasoning for the best match selection\n- MUST MAKE SURE: ALWAYS THINK HARDER\n\nSTART COMPREHENSIVE SEARCH NOW for: tmslaw.net",
  "results": {
    "page_url": "",
    "search_sources": [],
    "total_staff_found": 6,
    "paralegals": [
      {
        "name": "Full Name",
        "title": "Job Title",
        "email": "direct_email_if_found_OR_most_likely_generated_email",
        "email_options": [
          "email1@domain.com",
          "email2@domain.com",
          "email3@domain.com"
        ],
        "email_confidence": "found/generated_high/generated_medium/generated_low",
        "phone": "direct_phone_if_found",
        "department": "practice_area_or_department",
        "quote": "professional_background_or_bio_excerpt",
        "Best_match": "True_or_False",
        "Priority_score": "from 10 to 1 (10 is highest)"
      },
      {
        "name": "Ann Marie Mindek",
        "title": "Paralegal",
        "email": "amindek@tmslaw.net",
        "email_options": [
          "annmarie.mindek@tmslaw.net",
          "amindek@tmslaw.net",
          "annmarie@tmslaw.net"
        ],
        "email_confidence": "generated_medium",
        "phone": "",
        "department": "Debt Collection",
        "quote": "",
        "Best_match": "True",
        "Priority_score": "10"
      },
      {
        "name": "Gabrielle Lewis",
        "title": "Paralegal",
        "email": "glewis@tmslaw.net",
        "email_options": [
          "gabrielle.lewis@tmslaw.net",
          "glewis@tmslaw.net",
          "gabrielle@tmslaw.net"
        ],
        "email_confidence": "generated_medium",
        "phone": "",
        "department": "Debt Collection",
        "quote": "",
        "Best_match": "False",
        "Priority_score": "9"
      },
      {
        "name": "Carissa Smith",
        "title": "Legal Assistant",
        "email": "csmith@tmslaw.net",
        "email_options": [
          "carissa.smith@tmslaw.net",
          "csmith@tmslaw.net",
          "carissa@tmslaw.net"
        ],
        "email_confidence": "generated_medium",
        "phone": "",
        "department": "Debt Collection",
        "quote": "",
        "Best_match": "False",
        "Priority_score": "7"
      },
      {
        "name": "Greg Orlowski",
        "title": "General Manager",
        "email": "gorlowski@tmslaw.net",
        "email_options": [
          "greg.orlowski@tmslaw.net",
          "gorlowski@tmslaw.net",
          "greg@tmslaw.net"
        ],
        "email_confidence": "generated_medium",
        "phone": "",
        "department": "Debt Collection",
        "quote": "",
        "Best_match": "False",
        "Priority_score": "8"
      },
      {
        "name": "Sean Mansfield",
        "title": "Mail Clerk",
        "email": "smansfield@tmslaw.net",
        "email_options": [
          "sean.mansfield@tmslaw.net",
          "smansfield@tmslaw.net",
          "sean@tmslaw.net"
        ],
        "email_confidence": "generated_medium",
        "phone": "",
        "department": "Debt Collection",
        "quote": "",
        "Best_match": "False",
        "Priority_score": "3"
      }
    ],
    "search_notes": "",
    "raw_content": "Share\nSign up\nSign in\nCOMPREHENSIVE PARALEGAL SEARCH REQUEST\n\nMISSION: Find ALL paralegals, legal assistants, and support staff for this law firm\n\nFIRM DETAILS:\n- Attorney: Jeffrey L. Koberg\n- Email: courts@tmslaw.net\n- Phone: (216)762-1700\n- Website: tmslaw.net\n- Firm: Law Offices of Timothy M. Sullivan\n- Practice Area: DEBT_COLLECTION\n\nSEARCH REQUIREMENTS:\n1. PRIMARY: Search the main website (tmslaw.net) thoroughly for ALL staff\n2. DEEP SEARCH: If website has limited info, search these sources:\n   - LinkedIn company page and employee profiles\n   - Facebook business page and staff mentions\n   - Instagram business account\n   - Google Business listings\n   - Legal directories (Avvo, FindLaw, Lawyers.com)\n   - Bar association listings\n   - Court filing documents (if accessible)\n\nTARGET ROLES TO FIND:\n- Paralegals (all levels: senior, junior, certified)\n- Legal Assistants\n- Legal Secretaries\n- Case Managers\n- Document Specialists  \n- Litigation Support Staff\n- Client Services Coordinators\n- Administrative Assistants (in legal capacity)\n\nREQUIRED INFORMATION for each person:\n- Full Name (required)\n- Job Title/Role (required) \n- Direct Email (if available) + GENERATED EMAIL OPTIONS (see below)\n- Direct Phone/Extension (if available)\n- Department/Practice Area\n- Professional Background/Quote (if available)\n\nCRITICAL EMAIL REQUIREMENTS:\n1. If direct email found: Use the actual email\n2. If NO email found: Generate 2-3 probable email options using the attorney's email format\n3. Email generation patterns to try:\n   - firstname.lastname@domain.com\n   - firstinitiallastname@domain.com  \n   - firstname@domain.com\n   - staff.firstname@domain.com\n   - paralegal.firstname@domain.com\n4. Extract domain from attorney email: courts@tmslaw.net and use it for all generated emails\n5. or use common formats based on firm domain\n\nBEST CONTACT IDENTIFICATION:\nAnalyze the staff and identify the SINGLE BEST person to contact for attorney services/legal matters.\nConsider:\n- Senior paralegals or case managers (highest priority)\n- Legal assistants with client contact responsibilities\n- Office managers if they handle new client intake\n- Avoid receptionists unless they're the only option\nMark this person with \"Best_match\": \"True\"\n\nSEARCH STRATEGY:\n- Check \"Our Team\", \"Staff\", \"About Us\", \"Meet the Team\" pages\n- Look for staff bios and profiles\n- Search social media for team photos and mentions\n- Check LinkedIn for current employees\n- Look for staff in news articles or case announcements\n- Find people in office photos or group pictures\n\nEXTRACTION FORMAT:\nPlease output results in this EXACT JSON format:\n\n{\n    \"page_url\": \"website_searched\",\n    \"search_sources\": [\"list_of_sources_checked\"],\n    \"total_staff_found\": number,\n    \"attorney_email_domain\": \"domain_from_attorney_email\",\n    \"paralegals\": [\n        {\n            \"name\": \"Full Name\",\n            \"title\": \"Job Title\",\n            \"email\": \"direct_email_if_found_OR_most_likely_generated_email\", \n            \"email_options\": [\"email1@domain.com\", \"email2@domain.com\", \"email3@domain.com\"],\n            \"email_confidence\": \"found/generated_high/generated_medium/generated_low\",\n            \"phone\": \"direct_phone_if_found\",\n            \"department\": \"practice_area_or_department\",\n            \"quote\": \"professional_background_or_bio_excerpt\",\n            \"Best_match\": \"True_or_False\",\n            \"Priority_score\": \"from 10 to 1 (10 is highest)\"\n        }\n    ],\n    \"best_contact_reasoning\": \"explanation_of_why_this_person_was_selected_as_best_match\",\n    \"search_notes\": \"brief_summary_of_search_process_and_sources_used\"\n}\n\nSPECIFIC EMAIL GENERATION INSTRUCTIONS:\n- Attorney email pattern: courts@tmslaw.net\n- Extract domain from attorney email and use for all staff emails if it is right/accurate coz sometimes email's person name or domain can be little miscalculated because of OCR issues mostly it is accurate (domain).\n- For \"John Smith\" generate these patterns: [\"john.smith@domain.com\", \"jsmith@domain.com\", \"john@domain.com\"]\n- Always provide 2-3 email options per person (more if unsure)\n- Mark confidence level: \"found\" (actual email found), \"generated_high\" (strong pattern match), \"generated_medium\" (reasonable guess), \"generated_low\" (last resort)\n\nBEST MATCH SELECTION CRITERIA:\nBased on the case information (Practice Area: DEBT_COLLECTION), select the staff member who would be:\n1. Most likely to handle new client intake for this practice area\n2. Senior enough to make decisions about new cases  \n3. Specifically responsible for client communications\n4. Has experience in the relevant practice area\n\nIMPORTANT: Be thorough and creative! Many firms hide staff information, so use multiple search angles. If the main website is limited, definitely search social media and professional networks. We need to find as many legal support staff as possible!\n\nCRITICAL: \n- ALWAYS generate email options even if no direct emails found\n- ALWAYS select exactly ONE person as \"Best_match\": \"True\" \n- ALWAYS explain your reasoning for the best match selection\n- MUST MAKE SURE: ALWAYS THINK HARDER\n\nSTART COMPREHENSIVE SEARCH NOW for: tmslaw.net\nThought for 1m 56s\n{\n\"page_url\": \"https://tmslaw.net\",\n\"search_sources\": [\"https://tmslaw.net\", \"linkedin.com\", \"facebook.com\", \"avvo.com\", \"findlaw.com\", \"lawyers.com\", \"rocketreach.co\", \"zoominfo.com\", \"indeed.com\", \"salary.com\"],\n\"total_staff_found\": 5,\n\"attorney_email_domain\": \"tmslaw.net\",\n\"paralegals\": [\n{\n\"name\": \"Ann Marie Mindek\",\n\"title\": \"Paralegal\",\n\"email\": \"amindek@tmslaw.net\",\n\"email_options\": [\"annmarie.mindek@tmslaw.net\", \"amindek@tmslaw.net\", \"annmarie@tmslaw.net\"],\n\"email_confidence\": \"generated_medium\",\n\"phone\": \"\",\n\"department\": \"Debt Collection\",\n\"quote\": \"\",\n\"Best_match\": \"True\",\n\"Priority_score\": \"10\"\n},\n{\n\"name\": \"Gabrielle Lewis\",\n\"title\": \"Paralegal\",\n\"email\": \"glewis@tmslaw.net\",\n\"email_options\": [\"gabrielle.lewis@tmslaw.net\", \"glewis@tmslaw.net\", \"gabrielle@tmslaw.net\"],\n\"email_confidence\": \"generated_medium\",\n\"phone\": \"\",\n\"department\": \"Debt Collection\",\n\"quote\": \"\",\n\"Best_match\": \"False\",\n\"Priority_score\": \"9\"\n},\n{\n\"name\": \"Carissa Smith\",\n\"title\": \"Legal Assistant\",\n\"email\": \"csmith@tmslaw.net\",\n\"email_options\": [\"carissa.smith@tmslaw.net\", \"csmith@tmslaw.net\", \"carissa@tmslaw.net\"],\n\"email_confidence\": \"generated_medium\",\n\"phone\": \"\",\n\"department\": \"Debt Collection\",\n\"quote\": \"\",\n\"Best_match\": \"False\",\n\"Priority_score\": \"7\"\n},\n{\n\"name\": \"Greg Orlowski\",\n\"title\": \"General Manager\",\n\"email\": \"gorlowski@tmslaw.net\",\n\"email_options\": [\"greg.orlowski@tmslaw.net\", \"gorlowski@tmslaw.net\", \"greg@tmslaw.net\"],\n\"email_confidence\": \"generated_medium\",\n\"phone\": \"\",\n\"department\": \"Debt Collection\",\n\"quote\": \"\",\n\"Best_match\": \"False\",\n\"Priority_score\": \"8\"\n},\n{\n\"name\": \"Sean Mansfield\",\n\"title\": \"Mail Clerk\",\n\"email\": \"smansfield@tmslaw.net\",\n\"email_options\": [\"sean.mansfield@tmslaw.net\", \"smansfield@tmslaw.net\", \"sean@tmslaw.net\"],\n\"email_confidence\": \"generated_medium\",\n\"phone\": \"\",\n\"department\": \"Debt Collection\",\n\"quote\": \"\",\n\"Best_match\": \"False\",\n\"Priority_score\": \"3\"\n}\n],\n\"best_contact_reasoning\": \"Ann Marie Mindek was selected as the best match because she is a paralegal with an established professional background, including a bachelor's degree from 1978-1982, suggesting seniority and experience. In a debt collection firm, paralegals often handle case management, client communications, and new case intake, aligning with the criteria for seniority, decision-making on new cases, and relevant practice area experience.\",\n\"search_notes\": \"The main website tmslaw.net provided no staff information. Deep searches on LinkedIn revealed current employees through profiles and company mentions. Additional sources like RocketReach confirmed roles and current status. Affiliated entity HS Financial Group was noted but staff there were not included unless directly tied to the law firm. Former staff like Jann Washington and Ashley Richmond were identified but excluded as not current. Social media and directories yielded limited additional staff details.\"\n}\n13 𝕏 posts\n88 web pages\n1.2s\nExpert\nVerify emails with patterns\nContact HS Financial staff\nHow can Grok help?\nAuto",
    "extraction_timestamp": "2025-10-18T02:34:08.729577",
    "raw_file": "grok_paralegal_search_results\\grok_raw_results_20251018_023408.txt"
  },
  "search_completed_at": "2025-10-18T02:34:08.761939",
  "associated_cases": 1,
  "result_file": "grok_paralegal_search_results\\grok_paralegal_search_tmslaw_net_20251018_023408_w0.json"
}