{
  "domain": "cdgattorneys.com",
  "search_url": "cdgattorneys.com",
  "attorney_info": {
    "original_website": "cdgattorneys.com",
    "attorney_name": "David J. Demers",
    "attorney_email": "ddemers@cdgattorneys.com",
    "phone": "614-939-0930",
    "firm_name": "Cooke Demers, LLC",
    "practice_area": "FORECLOSURE",
    "case_id": "",
    "row_data": {
      "Case Number": "",
      "Filing Date": "",
      "Case Type": "FORECLOSURE",
      "Court": "CUYAHOGA COUNTY, OHIO COURT OF COMMON PLEAS CIVIL DIVISION",
      "County": "CUYAHOGA",
      "Plaintiff": "Wells Fargo Bank, N.A., as Trustee for Park Place Securities, Inc. Asset-Backed Pass-Through Certificates Series 2004-WHQ2",
      "Primary Defendant": "Naomi J. Rucker",
      "Attorney Name": "David J. Demers",
      "Attorney Office": "Cooke Demers, LLC",
      "Attorney Email": "ddemers@cdgattorneys.com",
      "Attorney Phone": "614-939-0930",
      "Attorney Website": "cdgattorneys.com",
      "Relief Requested": "$78,749.22",
      "Processed At": "2025-10-18T01:04:30.965438",
      "Folder Name": "case_3646441",
      "Paralegal Name": "",
      "Paralegal Email": "",
      "Email-2": "",
      "Email-3": "",
      "Email-4": "",
      "Email-5": "",
      "Paralegal Number": "",
      "Department": "",
      "Paralegal Website Page Link": "",
      "Email Sent?": "",
      "Email Replied?": "",
      "Paralegal email": "",
      "Phone call?": ""
    }
  },
  "search_message": "COMPREHENSIVE PARALEGAL SEARCH REQUEST\n\nMISSION: Find ALL paralegals, legal assistants, and support staff for this law firm\n\nFIRM DETAILS:\n- Attorney: David J. Demers\n- Email: ddemers@cdgattorneys.com\n- Phone: 614-939-0930\n- Website: cdgattorneys.com\n- Firm: Cooke Demers, LLC\n- Practice Area: FORECLOSURE\n\nSEARCH REQUIREMENTS:\n1. PRIMARY: Search the main website (cdgattorneys.com) thoroughly for ALL staff\n2. DEEP SEARCH: If website has limited info, search these sources:\n   - LinkedIn company page and employee profiles\n   - Facebook business page and staff mentions\n   - Instagram business account\n   - Google Business listings\n   - Legal directories (Avvo, FindLaw, Lawyers.com)\n   - Bar association listings\n   - Court filing documents (if accessible)\n\nTARGET ROLES TO FIND:\n- Paralegals (all levels: senior, junior, certified)\n- Legal Assistants\n- Legal Secretaries\n- Case Managers\n- Document Specialists  \n- Litigation Support Staff\n- Client Services Coordinators\n- Administrative Assistants (in legal capacity)\n\nREQUIRED INFORMATION for each person:\n- Full Name (required)\n- Job Title/Role (required) \n- Direct Email (if available) + GENERATED EMAIL OPTIONS (see below)\n- Direct Phone/Extension (if available)\n- Department/Practice Area\n- Professional Background/Quote (if available)\n\nCRITICAL EMAIL REQUIREMENTS:\n1. If direct email found: Use the actual email\n2. If NO email found: Generate 2-3 probable email options using the attorney's email format\n3. Email generation patterns to try:\n   - firstname.lastname@domain.com\n   - firstinitiallastname@domain.com  \n   - firstname@domain.com\n   - staff.firstname@domain.com\n   - paralegal.firstname@domain.com\n4. Extract domain from attorney email: ddemers@cdgattorneys.com and use it for all generated emails\n5. or use common formats based on firm domain\n\nBEST CONTACT IDENTIFICATION:\nAnalyze the staff and identify the SINGLE BEST person to contact for attorney services/legal matters.\nConsider:\n- Senior paralegals or case managers (highest priority)\n- Legal assistants with client contact responsibilities\n- Office managers if they handle new client intake\n- Avoid receptionists unless they're the only option\nMark this person with \"Best_match\": \"True\"\n\nSEARCH STRATEGY:\n- Check \"Our Team\", \"Staff\", \"About Us\", \"Meet the Team\" pages\n- Look for staff bios and profiles\n- Search social media for team photos and mentions\n- Check LinkedIn for current employees\n- Look for staff in news articles or case announcements\n- Find people in office photos or group pictures\n\nEXTRACTION FORMAT:\nPlease output results in this EXACT JSON format:\n\n{\n    \"page_url\": \"website_searched\",\n    \"search_sources\": [\"list_of_sources_checked\"],\n    \"total_staff_found\": number,\n    \"attorney_email_domain\": \"domain_from_attorney_email\",\n    \"paralegals\": [\n        {\n            \"name\": \"Full Name\",\n            \"title\": \"Job Title\",\n            \"email\": \"direct_email_if_found_OR_most_likely_generated_email\", \n            \"email_options\": [\"email1@domain.com\", \"email2@domain.com\", \"email3@domain.com\"],\n            \"email_confidence\": \"found/generated_high/generated_medium/generated_low\",\n            \"phone\": \"direct_phone_if_found\",\n            \"department\": \"practice_area_or_department\",\n            \"quote\": \"professional_background_or_bio_excerpt\",\n            \"Best_match\": \"True_or_False\",\n            \"Priority_score\": \"from 10 to 1 (10 is highest)\"\n        }\n    ],\n    \"best_contact_reasoning\": \"explanation_of_why_this_person_was_selected_as_best_match\",\n    \"search_notes\": \"brief_summary_of_search_process_and_sources_used\"\n}\n\nSPECIFIC EMAIL GENERATION INSTRUCTIONS:\n- Attorney email pattern: ddemers@cdgattorneys.com\n- Extract domain from attorney email and use for all staff emails if it is right/accurate coz sometimes email's person name or domain can be little miscalculated because of OCR issues mostly it is accurate (domain).\n- For \"John Smith\" generate these patterns: [\"john.smith@domain.com\", \"jsmith@domain.com\", \"john@domain.com\"]\n- Always provide 2-3 email options per person (more if unsure)\n- Mark confidence level: \"found\" (actual email found), \"generated_high\" (strong pattern match), \"generated_medium\" (reasonable guess), \"generated_low\" (last resort)\n\nBEST MATCH SELECTION CRITERIA:\nBased on the case information (Practice Area: FORECLOSURE), select the staff member who would be:\n1. Most likely to handle new client intake for this practice area\n2. Senior enough to make decisions about new cases  \n3. Specifically responsible for client communications\n4. Has experience in the relevant practice area\n\nIMPORTANT: Be thorough and creative! Many firms hide staff information, so use multiple search angles. If the main website is limited, definitely search social media and professional networks. We need to find as many legal support staff as possible!\n\nCRITICAL: \n- ALWAYS generate email options even if no direct emails found\n- ALWAYS select exactly ONE person as \"Best_match\": \"True\" \n- ALWAYS explain your reasoning for the best match selection\n- MUST MAKE SURE: ALWAYS THINK HARDER\n\nSTART COMPREHENSIVE SEARCH NOW for: cdgattorneys.com",
  "results": {
    "page_url": "",
    "search_sources": [],
    "total_staff_found": 5,
    "paralegals": [
      {
        "name": "Full Name",
        "title": "Job Title",
        "email": "direct_email_if_found_OR_most_likely_generated_email",
        "email_options": [
          "email1@domain.com",
          "email2@domain.com",
          "email3@domain.com"
        ],
        "email_confidence": "found/generated_high/generated_medium/generated_low",
        "phone": "direct_phone_if_found",
        "department": "practice_area_or_department",
        "quote": "professional_background_or_bio_excerpt",
        "Best_match": "True_or_False",
        "Priority_score": "from 10 to 1 (10 is highest)"
      },
      {
        "name": "Miracle McGowan",
        "title": "Paralegal",
        "email": "mmcgowan@cdgattorneys.com",
        "email_options": [
          "mmcgowan@cdgattorneys.com",
          "miracle.mcgowan@cdgattorneys.com",
          "miracle@cdgattorneys.com"
        ],
        "email_confidence": "generated_high",
        "phone": "",
        "department": "General/Foreclosure",
        "quote": "Paralegal motivated to continually improve and extend personal skills and knowledge to…",
        "Best_match": "True",
        "Priority_score": "10"
      },
      {
        "name": "Cheryl Bush",
        "title": "Legal Administrative Assistant",
        "email": "cbush@cdgattorneys.com",
        "email_options": [
          "cbush@cdgattorneys.com",
          "cheryl.bush@cdgattorneys.com",
          "cheryl@cdgattorneys.com"
        ],
        "email_confidence": "generated_high",
        "phone": "",
        "department": "General/Foreclosure",
        "quote": "",
        "Best_match": "False",
        "Priority_score": "8"
      },
      {
        "name": "Mariah Hicks",
        "title": "Legal Assistant",
        "email": "mhicks@cdgattorneys.com",
        "email_options": [
          "mhicks@cdgattorneys.com",
          "mariah.hicks@cdgattorneys.com",
          "mariah@cdgattorneys.com"
        ],
        "email_confidence": "generated_medium",
        "phone": "",
        "department": "General/Foreclosure",
        "quote": "",
        "Best_match": "False",
        "Priority_score": "8"
      },
      {
        "name": "Bridget Diehl",
        "title": "Office Manager",
        "email": "bdiehl@cdgattorneys.com",
        "email_options": [
          "bdiehl@cdgattorneys.com",
          "bridget.diehl@cdgattorneys.com",
          "bridget@cdgattorneys.com"
        ],
        "email_confidence": "generated_high",
        "phone": "",
        "department": "Administrative",
        "quote": "Office Manager at Cooke Demers | New Albany, OH",
        "Best_match": "False",
        "Priority_score": "7"
      }
    ],
    "search_notes": "",
    "raw_content": "Share\nSign up\nSign in\nCOMPREHENSIVE PARALEGAL SEARCH REQUEST\n\nMISSION: Find ALL paralegals, legal assistants, and support staff for this law firm\n\nFIRM DETAILS:\n- Attorney: David J. Demers\n- Email: ddemers@cdgattorneys.com\n- Phone: 614-939-0930\n- Website: cdgattorneys.com\n- Firm: Cooke Demers, LLC\n- Practice Area: FORECLOSURE\n\nSEARCH REQUIREMENTS:\n1. PRIMARY: Search the main website (cdgattorneys.com) thoroughly for ALL staff\n2. DEEP SEARCH: If website has limited info, search these sources:\n   - LinkedIn company page and employee profiles\n   - Facebook business page and staff mentions\n   - Instagram business account\n   - Google Business listings\n   - Legal directories (Avvo, FindLaw, Lawyers.com)\n   - Bar association listings\n   - Court filing documents (if accessible)\n\nTARGET ROLES TO FIND:\n- Paralegals (all levels: senior, junior, certified)\n- Legal Assistants\n- Legal Secretaries\n- Case Managers\n- Document Specialists  \n- Litigation Support Staff\n- Client Services Coordinators\n- Administrative Assistants (in legal capacity)\n\nREQUIRED INFORMATION for each person:\n- Full Name (required)\n- Job Title/Role (required) \n- Direct Email (if available) + GENERATED EMAIL OPTIONS (see below)\n- Direct Phone/Extension (if available)\n- Department/Practice Area\n- Professional Background/Quote (if available)\n\nCRITICAL EMAIL REQUIREMENTS:\n1. If direct email found: Use the actual email\n2. If NO email found: Generate 2-3 probable email options using the attorney's email format\n3. Email generation patterns to try:\n   - firstname.lastname@domain.com\n   - firstinitiallastname@domain.com  \n   - firstname@domain.com\n   - staff.firstname@domain.com\n   - paralegal.firstname@domain.com\n4. Extract domain from attorney email: ddemers@cdgattorneys.com and use it for all generated emails\n5. or use common formats based on firm domain\n\nBEST CONTACT IDENTIFICATION:\nAnalyze the staff and identify the SINGLE BEST person to contact for attorney services/legal matters.\nConsider:\n- Senior paralegals or case managers (highest priority)\n- Legal assistants with client contact responsibilities\n- Office managers if they handle new client intake\n- Avoid receptionists unless they're the only option\nMark this person with \"Best_match\": \"True\"\n\nSEARCH STRATEGY:\n- Check \"Our Team\", \"Staff\", \"About Us\", \"Meet the Team\" pages\n- Look for staff bios and profiles\n- Search social media for team photos and mentions\n- Check LinkedIn for current employees\n- Look for staff in news articles or case announcements\n- Find people in office photos or group pictures\n\nEXTRACTION FORMAT:\nPlease output results in this EXACT JSON format:\n\n{\n    \"page_url\": \"website_searched\",\n    \"search_sources\": [\"list_of_sources_checked\"],\n    \"total_staff_found\": number,\n    \"attorney_email_domain\": \"domain_from_attorney_email\",\n    \"paralegals\": [\n        {\n            \"name\": \"Full Name\",\n            \"title\": \"Job Title\",\n            \"email\": \"direct_email_if_found_OR_most_likely_generated_email\", \n            \"email_options\": [\"email1@domain.com\", \"email2@domain.com\", \"email3@domain.com\"],\n            \"email_confidence\": \"found/generated_high/generated_medium/generated_low\",\n            \"phone\": \"direct_phone_if_found\",\n            \"department\": \"practice_area_or_department\",\n            \"quote\": \"professional_background_or_bio_excerpt\",\n            \"Best_match\": \"True_or_False\",\n            \"Priority_score\": \"from 10 to 1 (10 is highest)\"\n        }\n    ],\n    \"best_contact_reasoning\": \"explanation_of_why_this_person_was_selected_as_best_match\",\n    \"search_notes\": \"brief_summary_of_search_process_and_sources_used\"\n}\n\nSPECIFIC EMAIL GENERATION INSTRUCTIONS:\n- Attorney email pattern: ddemers@cdgattorneys.com\n- Extract domain from attorney email and use for all staff emails if it is right/accurate coz sometimes email's person name or domain can be little miscalculated because of OCR issues mostly it is accurate (domain).\n- For \"John Smith\" generate these patterns: [\"john.smith@domain.com\", \"jsmith@domain.com\", \"john@domain.com\"]\n- Always provide 2-3 email options per person (more if unsure)\n- Mark confidence level: \"found\" (actual email found), \"generated_high\" (strong pattern match), \"generated_medium\" (reasonable guess), \"generated_low\" (last resort)\n\nBEST MATCH SELECTION CRITERIA:\nBased on the case information (Practice Area: FORECLOSURE), select the staff member who would be:\n1. Most likely to handle new client intake for this practice area\n2. Senior enough to make decisions about new cases  \n3. Specifically responsible for client communications\n4. Has experience in the relevant practice area\n\nIMPORTANT: Be thorough and creative! Many firms hide staff information, so use multiple search angles. If the main website is limited, definitely search social media and professional networks. We need to find as many legal support staff as possible!\n\nCRITICAL: \n- ALWAYS generate email options even if no direct emails found\n- ALWAYS select exactly ONE person as \"Best_match\": \"True\" \n- ALWAYS explain your reasoning for the best match selection\n- MUST MAKE SURE: ALWAYS THINK HARDER\n\nSTART COMPREHENSIVE SEARCH NOW for: cdgattorneys.com\nThought for 2m 1s\n{\n\"page_url\": \"https://cdgattorneys.com\",\n\"search_sources\": [\"https://cdgattorneys.com\", \"https://www.cdgattorneys.com/about/\", \"https://www.cdgattorneys.com/contact/\", \"LinkedIn profiles (various employee pages)\", \"Avvo\", \"FindLaw\", \"Lawyers.com\", \"Facebook search\", \"Instagram search\", \"X (Twitter) search\", \"OSBA.org\", \"General web searches via Google\", \"ZoomInfo\", \"DS News\", \"Legal notices and whitepapers\"],\n\"total_staff_found\": 4,\n\"attorney_email_domain\": \"cdgattorneys.com\",\n\"paralegals\": [\n{\n\"name\": \"Miracle McGowan\",\n\"title\": \"Paralegal\",\n\"email\": \"mmcgowan@cdgattorneys.com\",\n\"email_options\": [\"mmcgowan@cdgattorneys.com\", \"miracle.mcgowan@cdgattorneys.com\", \"miracle@cdgattorneys.com\"],\n\"email_confidence\": \"generated_high\",\n\"phone\": \"\",\n\"department\": \"General/Foreclosure\",\n\"quote\": \"Paralegal motivated to continually improve and extend personal skills and knowledge to…\",\n\"Best_match\": \"True\",\n\"Priority_score\": \"10\"\n},\n{\n\"name\": \"Cheryl Bush\",\n\"title\": \"Legal Administrative Assistant\",\n\"email\": \"cbush@cdgattorneys.com\",\n\"email_options\": [\"cbush@cdgattorneys.com\", \"cheryl.bush@cdgattorneys.com\", \"cheryl@cdgattorneys.com\"],\n\"email_confidence\": \"generated_high\",\n\"phone\": \"\",\n\"department\": \"General/Foreclosure\",\n\"quote\": \"\",\n\"Best_match\": \"False\",\n\"Priority_score\": \"8\"\n},\n{\n\"name\": \"Mariah Hicks\",\n\"title\": \"Legal Assistant\",\n\"email\": \"mhicks@cdgattorneys.com\",\n\"email_options\": [\"mhicks@cdgattorneys.com\", \"mariah.hicks@cdgattorneys.com\", \"mariah@cdgattorneys.com\"],\n\"email_confidence\": \"generated_medium\",\n\"phone\": \"\",\n\"department\": \"General/Foreclosure\",\n\"quote\": \"\",\n\"Best_match\": \"False\",\n\"Priority_score\": \"8\"\n},\n{\n\"name\": \"Bridget Diehl\",\n\"title\": \"Office Manager\",\n\"email\": \"bdiehl@cdgattorneys.com\",\n\"email_options\": [\"bdiehl@cdgattorneys.com\", \"bridget.diehl@cdgattorneys.com\", \"bridget@cdgattorneys.com\"],\n\"email_confidence\": \"generated_high\",\n\"phone\": \"\",\n\"department\": \"Administrative\",\n\"quote\": \"Office Manager at Cooke Demers | New Albany, OH\",\n\"Best_match\": \"False\",\n\"Priority_score\": \"7\"\n}\n],\n\"best_contact_reasoning\": \"Miracle McGowan was selected as the best match because she is the only identified paralegal, making her the most senior support staff likely to handle new client intake, case management, and communications in the foreclosure practice area. Paralegals typically have direct involvement in legal matters and decision-making for new cases, aligning with the criteria for seniority, client responsibilities, and relevant experience.\",\n\"search_notes\": \"Searched the firm website thoroughly, including homepage, about, and contact pages, which listed attorneys and one office manager but no other support staff. Deep dived into LinkedIn for employee profiles, identifying current and potential support staff. Checked legal directories (Avvo, FindLaw, Lawyers.com), social media (Facebook, Instagram, X), bar associations (OSBA), and general web for mentions, court filings, and news. Limited direct staff info available; most discoveries via LinkedIn. Several past employees found but excluded. Firm confirmed to handle foreclosure via secondary sources like DS News.\"\n}\n1 𝕏 post\n74 web pages\n1.6s\nExpert\nVerify staff emails with patterns\nSearch similar Ohio firms\nCondense search notes summary\nHow can Grok help?\nAuto",
    "extraction_timestamp": "2025-10-18T02:18:04.683188",
    "raw_file": "grok_paralegal_search_results\\grok_raw_results_20251018_021804.txt"
  },
  "search_completed_at": "2025-10-18T02:18:04.742165",
  "associated_cases": 1,
  "result_file": "grok_paralegal_search_results\\grok_paralegal_search_cdgattorneys_com_20251018_021804_w0.json"
}